setCode	setName	releasedAt	collectorNumber	name	oracleId	auditStatus	expectedRoles	actualAnalyzerRoles	needsCodeChange	tagDecision	manualNotes	typeLine	manaCost	manaValue	colors	colorIdentity	keywords	scryfallOracleTags	attentionHint	scryfallUrl	oracleText
afc	Forgotten Realms Commander	2021-07-23	1	Galea, Kindler of Hope	30c0df75-9822-4016-a52b-d2e69dd58124	covered		card_selection, combat_body, combat_threat, direct_draw, draw, repeatable_advantage, selection	false		Covered by PRM role audit.	Legendary Creature — Elf Knight	{1}{G}{W}{U}	4	GUW	GUW	Vigilance		already reviewed	https://scryfall.com/card/afc/1/galea-kindler-of-hope?utm_source=api	Vigilance You may look at the top card of your library any time. You may cast Aura and Equipment spells from the top of your library. When you cast an Equipment spell this way, it gains "When this Equipment enters, attach it to target creature you control."
afc	Forgotten Realms Commander	2021-07-23	2	Prosper, Tome-Bound	1e9b0fd6-5aae-401a-8df5-d94ce6442696	covered		burst_ramp, card_selection, combat_body, combat_threat, direct_draw, draw, mana_fixing, ramp, repeatable_advantage, repeatable_draw, selection, token_support	false		Covered by PRM role audit.	Legendary Creature — Tiefling Warlock	{2}{B}{R}	4	BR	BR	Treasure, Deathtouch		already reviewed	https://scryfall.com/card/afc/2/prosper-tome-bound?utm_source=api	Deathtouch Mystic Arcanum — At the beginning of your end step, exile the top card of your library. Until the end of your next turn, you may play that card. Pact Boon — Whenever you play a card from exile, create a Treasure token.
afc	Forgotten Realms Commander	2021-07-23	3	Sefris of the Hidden Ways	9b21e056-57e7-4e39-b2b4-2fdf8719d0d2	covered	battlefield_recursion, card_selection, combat_body, dungeon_support, recursion, repeatable_advantage	battlefield_recursion, card_selection, combat_body, dungeon_support, recursion, repeatable_advantage	false		Analyzer roles accepted during batch clean pass.	Legendary Creature — Human Wizard	{W}{U}{B}	3	BUW	BUW	Venture into the dungeon		verify analyzer roles	https://scryfall.com/card/afc/3/sefris-of-the-hidden-ways?utm_source=api	Whenever one or more creature cards are put into your graveyard from anywhere, venture into the dungeon. This ability triggers only once each turn. (To venture into the dungeon, enter the first room or advance to the next room.) Create Undead — Whenever you complete a dungeon, return target creature card from your graveyard to the battlefield.
afc	Forgotten Realms Commander	2021-07-23	4	Vrondiss, Rage of Ancients	2160c837-342b-409f-a1db-0ec5ac023ccf	covered	combat_body, dice_support, sacrifice_support, token_support	combat_body, dice_support, sacrifice_support, token_support	false		Analyzer roles accepted during batch clean pass.	Legendary Creature — Dragon Barbarian	{3}{R}{G}	5	GR	GR	Enrage		verify analyzer roles	https://scryfall.com/card/afc/4/vrondiss-rage-of-ancients?utm_source=api	Enrage — Whenever Vrondiss is dealt damage, you may create a 5/4 red and green Dragon Spirit creature token with "When this token deals damage, sacrifice it." Whenever you roll one or more dice, you may have Vrondiss deal 1 damage to itself.
afc	Forgotten Realms Commander	2021-07-23	5	Fey Steed	18cced8b-9836-4e11-bb4e-69a971a33a50	covered	card_draw, combat_body, combat_support, direct_draw, draw, protection, repeatable_advantage, repeatable_draw, self_protection, targeted_protection	card_draw, combat_body, combat_support, direct_draw, draw, protection, repeatable_advantage, repeatable_draw, self_protection, targeted_protection	false		Analyzer roles accepted during batch clean pass.	Creature — Elk	{2}{W}{W}	4	W	W			verify analyzer roles	https://scryfall.com/card/afc/5/fey-steed?utm_source=api	Whenever this creature attacks, another target attacking creature you control gains indestructible until end of turn. Whenever a creature or planeswalker you control becomes the target of a spell or ability an opponent controls, you may draw a card.
afc	Forgotten Realms Commander	2021-07-23	6	Holy Avenger	86df1de7-967a-4420-847f-7a77d0217a15	covered	artifact_support, combat_support	artifact_support, combat_support	false		Analyzer roles accepted during batch clean pass.	Artifact — Equipment	{2}{W}	3	W	W	Equip		verify analyzer roles	https://scryfall.com/card/afc/6/holy-avenger?utm_source=api	Equipped creature has double strike. Whenever equipped creature deals combat damage, you may put an Aura card from your hand onto the battlefield attached to it. Equip {2}{W}
afc	Forgotten Realms Commander	2021-07-23	7	Immovable Rod	ec664e13-b7c4-4ca3-80d6-55a564d97937	covered	combat_support, dungeon_support, repeatable_advantage	combat_support, dungeon_support, repeatable_advantage	false		Analyzer roles accepted during batch clean pass.	Artifact	{W}	1	W	W	Venture into the dungeon		verify analyzer roles	https://scryfall.com/card/afc/7/immovable-rod?utm_source=api	You may choose not to untap this artifact during your untap step. Whenever this artifact becomes untapped, venture into the dungeon. {3}{W}, {T}: For as long as this artifact remains tapped, another target permanent loses all abilities and can't attack or block.
afc	Forgotten Realms Commander	2021-07-23	8	Mantle of the Ancients	7424560f-557f-4bc9-a3e7-eb890c73aaa3	covered	battlefield_recursion, card_selection, combat_support, mass_recursion, recursion	battlefield_recursion, card_selection, combat_support, mass_recursion, recursion	false		Analyzer roles accepted during batch clean pass.	Enchantment — Aura	{3}{W}{W}	5	W	W	Enchant		verify analyzer roles	https://scryfall.com/card/afc/8/mantle-of-the-ancients?utm_source=api	Enchant creature you control When this Aura enters, return any number of target Aura and/or Equipment cards from your graveyard to the battlefield attached to enchanted creature. Enchanted creature gets +1/+1 for each Aura and Equipment attached to it.
afc	Forgotten Realms Commander	2021-07-23	9	Radiant Solar	21a86dcd-03e3-409b-b214-5feed07db584	covered		combat_body, combat_threat, dungeon_support, lifegain, repeatable_advantage	false		Covered by PRM role audit.	Creature — Angel	{5}{W}	6	W	W	Flying, Lifelink, Venture into the dungeon		already reviewed	https://scryfall.com/card/afc/9/radiant-solar?utm_source=api	Flying, lifelink Whenever this creature or another nontoken creature you control enters, venture into the dungeon. (Enter the first room or advance to the next room.) {W}, Discard this card: Venture into the dungeon and you gain 3 life.
afc	Forgotten Realms Commander	2021-07-23	10	Revivify	55eb3c21-6834-4c62-8ab9-54b901531fed	covered	card_selection, dice_support, hand_recursion, mass_recursion	card_selection, dice_support, hand_recursion, mass_recursion	false		Analyzer roles accepted during batch clean pass.	Instant	{2}{W}	3	W	W			verify analyzer roles	https://scryfall.com/card/afc/10/revivify?utm_source=api	Roll a d20 and add the number of creature cards in your graveyard that were put there from the battlefield this turn. 1—14 | Return all creature cards in your graveyard that were put there from the battlefield this turn to your hand. 15+ | Return those cards from your graveyard to the battlefield.
afc	Forgotten Realms Commander	2021-07-23	11	Robe of Stars	416f49e2-feb1-43e7-befc-b0e02181b202	covered	artifact_support, combat_support, equipment_protection, protection, replacement_engine	artifact_support, combat_support, equipment_protection, protection, replacement_engine	false		Analyzer roles accepted during batch clean pass.	Artifact — Equipment	{1}{W}	2	W	W	Equip		verify analyzer roles	https://scryfall.com/card/afc/11/robe-of-stars?utm_source=api	Equipped creature gets +0/+3. Astral Projection — {1}{W}: Equipped creature phases out. (Treat it and anything attached to it as though they don't exist until its controller's next turn.) Equip {1}
afc	Forgotten Realms Commander	2021-07-23	12	Thorough Investigation	e7504407-bb72-4baf-be4a-8152e4198e2b	covered	card_draw, combat_support, direct_draw, draw, dungeon_support, repeatable_advantage, repeatable_draw, sacrifice_support, selection, token_support	card_draw, combat_support, direct_draw, draw, dungeon_support, repeatable_advantage, repeatable_draw, sacrifice_support, selection, token_support	false		Analyzer roles accepted during batch clean pass.	Enchantment	{2}{W}	3	W	W	Investigate, Venture into the dungeon		verify analyzer roles	https://scryfall.com/card/afc/12/thorough-investigation?utm_source=api	Whenever you attack, investigate. (Create a Clue token. It's an artifact with "{2}, Sacrifice this token: Draw a card.") Whenever you sacrifice a Clue, venture into the dungeon. (Enter the first room or advance to the next room.)
afc	Forgotten Realms Commander	2021-07-23	13	Valiant Endeavor	4ba1f2c5-6456-4809-a563-fd5bd311869a	covered	dice_support, token_support	dice_support, token_support	false		Analyzer roles accepted during batch clean pass.	Sorcery	{4}{W}{W}	6	W	W			verify analyzer roles	https://scryfall.com/card/afc/13/valiant-endeavor?utm_source=api	Roll two d6 and choose one result. Destroy each creature with power greater than or equal to that result. Then create a number of 2/2 white Knight creature tokens with vigilance equal to the other result.
afc	Forgotten Realms Commander	2021-07-23	14	Arcane Endeavor	901ee0e3-1011-40e1-815a-09246112e8dc	covered	card_draw, dice_support, direct_draw, draw	card_draw, dice_support, direct_draw, draw	false		Analyzer roles accepted during batch clean pass.	Sorcery	{5}{U}{U}	7	U	U			verify analyzer roles	https://scryfall.com/card/afc/14/arcane-endeavor?utm_source=api	Roll two d8 and choose one result. Draw cards equal to that result. Then you may cast an instant or sorcery spell with mana value less than or equal to the other result from your hand without paying its mana cost.
afc	Forgotten Realms Commander	2021-07-23	15	Diviner's Portent	119585c7-ddfa-47ed-b2f8-488ebc156222	covered	card_draw, card_selection, dice_support, direct_draw, draw, mana_sink, scalable_spell, selection	card_draw, card_selection, dice_support, direct_draw, draw, mana_sink, scalable_spell, selection	false		Analyzer roles accepted during batch clean pass.	Instant	{X}{U}{U}{U}	3	U	U	Scry		verify analyzer roles	https://scryfall.com/card/afc/15/diviners-portent?utm_source=api	Roll a d20 and add the number of cards in your hand. 1—14 | Draw X cards. 15+ | Scry X, then draw X cards.
afc	Forgotten Realms Commander	2021-07-23	16	Minn, Wily Illusionist	d4212d44-d6a0-4c5b-9c54-bc90f36828dd	covered	combat_body, combat_support, cost_reduction, ramp, sacrifice_support, token_support	combat_body, combat_support, cost_reduction, ramp, sacrifice_support, token_support	false		Analyzer roles accepted during batch clean pass.	Legendary Creature — Gnome Wizard	{1}{U}{U}	3	U	U			verify analyzer roles	https://scryfall.com/card/afc/16/minn-wily-illusionist?utm_source=api	Whenever you draw your second card each turn, create a 1/1 blue Illusion creature token with "This token gets +1/+0 for each other Illusion you control." Whenever an Illusion you control dies, you may put a permanent card with mana value less than or equal to that creature's power from your hand onto the battlefield.
afc	Forgotten Realms Commander	2021-07-23	17	Netherese Puzzle-Ward	561e8ecc-1f2b-4fd4-8f92-a0acea449816	covered	card_draw, card_selection, dice_support, direct_draw, draw, repeatable_advantage, repeatable_draw, scalable_spell, selection	card_draw, card_selection, dice_support, direct_draw, draw, repeatable_advantage, repeatable_draw, scalable_spell, selection	false		Analyzer roles accepted during batch clean pass.	Enchantment	{3}{U}	4	U	U	Scry		verify analyzer roles	https://scryfall.com/card/afc/17/netherese-puzzle-ward?utm_source=api	Focus Beam — At the beginning of your upkeep, roll a d4. Scry X, where X is the result. Perfect Illumination — Whenever you roll a die's highest natural result, draw a card.
afc	Forgotten Realms Commander	2021-07-23	18	Phantom Steed	22c643b1-62dd-477c-8944-97b3becdfdbe	covered	combat_body, combat_support, copy_support, sacrifice_support, token_support	combat_body, combat_support, copy_support, sacrifice_support, token_support	false		Analyzer roles accepted during batch clean pass.	Creature — Horse Illusion	{3}{U}	4	U	U	Flash		verify analyzer roles	https://scryfall.com/card/afc/18/phantom-steed?utm_source=api	Flash When this creature enters, exile another target creature you control until this creature leaves the battlefield. Whenever this creature attacks, create a tapped and attacking token that's a copy of the exiled card, except it's an Illusion in addition to its other types. Sacrifice that token at end of combat.
afc	Forgotten Realms Commander	2021-07-23	19	Rod of Absorption	d32345c1-ed20-4bfc-a5fa-6ac7b99542ec	covered	card_selection, repeatable_advantage, sacrifice_support	card_selection, repeatable_advantage, sacrifice_support	false		Analyzer roles accepted during batch clean pass.	Artifact	{2}{U}	3	U	U			verify analyzer roles	https://scryfall.com/card/afc/19/rod-of-absorption?utm_source=api	Whenever a player casts an instant or sorcery spell, exile it instead of putting it into a graveyard as it resolves. {X}, {T}, Sacrifice this artifact: You may cast any number of spells from among cards exiled with this artifact with total mana value X or less without paying their mana costs.
afc	Forgotten Realms Commander	2021-07-23	20	Winged Boots	a178a789-1f5f-46ca-a90b-574bd236a671	covered	artifact_support, combat_support, equipment_protection, protection, self_protection	artifact_support, combat_support, equipment_protection, protection, self_protection	false		Covered by Media and Collaboration Promos role audit.	Artifact — Equipment	{1}{U}	2	U	U	Equip		already reviewed	https://scryfall.com/card/afc/20/winged-boots?utm_source=api	Equipped creature has flying and ward {4}. (Whenever equipped creature becomes the target of a spell or ability an opponent controls, counter it unless that player pays {4}.) Equip {1}
afc	Forgotten Realms Commander	2021-07-23	21	Bag of Devouring	4443345d-a292-4394-97dd-0e6f4d9aedf7	covered	card_draw, dice_support, direct_draw, draw, repeatable_advantage, repeatable_draw, sacrifice_support, scalable_spell	card_draw, dice_support, direct_draw, draw, repeatable_advantage, repeatable_draw, sacrifice_support, scalable_spell	false		Analyzer roles accepted during batch clean pass.	Artifact	{B}	1	B	B			verify analyzer roles	https://scryfall.com/card/afc/21/bag-of-devouring?utm_source=api	Whenever you sacrifice another nontoken artifact or creature, exile it. {2}, {T}, Sacrifice another artifact or creature: Draw a card. {3}, {T}, Sacrifice this artifact: Roll a d10. Return up to X cards from among cards exiled with this artifact to their owners' hands, where X is the result.
afc	Forgotten Realms Commander	2021-07-23	22	Danse Macabre	a9c58cfe-9630-48fa-84ad-50268eb725ed	covered	dice_support, targeted_removal	dice_support, targeted_removal	false		Analyzer roles accepted during batch clean pass.	Sorcery	{3}{B}{B}	5	B	B			verify analyzer roles	https://scryfall.com/card/afc/22/danse-macabre?utm_source=api	Each player sacrifices a nontoken creature of their choice. Roll a d20 and add the toughness of the creature you sacrificed this way. 1—14 | Return a creature card put into a graveyard this way to the battlefield under your control. 15+ | Return up to two creature cards put into graveyards this way to the battlefield under your control.
afc	Forgotten Realms Commander	2021-07-23	23	Death Tyrant	fa944633-e078-41bb-9c7d-4f6b669c27a5	covered	battlefield_recursion, card_selection, combat_body, combat_threat, repeatable_advantage, sacrifice_support, token_support	battlefield_recursion, card_selection, combat_body, combat_threat, repeatable_advantage, sacrifice_support, token_support	false		Analyzer roles accepted during batch clean pass.	Creature — Beholder Skeleton	{4}{B}	5	B	B	Menace		verify analyzer roles	https://scryfall.com/card/afc/23/death-tyrant?utm_source=api	Menace Negative Energy Cone — Whenever an attacking creature you control or a blocking creature an opponent controls dies, create a 2/2 black Zombie creature token. {5}{B}: Return this card from your graveyard to the battlefield tapped.
afc	Forgotten Realms Commander	2021-07-23	24	Grave Endeavor	917dc5a0-071d-4658-ab58-29ac841260f7	covered	battlefield_recursion, card_selection, counter_support, dice_support, direct_finisher, finisher, lifegain, recursion, scalable_spell	battlefield_recursion, card_selection, counter_support, dice_support, direct_finisher, finisher, lifegain, recursion, scalable_spell	false		Analyzer roles accepted during batch clean pass.	Instant	{5}{B}{B}	7	B	B			verify analyzer roles	https://scryfall.com/card/afc/24/grave-endeavor?utm_source=api	Roll two d10 and choose one result. Return a creature card from your graveyard to the battlefield with a number of +1/+1 counters on it equal to that result. Then each opponent loses X life and you gain X life, where X is the other result.
afc	Forgotten Realms Commander	2021-07-23	25	Grim Hireling	89738595-dafb-400a-bfba-91a53a37e717	covered		burst_ramp, combat_body, combat_support, mana_fixing, ramp, removal, sacrifice_support, scalable_spell, targeted_removal, token_support	false		Covered by PRM role audit.	Creature — Tiefling Rogue	{3}{B}	4	B	B	Treasure		already reviewed	https://scryfall.com/card/afc/25/grim-hireling?utm_source=api	Whenever one or more creatures you control deal combat damage to a player, create two Treasure tokens. {B}, Sacrifice X Treasures: Target creature gets -X/-X until end of turn. Activate only as a sorcery.
afc	Forgotten Realms Commander	2021-07-23	26	Hellish Rebuke	5d307515-6ea1-4b1f-8e4b-49bfebfbdfcc	covered	sacrifice_support	sacrifice_support	false		Analyzer roles accepted during batch clean pass.	Instant	{2}{B}	3	B	B			verify analyzer roles	https://scryfall.com/card/afc/26/hellish-rebuke?utm_source=api	Until end of turn, permanents your opponents control gain "When this permanent deals damage to the player who cast Hellish Rebuke, sacrifice this permanent. You lose 2 life."
afc	Forgotten Realms Commander	2021-07-23	27	Lorcan, Warlock Collector	6c87c261-00a8-46f2-92c8-42009a0a2faf	covered	combat_body, combat_threat, replacement_engine	combat_body, combat_threat, replacement_engine	false		Analyzer roles accepted during batch clean pass.	Legendary Creature — Devil	{5}{B}{B}	7	B	B	Flying		verify analyzer roles	https://scryfall.com/card/afc/27/lorcan-warlock-collector?utm_source=api	Flying Whenever a creature card is put into an opponent's graveyard from anywhere, you may pay life equal to its mana value. If you do, put it onto the battlefield under your control. It's a Warlock in addition to its other types. If a Warlock you control would die, exile it instead.
afc	Forgotten Realms Commander	2021-07-23	28	Wand of Orcus	9fd521d5-baa3-4054-a990-d23265863c71	covered	artifact_support, combat_support, token_support	artifact_support, combat_support, token_support	false		Analyzer roles accepted during batch clean pass.	Legendary Artifact — Equipment	{2}{B}	3	B	B	Equip		verify analyzer roles	https://scryfall.com/card/afc/28/wand-of-orcus?utm_source=api	Whenever equipped creature attacks or blocks, it and Zombies you control gain deathtouch until end of turn. Whenever equipped creature deals combat damage to a player, create that many 2/2 black Zombie creature tokens. Equip {3}
afc	Forgotten Realms Commander	2021-07-23	29	Berserker's Frenzy	5cd51d39-aebc-4367-9157-da70b8d9b1a3	covered	dice_support, replacement_engine	dice_support, replacement_engine	false		Analyzer roles accepted during batch clean pass.	Instant	{2}{R}	3	R	R			verify analyzer roles	https://scryfall.com/card/afc/29/berserkers-frenzy?utm_source=api	Cast this spell only before combat or during combat before blockers are declared. Roll two d20 and ignore the lower roll. 1—14 | Choose any number of creatures. They block this turn if able. 15—20 | You choose which creatures block this turn and how those creatures block.
afc	Forgotten Realms Commander	2021-07-23	30	Chaos Dragon	a04f46b4-b0b0-4aef-907f-1df1a2e261de	covered	combat_body, combat_support, combat_threat, dice_support	combat_body, combat_support, combat_threat, dice_support	false		Analyzer roles accepted during batch clean pass.	Creature — Dragon	{1}{R}{R}	3	R	R	Flying, Haste		verify analyzer roles	https://scryfall.com/card/afc/30/chaos-dragon?utm_source=api	Flying, haste This creature attacks each combat if able. At the beginning of combat on your turn, each player rolls a d20. If one or more opponents had the highest result, this creature can't attack those players or planeswalkers they control this combat.
afc	Forgotten Realms Commander	2021-07-23	31	Fiendlash	2d21dc80-2900-4dc3-9657-f17b50716481	covered	artifact_support, combat_support, removal, targeted_removal	artifact_support, combat_support, removal, targeted_removal	false		Analyzer roles accepted during batch clean pass.	Artifact — Equipment	{1}{R}	2	R	R	Equip		verify analyzer roles	https://scryfall.com/card/afc/31/fiendlash?utm_source=api	Equipped creature gets +2/+0 and has reach. Whenever equipped creature is dealt damage, it deals damage equal to its power to target player or planeswalker. Equip {2}{R}
afc	Forgotten Realms Commander	2021-07-23	32	Maddening Hex	5d96170f-14dd-496e-a485-bd3b9eedfe02	covered	dice_support	dice_support	false		Analyzer roles accepted during batch clean pass.	Enchantment — Aura Curse	{1}{R}{R}	3	R	R	Enchant		verify analyzer roles	https://scryfall.com/card/afc/32/maddening-hex?utm_source=api	Enchant player Whenever enchanted player casts a noncreature spell, roll a d6. This Aura deals damage to that player equal to the result. Then attach this Aura to another one of your opponents chosen at random.
afc	Forgotten Realms Commander	2021-07-23	33	Reckless Endeavor	928bf0d9-89be-462d-aeb7-74a65e95535c	covered	burst_ramp, dice_support, mana_fixing, mass_removal, ramp, removal, targeted_removal, token_support	burst_ramp, dice_support, mana_fixing, mass_removal, ramp, removal, targeted_removal, token_support	false		Analyzer roles accepted during batch clean pass.	Sorcery	{5}{R}{R}	7	R	R	Treasure		verify analyzer roles	https://scryfall.com/card/afc/33/reckless-endeavor?utm_source=api	Roll two d12 and choose one result. Reckless Endeavor deals damage equal to that result to each creature. Then create a number of Treasure tokens equal to the other result.
afc	Forgotten Realms Commander	2021-07-23	34	Share the Spoils	d39af66c-4997-48b8-a704-f21d93247d7d	covered		replacement_engine	false		Covered by PRM role audit.	Enchantment	{1}{R}	2	R	R			already reviewed	https://scryfall.com/card/afc/34/share-the-spoils?utm_source=api	When this enchantment enters and whenever an opponent loses the game, exile the top card of each player's library. During each player's turn, that player may play a land or cast a spell from among cards exiled with this enchantment, and they may spend mana as though it were mana of any color to cast that spell. When they do, exile the top card of their library.
afc	Forgotten Realms Commander	2021-07-23	35	Vengeful Ancestor	f3b3173b-f7ae-420e-84ec-ea61414674a0	covered	combat_body, combat_support, combat_threat	combat_body, combat_support, combat_threat	false		Analyzer roles accepted during batch clean pass.	Creature — Spirit Dragon	{2}{R}{R}	4	R	R	Flying, Goad		verify analyzer roles	https://scryfall.com/card/afc/35/vengeful-ancestor?utm_source=api	Flying Whenever this creature enters or attacks, goad target creature. (Until your next turn, that creature attacks each combat if able and attacks a player other than you if able.) Whenever a goaded creature attacks, it deals 1 damage to its controller.
afc	Forgotten Realms Commander	2021-07-23	36	Wild-Magic Sorcerer	a450ef56-8511-43e0-bdca-0c25f54ba338	covered		card_selection, combat_body, cost_reduction, draw, repeatable_advantage, repeatable_draw, selection	false		Covered by PRM role audit.	Creature — Orc Shaman Sorcerer	{3}{R}	4	R	R			already reviewed	https://scryfall.com/card/afc/36/wild-magic-sorcerer?utm_source=api	The first spell you cast from exile each turn has cascade. (When you cast your first spell from exile, exile cards from the top of your library until you exile a nonland card that costs less. You may cast it without paying its mana cost. Put the exiled cards on the bottom in a random order.)
afc	Forgotten Realms Commander	2021-07-23	37	Bag of Tricks	f14ce7d7-6cfa-4f88-a381-d6e912c18b5d	covered	card_draw, card_selection, dice_support, draw, repeatable_advantage, restricted_tutor, selection, tutor	card_draw, card_selection, dice_support, draw, repeatable_advantage, restricted_tutor, selection, tutor	false		Analyzer roles accepted during batch clean pass.	Artifact	{1}{G}	2	G	G			verify analyzer roles	https://scryfall.com/card/afc/37/bag-of-tricks?utm_source=api	{4}{G}, {T}: Roll a d8. Reveal cards from the top of your library until you reveal a creature card with mana value equal to the result. Put that card onto the battlefield and the rest on the bottom of your library in a random order.
afc	Forgotten Realms Commander	2021-07-23	38	Belt of Giant Strength	eb70939f-c4ce-4224-ab74-acc24771d7f0	covered	artifact_support, scalable_spell	artifact_support, scalable_spell	false		Analyzer roles accepted during batch clean pass.	Artifact — Equipment	{1}{G}	2	G	G	Equip		verify analyzer roles	https://scryfall.com/card/afc/38/belt-of-giant-strength?utm_source=api	Equipped creature has base power and toughness 10/10. Equip {10}. This ability costs {X} less to activate, where X is the power of the creature it targets.
