setCode	setName	releasedAt	collectorNumber	name	oracleId	auditStatus	expectedRoles	actualAnalyzerRoles	needsCodeChange	tagDecision	manualNotes	typeLine	manaCost	manaValue	colors	colorIdentity	keywords	scryfallOracleTags	attentionHint	scryfallUrl	oracleText
afc	Forgotten Realms Commander	2021-07-23	82	Curse of Verbosity	c6f76fa7-095e-4bfe-a38c-5c4531880880	covered	card_draw, direct_draw, draw, repeatable_advantage, repeatable_draw	card_draw, direct_draw, draw, repeatable_advantage, repeatable_draw	false		Analyzer roles accepted during batch clean pass.	Enchantment — Aura Curse	{2}{U}	3	U	U	Enchant		verify analyzer roles	https://scryfall.com/card/afc/82/curse-of-verbosity?utm_source=api	Enchant player Whenever enchanted player is attacked, you draw a card. Each opponent attacking that player does the same.
afc	Forgotten Realms Commander	2021-07-23	83	Eel Umbra	4be1ecd0-ee41-4ac0-9155-0fcae7a4d337	covered	combat_support, replacement_engine, tempo_support	combat_support, replacement_engine, tempo_support	false		Analyzer roles accepted during batch clean pass.	Enchantment — Aura	{1}{U}	2	U	U	Umbra armor, Enchant, Flash		verify analyzer roles	https://scryfall.com/card/afc/83/eel-umbra?utm_source=api	Flash (You may cast this spell any time you could cast an instant.) Enchant creature Enchanted creature gets +1/+1. Umbra armor (If enchanted creature would be destroyed, instead remove all damage from it and destroy this Aura.)
afc	Forgotten Realms Commander	2021-07-23	84	Forbidden Alchemy	66d65cda-e3d1-4a00-8ff3-c6d5ef0ab0c1	covered		card_selection, direct_draw, draw, graveyard_support, restricted_tutor, selection	false		Covered by PRM role audit.	Instant	{2}{U}	3	U	BU	Flashback		already reviewed	https://scryfall.com/card/afc/84/forbidden-alchemy?utm_source=api	Look at the top four cards of your library. Put one of them into your hand and the rest into your graveyard. Flashback {6}{B} (You may cast this card from your graveyard for its flashback cost. Then exile it.)
afc	Forgotten Realms Commander	2021-07-23	85	Imprisoned in the Moon	339a7418-9a29-4eae-a3c2-ea590d175936	covered	burst_ramp, ramp, removal, stable_ramp, targeted_removal	burst_ramp, ramp, removal, stable_ramp, targeted_removal	false		Analyzer roles accepted during batch clean pass.	Enchantment — Aura	{2}{U}	3	U	U	Enchant		verify analyzer roles	https://scryfall.com/card/afc/85/imprisoned-in-the-moon?utm_source=api	Enchant creature, land, or planeswalker Enchanted permanent is a colorless land with "{T}: Add {C}" and loses all other card types and abilities.
afc	Forgotten Realms Commander	2021-07-23	86	Merfolk Looter	67362406-b1ca-49e2-800d-9050bfe8742a	covered		card_draw, card_selection, combat_body, direct_draw, draw, repeatable_advantage, repeatable_draw, selection	false		Covered by 7ED role audit.	Creature — Merfolk Rogue	{1}{U}	2	U	U			already reviewed	https://scryfall.com/card/afc/86/merfolk-looter?utm_source=api	{T}: Draw a card, then discard a card.
afc	Forgotten Realms Commander	2021-07-23	87	Mulldrifter	24d0f5e7-0d9e-4b76-900e-a7274e80312d	covered		card_draw, combat_body, combat_threat, direct_draw, draw	false		Covered by PRM role audit.	Creature — Elemental	{4}{U}	5	U	U	Flying, Evoke		already reviewed	https://scryfall.com/card/afc/87/mulldrifter?utm_source=api	Flying When this creature enters, draw two cards. Evoke {2}{U} (You may cast this spell for its evoke cost. If you do, it's sacrificed when it enters.)
afc	Forgotten Realms Commander	2021-07-23	88	Murder of Crows	babab2f5-fd1f-4e0a-a692-6c2ce35df708	covered	card_draw, combat_body, combat_threat, direct_draw, draw, repeatable_advantage, repeatable_draw, sacrifice_support	card_draw, combat_body, combat_threat, direct_draw, draw, repeatable_advantage, repeatable_draw, sacrifice_support	false		Analyzer roles accepted during batch clean pass.	Creature — Bird	{3}{U}{U}	5	U	U	Flying		verify analyzer roles	https://scryfall.com/card/afc/88/murder-of-crows?utm_source=api	Flying Whenever another creature dies, you may draw a card. If you do, discard a card.
afc	Forgotten Realms Commander	2021-07-23	89	Phantasmal Image	bde94af8-faea-41ff-8eed-ba642eac9968	covered	combat_body, copy_support, sacrifice_support	combat_body, copy_support, sacrifice_support	false		Analyzer roles accepted during batch clean pass.	Creature — Illusion	{1}{U}	2	U	U			verify analyzer roles	https://scryfall.com/card/afc/89/phantasmal-image?utm_source=api	You may have this creature enter as a copy of any creature on the battlefield, except it's an Illusion in addition to its other types and it has "When this creature becomes the target of a spell or ability, sacrifice it."
afc	Forgotten Realms Commander	2021-07-23	90	Prognostic Sphinx	92c470c9-1373-4f3a-9805-5e9613874793	covered		card_selection, combat_body, combat_support, combat_threat, repeatable_advantage, selection, self_protection	false		Covered by PRM role audit.	Creature — Sphinx	{3}{U}{U}	5	U	U	Scry, Flying		already reviewed	https://scryfall.com/card/afc/90/prognostic-sphinx?utm_source=api	Flying Discard a card: This creature gains hexproof until end of turn. Tap it. Whenever this creature attacks, scry 3.
afc	Forgotten Realms Commander	2021-07-23	91	Propaganda	ea9709b6-4c37-4d5a-b04d-cd4c42e4f9dd	covered	combat_support, stax_piece	combat_support, stax_piece	false		Covered by Tempest role audit.	Enchantment	{2}{U}	3	U	U			already reviewed	https://scryfall.com/card/afc/91/propaganda?utm_source=api	Creatures can't attack you unless their controller pays {2} for each creature they control that's attacking you.
afc	Forgotten Realms Commander	2021-07-23	92	Psychic Impetus	47214acc-08c4-4dcb-9a8b-09196ce41045	covered	card_selection, combat_support, repeatable_advantage, selection	card_selection, combat_support, repeatable_advantage, selection	false		Analyzer roles accepted during batch clean pass.	Enchantment — Aura	{2}{U}	3	U	U	Goad, Enchant, Scry		verify analyzer roles	https://scryfall.com/card/afc/92/psychic-impetus?utm_source=api	Enchant creature Enchanted creature gets +2/+2 and is goaded. (It attacks each combat if able and attacks a player other than you if able.) Whenever enchanted creature attacks, you scry 2.
afc	Forgotten Realms Commander	2021-07-23	93	Riverwise Augur	eac79f15-3b63-457a-b6a8-f9237439c93c	covered	card_draw, combat_body, direct_draw, draw	card_draw, combat_body, direct_draw, draw	false		Analyzer roles accepted during batch clean pass.	Creature — Merfolk Wizard	{3}{U}	4	U	U			verify analyzer roles	https://scryfall.com/card/afc/93/riverwise-augur?utm_source=api	When this creature enters, draw three cards, then put two cards from your hand on top of your library in any order.
afc	Forgotten Realms Commander	2021-07-23	94	Serum Visions	56956afd-db53-4542-816b-490c8b0bbcf7	covered		card_draw, card_selection, direct_draw, draw, selection	false		Covered by PRM role audit.	Sorcery	{U}	1	U	U	Scry		already reviewed	https://scryfall.com/card/afc/94/serum-visions?utm_source=api	Draw a card. Scry 2.
afc	Forgotten Realms Commander	2021-07-23	95	Chittering Witch	8b1aa532-4f19-407e-83a5-13b3160ad8c2	covered	combat_body, sacrifice_support, targeted_removal, token_support	combat_body, sacrifice_support, targeted_removal, token_support	false		Analyzer roles accepted during batch clean pass.	Creature — Human Warlock	{3}{B}	4	B	B			verify analyzer roles	https://scryfall.com/card/afc/95/chittering-witch?utm_source=api	When this creature enters, create a number of 1/1 black Rat creature tokens equal to the number of opponents you have. {1}{B}, Sacrifice a creature: Target creature gets -2/-2 until end of turn.
afc	Forgotten Realms Commander	2021-07-23	96	Consuming Vapors	a10ce333-48d7-499b-9355-f381f2395497	covered	card_selection, lifegain, removal, repeatable_advantage, repeatable_draw, selection, targeted_removal	card_selection, lifegain, removal, repeatable_advantage, repeatable_draw, selection, targeted_removal	false		Analyzer roles accepted during batch clean pass.	Sorcery	{3}{B}	4	B	B	Rebound		verify analyzer roles	https://scryfall.com/card/afc/96/consuming-vapors?utm_source=api	Target player sacrifices a creature of their choice. You gain life equal to that creature's toughness. Rebound (If you cast this spell from your hand, exile it as it resolves. At the beginning of your next upkeep, you may cast this card from exile without paying its mana cost.)
afc	Forgotten Realms Commander	2021-07-23	97	Dead Man's Chest	e5fdd6fd-6492-47ec-8b74-9ff22ff9849a	covered	card_selection, sacrifice_support	card_selection, sacrifice_support	false		Analyzer roles accepted during batch clean pass.	Enchantment — Aura	{1}{B}	2	B	B	Enchant		verify analyzer roles	https://scryfall.com/card/afc/97/dead-mans-chest?utm_source=api	Enchant creature an opponent controls When enchanted creature dies, exile cards equal to its power from the top of its owner's library. You may cast spells from among those cards for as long as they remain exiled, and mana of any type can be spent to cast them.
afc	Forgotten Realms Commander	2021-07-23	98	Doomed Necromancer	155422a0-a0cd-4399-8ed9-fa68ac2c80a6	covered		battlefield_recursion, card_selection, combat_body, recursion, repeatable_advantage, sacrifice_support	false		Covered by ONS role audit.	Creature — Human Cleric Mercenary	{2}{B}	3	B	B			already reviewed	https://scryfall.com/card/afc/98/doomed-necromancer?utm_source=api	{B}, {T}, Sacrifice this creature: Return target creature card from your graveyard to the battlefield.
afc	Forgotten Realms Commander	2021-07-23	99	Fiend of the Shadows	3891a3b6-d8ac-4cd3-b2f6-d6d786e89a67	covered	card_selection, combat_body, combat_support, combat_threat, protection, regeneration_protection, sacrifice_support, targeted_protection	card_selection, combat_body, combat_support, combat_threat, protection, regeneration_protection, sacrifice_support, targeted_protection	false		Analyzer roles accepted during batch clean pass.	Creature — Vampire Wizard	{3}{B}{B}	5	B	B	Flying, Regenerate		verify analyzer roles	https://scryfall.com/card/afc/99/fiend-of-the-shadows?utm_source=api	Flying Whenever this creature deals combat damage to a player, that player exiles a card from their hand. You may play that card for as long as it remains exiled. Sacrifice a Human: Regenerate this creature.
afc	Forgotten Realms Commander	2021-07-23	100	Gonti, Lord of Luxury	d5be0ff6-39d9-4f9f-a028-e62dc38463f2	covered	card_selection, combat_body, combat_threat, face_down_support	card_selection, combat_body, combat_threat, face_down_support	false		Analyzer roles accepted during batch clean pass.	Legendary Creature — Aetherborn Rogue	{2}{B}{B}	4	B	B	Deathtouch		verify analyzer roles	https://scryfall.com/card/afc/100/gonti-lord-of-luxury?utm_source=api	Deathtouch When Gonti enters, look at the top four cards of target opponent's library, exile one of them face down, then put the rest on the bottom of that library in a random order. You may cast that card for as long as it remains exiled, and mana of any type can be spent to cast that spell.
afc	Forgotten Realms Commander	2021-07-23	101	Hex	89457fa8-b0e2-4277-b6a9-c6601c59b46d	covered	removal, targeted_removal	removal, targeted_removal	false		Analyzer roles accepted during batch clean pass.	Sorcery	{4}{B}{B}	6	B	B			verify analyzer roles	https://scryfall.com/card/afc/101/hex?utm_source=api	Destroy six target creatures.
afc	Forgotten Realms Commander	2021-07-23	102	Marionette Master	dabbf796-3b88-499e-8839-06fa36fe01ac	covered	artifact_support, combat_body, counter_support, direct_finisher, finisher, repeatable_finisher, token_support	artifact_support, combat_body, counter_support, direct_finisher, finisher, repeatable_finisher, token_support	false		Analyzer roles accepted during batch clean pass.	Creature — Human Artificer	{4}{B}{B}	6	B	B	Fabricate		verify analyzer roles	https://scryfall.com/card/afc/102/marionette-master?utm_source=api	Fabricate 3 (When this creature enters, put three +1/+1 counters on it or create three 1/1 colorless Servo artifact creature tokens.) Whenever an artifact you control is put into a graveyard from the battlefield, target opponent loses life equal to this creature's power.
afc	Forgotten Realms Commander	2021-07-23	103	Necromantic Selection	b48a149c-aead-43b2-a99e-c964d6d28aa0	covered	mass_removal, removal	mass_removal, removal	false		Analyzer roles accepted during batch clean pass.	Sorcery	{4}{B}{B}{B}	7	B	B			verify analyzer roles	https://scryfall.com/card/afc/103/necromantic-selection?utm_source=api	Destroy all creatures, then return a creature card put into a graveyard this way to the battlefield under your control. It's a black Zombie in addition to its other colors and types. Exile Necromantic Selection.
afc	Forgotten Realms Commander	2021-07-23	104	Ogre Slumlord	0a5e3748-2e58-4e53-9653-8af4e21cf223	covered	combat_body, sacrifice_support, token_support	combat_body, sacrifice_support, token_support	false		Analyzer roles accepted during batch clean pass.	Creature — Ogre Rogue	{3}{B}{B}	5	B	B			verify analyzer roles	https://scryfall.com/card/afc/104/ogre-slumlord?utm_source=api	Whenever another nontoken creature dies, you may create a 1/1 black Rat creature token. Rats you control have deathtouch.
afc	Forgotten Realms Commander	2021-07-23	105	Phthisis	530f088d-bfa1-4410-b1aa-ade8abdb2b7a	covered	card_selection, cost_reduction, counter_support, removal, repeatable_advantage, repeatable_draw, selection, targeted_removal	card_selection, cost_reduction, counter_support, removal, repeatable_advantage, repeatable_draw, selection, targeted_removal	false		Analyzer roles accepted during batch clean pass.	Sorcery	{3}{B}{B}{B}{B}	7	B	B	Suspend		verify analyzer roles	https://scryfall.com/card/afc/105/phthisis?utm_source=api	Destroy target creature. Its controller loses life equal to its power plus its toughness. Suspend 5—{1}{B} (Rather than cast this card from your hand, you may pay {1}{B} and exile it with five time counters on it. At the beginning of your upkeep, remove a time counter. When the last is removed, you may cast it without paying its mana cost.)
afc	Forgotten Realms Commander	2021-07-23	106	Piper of the Swarm	a6c5c5ea-0bd0-4d5a-bd3f-6217f14c9939	covered		combat_body, removal, sacrifice_support, tempo_removal, theft_support, token_support	false		Covered by PRM role audit.	Creature — Human Warlock	{1}{B}	2	B	B			already reviewed	https://scryfall.com/card/afc/106/piper-of-the-swarm?utm_source=api	Rats you control have menace. {1}{B}, {T}: Create a 1/1 black Rat creature token. {2}{B}{B}, {T}, Sacrifice three Rats: Gain control of target creature.
afc	Forgotten Realms Commander	2021-07-23	107	Plaguecrafter	2e3ee458-fa3f-4452-ab95-5a7fb5a0483b	covered	combat_body, removal, targeted_removal	combat_body, removal, targeted_removal	false		Analyzer roles accepted during batch clean pass.	Creature — Human Shaman	{2}{B}	3	B	B			verify analyzer roles	https://scryfall.com/card/afc/107/plaguecrafter?utm_source=api	When this creature enters, each player sacrifices a creature or planeswalker of their choice. Each player who can't discards a card.
afc	Forgotten Realms Commander	2021-07-23	108	Pontiff of Blight	f5a95092-fb71-4b55-bc54-782bd1c603e1	covered	combat_body, direct_finisher, finisher, lifegain, repeatable_finisher	combat_body, direct_finisher, finisher, lifegain, repeatable_finisher	false		Analyzer roles accepted during batch clean pass.	Creature — Zombie Cleric	{4}{B}{B}	6	B	B	Extort		verify analyzer roles	https://scryfall.com/card/afc/108/pontiff-of-blight?utm_source=api	Extort (Whenever you cast a spell, you may pay {W/B}. If you do, each opponent loses 1 life and you gain that much life.) Other creatures you control have extort. (If a creature has multiple instances of extort, each triggers separately.)
afc	Forgotten Realms Commander	2021-07-23	109	Reassembling Skeleton	9dbc3530-b278-4c8d-b2cc-a09dfac9d5e5	covered	battlefield_recursion, card_selection, combat_body, repeatable_advantage	battlefield_recursion, card_selection, combat_body, repeatable_advantage	false		Analyzer roles accepted during batch clean pass.	Creature — Skeleton Warrior	{1}{B}	2	B	B			verify analyzer roles	https://scryfall.com/card/afc/109/reassembling-skeleton?utm_source=api	{1}{B}: Return this card from your graveyard to the battlefield tapped.
afc	Forgotten Realms Commander	2021-07-23	110	Shriekmaw	717bbb9d-0a5b-4979-a24b-9d54aac7657a	covered		combat_body, combat_support, removal, targeted_removal	false		Covered by PRM role audit.	Creature — Elemental	{4}{B}	5	B	B	Evoke, Fear		already reviewed	https://scryfall.com/card/afc/110/shriekmaw?utm_source=api	Fear (This creature can't be blocked except by artifact creatures and/or black creatures.) When this creature enters, destroy target nonartifact, nonblack creature. Evoke {1}{B} (You may cast this spell for its evoke cost. If you do, it's sacrificed when it enters.)
afc	Forgotten Realms Commander	2021-07-23	111	Unburial Rites	d48e1545-7997-45ed-83a1-aee45b3d3d20	covered	battlefield_recursion, card_selection, graveyard_support, recursion	battlefield_recursion, card_selection, graveyard_support, recursion	false		Analyzer roles accepted during batch clean pass.	Sorcery	{4}{B}	5	B	BW	Flashback		verify analyzer roles	https://scryfall.com/card/afc/111/unburial-rites?utm_source=api	Return target creature card from your graveyard to the battlefield. Flashback {3}{W} (You may cast this card from your graveyard for its flashback cost. Then exile it.)
afc	Forgotten Realms Commander	2021-07-23	112	Victimize	240e85d3-e495-4877-8609-4b4056c402f7	covered		sacrifice_support	false		Covered by USG role audit.	Sorcery	{2}{B}	3	B	B			already reviewed	https://scryfall.com/card/afc/112/victimize?utm_source=api	Choose two target creature cards in your graveyard. Sacrifice a creature. If you do, return the chosen cards to the battlefield tapped.
afc	Forgotten Realms Commander	2021-07-23	113	Anger	eaabd151-2160-4bff-82c0-3fa88659be98	covered		combat_body, combat_support, combat_threat	false		Covered by JUD role audit.	Creature — Incarnation	{3}{R}	4	R	R	Haste		already reviewed	https://scryfall.com/card/afc/113/anger?utm_source=api	Haste As long as this card is in your graveyard and you control a Mountain, creatures you control have haste.
afc	Forgotten Realms Commander	2021-07-23	114	Apex of Power	d06eedb4-bd5a-4864-9505-a570a745d165	covered	burst_ramp, card_selection, direct_draw, draw, selection	burst_ramp, card_selection, direct_draw, draw, selection	false		Analyzer roles accepted during batch clean pass.	Sorcery	{7}{R}{R}{R}	10	R	R			verify analyzer roles	https://scryfall.com/card/afc/114/apex-of-power?utm_source=api	Exile the top seven cards of your library. Until end of turn, you may cast spells from among them. If this spell was cast from your hand, add ten mana of any one color.
afc	Forgotten Realms Commander	2021-07-23	115	Bogardan Hellkite	699bc130-2f1f-4bc8-a25f-9329e40efbb1	covered	combat_body, combat_threat, removal, targeted_removal	combat_body, combat_threat, removal, targeted_removal	false		Analyzer roles accepted during batch clean pass.	Creature — Dragon	{6}{R}{R}	8	R	R	Flying, Flash		verify analyzer roles	https://scryfall.com/card/afc/115/bogardan-hellkite?utm_source=api	Flash Flying When this creature enters, it deals 5 damage divided as you choose among any number of targets.
afc	Forgotten Realms Commander	2021-07-23	116	Chain Reaction	086b2564-9114-4ba2-94fd-b490f98f38a7	covered	mass_removal, removal, scalable_spell	mass_removal, removal, scalable_spell	false		Analyzer roles accepted during batch clean pass.	Sorcery	{2}{R}{R}	4	R	R			verify analyzer roles	https://scryfall.com/card/afc/116/chain-reaction?utm_source=api	Chain Reaction deals X damage to each creature, where X is the number of creatures on the battlefield.
afc	Forgotten Realms Commander	2021-07-23	117	Chaos Warp	07a0cba9-8768-4fd9-a3d5-b0f83b4bf8e8	covered		removal, targeted_removal	false		Covered by PRM role audit.	Instant	{2}{R}	3	R	R			already reviewed	https://scryfall.com/card/afc/117/chaos-warp?utm_source=api	The owner of target permanent shuffles it into their library, then reveals the top card of their library. If it's a permanent card, they put it onto the battlefield.
afc	Forgotten Realms Commander	2021-07-23	118	Commune with Lava	f4aa0f64-d202-42a1-af62-0e53bbe87782	covered	card_selection, direct_draw, draw, mana_sink, scalable_spell, selection	card_selection, direct_draw, draw, mana_sink, scalable_spell, selection	false		Analyzer roles accepted during batch clean pass.	Instant	{X}{R}{R}	2	R	R			verify analyzer roles	https://scryfall.com/card/afc/118/commune-with-lava?utm_source=api	Exile the top X cards of your library. Until the end of your next turn, you may play those cards.
afc	Forgotten Realms Commander	2021-07-23	119	Dark-Dweller Oracle	17917b7a-2b2b-4a96-a21e-10cd91375660	covered	card_selection, combat_body, direct_draw, draw, sacrifice_support, selection	card_selection, combat_body, direct_draw, draw, sacrifice_support, selection	false		Analyzer roles accepted during batch clean pass.	Creature — Goblin Shaman	{1}{R}	2	R	R			verify analyzer roles	https://scryfall.com/card/afc/119/dark-dweller-oracle?utm_source=api	{1}, Sacrifice a creature: Exile the top card of your library. You may play that card this turn. (You still pay its costs. You can play a land this way only if you have an available land play remaining.)
afc	Forgotten Realms Commander	2021-07-23	120	Demanding Dragon	c8f1e3bd-bbf0-4750-b054-03553fc61850	covered	combat_body, combat_threat, removal, targeted_removal	combat_body, combat_threat, removal, targeted_removal	false		Analyzer roles accepted during batch clean pass.	Creature — Dragon	{3}{R}{R}	5	R	R	Flying		verify analyzer roles	https://scryfall.com/card/afc/120/demanding-dragon?utm_source=api	Flying When this creature enters, it deals 5 damage to target opponent unless that player sacrifices a creature of their choice.
afc	Forgotten Realms Commander	2021-07-23	121	Dire Fleet Daredevil	7a3e50a5-c163-4c41-b62d-d52c233c55b7	covered	card_selection, combat_body, combat_threat, replacement_engine	card_selection, combat_body, combat_threat, replacement_engine	false		Analyzer roles accepted during batch clean pass.	Creature — Human Pirate	{1}{R}	2	R	R	First strike		verify analyzer roles	https://scryfall.com/card/afc/121/dire-fleet-daredevil?utm_source=api	First strike When this creature enters, exile target instant or sorcery card from an opponent's graveyard. You may cast it this turn, and mana of any type can be spent to cast that spell. If that spell would be put into a graveyard, exile it instead.
afc	Forgotten Realms Commander	2021-07-23	122	Disrupt Decorum	9b084cd4-cc21-4f3a-9ac5-1e1160a31aa6	covered	combat_support	combat_support	false		Analyzer roles accepted during batch clean pass.	Sorcery	{2}{R}{R}	4	R	R	Goad		verify analyzer roles	https://scryfall.com/card/afc/122/disrupt-decorum?utm_source=api	Goad all creatures you don't control. (Until your next turn, those creatures attack each combat if able and attack a player other than you if able.)
afc	Forgotten Realms Commander	2021-07-23	123	Dragonlord's Servant	faf81ae0-0b35-45ef-a50d-6cecf0c0eeeb	covered		combat_body, cost_reduction, ramp	false		Covered by PRM role audit.	Creature — Goblin Shaman	{1}{R}	2	R	R			already reviewed	https://scryfall.com/card/afc/123/dragonlords-servant?utm_source=api	Dragon spells you cast cost {1} less to cast.
afc	Forgotten Realms Commander	2021-07-23	124	Dragonmaster Outcast	b6fb79c3-cd32-4045-8177-e52841eea65b	covered	combat_body, token_support	combat_body, token_support	false		Analyzer roles accepted during batch clean pass.	Creature — Human Shaman	{R}	1	R	R			verify analyzer roles	https://scryfall.com/card/afc/124/dragonmaster-outcast?utm_source=api	At the beginning of your upkeep, if you control six or more lands, create a 5/5 red Dragon creature token with flying.
afc	Forgotten Realms Commander	2021-07-23	125	Dream Pillager	504cc26d-3fd5-4391-9d30-f0614e5c8bbc	covered	card_selection, combat_body, combat_support, combat_threat	card_selection, combat_body, combat_support, combat_threat	false		Analyzer roles accepted during batch clean pass.	Creature — Dragon	{5}{R}{R}	7	R	R	Flying		verify analyzer roles	https://scryfall.com/card/afc/125/dream-pillager?utm_source=api	Flying Whenever this creature deals combat damage to a player, exile that many cards from the top of your library. Until end of turn, you may cast spells from among those exiled cards.
afc	Forgotten Realms Commander	2021-07-23	126	Etali, Primal Storm	078def07-ae5d-4591-8db6-d156834aab97	covered	card_selection, combat_body, combat_support, direct_draw, draw, repeatable_advantage, repeatable_draw, selection	card_selection, combat_body, combat_support, direct_draw, draw, repeatable_advantage, repeatable_draw, selection	false		Analyzer roles accepted during batch clean pass.	Legendary Creature — Elder Dinosaur	{4}{R}{R}	6	R	R			verify analyzer roles	https://scryfall.com/card/afc/126/etali-primal-storm?utm_source=api	Whenever Etali attacks, exile the top card of each player's library, then you may cast any number of spells from among those cards without paying their mana costs.
afc	Forgotten Realms Commander	2021-07-23	127	Gratuitous Violence	7c340a39-4ee0-4ba1-bb66-6674f8020fda	covered		multiplier_support, replacement_engine	false		Covered by ONS role audit.	Enchantment	{2}{R}{R}{R}	5	R	R	Double		already reviewed	https://scryfall.com/card/afc/127/gratuitous-violence?utm_source=api	If a creature you control would deal damage to a permanent or player, it deals double that damage instead.
