setCode	setName	releasedAt	collectorNumber	name	oracleId	auditStatus	expectedRoles	actualAnalyzerRoles	needsCodeChange	tagDecision	manualNotes	typeLine	manaCost	manaValue	colors	colorIdentity	keywords	scryfallOracleTags	attentionHint	scryfallUrl	oracleText
c21	Commander 2021	2021-04-23	97	Oblation	860e744d-899c-43c7-84bb-d52c69d2f45a	covered		card_draw	false		Covered by ONS role audit.	Instant	{2}{W}	3	W	W			already reviewed	https://scryfall.com/card/c21/97/oblation?utm_source=api	The owner of target nonland permanent shuffles it into their library, then draws two cards.
c21	Commander 2021	2021-04-23	98	Oreskos Explorer	a3055ae8-990d-495a-9cb5-971407990cfa			combat_body, land_acceleration, land_tutor, mana_fixing, scalable_spell, tutor				Creature — Cat Scout	{1}{W}	2	W	W			verify analyzer roles	https://scryfall.com/card/c21/98/oreskos-explorer?utm_source=api	When this creature enters, search your library for up to X Plains cards, where X is the number of players who control more lands than you. Reveal those cards, put them into your hand, then shuffle.
c21	Commander 2021	2021-04-23	99	Orzhov Advokist	d5e9942e-096f-433f-8668-4b594f3c1b02			combat_body, combat_support, counter_support				Creature — Human Advisor	{2}{W}	3	W	W			verify analyzer roles	https://scryfall.com/card/c21/99/orzhov-advokist?utm_source=api	At the beginning of your upkeep, each player may put two +1/+1 counters on a creature they control. If a player does, creatures that player controls can't attack you or planeswalkers you control until your next turn.
c21	Commander 2021	2021-04-23	100	Return to Dust	3029df1d-d02a-4fed-8ab4-000a2096f823	covered		removal, targeted_removal	false		Covered by PRM role audit.	Instant	{2}{W}{W}	4	W	W			already reviewed	https://scryfall.com/card/c21/100/return-to-dust?utm_source=api	Exile target artifact or enchantment. If you cast this spell during your main phase, you may exile up to one other target artifact or enchantment.
c21	Commander 2021	2021-04-23	101	Rout	d69aa624-23d1-406a-b7e0-9140a6f57929	covered		mass_removal, removal, replacement_engine, tempo_support	false		Covered by INV role audit.	Sorcery	{3}{W}{W}	5	W	W			already reviewed	https://scryfall.com/card/c21/101/rout?utm_source=api	You may cast this spell as though it had flash if you pay {2} more to cast it. (You may cast it any time you could cast an instant.) Destroy all creatures. They can't be regenerated.
c21	Commander 2021	2021-04-23	102	Sanctum Gargoyle	6ee9802a-7a44-49c7-93d9-f75c4d42e71e			card_selection, combat_body, combat_threat, hand_recursion, recursion				Artifact Creature — Gargoyle	{3}{W}	4	W	W	Flying		verify analyzer roles	https://scryfall.com/card/c21/102/sanctum-gargoyle?utm_source=api	Flying When this creature enters, you may return target artifact card from your graveyard to your hand.
c21	Commander 2021	2021-04-23	103	Selfless Squire	7d079c78-b2a9-444f-ab54-c61c041baa6d			broad_protection, combat_body, counter_support, protection				Creature — Human Soldier	{3}{W}	4	W	W	Flash		verify analyzer roles	https://scryfall.com/card/c21/103/selfless-squire?utm_source=api	Flash When this creature enters, prevent all damage that would be dealt to you this turn. Whenever damage that would be dealt to you is prevented, put that many +1/+1 counters on this creature.
c21	Commander 2021	2021-04-23	104	Soul Snare	52bd4331-67b6-4eb8-9566-e00359889fc6			sacrifice_support				Enchantment	{W}	1	W	W			verify analyzer roles	https://scryfall.com/card/c21/104/soul-snare?utm_source=api	{W}, Sacrifice this enchantment: Exile target creature that's attacking you or a planeswalker you control.
c21	Commander 2021	2021-04-23	105	Stalking Leonin	6ec98a34-5c04-423c-98e5-8cf3047135c1			combat_body, removal, targeted_removal				Creature — Cat Archer	{2}{W}	3	W	W			verify analyzer roles	https://scryfall.com/card/c21/105/stalking-leonin?utm_source=api	When this creature enters, secretly choose an opponent. Reveal the player you chose: Exile target creature that's attacking you if it's controlled by the chosen player. Activate only once.
c21	Commander 2021	2021-04-23	106	Sun Titan	b2e950fb-cb7e-40a0-a311-5bbdd0477b29	covered		battlefield_recursion, card_selection, combat_body, combat_support, combat_threat, recursion, repeatable_advantage	false		Covered by PRM role audit.	Creature — Giant	{4}{W}{W}	6	W	W	Vigilance		already reviewed	https://scryfall.com/card/c21/106/sun-titan?utm_source=api	Vigilance Whenever this creature enters or attacks, you may return target permanent card with mana value 3 or less from your graveyard to the battlefield.
c21	Commander 2021	2021-04-23	107	Sunscorch Regent	c8ff464f-0059-4055-a2f2-556fe6db8fbf	covered		combat_body, combat_threat, counter_support, lifegain	false		Covered by PRM role audit.	Creature — Dragon	{3}{W}{W}	5	W	W	Flying		already reviewed	https://scryfall.com/card/c21/107/sunscorch-regent?utm_source=api	Flying Whenever an opponent casts a spell, put a +1/+1 counter on this creature and you gain 1 life.
c21	Commander 2021	2021-04-23	108	Together Forever	36b19ec0-d581-4213-bfae-1d7808a2f60d			counter_support, sacrifice_support				Enchantment	{W}{W}	2	W	W	Support		verify analyzer roles	https://scryfall.com/card/c21/108/together-forever?utm_source=api	When this enchantment enters, support 2. (Put a +1/+1 counter on each of up to two target creatures.) {1}: Choose target creature with a counter on it. When that creature dies this turn, return that card to its owner's hand.
c21	Commander 2021	2021-04-23	109	Tragic Arrogance	8a29bd35-33ef-4317-9fe5-8aaff5d7d64d			removal, targeted_removal				Sorcery	{3}{W}{W}	5	W	W			verify analyzer roles	https://scryfall.com/card/c21/109/tragic-arrogance?utm_source=api	For each player, you choose from among the permanents that player controls an artifact, a creature, an enchantment, and a planeswalker. Then each player sacrifices all other nonland permanents they control.
c21	Commander 2021	2021-04-23	110	Vow of Duty	1e7bddbd-e448-4aea-9d18-b44bd45837c5			combat_support				Enchantment — Aura	{2}{W}	3	W	W	Enchant		verify analyzer roles	https://scryfall.com/card/c21/110/vow-of-duty?utm_source=api	Enchant creature Enchanted creature gets +2/+2, has vigilance, and can't attack you or planeswalkers you control.
c21	Commander 2021	2021-04-23	111	Windborn Muse	75e09ac6-d789-4c4d-9aca-845d68f3899f	covered		combat_body, combat_support, combat_threat, stax_piece	false		Covered by LGN role audit.	Creature — Spirit	{3}{W}	4	W	W	Flying		already reviewed	https://scryfall.com/card/c21/111/windborn-muse?utm_source=api	Flying Creatures can't attack you unless their controller pays {2} for each creature they control that's attacking you.
c21	Commander 2021	2021-04-23	112	Zetalpa, Primal Dawn	7da0e5de-3e4c-420a-8685-991206100b9d	covered	combat_body, combat_threat, self_protection	combat_body, combat_threat, self_protection	false		Covered by Media and Collaboration Promos role audit.	Legendary Creature — Elder Dinosaur	{6}{W}{W}	8	W	W	Flying, Indestructible, Vigilance, Trample, Double strike		already reviewed	https://scryfall.com/card/c21/112/zetalpa-primal-dawn?utm_source=api	Flying, double strike, vigilance, trample, indestructible
c21	Commander 2021	2021-04-23	113	Aether Gale	b21d6482-1b3a-47e6-98a5-3067f5f3818b			removal, tempo_removal				Sorcery	{3}{U}{U}	5	U	U			verify analyzer roles	https://scryfall.com/card/c21/113/aether-gale?utm_source=api	Return six target nonland permanents to their owners' hands.
c21	Commander 2021	2021-04-23	114	Aetherspouts	48369aec-a991-4bef-8554-01c84302b063			mass_removal, removal				Instant	{3}{U}{U}	5	U	U			verify analyzer roles	https://scryfall.com/card/c21/114/aetherspouts?utm_source=api	For each attacking creature, its owner puts it on their choice of the top or bottom of their library.
c21	Commander 2021	2021-04-23	115	Brainstorm	36cd2364-d113-47d1-b2c4-b088d9eb88dd	covered	card_draw, direct_draw, draw	card_draw, direct_draw, draw	false		Covered by Ice Age role audit.	Instant	{U}	1	U	U			already reviewed	https://scryfall.com/card/c21/115/brainstorm?utm_source=api	Draw three cards, then put two cards from your hand on top of your library in any order.
c21	Commander 2021	2021-04-23	116	Champion of Wits	3fd8ba0c-75ec-43ea-8706-f71e6cf1d236			card_draw, combat_body, copy_support, direct_draw, draw, graveyard_support, token_support				Creature — Snake Wizard	{2}{U}	3	U	U	Eternalize		verify analyzer roles	https://scryfall.com/card/c21/116/champion-of-wits?utm_source=api	When this creature enters, you may draw cards equal to its power. If you do, discard two cards. Eternalize {5}{U}{U} ({5}{U}{U}, Exile this card from your graveyard: Create a token that's a copy of it, except it's a 4/4 black Zombie Snake Wizard with no mana cost. Eternalize only as a sorcery.)
c21	Commander 2021	2021-04-23	117	Crafty Cutpurse	2ef53e18-0baf-4eee-b671-4c19b464cbfb			combat_body				Creature — Human Pirate	{3}{U}	4	U	U	Flash		verify analyzer roles	https://scryfall.com/card/c21/117/crafty-cutpurse?utm_source=api	Flash When this creature enters, each token that would be created under an opponent's control this turn is created under your control instead.
c21	Commander 2021	2021-04-23	118	Curse of the Swine	5669ea7c-c4fc-494c-896b-4bce9b494817			mana_sink, scalable_spell, targeted_removal				Sorcery	{X}{U}{U}	2	U	U			verify analyzer roles	https://scryfall.com/card/c21/118/curse-of-the-swine?utm_source=api	Exile X target creatures. For each creature exiled this way, its controller creates a 2/2 green Boar creature token.
c21	Commander 2021	2021-04-23	119	Dig Through Time	f8b17b89-26ce-4208-874a-9e1d66514640	covered		card_selection, cost_reduction	false		Covered by PRM role audit.	Instant	{6}{U}{U}	8	U	U	Delve		already reviewed	https://scryfall.com/card/c21/119/dig-through-time?utm_source=api	Delve (Each card you exile from your graveyard while casting this spell pays for {1}.) Look at the top seven cards of your library. Put two of them into your hand and the rest on the bottom of your library in any order.
c21	Commander 2021	2021-04-23	120	Diluvian Primordial	f21ce158-2925-4658-ab7b-b73718d31965			card_selection, combat_body, combat_threat, repeatable_advantage, repeatable_draw, replacement_engine, selection				Creature — Avatar	{5}{U}{U}	7	U	U	Flying		verify analyzer roles	https://scryfall.com/card/c21/120/diluvian-primordial?utm_source=api	Flying When this creature enters, for each opponent, you may cast up to one target instant or sorcery card from that player's graveyard without paying its mana cost. If a spell cast this way would be put into a graveyard, exile it instead.
c21	Commander 2021	2021-04-23	121	Living Lore	7c48c341-1d56-4210-9d86-181ebb206098			card_selection, combat_body, combat_support, repeatable_advantage, repeatable_draw, sacrifice_support, selection				Creature — Avatar	{3}{U}	4	U	U			verify analyzer roles	https://scryfall.com/card/c21/121/living-lore?utm_source=api	As this creature enters, exile an instant or sorcery card from your graveyard. Living Lore's power and toughness are each equal to the exiled card's mana value. Whenever this creature deals combat damage, you may sacrifice it. If you do, you may cast the exiled card without paying its mana cost.
c21	Commander 2021	2021-04-23	122	Metallurgic Summonings	7d5149c6-0e7e-438c-a554-5235c85e2426			card_selection, combat_support, copy_support, mass_recursion, recursion, repeatable_advantage, scalable_spell, spellslinger, token_support				Enchantment	{3}{U}{U}	5	U	U			verify analyzer roles	https://scryfall.com/card/c21/122/metallurgic-summonings?utm_source=api	Whenever you cast an instant or sorcery spell, create an X/X colorless Construct artifact creature token, where X is that spell's mana value. {3}{U}{U}, Exile this enchantment: Return all instant and sorcery cards from your graveyard to your hand. Activate only if you control six or more artifacts.
c21	Commander 2021	2021-04-23	123	Mind's Desire	b3739b5a-5731-4c64-a244-815a363b0d5c	covered		card_selection, direct_draw, draw, selection	false		Covered by PRM role audit.	Sorcery	{4}{U}{U}	6	U	U	Storm		already reviewed	https://scryfall.com/card/c21/123/minds-desire?utm_source=api	Shuffle your library. Then exile the top card of your library. Until end of turn, you may play that card without paying its mana cost. Storm (When you cast this spell, copy it for each spell cast before it this turn.)
c21	Commander 2021	2021-04-23	124	Naru Meha, Master Wizard	562c9c68-e5a7-45ab-b098-5b649d165ff5			combat_body, combat_support, copy_support				Legendary Creature — Human Wizard	{2}{U}{U}	4	U	U	Flash		verify analyzer roles	https://scryfall.com/card/c21/124/naru-meha-master-wizard?utm_source=api	Flash When Naru Meha enters, copy target instant or sorcery spell you control. You may choose new targets for the copy. Other Wizards you control get +1/+1.
c21	Commander 2021	2021-04-23	125	Ponder	02090581-61aa-4348-ad57-451be8ee91c2	covered		card_draw, card_selection, direct_draw, draw, selection	false		Covered by PRM role audit.	Sorcery	{U}	1	U	U			already reviewed	https://scryfall.com/card/c21/125/ponder?utm_source=api	Look at the top three cards of your library, then put them back in any order. You may shuffle. Draw a card.
c21	Commander 2021	2021-04-23	126	Rapid Hybridization	06692cd9-ac2f-4a32-8fd1-043ba3c0fe71			removal, targeted_removal				Instant	{U}	1	U	U			verify analyzer roles	https://scryfall.com/card/c21/126/rapid-hybridization?utm_source=api	Destroy target creature. It can't be regenerated. That creature's controller creates a 3/3 green Frog Lizard creature token.
c21	Commander 2021	2021-04-23	127	Reef Worm	e3ad5cbc-4245-4e1e-8204-509381fa0c1c			combat_body, sacrifice_support, token_support				Creature — Worm	{3}{U}	4	U	U			verify analyzer roles	https://scryfall.com/card/c21/127/reef-worm?utm_source=api	When this creature dies, create a 3/3 blue Fish creature token with "When this token dies, create a 6/6 blue Whale creature token with 'When this token dies, create a 9/9 blue Kraken creature token.'"
c21	Commander 2021	2021-04-23	128	Rite of Replication	fb60739e-1dc3-481d-a056-ad72e665c680			copy_support, token_support				Sorcery	{2}{U}{U}	4	U	U	Kicker		verify analyzer roles	https://scryfall.com/card/c21/128/rite-of-replication?utm_source=api	Kicker {5} (You may pay an additional {5} as you cast this spell.) Create a token that's a copy of target creature. If this spell was kicked, create five of those tokens instead.
c21	Commander 2021	2021-04-23	129	Serum Visions	56956afd-db53-4542-816b-490c8b0bbcf7	covered		card_draw, card_selection, direct_draw, draw, selection	false		Covered by PRM role audit.	Sorcery	{U}	1	U	U	Scry		already reviewed	https://scryfall.com/card/c21/129/serum-visions?utm_source=api	Draw a card. Scry 2.
c21	Commander 2021	2021-04-23	130	Swarm Intelligence	4a7a5ea9-b633-459f-bcd4-40de53afce0e			copy_support, spellslinger				Enchantment	{6}{U}	7	U	U			verify analyzer roles	https://scryfall.com/card/c21/130/swarm-intelligence?utm_source=api	Whenever you cast an instant or sorcery spell, you may copy that spell. You may choose new targets for the copy.
c21	Commander 2021	2021-04-23	131	Talrand, Sky Summoner	ea1eb902-a23c-44ff-9169-19baf71de238			combat_body, copy_support, spellslinger, token_support				Legendary Creature — Merfolk Wizard	{2}{U}{U}	4	U	U			verify analyzer roles	https://scryfall.com/card/c21/131/talrand-sky-summoner?utm_source=api	Whenever you cast an instant or sorcery spell, create a 2/2 blue Drake creature token with flying.
c21	Commander 2021	2021-04-23	132	Traumatic Visions	a30724f0-d174-408e-8baf-4bba3cbc45b5			card_selection, hard_stack, land_acceleration, land_tutor, mana_fixing, ramp, selection, stack, tutor				Instant	{3}{U}{U}	5	U	U	Landcycling, Basic landcycling, Typecycling, Cycling		verify analyzer roles	https://scryfall.com/card/c21/132/traumatic-visions?utm_source=api	Counter target spell. Basic landcycling {1}{U} ({1}{U}, Discard this card: Search your library for a basic land card, reveal it, put it into your hand, then shuffle.)
c21	Commander 2021	2021-04-23	133	Treasure Cruise	5b6bdf5a-2742-4851-92cd-a857a3852836			card_draw, cost_reduction, direct_draw, draw				Sorcery	{7}{U}	8	U	U	Delve		verify analyzer roles	https://scryfall.com/card/c21/133/treasure-cruise?utm_source=api	Delve (Each card you exile from your graveyard while casting this spell pays for {1}.) Draw three cards.
c21	Commander 2021	2021-04-23	134	Ambition's Cost	84de4fec-2f38-4293-93d3-b3882c5aac14	covered		card_draw, direct_draw, draw	false		Covered by PTK role audit.	Sorcery	{3}{B}	4	B	B			already reviewed	https://scryfall.com/card/c21/134/ambitions-cost?utm_source=api	You draw three cards and you lose 3 life.
c21	Commander 2021	2021-04-23	135	Ancient Craving	78725353-9274-420a-b722-add0f43c444e	covered		card_draw, direct_draw, draw	false		Covered by S99 role audit.	Sorcery	{3}{B}	4	B	B			already reviewed	https://scryfall.com/card/c21/135/ancient-craving?utm_source=api	You draw three cards and you lose 3 life.
c21	Commander 2021	2021-04-23	136	Bloodthirsty Aerialist	ae78b6f9-8334-479e-8111-8e3acb2b7ca7			combat_body, combat_threat, counter_support, lifegain				Creature — Vampire Rogue	{1}{B}{B}	3	B	B	Flying		verify analyzer roles	https://scryfall.com/card/c21/136/bloodthirsty-aerialist?utm_source=api	Flying Whenever you gain life, put a +1/+1 counter on this creature.
c21	Commander 2021	2021-04-23	137	Bloodtracker	fcf9ced2-867d-4bc5-b7b6-6153ed2cac97			card_draw, combat_body, combat_threat, counter_support, direct_draw, draw				Creature — Vampire Wizard	{3}{B}	4	B	B	Flying		verify analyzer roles	https://scryfall.com/card/c21/137/bloodtracker?utm_source=api	Flying {B}, Pay 2 life: Put a +1/+1 counter on this creature. When this creature leaves the battlefield, draw a card for each +1/+1 counter on it.
c21	Commander 2021	2021-04-23	138	Curse of Disturbance	6cbd36d9-de47-41b0-9ef4-a72ca01adccd			token_support				Enchantment — Aura Curse	{2}{B}	3	B	B	Enchant		verify analyzer roles	https://scryfall.com/card/c21/138/curse-of-disturbance?utm_source=api	Enchant player Whenever enchanted player is attacked, create a 2/2 black Zombie creature token. Each opponent attacking that player does the same.
c21	Commander 2021	2021-04-23	139	Damnable Pact	28dd0ae4-fc56-4abf-af24-6c6c8d0a10cd			card_draw, direct_draw, direct_finisher, draw, finisher, mana_sink, scalable_spell				Sorcery	{X}{B}{B}	2	B	B			verify analyzer roles	https://scryfall.com/card/c21/139/damnable-pact?utm_source=api	Target player draws X cards and loses X life.
c21	Commander 2021	2021-04-23	140	Deadly Tempest	b5516bc9-ec8d-4323-8748-96c49d7d0622			mass_removal, removal				Sorcery	{4}{B}{B}	6	B	B			verify analyzer roles	https://scryfall.com/card/c21/140/deadly-tempest?utm_source=api	Destroy all creatures. Each player loses life equal to the number of creatures they controlled that were destroyed this way.
c21	Commander 2021	2021-04-23	141	Deathbringer Regent	71b5fdf2-4475-4102-85eb-9be164a9ae29	covered		combat_body, combat_threat, mass_removal, removal	false		Covered by PRM role audit.	Creature — Dragon	{5}{B}{B}	7	B	B	Flying		already reviewed	https://scryfall.com/card/c21/141/deathbringer-regent?utm_source=api	Flying When this creature enters, if you cast it from your hand and there are five or more other creatures on the battlefield, destroy all other creatures.
c21	Commander 2021	2021-04-23	142	Defiant Bloodlord	7bf5196d-a16c-418f-943c-2128e40c55da	covered		combat_body, combat_threat, lifegain	false		Covered by PRM role audit.	Creature — Vampire	{5}{B}{B}	7	B	B	Flying		already reviewed	https://scryfall.com/card/c21/142/defiant-bloodlord?utm_source=api	Flying Whenever you gain life, target opponent loses that much life.
c21	Commander 2021	2021-04-23	143	Epicure of Blood	bdb319a6-a1cd-44f5-999d-af1bb55b2fc4			combat_body, direct_finisher, finisher, lifegain, repeatable_finisher				Creature — Vampire	{4}{B}	5	B	B			verify analyzer roles	https://scryfall.com/card/c21/143/epicure-of-blood?utm_source=api	Whenever you gain life, each opponent loses 1 life.
c21	Commander 2021	2021-04-23	144	Feed the Swarm	5825997b-10d7-4a36-972c-a80ddd90b8ed			removal, targeted_removal				Sorcery	{1}{B}	2	B	B			verify analyzer roles	https://scryfall.com/card/c21/144/feed-the-swarm?utm_source=api	Destroy target creature or enchantment an opponent controls. You lose life equal to that permanent's mana value.
c21	Commander 2021	2021-04-23	145	Greed	1ff62220-be95-4901-b8d8-812b9a1a1b0a	covered	card_draw, direct_draw, draw, repeatable_advantage	card_draw, direct_draw, draw, repeatable_advantage	false		Covered by Legends role audit.	Enchantment	{3}{B}	4	B	B			already reviewed	https://scryfall.com/card/c21/145/greed?utm_source=api	{B}, Pay 2 life: Draw a card.
c21	Commander 2021	2021-04-23	146	Infernal Offering	348201c4-79de-4278-9896-d8b1567cc5cc			battlefield_recursion, card_draw, card_selection, recursion, sacrifice_support				Sorcery	{4}{B}	5	B	B			verify analyzer roles	https://scryfall.com/card/c21/146/infernal-offering?utm_source=api	Choose an opponent. You and that player each sacrifice a creature. Each player who sacrificed a creature this way draws two cards. Choose an opponent. Return a creature card from your graveyard to the battlefield, then that player returns a creature card from their graveyard to the battlefield.
c21	Commander 2021	2021-04-23	147	Necropolis Regent	33c3a6be-8cae-4de8-9d9b-43216d727e93			combat_body, combat_support, combat_threat, counter_support				Creature — Vampire	{3}{B}{B}{B}	6	B	B	Flying		verify analyzer roles	https://scryfall.com/card/c21/147/necropolis-regent?utm_source=api	Flying Whenever a creature you control deals combat damage to a player, put that many +1/+1 counters on it.
c21	Commander 2021	2021-04-23	148	Noxious Gearhulk	a77b5be2-f361-4135-ba25-670a74d268ac			combat_body, combat_threat, lifegain, removal, targeted_removal				Artifact Creature — Construct	{4}{B}{B}	6	B	B	Menace		verify analyzer roles	https://scryfall.com/card/c21/148/noxious-gearhulk?utm_source=api	Menace When this creature enters, you may destroy another target creature. If a creature is destroyed this way, you gain life equal to its toughness.
c21	Commander 2021	2021-04-23	149	Ob Nixilis Reignited	65481ae1-54b2-44d2-91e1-20cd486386da	covered		card_draw, direct_draw, draw, removal, repeatable_advantage, repeatable_draw, targeted_removal	false		Covered by PRM role audit.	Legendary Planeswalker — Nixilis	{3}{B}{B}	5	B	B			already reviewed	https://scryfall.com/card/c21/149/ob-nixilis-reignited?utm_source=api	+1: You draw a card and you lose 1 life. −3: Destroy target creature. −8: Target opponent gets an emblem with "Whenever a player draws a card, you lose 2 life."
c21	Commander 2021	2021-04-23	150	Parasitic Impetus	ff3de07d-86c3-49e1-9de0-97c85301ff93			combat_support, lifegain				Enchantment — Aura	{2}{B}	3	B	B	Goad, Enchant		verify analyzer roles	https://scryfall.com/card/c21/150/parasitic-impetus?utm_source=api	Enchant creature Enchanted creature gets +2/+2 and is goaded. (It attacks each combat if able and attacks a player other than you if able.) Whenever enchanted creature attacks, its controller loses 2 life and you gain 2 life.
c21	Commander 2021	2021-04-23	151	Reckless Spite	a684df3a-5441-4daa-86d1-c47a91b35e6a	covered	removal, targeted_removal	removal, targeted_removal	false		Covered by Tempest role audit.	Instant	{1}{B}{B}	3	B	B			already reviewed	https://scryfall.com/card/c21/151/reckless-spite?utm_source=api	Destroy two target nonblack creatures. You lose 5 life.
c21	Commander 2021	2021-04-23	152	Sangromancer	920445ab-0ac2-4de7-bc1c-f5e58eb4424c			combat_body, combat_threat, lifegain, sacrifice_support				Creature — Vampire Shaman	{2}{B}{B}	4	B	B	Flying		verify analyzer roles	https://scryfall.com/card/c21/152/sangromancer?utm_source=api	Flying Whenever a creature an opponent controls dies, you may gain 3 life. Whenever an opponent discards a card, you may gain 3 life.
c21	Commander 2021	2021-04-23	153	Sanguine Bond	73089a39-a2f6-4aa2-a058-e6551475153d			lifegain				Enchantment	{3}{B}{B}	5	B	B			verify analyzer roles	https://scryfall.com/card/c21/153/sanguine-bond?utm_source=api	Whenever you gain life, target opponent loses that much life.
c21	Commander 2021	2021-04-23	154	Silversmote Ghoul	67d55b4f-944e-4376-93ed-1a240bca1eae			battlefield_recursion, card_draw, card_selection, combat_body, direct_draw, draw, repeatable_advantage, repeatable_draw, sacrifice_support				Creature — Zombie Vampire	{2}{B}	3	B	B			verify analyzer roles	https://scryfall.com/card/c21/154/silversmote-ghoul?utm_source=api	At the beginning of your end step, if you gained 3 or more life this turn, return this card from your graveyard to the battlefield tapped. {1}{B}, Sacrifice this creature: Draw a card.
c21	Commander 2021	2021-04-23	155	Suffer the Past	edf46ef0-159d-4f0b-ae14-14e0c8446382			lifegain, mana_sink, scalable_spell				Instant	{X}{B}	1	B	B			verify analyzer roles	https://scryfall.com/card/c21/155/suffer-the-past?utm_source=api	Exile X target cards from target player's graveyard. For each card exiled this way, that player loses 1 life and you gain 1 life.
c21	Commander 2021	2021-04-23	156	Taste of Death	f92673fe-cd73-48ae-bfbd-aa750582b80b			lifegain, removal, sacrifice_support, targeted_removal, token_support				Sorcery	{4}{B}{B}	6	B	B	Food		verify analyzer roles	https://scryfall.com/card/c21/156/taste-of-death?utm_source=api	Each player sacrifices three creatures of their choice. You create three Food tokens. (They're artifacts with "{2}, {T}, Sacrifice this token: You gain 3 life.")
