setCode	setName	releasedAt	collectorNumber	name	oracleId	auditStatus	expectedRoles	actualAnalyzerRoles	needsCodeChange	tagDecision	manualNotes	typeLine	manaCost	manaValue	colors	colorIdentity	keywords	scryfallOracleTags	attentionHint	scryfallUrl	oracleText
c21	Commander 2021	2021-04-23	214	Deathbringer Liege	caf89756-fb78-4e58-a730-001393ffa0a8			combat_body, combat_support, removal, targeted_removal, tempo_removal				Creature — Horror	{2}{W/B}{W/B}{W/B}	5	BW	BW			verify analyzer roles	https://scryfall.com/card/c21/214/deathbringer-liege?utm_source=api	Other white creatures you control get +1/+1. Other black creatures you control get +1/+1. Whenever you cast a white spell, you may tap target creature. Whenever you cast a black spell, you may destroy target creature if it's tapped.
c21	Commander 2021	2021-04-23	215	Debtors' Knell	a9ff368b-5208-4ada-bb99-eccbf8eaea28			battlefield_recursion				Enchantment	{4}{W/B}{W/B}{W/B}	7	BW	BW			verify analyzer roles	https://scryfall.com/card/c21/215/debtors-knell?utm_source=api	({W/B} can be paid with either {W} or {B}.) At the beginning of your upkeep, put target creature card from a graveyard onto the battlefield under your control.
c21	Commander 2021	2021-04-23	216	Epic Experiment	08bc10fd-8901-4836-ad4d-a867e1bcba77			card_selection, direct_draw, draw, mana_sink, scalable_spell, selection				Sorcery	{X}{U}{R}	2	RU	RU			verify analyzer roles	https://scryfall.com/card/c21/216/epic-experiment?utm_source=api	Exile the top X cards of your library. You may cast instant and sorcery spells with mana value X or less from among them without paying their mana costs. Then put all cards exiled this way that weren't cast into your graveyard.
c21	Commander 2021	2021-04-23	217	Gaze of Granite	103d9ad0-d655-4bd5-a899-e9f8869e333d			mana_sink, mass_removal, removal, scalable_spell				Sorcery	{X}{B}{B}{G}	3	BG	BG			verify analyzer roles	https://scryfall.com/card/c21/217/gaze-of-granite?utm_source=api	Destroy each nonland permanent with mana value X or less.
c21	Commander 2021	2021-04-23	218	Gluttonous Troll	2a3712f9-6bed-4068-9064-2b5240fc7b28			combat_body, combat_support, combat_threat, lifegain, sacrifice_support, token_support				Creature — Troll	{2}{B}{G}	4	BG	BG	Food, Trample		verify analyzer roles	https://scryfall.com/card/c21/218/gluttonous-troll?utm_source=api	Trample When this creature enters, create a number of Food tokens equal to the number of opponents you have. (Food tokens are artifacts with "{2}, {T}, Sacrifice this token: You gain 3 life.") {1}{G}, Sacrifice another nonland permanent: This creature gets +2/+2 until end of turn.
c21	Commander 2021	2021-04-23	219	Incubation // Incongruity	363edb16-009f-4cc2-99e3-2b15db84e7af			card_selection, removal, selection, targeted_removal				Sorcery // Instant	{G/U} // {1}{G}{U}	4	GU	GU			verify analyzer roles	https://scryfall.com/card/c21/219/incubation-incongruity?utm_source=api	Incubation: Look at the top five cards of your library. You may reveal a creature card from among them and put it into your hand. Put the rest on the bottom of your library in a random order. // Incongruity: Exile target creature. That creature's controller creates a 3/3 green Frog Lizard creature token.
c21	Commander 2021	2021-04-23	220	Jor Kadeen, the Prevailer	7c4dbaa8-e24f-4126-81fe-3f218f520d8c			combat_body, combat_support, combat_threat				Legendary Creature — Human Warrior	{3}{R}{W}	5	RW	RW	Metalcraft, First strike		verify analyzer roles	https://scryfall.com/card/c21/220/jor-kadeen-the-prevailer?utm_source=api	First strike Metalcraft — Creatures you control get +3/+0 as long as you control three or more artifacts.
c21	Commander 2021	2021-04-23	221	Kaseto, Orochi Archmage	198b6c6f-a480-4672-9d87-b0cb5d8ed1c0			combat_body, combat_support				Legendary Creature — Snake Wizard	{1}{G}{U}	3	GU	GU			verify analyzer roles	https://scryfall.com/card/c21/221/kaseto-orochi-archmage?utm_source=api	{G}{U}: Target creature can't be blocked this turn. If that creature is a Snake, it gets +2/+2 until end of turn.
c21	Commander 2021	2021-04-23	222	Leyline Prowler	8ca3852a-fa37-46ef-a74d-3c7487ae50fc			combat_body, combat_threat, lifegain, mana_fixing, ramp, stable_ramp				Creature — Nightmare Beast	{1}{B}{G}	3	BG	BG	Lifelink, Deathtouch		verify analyzer roles	https://scryfall.com/card/c21/222/leyline-prowler?utm_source=api	Deathtouch, lifelink {T}: Add one mana of any color.
c21	Commander 2021	2021-04-23	223	Magister of Worth	0429d146-332f-4fb0-8273-c73679ca6d47	covered		combat_body, combat_threat, mass_recursion, mass_removal, removal	false		Covered by PRM role audit.	Creature — Angel	{4}{W}{B}	6	BW	BW	Flying, Will of the council		already reviewed	https://scryfall.com/card/c21/223/magister-of-worth?utm_source=api	Flying Will of the council — When this creature enters, starting with you, each player votes for grace or condemnation. If grace gets more votes, each player returns each creature card from their graveyard to the battlefield. If condemnation gets more votes or the vote is tied, destroy all creatures other than this creature.
c21	Commander 2021	2021-04-23	224	Master Biomancer	afeba4d7-b659-4fb1-84dd-27704fbb2621			combat_body, counter_support				Creature — Elf Wizard	{2}{G}{U}	4	GU	GU			verify analyzer roles	https://scryfall.com/card/c21/224/master-biomancer?utm_source=api	Each other creature you control enters with a number of additional +1/+1 counters on it equal to this creature's power and as a Mutant in addition to its other types.
c21	Commander 2021	2021-04-23	225	Moldervine Reclamation	68639a3d-2192-4921-8298-c76bb0cd6b02			card_draw, direct_draw, draw, lifegain, repeatable_advantage, repeatable_draw, sacrifice_support				Enchantment	{3}{B}{G}	5	BG	BG			verify analyzer roles	https://scryfall.com/card/c21/225/moldervine-reclamation?utm_source=api	Whenever a creature you control dies, you gain 1 life and draw a card.
c21	Commander 2021	2021-04-23	226	Plaxcaster Frogling	8c1ea1a5-5966-4d14-8361-ffc6a8d1bd79			combat_body, counter_support, self_protection, targeted_protection				Creature — Frog Mutant	{1}{G}{U}	3	GU	GU	Graft		verify analyzer roles	https://scryfall.com/card/c21/226/plaxcaster-frogling?utm_source=api	Graft 3 (This creature enters with three +1/+1 counters on it. Whenever another creature enters, you may move a +1/+1 counter from this creature onto it.) {2}: Target creature with a +1/+1 counter on it gains shroud until end of turn. (It can't be the target of spells or abilities.)
c21	Commander 2021	2021-04-23	227	Primal Empathy	24645d9e-5e6d-411d-be41-c2bd1659937f			card_draw, counter_support, direct_draw, draw, repeatable_advantage, repeatable_draw				Enchantment	{1}{G}{U}	3	GU	GU			verify analyzer roles	https://scryfall.com/card/c21/227/primal-empathy?utm_source=api	At the beginning of your upkeep, draw a card if you control a creature with the greatest power among creatures on the battlefield. Otherwise, put a +1/+1 counter on a creature you control.
c21	Commander 2021	2021-04-23	228	Sapling of Colfenor	0c1e2bb8-0629-466c-b435-c4c71cdc755d			card_selection, combat_body, combat_support, lifegain, self_protection				Legendary Creature — Treefolk Shaman	{3}{B/G}{B/G}	5	BG	BG	Indestructible		verify analyzer roles	https://scryfall.com/card/c21/228/sapling-of-colfenor?utm_source=api	Indestructible Whenever Sapling of Colfenor attacks, reveal the top card of your library. If it's a creature card, you gain life equal to that card's toughness, lose life equal to its power, then put it into your hand.
c21	Commander 2021	2021-04-23	229	Spitting Image	a30dee74-86e3-4888-980e-b22437fbbb66			copy_support, token_support				Sorcery	{4}{G/U}{G/U}	6	GU	GU	Retrace		verify analyzer roles	https://scryfall.com/card/c21/229/spitting-image?utm_source=api	Create a token that's a copy of target creature. Retrace (You may cast this card from your graveyard by discarding a land card in addition to paying its other costs.)
c21	Commander 2021	2021-04-23	230	Teysa, Envoy of Ghosts	98b283dc-96a6-45a3-8a3f-11458497f358			combat_body, combat_support, combat_threat, self_protection, token_support				Legendary Creature — Human Advisor	{5}{W}{B}	7	BW	BW	Vigilance, Protection		verify analyzer roles	https://scryfall.com/card/c21/230/teysa-envoy-of-ghosts?utm_source=api	Vigilance, protection from creatures Whenever a creature deals combat damage to you, destroy that creature. Create a 1/1 white and black Spirit creature token with flying.
c21	Commander 2021	2021-04-23	231	Trygon Predator	c744b5f4-fbcf-48b8-9d60-5e9c6ac297e0			combat_body, combat_support, combat_threat, removal, targeted_removal				Creature — Beast	{1}{G}{U}	3	GU	GU	Flying		verify analyzer roles	https://scryfall.com/card/c21/231/trygon-predator?utm_source=api	Flying Whenever this creature deals combat damage to a player, you may destroy target artifact or enchantment that player controls.
c21	Commander 2021	2021-04-23	232	Utter End	cba94732-1f1f-4ffd-9aba-45db990043fa	covered		removal, targeted_removal	false		Covered by PRM role audit.	Instant	{2}{W}{B}	4	BW	BW			already reviewed	https://scryfall.com/card/c21/232/utter-end?utm_source=api	Exile target nonland permanent.
c21	Commander 2021	2021-04-23	233	Alhammarret's Archive	d5c4d36c-54b3-4149-906b-a57a670260fc			lifegain, multiplier_support, repeatable_advantage, replacement_engine				Legendary Artifact	{5}	5					verify analyzer roles	https://scryfall.com/card/c21/233/alhammarrets-archive?utm_source=api	If you would gain life, you gain twice that much life instead. If you would draw a card except the first one you draw in each of your draw steps, draw two cards instead.
c21	Commander 2021	2021-04-23	234	Arcane Signet	0bc7f093-bef0-4f1a-852c-4b75ebf54838	covered		mana_fixing, ramp, stable_ramp	false		Covered by PRM role audit.	Artifact	{2}	2					already reviewed	https://scryfall.com/card/c21/234/arcane-signet?utm_source=api	{T}: Add one mana of any color in your commander's color identity.
c21	Commander 2021	2021-04-23	235	Bloodthirsty Blade	b2747459-05ec-42a6-81be-e97e182bc778			artifact_support, combat_support				Artifact — Equipment	{2}	2			Goad		verify analyzer roles	https://scryfall.com/card/c21/235/bloodthirsty-blade?utm_source=api	Equipped creature gets +2/+0 and is goaded. (It attacks each combat if able and attacks a player other than you if able.) {1}: Attach this Equipment to target creature an opponent controls. Activate only as a sorcery.
c21	Commander 2021	2021-04-23	236	Boros Locket	b044b4fd-d504-4a11-80bf-eb8fb0b6e21e			card_draw, direct_draw, draw, mana_fixing, ramp, repeatable_advantage, repeatable_draw, sacrifice_support, stable_ramp				Artifact	{3}	3		RW			verify analyzer roles	https://scryfall.com/card/c21/236/boros-locket?utm_source=api	{T}: Add {R} or {W}. {R/W}{R/W}{R/W}{R/W}, {T}, Sacrifice this artifact: Draw two cards.
c21	Commander 2021	2021-04-23	237	Bosh, Iron Golem	2fb6f65f-a0fb-4d45-be1b-d6405e61d47a			combat_body, combat_threat, removal, sacrifice_support, targeted_removal				Legendary Artifact Creature — Golem	{8}	8		R	Trample		verify analyzer roles	https://scryfall.com/card/c21/237/bosh-iron-golem?utm_source=api	Trample {3}{R}, Sacrifice an artifact: Bosh deals damage equal to the sacrificed artifact's mana value to any target.
c21	Commander 2021	2021-04-23	238	Burnished Hart	893fed41-c144-433f-af88-bc7d419b7fb3	covered		combat_body, land_acceleration, land_tutor, mana_fixing, ramp, repeatable_tutor, sacrifice_support, tutor	false		Covered by PRM role audit.	Artifact Creature — Elk	{3}	3					already reviewed	https://scryfall.com/card/c21/238/burnished-hart?utm_source=api	{3}, Sacrifice this creature: Search your library for up to two basic land cards, put them onto the battlefield tapped, then shuffle.
c21	Commander 2021	2021-04-23	239	Commander's Sphere	0b67c4e2-f88b-4e01-85a1-9d5f5b8db13b	covered		card_draw, direct_draw, draw, mana_fixing, ramp, repeatable_draw, sacrifice_support, stable_ramp	false		Covered by PRM role audit.	Artifact	{3}	3					already reviewed	https://scryfall.com/card/c21/239/commanders-sphere?utm_source=api	{T}: Add one mana of any color in your commander's color identity. Sacrifice this artifact: Draw a card.
c21	Commander 2021	2021-04-23	240	Coveted Jewel	98492d7d-3b9e-4ae1-ac45-1b508d6d2670			card_draw, combat_support, direct_draw, draw, ramp, repeatable_advantage, stable_ramp				Artifact	{6}	6					verify analyzer roles	https://scryfall.com/card/c21/240/coveted-jewel?utm_source=api	When this artifact enters, draw three cards. {T}: Add three mana of any one color. Whenever one or more creatures an opponent controls attack you and aren't blocked, that player draws three cards and gains control of this artifact. Untap it.
c21	Commander 2021	2021-04-23	241	Druidic Satchel	75a4ddf5-1b3c-4dde-a6e4-4346e46cebf1			lifegain, theft_support, token_support				Artifact	{3}	3					verify analyzer roles	https://scryfall.com/card/c21/241/druidic-satchel?utm_source=api	{2}, {T}: Reveal the top card of your library. If it's a creature card, create a 1/1 green Saproling creature token. If it's a land card, put that card onto the battlefield under your control. If it's a noncreature, nonland card, you gain 2 life.
c21	Commander 2021	2021-04-23	242	Duplicant	ea86abfa-6cab-4ef0-8463-34136fc25b59	covered		combat_body, removal, targeted_removal	false		Covered by PRM role audit.	Artifact Creature — Shapeshifter	{6}	6			Imprint		already reviewed	https://scryfall.com/card/c21/242/duplicant?utm_source=api	Imprint — When this creature enters, you may exile target nontoken creature. As long as a card exiled with this creature is a creature card, this creature has the power, toughness, and creature types of the last creature card exiled with it. It's still a Shapeshifter.
c21	Commander 2021	2021-04-23	243	Elixir of Immortality	204b71fc-4d5f-40dd-903d-56c733171d84			lifegain				Artifact	{1}	1					verify analyzer roles	https://scryfall.com/card/c21/243/elixir-of-immortality?utm_source=api	{2}, {T}: You gain 5 life. Shuffle this artifact and your graveyard into their owner's library.
c21	Commander 2021	2021-04-23	244	Hedron Archive	32263baa-d3f0-463f-92b3-4e9938476add			card_draw, direct_draw, draw, ramp, repeatable_advantage, repeatable_draw, sacrifice_support, stable_ramp				Artifact	{4}	4					verify analyzer roles	https://scryfall.com/card/c21/244/hedron-archive?utm_source=api	{T}: Add {C}{C}. {2}, {T}, Sacrifice this artifact: Draw two cards.
c21	Commander 2021	2021-04-23	245	Ichor Wellspring	5b5ef43b-13fd-4461-8d2d-18be65e9a790			card_draw, direct_draw, draw				Artifact	{2}	2					verify analyzer roles	https://scryfall.com/card/c21/245/ichor-wellspring?utm_source=api	When this artifact enters or is put into a graveyard from the battlefield, draw a card.
c21	Commander 2021	2021-04-23	246	Idol of Oblivion	c232d974-9c65-4bce-b045-e5a7cc0c62e0			card_draw, direct_draw, draw, repeatable_advantage, repeatable_draw, sacrifice_support, token_support				Artifact	{2}	2					verify analyzer roles	https://scryfall.com/card/c21/246/idol-of-oblivion?utm_source=api	{T}: Draw a card. Activate only if you created a token this turn. {8}, {T}, Sacrifice this artifact: Create a 10/10 colorless Eldrazi creature token.
c21	Commander 2021	2021-04-23	247	Izzet Signet	2fda4fe7-8b0c-489c-a000-6d358e614e34	covered		mana_fixing, ramp, stable_ramp	false		Covered by PRM role audit.	Artifact	{2}	2		RU			already reviewed	https://scryfall.com/card/c21/247/izzet-signet?utm_source=api	{1}, {T}: Add {U}{R}.
c21	Commander 2021	2021-04-23	248	Key to the City	a242c9bf-dab6-4996-bb3a-b4356f9ed0c9			card_draw, combat_support, direct_draw, draw, repeatable_advantage, repeatable_draw				Artifact	{2}	2					verify analyzer roles	https://scryfall.com/card/c21/248/key-to-the-city?utm_source=api	{T}, Discard a card: Up to one target creature can't be blocked this turn. Whenever this artifact becomes untapped, you may pay {2}. If you do, draw a card.
c21	Commander 2021	2021-04-23	249	Loxodon Warhammer	dba35ac5-7ad3-488a-a006-6b9a1d54eea5			artifact_support, combat_support, lifegain				Artifact — Equipment	{3}	3			Equip		verify analyzer roles	https://scryfall.com/card/c21/249/loxodon-warhammer?utm_source=api	Equipped creature gets +3/+0 and has trample and lifelink. Equip {3}
c21	Commander 2021	2021-04-23	250	Meteor Golem	d9f11aa1-9219-42a8-85a9-a8f204160706			combat_body, removal, targeted_removal				Artifact Creature — Golem	{7}	7					verify analyzer roles	https://scryfall.com/card/c21/250/meteor-golem?utm_source=api	When this creature enters, destroy target nonland permanent an opponent controls.
c21	Commander 2021	2021-04-23	251	Mind Stone	c97361b5-af16-4a7b-af85-a429dbaf4ad2	covered	card_draw, direct_draw, draw, ramp, repeatable_advantage, repeatable_draw, sacrifice_support, stable_ramp	card_draw, direct_draw, draw, ramp, repeatable_advantage, repeatable_draw, sacrifice_support, stable_ramp	false		Covered by Weatherlight role audit.	Artifact	{2}	2					already reviewed	https://scryfall.com/card/c21/251/mind-stone?utm_source=api	{T}: Add {C}. {1}, {T}, Sacrifice this artifact: Draw a card.
c21	Commander 2021	2021-04-23	252	Mycosynth Wellspring	9ec43ec6-b625-4be8-8f79-3679e6657dbc			land_acceleration, land_tutor, mana_fixing, ramp, tutor				Artifact	{2}	2					verify analyzer roles	https://scryfall.com/card/c21/252/mycosynth-wellspring?utm_source=api	When this artifact enters or is put into a graveyard from the battlefield, you may search your library for a basic land card, reveal it, put it into your hand, then shuffle.
c21	Commander 2021	2021-04-23	253	Myr Battlesphere	c53ba31a-ba27-4e17-9a92-311acb1cab29			combat_body, combat_support, scalable_spell, token_support				Artifact Creature — Myr Construct	{7}	7					verify analyzer roles	https://scryfall.com/card/c21/253/myr-battlesphere?utm_source=api	When this creature enters, create four 1/1 colorless Myr artifact creature tokens. Whenever this creature attacks, you may tap X untapped Myr you control. If you do, this creature gets +X/+0 until end of turn and deals X damage to the player or planeswalker it's attacking.
c21	Commander 2021	2021-04-23	254	Orzhov Signet	de3dcb5d-775a-479f-99f5-d1883ed9b1b5	covered		mana_fixing, ramp, stable_ramp	false		Covered by PRM role audit.	Artifact	{2}	2		BW			already reviewed	https://scryfall.com/card/c21/254/orzhov-signet?utm_source=api	{1}, {T}: Add {W}{B}.
c21	Commander 2021	2021-04-23	255	Paradise Plume	665e52f1-901b-49a1-bfbd-ee38bdee8983			lifegain, mana_fixing, ramp, stable_ramp				Artifact	{4}	4					verify analyzer roles	https://scryfall.com/card/c21/255/paradise-plume?utm_source=api	As this artifact enters, choose a color. Whenever a player casts a spell of the chosen color, you may gain 1 life. {T}: Add one mana of the chosen color.
c21	Commander 2021	2021-04-23	256	Pendant of Prosperity	d958321b-789d-4f9a-bdbe-f907166a0216			card_draw, direct_draw, draw, land_acceleration, ramp, repeatable_advantage, repeatable_draw				Artifact	{3}	3					verify analyzer roles	https://scryfall.com/card/c21/256/pendant-of-prosperity?utm_source=api	This artifact enters under the control of an opponent of your choice. {2}, {T}: Draw a card, then you may put a land card from your hand onto the battlefield. This artifact's owner draws a card, then that player may put a land card from their hand onto the battlefield.
c21	Commander 2021	2021-04-23	257	Pilgrim's Eye	66155010-cc2c-449a-85d5-92c95aade514			combat_body, combat_threat, land_acceleration, land_tutor, mana_fixing, ramp, tutor				Artifact Creature — Thopter	{3}	3			Flying		verify analyzer roles	https://scryfall.com/card/c21/257/pilgrims-eye?utm_source=api	Flying When this creature enters, you may search your library for a basic land card, reveal it, put it into your hand, then shuffle.
c21	Commander 2021	2021-04-23	258	Pristine Talisman	1b3d7fce-e9fe-4176-9d9a-472415826cdd	covered		lifegain, ramp, stable_ramp	false		Covered by PRM role audit.	Artifact	{3}	3					already reviewed	https://scryfall.com/card/c21/258/pristine-talisman?utm_source=api	{T}: Add {C}. You gain 1 life.
c21	Commander 2021	2021-04-23	259	Pyromancer's Goggles	f76bcbfe-483f-4e63-8425-76feca1abf3e			copy_support, ramp, stable_ramp				Legendary Artifact	{5}	5		R			verify analyzer roles	https://scryfall.com/card/c21/259/pyromancers-goggles?utm_source=api	{T}: Add {R}. When that mana is spent to cast a red instant or sorcery spell, copy that spell and you may choose new targets for the copy.
c21	Commander 2021	2021-04-23	260	Scrap Trawler	164f3f85-21fc-40b7-9871-4f303ba98428	covered		artifact_support, combat_body, sacrifice_support	false		Covered by PRM role audit.	Artifact Creature — Construct	{3}	3					already reviewed	https://scryfall.com/card/c21/260/scrap-trawler?utm_source=api	Whenever this creature dies or another artifact you control is put into a graveyard from the battlefield, return to your hand target artifact card in your graveyard with lesser mana value.
c21	Commander 2021	2021-04-23	261	Sculpting Steel	6c85271c-c711-49b0-a72e-9e576c33714d			copy_support				Artifact	{3}	3					verify analyzer roles	https://scryfall.com/card/c21/261/sculpting-steel?utm_source=api	You may have this artifact enter as a copy of any artifact on the battlefield.
c21	Commander 2021	2021-04-23	262	Simic Signet	44503105-3e13-408d-a44f-37d503c61d72	covered		mana_fixing, ramp, stable_ramp	false		Covered by PRM role audit.	Artifact	{2}	2		GU			already reviewed	https://scryfall.com/card/c21/262/simic-signet?utm_source=api	{1}, {T}: Add {G}{U}.
c21	Commander 2021	2021-04-23	263	Sol Ring	6ad8011d-3471-4369-9d68-b264cc027487	covered	ramp, stable_ramp	ramp, stable_ramp	false		Covered by PRM role audit.	Artifact	{1}	1					already reviewed	https://scryfall.com/card/c21/263/sol-ring?utm_source=api	{T}: Add {C}{C}.
c21	Commander 2021	2021-04-23	264	Solemn Simulacrum	00c0543c-2a1f-4425-8283-4062d74a1637	covered		card_draw, combat_body, direct_draw, draw, land_acceleration, land_tutor, mana_fixing, ramp, sacrifice_support, tutor	false		Covered by PRM role audit.	Artifact Creature — Golem	{4}	4					already reviewed	https://scryfall.com/card/c21/264/solemn-simulacrum?utm_source=api	When this creature enters, you may search your library for a basic land card, put that card onto the battlefield tapped, then shuffle. When this creature dies, you may draw a card.
c21	Commander 2021	2021-04-23	265	Spectral Searchlight	511b1174-8ef7-4d17-93de-01b9b81bda6a			mana_fixing, stable_ramp				Artifact	{3}	3					verify analyzer roles	https://scryfall.com/card/c21/265/spectral-searchlight?utm_source=api	{T}: Choose a player. That player adds one mana of any color they choose.
c21	Commander 2021	2021-04-23	266	Steel Hellkite	6e64f1e0-ddd6-4ee7-8797-086e234b02e8	covered		combat_body, combat_support, combat_threat	false		Covered by PRM role audit.	Artifact Creature — Dragon	{6}	6			Flying		already reviewed	https://scryfall.com/card/c21/266/steel-hellkite?utm_source=api	Flying {2}: This creature gets +1/+0 until end of turn. {X}: Destroy each nonland permanent with mana value X whose controller was dealt combat damage by this creature this turn. Activate only once each turn.
c21	Commander 2021	2021-04-23	267	Steel Overseer	986ae327-f433-4c58-93dc-afc544b9bfcb			combat_body, counter_support				Artifact Creature — Construct	{2}	2					verify analyzer roles	https://scryfall.com/card/c21/267/steel-overseer?utm_source=api	{T}: Put a +1/+1 counter on each artifact creature you control.
c21	Commander 2021	2021-04-23	268	Sun Droplet	1820af5c-9cc2-4b77-b4ca-86084442f087			counter_support, lifegain				Artifact	{2}	2					verify analyzer roles	https://scryfall.com/card/c21/268/sun-droplet?utm_source=api	Whenever you're dealt damage, put that many charge counters on this artifact. At the beginning of each upkeep, you may remove a charge counter from this artifact. If you do, you gain 1 life.
c21	Commander 2021	2021-04-23	269	Talisman of Creativity	14d2979d-5728-42d7-a027-0eb1f754655d	covered		mana_fixing, ramp, stable_ramp	false		Covered by PRM role audit.	Artifact	{2}	2		RU			already reviewed	https://scryfall.com/card/c21/269/talisman-of-creativity?utm_source=api	{T}: Add {C}. {T}: Add {U} or {R}. This artifact deals 1 damage to you.
c21	Commander 2021	2021-04-23	270	Talisman of Resilience	42b8aa14-10bc-4bd6-88d9-4bb287eadd19	covered		mana_fixing, ramp, stable_ramp	false		Covered by PRM role audit.	Artifact	{2}	2		BG			already reviewed	https://scryfall.com/card/c21/270/talisman-of-resilience?utm_source=api	{T}: Add {C}. {T}: Add {B} or {G}. This artifact deals 1 damage to you.
c21	Commander 2021	2021-04-23	271	Thousand-Year Elixir	4dc5726e-2f7e-4c2b-9616-c3301d212f78			replacement_engine, tap_untap, tempo_support				Artifact	{3}	3					verify analyzer roles	https://scryfall.com/card/c21/271/thousand-year-elixir?utm_source=api	You may activate abilities of creatures you control as though those creatures had haste. {1}, {T}: Untap target creature.
c21	Commander 2021	2021-04-23	272	Unstable Obelisk	060ae1bb-956a-4264-b405-a33151f31493			ramp, removal, sacrifice_support, stable_ramp, targeted_removal				Artifact	{3}	3					verify analyzer roles	https://scryfall.com/card/c21/272/unstable-obelisk?utm_source=api	{T}: Add {C}. {7}, {T}, Sacrifice this artifact: Destroy target permanent.
c21	Commander 2021	2021-04-23	273	Venser's Journal	f7907327-4df3-4bb2-a274-03d9e266af2f			hand_size, lifegain				Artifact — Book	{5}	5					verify analyzer roles	https://scryfall.com/card/c21/273/vensers-journal?utm_source=api	You have no maximum hand size. At the beginning of your upkeep, you gain 1 life for each card in your hand.
c21	Commander 2021	2021-04-23	274	Victory Chimes	be8b36ce-52c1-4ca0-9141-4c9a80dca3ea			stable_ramp				Artifact	{3}	3					verify analyzer roles	https://scryfall.com/card/c21/274/victory-chimes?utm_source=api	Untap this artifact during each other player's untap step. {T}: A player of your choice adds {C}.
