setCode	setName	releasedAt	collectorNumber	name	oracleId	auditStatus	expectedRoles	actualAnalyzerRoles	needsCodeChange	tagDecision	manualNotes	typeLine	manaCost	manaValue	colors	colorIdentity	keywords	scryfallOracleTags	attentionHint	scryfallUrl	oracleText
cm1	Commander's Arsenal	2012-11-02	1	Chaos Warp	07a0cba9-8768-4fd9-a3d5-b0f83b4bf8e8	covered		removal, targeted_removal	false		Covered by PRM role audit.	Instant	{2}{R}	3	R	R			already reviewed	https://scryfall.com/card/cm1/1/chaos-warp?utm_source=api	The owner of target permanent shuffles it into their library, then reveals the top card of their library. If it's a permanent card, they put it onto the battlefield.
cm1	Commander's Arsenal	2012-11-02	2	Command Tower	0895c9b7-ae7d-4bb3-af17-3b75deb50a25	covered	land_base, land_slot, mana_source	land_base, land_slot, mana_source	false		Covered by Media and Collaboration Promos role audit.	Land		0					already reviewed	https://scryfall.com/card/cm1/2/command-tower?utm_source=api	{T}: Add one mana of any color in your commander's color identity.
cm1	Commander's Arsenal	2012-11-02	3	Decree of Pain	932668fa-d6e3-41c0-ad0c-8e0a00e68d11	covered		card_draw, direct_draw, draw, mass_removal, removal, selection	false		Covered by PRM role audit.	Sorcery	{6}{B}{B}	8	B	B	Cycling		already reviewed	https://scryfall.com/card/cm1/3/decree-of-pain?utm_source=api	Destroy all creatures. They can't be regenerated. Draw a card for each creature destroyed this way. Cycling {3}{B}{B} ({3}{B}{B}, Discard this card: Draw a card.) When you cycle this card, all creatures get -2/-2 until end of turn.
cm1	Commander's Arsenal	2012-11-02	4	Desertion	ee3d1f44-e0ca-4ce9-be76-4b675a115156	covered	hard_stack, stack, theft_support	hard_stack, stack, theft_support	false		Covered by Visions role audit.	Instant	{3}{U}{U}	5	U	U			already reviewed	https://scryfall.com/card/cm1/4/desertion?utm_source=api	Counter target spell. If an artifact or creature spell is countered this way, put that card onto the battlefield under your control instead of into its owner's graveyard.
cm1	Commander's Arsenal	2012-11-02	5	Diaochan, Artful Beauty	bf20bc37-3205-45af-a3be-05d6835c0d87	covered		combat_body, removal, targeted_removal	false		Covered by PTK role audit.	Legendary Creature — Human Advisor	{3}{R}	4	R	R			already reviewed	https://scryfall.com/card/cm1/5/diaochan-artful-beauty?utm_source=api	{T}: Destroy target creature of your choice, then destroy target creature of an opponent's choice. Activate only during your turn, before attackers are declared.
cm1	Commander's Arsenal	2012-11-02	6	Dragonlair Spider	f17d3aa4-6e88-4973-b2a4-942098a1c463	covered	combat_body, combat_threat, token_support	combat_body, combat_threat, token_support	false		Analyzer roles accepted during batch clean pass.	Creature — Spider	{2}{R}{R}{G}{G}	6	GR	GR	Reach		verify analyzer roles	https://scryfall.com/card/cm1/6/dragonlair-spider?utm_source=api	Reach Whenever an opponent casts a spell, create a 1/1 green Insect creature token.
cm1	Commander's Arsenal	2012-11-02	7	Duplicant	ea86abfa-6cab-4ef0-8463-34136fc25b59	covered		combat_body, removal, targeted_removal	false		Covered by PRM role audit.	Artifact Creature — Shapeshifter	{6}	6			Imprint		already reviewed	https://scryfall.com/card/cm1/7/duplicant?utm_source=api	Imprint — When this creature enters, you may exile target nontoken creature. As long as a card exiled with this creature is a creature card, this creature has the power, toughness, and creature types of the last creature card exiled with it. It's still a Shapeshifter.
cm1	Commander's Arsenal	2012-11-02	8	Edric, Spymaster of Trest	9a1de7e4-9930-4db3-a8f3-d146d0abf38b	covered	combat_body, combat_support	combat_body, combat_support	false		Analyzer roles accepted during batch clean pass.	Legendary Creature — Elf Rogue	{1}{G}{U}	3	GU	GU			verify analyzer roles	https://scryfall.com/card/cm1/8/edric-spymaster-of-trest?utm_source=api	Whenever a creature deals combat damage to one of your opponents, its controller may draw a card.
cm1	Commander's Arsenal	2012-11-02	9	Kaalia of the Vast	cb8d80c9-ed58-4f2d-aa8c-c383370c7f1a	covered	combat_body, combat_support, combat_threat, cost_reduction, ramp	combat_body, combat_support, combat_threat, cost_reduction, ramp	false		Covered by Media and Collaboration Promos role audit.	Legendary Creature — Human Cleric	{1}{R}{W}{B}	4	BRW	BRW	Flying		already reviewed	https://scryfall.com/card/cm1/9/kaalia-of-the-vast?utm_source=api	Flying Whenever Kaalia attacks an opponent, you may put an Angel, Demon, or Dragon creature card from your hand onto the battlefield tapped and attacking that opponent.
cm1	Commander's Arsenal	2012-11-02	10	Loyal Retainers	55b88d43-ec45-4435-a316-1c8aee249ff0	covered		battlefield_recursion, card_selection, combat_body, recursion, repeatable_advantage, sacrifice_support	false		Covered by PTK role audit.	Creature — Human Advisor	{2}{W}	3	W	W			already reviewed	https://scryfall.com/card/cm1/10/loyal-retainers?utm_source=api	Sacrifice this creature: Return target legendary creature card from your graveyard to the battlefield. Activate only during your turn, before attackers are declared.
cm1	Commander's Arsenal	2012-11-02	11	Maelstrom Wanderer	ad9b7fbc-61c8-43ee-a65c-99206fd1e4df	covered		card_selection, combat_body, combat_support, cost_reduction, draw, repeatable_advantage, repeatable_draw, selection	false		Covered by PRM role audit.	Legendary Creature — Elemental	{5}{G}{U}{R}	8	GRU	GRU	Cascade		already reviewed	https://scryfall.com/card/cm1/11/maelstrom-wanderer?utm_source=api	Creatures you control have haste. Cascade, cascade (When you cast this spell, exile cards from the top of your library until you exile a nonland card that costs less. You may cast it without paying its mana cost. Put the exiled cards on the bottom in a random order. Then do it again.)
cm1	Commander's Arsenal	2012-11-02	12	The Mimeoplasm	55123455-d435-46d4-b0cd-0c1614343be2	covered		combat_body, copy_support, counter_support	false		Covered by PRM role audit.	Legendary Creature — Ooze	{2}{B}{G}{U}	5	BGU	BGU			already reviewed	https://scryfall.com/card/cm1/12/the-mimeoplasm?utm_source=api	As The Mimeoplasm enters, you may exile two creature cards from graveyards. If you do, it enters as a copy of one of those cards with a number of additional +1/+1 counters on it equal to the power of the other card.
cm1	Commander's Arsenal	2012-11-02	13	Mind's Eye	63fd2a57-7a47-4e07-947c-f4e9da7ee538	covered		card_draw, direct_draw, draw, repeatable_advantage, repeatable_draw	false		Covered by PRM role audit.	Artifact	{5}	5					already reviewed	https://scryfall.com/card/cm1/13/minds-eye?utm_source=api	Whenever an opponent draws a card, you may pay {1}. If you do, draw a card.
cm1	Commander's Arsenal	2012-11-02	14	Mirari's Wake	852657c0-18a4-4b28-b9ae-7728acdb5044	covered		combat_support, mana_fixing, stable_ramp	false		Covered by JUD role audit.	Enchantment	{3}{G}{W}	5	GW	GW			already reviewed	https://scryfall.com/card/cm1/14/miraris-wake?utm_source=api	Creatures you control get +1/+1. Whenever you tap a land for mana, add one mana of any type that land produced.
cm1	Commander's Arsenal	2012-11-02	15	Rhystic Study	53236dd7-845a-444c-96d5-f41ed7325d8f	covered		card_draw, direct_draw, draw, repeatable_advantage, repeatable_draw	false		Covered by PCY role audit.	Enchantment	{2}{U}	3	U	U			already reviewed	https://scryfall.com/card/cm1/15/rhystic-study?utm_source=api	Whenever an opponent casts a spell, you may draw a card unless that player pays {1}.
cm1	Commander's Arsenal	2012-11-02	16	Scroll Rack	648bd03d-247e-4d6f-87a9-12a67688cbf5	covered	card_selection, face_down_support, selection	card_selection, face_down_support, selection	false		Covered by Tempest role audit.	Artifact	{2}	2					already reviewed	https://scryfall.com/card/cm1/16/scroll-rack?utm_source=api	{1}, {T}: Exile any number of cards from your hand face down. Put that many cards from the top of your library into your hand. Then look at the exiled cards and put them on top of your library in any order.
cm1	Commander's Arsenal	2012-11-02	17	Sylvan Library	92eed395-62ca-4293-882b-8565c40daab5	covered	card_draw, direct_draw, draw, repeatable_advantage, repeatable_draw	card_draw, direct_draw, draw, repeatable_advantage, repeatable_draw	false		Covered by Legends role audit.	Enchantment	{1}{G}	2	G	G			already reviewed	https://scryfall.com/card/cm1/17/sylvan-library?utm_source=api	At the beginning of your draw step, you may draw two additional cards. If you do, choose two cards in your hand drawn this turn. For each of those cards, pay 4 life or put the card on top of your library.
cm1	Commander's Arsenal	2012-11-02	18	Vela the Night-Clad	185e34f0-60ae-4b07-94ac-96cef11b1604	covered	combat_body, combat_support, direct_finisher, finisher, repeatable_finisher	combat_body, combat_support, direct_finisher, finisher, repeatable_finisher	false		Analyzer roles accepted during batch clean pass.	Legendary Creature — Human Wizard	{4}{U}{B}	6	BU	BU	Intimidate		verify analyzer roles	https://scryfall.com/card/cm1/18/vela-the-night-clad?utm_source=api	Intimidate (This creature can't be blocked except by artifact creatures and/or creatures that share a color with it.) Other creatures you control have intimidate. Whenever Vela or another creature you control leaves the battlefield, each opponent loses 1 life.
