setCode	setName	releasedAt	collectorNumber	name	oracleId	auditStatus	expectedRoles	actualAnalyzerRoles	needsCodeChange	tagDecision	manualNotes	typeLine	manaCost	manaValue	colors	colorIdentity	keywords	scryfallOracleTags	attentionHint	scryfallUrl	oracleText
dst	Darksteel	2004-02-06	1	Auriok Glaivemaster	77ec26f9-c7de-4bd8-bafb-8b9825891015			combat_body, combat_support				Creature — Human Soldier	{W}	1	W	W			verify analyzer roles	https://scryfall.com/card/dst/1/auriok-glaivemaster?utm_source=api	As long as this creature is equipped, it gets +1/+1 and has first strike.
dst	Darksteel	2004-02-06	2	Echoing Calm	d0bc217b-1149-4a33-a4a1-29e07597dc41			removal, targeted_removal				Instant	{1}{W}	2	W	W			verify analyzer roles	https://scryfall.com/card/dst/2/echoing-calm?utm_source=api	Destroy target enchantment and all other enchantments with the same name as that enchantment.
dst	Darksteel	2004-02-06	3	Emissary of Hope	62a6dbdb-70fc-43ab-8e63-367a609ecdeb			combat_body, combat_support, combat_threat, lifegain				Creature — Spirit	{1}{W}{W}	3	W	W	Flying		verify analyzer roles	https://scryfall.com/card/dst/3/emissary-of-hope?utm_source=api	Flying Whenever this creature deals combat damage to a player, you gain 1 life for each artifact that player controls.
dst	Darksteel	2004-02-06	4	Hallow	60b6a31f-043e-4de3-ad37-67eec02114f8			broad_protection, lifegain, protection				Instant	{W}	1	W	W			verify analyzer roles	https://scryfall.com/card/dst/4/hallow?utm_source=api	Prevent all damage target spell would deal this turn. You gain life equal to the damage prevented this way.
dst	Darksteel	2004-02-06	5	Leonin Battlemage	7c0e4731-d384-4f63-a36c-b571d8f79922			combat_body, combat_support				Creature — Cat Wizard	{3}{W}	4	W	W			verify analyzer roles	https://scryfall.com/card/dst/5/leonin-battlemage?utm_source=api	{T}: Target creature gets +1/+1 until end of turn. Whenever you cast a spell, you may untap this creature.
dst	Darksteel	2004-02-06	6	Leonin Shikari	857d94f7-113c-45a4-a88a-5d087347d57f			combat_body				Creature — Cat Soldier	{1}{W}	2	W	W			verify analyzer roles	https://scryfall.com/card/dst/6/leonin-shikari?utm_source=api	You may activate equip abilities any time you could cast an instant.
dst	Darksteel	2004-02-06	7	Loxodon Mystic	f3e22884-a9ca-4479-b400-df1c1d2fd153			combat_body, removal, tempo_removal				Creature — Elephant Cleric	{3}{W}{W}	5	W	W			verify analyzer roles	https://scryfall.com/card/dst/7/loxodon-mystic?utm_source=api	{W}, {T}: Tap target creature.
dst	Darksteel	2004-02-06	8	Metal Fatigue	f817352a-908a-4cb5-8e10-feeb770540fc							Instant	{2}{W}	3	W	W			manual review	https://scryfall.com/card/dst/8/metal-fatigue?utm_source=api	Tap all artifacts.
dst	Darksteel	2004-02-06	9	Pristine Angel	275f70e9-a5b8-4eeb-935d-8f4cffc3293b			combat_body, combat_threat, self_protection				Creature — Angel	{4}{W}{W}	6	W	W	Flying		verify analyzer roles	https://scryfall.com/card/dst/9/pristine-angel?utm_source=api	Flying As long as this creature is untapped, it has protection from artifacts and from each color. Whenever you cast a spell, you may untap this creature.
dst	Darksteel	2004-02-06	10	Pteron Ghost	783c48b8-a760-4334-ac70-557af7802f33			combat_body, combat_threat, protection, sacrifice_support, targeted_protection				Creature — Dinosaur Spirit	{1}{W}	2	W	W	Flying		verify analyzer roles	https://scryfall.com/card/dst/10/pteron-ghost?utm_source=api	Flying Sacrifice this creature: Regenerate target artifact.
dst	Darksteel	2004-02-06	11	Pulse of the Fields	fc401c08-514d-43ea-9f57-6c3afe7c2652			lifegain				Instant	{1}{W}{W}	3	W	W			verify analyzer roles	https://scryfall.com/card/dst/11/pulse-of-the-fields?utm_source=api	You gain 4 life. Then if an opponent has more life than you, return Pulse of the Fields to its owner's hand.
dst	Darksteel	2004-02-06	12	Purge	d06f0f7c-0270-44be-991a-a5ebbddb0900			removal, targeted_removal				Instant	{1}{W}	2	W	W			verify analyzer roles	https://scryfall.com/card/dst/12/purge?utm_source=api	Destroy target artifact creature or black creature. It can't be regenerated.
dst	Darksteel	2004-02-06	13	Ritual of Restoration	7cfd0320-0b1c-4ef4-8e17-600cbcbddd6f			card_selection, hand_recursion, recursion				Sorcery	{W}	1	W	W			verify analyzer roles	https://scryfall.com/card/dst/13/ritual-of-restoration?utm_source=api	Return target artifact card from your graveyard to your hand.
dst	Darksteel	2004-02-06	14	Soulscour	d7644325-8a0f-4f40-bab6-518df7ac1d14			mass_removal, removal				Sorcery	{7}{W}{W}{W}	10	W	W			verify analyzer roles	https://scryfall.com/card/dst/14/soulscour?utm_source=api	Destroy all nonartifact permanents.
dst	Darksteel	2004-02-06	15	Steelshaper Apprentice	bf325b3a-0b28-4660-8b51-4334b59a9034			combat_body, repeatable_tutor, restricted_tutor, tutor				Creature — Human Soldier	{2}{W}{W}	4	W	W			verify analyzer roles	https://scryfall.com/card/dst/15/steelshaper-apprentice?utm_source=api	{W}, {T}, Return this creature to its owner's hand: Search your library for an Equipment card, reveal that card, put it into your hand, then shuffle.
dst	Darksteel	2004-02-06	16	Stir the Pride	7e46d2c7-59ae-4b0e-a2ec-d0ac1b68d594			combat_support, lifegain				Instant	{4}{W}	5	W	W	Entwine		verify analyzer roles	https://scryfall.com/card/dst/16/stir-the-pride?utm_source=api	Choose one — • Creatures you control get +2/+2 until end of turn. • Until end of turn, creatures you control gain "Whenever this creature deals damage, you gain that much life." Entwine {1}{W} (Choose both if you pay the entwine cost.)
dst	Darksteel	2004-02-06	17	Test of Faith	3397aa3d-bf73-4ca3-a806-059361603079			counter_support, protection, targeted_protection				Instant	{1}{W}	2	W	W			verify analyzer roles	https://scryfall.com/card/dst/17/test-of-faith?utm_source=api	Prevent the next 3 damage that would be dealt to target creature this turn. For each 1 damage prevented this way, put a +1/+1 counter on that creature.
dst	Darksteel	2004-02-06	18	Turn the Tables	bd5ad7c3-4477-4278-9875-d2ffbb0e8089			combat_support				Instant	{3}{W}{W}	5	W	W			verify analyzer roles	https://scryfall.com/card/dst/18/turn-the-tables?utm_source=api	All combat damage that would be dealt to you this turn is dealt to target attacking creature instead.
dst	Darksteel	2004-02-06	19	Carry Away	913b57de-f921-40ea-9124-0da35a269181							Enchantment — Aura	{U}{U}	2	U	U	Enchant		has Scryfall tags/keywords but no analyzer role	https://scryfall.com/card/dst/19/carry-away?utm_source=api	Enchant Equipment When this Aura enters, unattach enchanted Equipment. You control enchanted Equipment.
dst	Darksteel	2004-02-06	20	Chromescale Drake	534eb5bd-1eb0-4a12-8e98-e964495aa7e9			artifact_support, card_selection, combat_body, combat_threat				Creature — Drake	{6}{U}{U}{U}	9	U	U	Flying, Affinity		verify analyzer roles	https://scryfall.com/card/dst/20/chromescale-drake?utm_source=api	Affinity for artifacts (This spell costs {1} less to cast for each artifact you control.) Flying When this creature enters, reveal the top three cards of your library. Put all artifact cards revealed this way into your hand and the rest into your graveyard.
dst	Darksteel	2004-02-06	21	Echoing Truth	ef100544-3e6d-4661-a1d1-8b02e58c059c			removal, tempo_removal				Instant	{1}{U}	2	U	U			verify analyzer roles	https://scryfall.com/card/dst/21/echoing-truth?utm_source=api	Return target nonland permanent and all other permanents with the same name as that permanent to their owners' hands.
dst	Darksteel	2004-02-06	22	Hoverguard Observer	5ca8d756-a55a-4b36-b0a6-562a39484952			combat_body, combat_threat				Creature — Drone	{2}{U}{U}	4	U	U	Flying		verify analyzer roles	https://scryfall.com/card/dst/22/hoverguard-observer?utm_source=api	Flying This creature can block only creatures with flying.
dst	Darksteel	2004-02-06	23	Last Word	33d6a17a-0112-4d4f-a24a-0769360408a8			hard_stack, stack				Instant	{2}{U}{U}	4	U	U			verify analyzer roles	https://scryfall.com/card/dst/23/last-word?utm_source=api	This spell can't be countered. Counter target spell.
dst	Darksteel	2004-02-06	24	Machinate	545399a0-f1f5-40bc-bd40-038946df8ad7			artifact_support, card_selection, scalable_spell				Instant	{1}{U}{U}	3	U	U			verify analyzer roles	https://scryfall.com/card/dst/24/machinate?utm_source=api	Look at the top X cards of your library, where X is the number of artifacts you control. Put one of those cards into your hand and the rest on the bottom of your library in any order.
dst	Darksteel	2004-02-06	25	Magnetic Flux	d50f756d-9ab6-4597-86ae-80beb70879ac			combat_support				Instant	{2}{U}	3	U	U			verify analyzer roles	https://scryfall.com/card/dst/25/magnetic-flux?utm_source=api	Artifact creatures you control gain flying until end of turn.
dst	Darksteel	2004-02-06	26	Neurok Prodigy	910860ce-d617-48c1-b44d-b1d95cdd006f			combat_body, combat_threat				Creature — Human Wizard	{2}{U}	3	U	U	Flying		verify analyzer roles	https://scryfall.com/card/dst/26/neurok-prodigy?utm_source=api	Flying Discard an artifact card: Return this creature to its owner's hand.
dst	Darksteel	2004-02-06	27	Neurok Transmuter	08a64b22-49da-415e-98ce-e1a61d3dfff3			combat_body				Creature — Human Wizard	{2}{U}	3	U	U			verify analyzer roles	https://scryfall.com/card/dst/27/neurok-transmuter?utm_source=api	{U}: Target creature becomes an artifact in addition to its other types until end of turn. {U}: Until end of turn, target artifact creature becomes blue and isn't an artifact.
dst	Darksteel	2004-02-06	28	Psychic Overload	c50354fc-7dfe-4ea7-87dd-488ca6213344							Enchantment — Aura	{3}{U}	4	U	U	Enchant		has Scryfall tags/keywords but no analyzer role	https://scryfall.com/card/dst/28/psychic-overload?utm_source=api	Enchant permanent When this Aura enters, tap enchanted permanent. Enchanted permanent doesn't untap during its controller's untap step. Enchanted permanent has "Discard two artifact cards: Untap this permanent."
dst	Darksteel	2004-02-06	29	Pulse of the Grid	73ea32e4-72c5-42ee-8ed5-21dee83d7eec			card_draw, card_selection, direct_draw, draw, selection				Instant	{1}{U}{U}	3	U	U			verify analyzer roles	https://scryfall.com/card/dst/29/pulse-of-the-grid?utm_source=api	Draw two cards, then discard a card. Then if an opponent has more cards in hand than you, return Pulse of the Grid to its owner's hand.
dst	Darksteel	2004-02-06	30	Quicksilver Behemoth	799f31fc-3b6f-419a-8e70-b41c8e97f000			artifact_support, combat_body, combat_support				Creature — Beast	{6}{U}	7	U	U	Affinity		verify analyzer roles	https://scryfall.com/card/dst/30/quicksilver-behemoth?utm_source=api	Affinity for artifacts (This spell costs {1} less to cast for each artifact you control.) When this creature attacks or blocks, return it to its owner's hand at end of combat. (Return it only if it's on the battlefield.)
dst	Darksteel	2004-02-06	31	Reshape	42a3855d-25ab-45b3-9e5d-9a0f3da35a05			cheat_into_play, cost_reduction, mana_sink, restricted_tutor, sacrifice_support, scalable_spell, tutor				Sorcery	{X}{U}{U}	2	U	U			verify analyzer roles	https://scryfall.com/card/dst/31/reshape?utm_source=api	As an additional cost to cast this spell, sacrifice an artifact. Search your library for an artifact card with mana value X or less, put it onto the battlefield, then shuffle.
dst	Darksteel	2004-02-06	32	Retract	31cefc9d-cc13-4b32-a1f8-edbcaf35aa3b			artifact_support, mass_removal, removal				Instant	{U}	1	U	U			verify analyzer roles	https://scryfall.com/card/dst/32/retract?utm_source=api	Return all artifacts you control to their owner's hand.
dst	Darksteel	2004-02-06	33	Second Sight	1a4e948a-5a5e-4811-a6af-7ea93a051746			card_selection, selection, topdeck_control				Instant	{2}{U}	3	U	U	Entwine		verify analyzer roles	https://scryfall.com/card/dst/33/second-sight?utm_source=api	Choose one — • Look at the top five cards of target opponent's library, then put them back in any order. • Look at the top five cards of your library, then put them back in any order. Entwine {U} (Choose both if you pay the entwine cost.)
dst	Darksteel	2004-02-06	34	Synod Artificer	b93383ea-0206-43c4-908e-f424ef4523c3			combat_body				Creature — Vedalken Artificer	{2}{U}	3	U	U			verify analyzer roles	https://scryfall.com/card/dst/34/synod-artificer?utm_source=api	{X}, {T}: Tap X target noncreature artifacts. {X}, {T}: Untap X target noncreature artifacts.
dst	Darksteel	2004-02-06	35	Vedalken Engineer	b36accb4-cde6-4b1d-b549-8c975cfa999d			combat_body, ramp, stable_ramp				Creature — Vedalken Artificer	{1}{U}	2	U	U			verify analyzer roles	https://scryfall.com/card/dst/35/vedalken-engineer?utm_source=api	{T}: Add two mana of any one color. Spend this mana only to cast artifact spells or activate abilities of artifacts.
dst	Darksteel	2004-02-06	36	Vex	fd6ba826-e7b1-4375-8aaf-c3cd3dc7ba07			card_draw, direct_draw, draw, hard_stack, stack				Instant	{2}{U}	3	U	U			verify analyzer roles	https://scryfall.com/card/dst/36/vex?utm_source=api	Counter target spell. That spell's controller may draw a card.
dst	Darksteel	2004-02-06	37	Aether Snap	1a1a16e5-ce4f-42b8-a1c6-05dd635d83cc							Sorcery	{3}{B}{B}	5	B	B			manual review	https://scryfall.com/card/dst/37/aether-snap?utm_source=api	Remove all counters from all permanents and exile all tokens.
dst	Darksteel	2004-02-06	38	Burden of Greed	a80c13db-949d-4784-8177-04aaa22b96b0							Instant	{3}{B}	4	B	B			manual review	https://scryfall.com/card/dst/38/burden-of-greed?utm_source=api	Target player loses 1 life for each tapped artifact they control.
dst	Darksteel	2004-02-06	39	Chittering Rats	08dfe42e-35c0-4be0-abba-57269792ff3d	covered		combat_body	false		Covered by PRM role audit.	Creature — Rat	{1}{B}{B}	3	B	B			already reviewed	https://scryfall.com/card/dst/39/chittering-rats?utm_source=api	When this creature enters, target opponent puts a card from their hand on top of their library.
dst	Darksteel	2004-02-06	40	Death Cloud	680f5eca-b98e-4f73-a852-ab629d94297e			direct_finisher, finisher, mana_sink, removal, scalable_spell, targeted_removal				Sorcery	{X}{B}{B}{B}	3	B	B			verify analyzer roles	https://scryfall.com/card/dst/40/death-cloud?utm_source=api	Each player loses X life, discards X cards, sacrifices X creatures of their choice, then sacrifices X lands of their choice.
dst	Darksteel	2004-02-06	41	Echoing Decay	a1e46cc7-47da-4165-8c6b-f1cd2aa79aa5			removal, targeted_removal				Instant	{1}{B}	2	B	B			verify analyzer roles	https://scryfall.com/card/dst/41/echoing-decay?utm_source=api	Target creature and all other creatures with the same name as that creature get -2/-2 until end of turn.
dst	Darksteel	2004-02-06	42	Emissary of Despair	4efa1654-c822-4477-ad24-f379ed7ecb11			combat_body, combat_support, combat_threat				Creature — Spirit	{1}{B}{B}	3	B	B	Flying		verify analyzer roles	https://scryfall.com/card/dst/42/emissary-of-despair?utm_source=api	Flying Whenever this creature deals combat damage to a player, that player loses 1 life for each artifact they control.
dst	Darksteel	2004-02-06	43	Essence Drain	4bf5402f-7bba-4c0c-aebd-1b231768f2b2			lifegain, removal, targeted_removal				Sorcery	{4}{B}	5	B	B			verify analyzer roles	https://scryfall.com/card/dst/43/essence-drain?utm_source=api	Essence Drain deals 3 damage to any target and you gain 3 life.
dst	Darksteel	2004-02-06	44	Greater Harvester	1e8f17ab-4616-44de-adfd-010882cfcd42			combat_body, combat_support, sacrifice_support				Creature — Horror	{2}{B}{B}{B}	5	B	B			verify analyzer roles	https://scryfall.com/card/dst/44/greater-harvester?utm_source=api	At the beginning of your upkeep, sacrifice a permanent. Whenever this creature deals combat damage to a player, that player sacrifices two permanents of their choice.
dst	Darksteel	2004-02-06	45	Grimclaw Bats	161ebbc8-b8f9-4ac4-80f3-e290070a1e30			combat_body, combat_support, combat_threat				Creature — Bat	{1}{B}	2	B	B	Flying		verify analyzer roles	https://scryfall.com/card/dst/45/grimclaw-bats?utm_source=api	Flying {B}, Pay 1 life: This creature gets +1/+1 until end of turn.
dst	Darksteel	2004-02-06	46	Hunger of the Nim	1af3c6ff-2884-4d8c-a01f-6f74d8ea10cc			artifact_support, combat_support				Sorcery	{1}{B}	2	B	B			verify analyzer roles	https://scryfall.com/card/dst/46/hunger-of-the-nim?utm_source=api	Target creature gets +1/+0 until end of turn for each artifact you control.
dst	Darksteel	2004-02-06	47	Mephitic Ooze	230e0bf3-3f17-4968-8723-3fb6a0909816			artifact_support, combat_body, combat_support				Creature — Ooze	{4}{B}	5	B	B			verify analyzer roles	https://scryfall.com/card/dst/47/mephitic-ooze?utm_source=api	This creature gets +1/+0 for each artifact you control. Whenever this creature deals combat damage to a creature, destroy that creature. The creature can't be regenerated.
dst	Darksteel	2004-02-06	48	Murderous Spoils	e911f9d9-da04-4997-a8d7-449b566cd1ce			removal, targeted_removal, theft_support				Instant	{5}{B}	6	B	B			verify analyzer roles	https://scryfall.com/card/dst/48/murderous-spoils?utm_source=api	Destroy target nonblack creature. It can't be regenerated. You gain control of all Equipment that were attached to it. (This effect lasts indefinitely.)
dst	Darksteel	2004-02-06	49	Nim Abomination	b0713b1e-544d-4549-9371-61ac7f6c2a6a			combat_body				Creature — Zombie	{2}{B}	3	B	B			verify analyzer roles	https://scryfall.com/card/dst/49/nim-abomination?utm_source=api	At the beginning of your end step, if this creature is untapped, you lose 3 life.
dst	Darksteel	2004-02-06	50	Pulse of the Dross	95846070-7b35-4689-a56c-5b32b6264013			hand_attack, removal				Sorcery	{1}{B}{B}	3	B	B			verify analyzer roles	https://scryfall.com/card/dst/50/pulse-of-the-dross?utm_source=api	Target player reveals three cards from their hand and you choose one of them. That player discards that card. Then if that player has more cards in hand than you, return Pulse of the Dross to its owner's hand.
dst	Darksteel	2004-02-06	51	Scavenging Scarab	3ce2f3ad-23b3-40fe-bb31-25dbe9d1150d			combat_body, combat_support				Creature — Insect	{3}{B}	4	B	B			verify analyzer roles	https://scryfall.com/card/dst/51/scavenging-scarab?utm_source=api	This creature can't block.
dst	Darksteel	2004-02-06	52	Screams from Within	a3b3b9ae-1e48-481d-80a5-7e2a26cf2f50			battlefield_recursion, card_selection, combat_support, sacrifice_support				Enchantment — Aura	{1}{B}{B}	3	B	B	Enchant		verify analyzer roles	https://scryfall.com/card/dst/52/screams-from-within?utm_source=api	Enchant creature Enchanted creature gets -1/-1. When enchanted creature dies, return this card from your graveyard to the battlefield.
dst	Darksteel	2004-02-06	53	Scrounge	e6f0d7a9-41bd-4297-a07a-b81554a30262			theft_support				Sorcery	{2}{B}	3	B	B			verify analyzer roles	https://scryfall.com/card/dst/53/scrounge?utm_source=api	Target opponent chooses an artifact card in their graveyard. Put that card onto the battlefield under your control.
dst	Darksteel	2004-02-06	54	Shriveling Rot	9ce8691a-d9e2-45b2-bda0-2c3891b55307			mass_removal, removal, sacrifice_support, targeted_removal				Instant	{2}{B}{B}	4	B	B	Entwine		verify analyzer roles	https://scryfall.com/card/dst/54/shriveling-rot?utm_source=api	Choose one — • Until end of turn, whenever a creature is dealt damage, destroy it. • Until end of turn, whenever a creature dies, that creature's controller loses life equal to its toughness. Entwine {2}{B} (Choose both if you pay the entwine cost.)
dst	Darksteel	2004-02-06	55	Barbed Lightning	f6e1eb52-9f13-425c-8309-1b08ed6557db			removal, targeted_removal				Instant	{2}{R}	3	R	R	Entwine		verify analyzer roles	https://scryfall.com/card/dst/55/barbed-lightning?utm_source=api	Choose one — • Barbed Lightning deals 3 damage to target creature. • Barbed Lightning deals 3 damage to target player or planeswalker. Entwine {2} (Choose both if you pay the entwine cost.)
dst	Darksteel	2004-02-06	56	Crazed Goblin	fafe2d90-e5fc-401a-a971-829192bec6c0			combat_body, combat_support				Creature — Goblin Warrior	{R}	1	R	R			verify analyzer roles	https://scryfall.com/card/dst/56/crazed-goblin?utm_source=api	This creature attacks each combat if able.
dst	Darksteel	2004-02-06	57	Dismantle	5f4d0a43-ff5b-4f75-9144-a218ec352489			artifact_support, counter_support, removal, targeted_removal				Sorcery	{2}{R}	3	R	R			verify analyzer roles	https://scryfall.com/card/dst/57/dismantle?utm_source=api	Destroy target artifact. If that artifact had counters on it, put that many +1/+1 counters or charge counters on an artifact you control.
dst	Darksteel	2004-02-06	58	Drooling Ogre	97b37822-b030-4792-bcd7-c84499f51b18			combat_body				Creature — Ogre	{1}{R}	2	R	R			verify analyzer roles	https://scryfall.com/card/dst/58/drooling-ogre?utm_source=api	Whenever a player casts an artifact spell, that player gains control of this creature. (This effect lasts indefinitely.)
dst	Darksteel	2004-02-06	59	Echoing Ruin	e04ca2dc-873e-4d80-b1d7-4873ffdb3af5			removal, targeted_removal				Sorcery	{1}{R}	2	R	R			verify analyzer roles	https://scryfall.com/card/dst/59/echoing-ruin?utm_source=api	Destroy target artifact and all other artifacts with the same name as that artifact.
dst	Darksteel	2004-02-06	60	Fireball	aa7714b0-2bfb-458a-8ebf-37ec2c53383e	covered	direct_finisher, finisher, mana_sink, removal, scalable_spell, targeted_removal	direct_finisher, finisher, mana_sink, removal, scalable_spell, targeted_removal	false		Covered by ATH role audit.	Sorcery	{X}{R}	1	R	R			already reviewed	https://scryfall.com/card/dst/60/fireball?utm_source=api	This spell costs {1} more to cast for each target beyond the first. Fireball deals X damage divided evenly, rounded down, among any number of targets.
dst	Darksteel	2004-02-06	61	Flamebreak	9e608ace-2844-419b-9204-9054127557b2			damage_engine, group_slug, mass_removal, removal				Sorcery	{R}{R}{R}	3	R	R			verify analyzer roles	https://scryfall.com/card/dst/61/flamebreak?utm_source=api	Flamebreak deals 3 damage to each creature without flying and each player. Creatures dealt damage this way can't be regenerated this turn.
dst	Darksteel	2004-02-06	62	Furnace Dragon	13d92af9-a6e2-4847-b2e9-179fe0cc840e			artifact_support, combat_body, combat_threat, mass_removal, removal				Creature — Dragon	{6}{R}{R}{R}	9	R	R	Flying, Affinity		verify analyzer roles	https://scryfall.com/card/dst/62/furnace-dragon?utm_source=api	Affinity for artifacts (This spell costs {1} less to cast for each artifact you control.) Flying When this creature enters, if you cast it from your hand, exile all artifacts.
dst	Darksteel	2004-02-06	63	Goblin Archaeologist	7d61dd63-7c39-4d43-ba8e-a4e1b98c2192			coin_support, combat_body, removal, sacrifice_support, targeted_removal				Creature — Goblin Artificer	{1}{R}	2	R	R			verify analyzer roles	https://scryfall.com/card/dst/63/goblin-archaeologist?utm_source=api	{R}, {T}: Flip a coin. If you win the flip, destroy target artifact and untap this creature. If you lose the flip, sacrifice this creature.
dst	Darksteel	2004-02-06	64	Inflame	8426bdb6-b002-4d27-9eaf-d7f8353aa7e8	covered		mass_removal, removal	false		Covered by PCY role audit.	Instant	{R}	1	R	R			already reviewed	https://scryfall.com/card/dst/64/inflame?utm_source=api	Inflame deals 2 damage to each creature dealt damage this turn.
dst	Darksteel	2004-02-06	65	Krark-Clan Stoker	756b4bc9-6f3f-4eae-b6b0-63c94ed8482f			burst_ramp, combat_body, ramp, sacrifice_support				Creature — Goblin Shaman	{2}{R}	3	R	R			verify analyzer roles	https://scryfall.com/card/dst/65/krark-clan-stoker?utm_source=api	{T}, Sacrifice an artifact: Add {R}{R}.
dst	Darksteel	2004-02-06	66	Pulse of the Forge	f1c05ba3-7225-4d29-96aa-9d9c0b54de53			removal, targeted_removal				Instant	{1}{R}{R}	3	R	R			verify analyzer roles	https://scryfall.com/card/dst/66/pulse-of-the-forge?utm_source=api	Pulse of the Forge deals 4 damage to target player or planeswalker. Then if that player or that planeswalker's controller has more life than you, return Pulse of the Forge to its owner's hand.
dst	Darksteel	2004-02-06	67	Savage Beating	89d1cd45-8148-4396-a9b8-e0f495e94b5b			combat_finisher, combat_support, finisher, multiplier_support, replacement_engine, tap_untap, tempo_support				Instant	{3}{R}{R}	5	R	R	Entwine		verify analyzer roles	https://scryfall.com/card/dst/67/savage-beating?utm_source=api	Cast this spell only during combat on your turn. Choose one — • Creatures you control gain double strike until end of turn. • Untap all creatures you control. After this phase, there is an additional combat phase. Entwine {1}{R} (Choose both if you pay the entwine cost.)
dst	Darksteel	2004-02-06	68	Shunt	e714bcfb-b451-4b7b-ab60-4cb845c75647			broad_stack, stack				Instant	{1}{R}{R}	3	R	R			verify analyzer roles	https://scryfall.com/card/dst/68/shunt?utm_source=api	Change the target of target spell with a single target.
dst	Darksteel	2004-02-06	69	Slobad, Goblin Tinkerer	1f2d6cf4-b8f4-440f-ac08-ca47ada868ac			combat_body, protection, sacrifice_support, self_protection, targeted_protection				Legendary Creature — Goblin Artificer	{1}{R}	2	R	R			verify analyzer roles	https://scryfall.com/card/dst/69/slobad-goblin-tinkerer?utm_source=api	Sacrifice an artifact: Target artifact gains indestructible until end of turn.
dst	Darksteel	2004-02-06	70	Tears of Rage	564ffd21-bffb-488d-a496-cca29f344cdc			combat_support, sacrifice_support, scalable_spell				Instant	{2}{R}{R}	4	R	R			verify analyzer roles	https://scryfall.com/card/dst/70/tears-of-rage?utm_source=api	Cast this spell only during the declare attackers step. Attacking creatures you control get +X/+0 until end of turn, where X is the number of attacking creatures. Sacrifice those creatures at the beginning of the next end step.
dst	Darksteel	2004-02-06	71	Unforge	fa360a9d-3cff-4833-9ce2-b2f53d26127f							Instant	{2}{R}	3	R	R			manual review	https://scryfall.com/card/dst/71/unforge?utm_source=api	Destroy target Equipment. If that Equipment was attached to a creature, Unforge deals 2 damage to that creature.
