setCode	setName	releasedAt	collectorNumber	name	oracleId	auditStatus	expectedRoles	actualAnalyzerRoles	needsCodeChange	tagDecision	manualNotes	typeLine	manaCost	manaValue	colors	colorIdentity	keywords	scryfallOracleTags	attentionHint	scryfallUrl	oracleText
dst	Darksteel	2004-02-06	137	Razor Golem	c7b2188a-7571-48b8-ac66-ca741bf2e779			combat_body, combat_threat				Artifact Creature — Golem	{6}	6			Affinity, Vigilance		verify analyzer roles	https://scryfall.com/card/dst/137/razor-golem?utm_source=api	Affinity for Plains (This spell costs {1} less to cast for each Plains you control.) Vigilance
dst	Darksteel	2004-02-06	138	Serum Powder	4e734493-9cb8-4409-8a30-cc15d519a27e			card_draw, ramp, stable_ramp				Artifact	{3}	3					verify analyzer roles	https://scryfall.com/card/dst/138/serum-powder?utm_source=api	{T}: Add {C}. Any time you could mulligan and this card is in your hand, you may exile all the cards from your hand, then draw that many cards. (You can do this in addition to taking mulligans.)
dst	Darksteel	2004-02-06	139	Shield of Kaldra	4fdd570f-dbe0-486f-9843-f77f80956307	covered		artifact_support, combat_support, equipment_protection, self_protection	false		Covered by PRM role audit.	Legendary Artifact — Equipment	{4}	4			Equip		already reviewed	https://scryfall.com/card/dst/139/shield-of-kaldra?utm_source=api	Equipment named Sword of Kaldra, Shield of Kaldra, and Helm of Kaldra have indestructible. Equipped creature has indestructible. (Damage and effects that say "destroy" don't destroy it.) Equip {4}
dst	Darksteel	2004-02-06	140	Skullclamp	65986c1b-8e51-4604-b685-d82fa7d1263a			artifact_support, card_draw, combat_support, direct_draw, draw, repeatable_advantage, repeatable_draw, sacrifice_support				Artifact — Equipment	{1}	1			Equip		verify analyzer roles	https://scryfall.com/card/dst/140/skullclamp?utm_source=api	Equipped creature gets +1/-1. Whenever equipped creature dies, draw two cards. Equip {1}
dst	Darksteel	2004-02-06	141	Spawning Pit	ea7b0704-7715-4f8a-b32f-d2d2f3b36054			counter_support, sacrifice_support, token_support				Artifact	{2}	2					verify analyzer roles	https://scryfall.com/card/dst/141/spawning-pit?utm_source=api	Sacrifice a creature: Put a charge counter on this artifact. {1}, Remove two charge counters from this artifact: Create a 2/2 colorless Spawn artifact creature token.
dst	Darksteel	2004-02-06	142	Specter's Shroud	dbc2b0f9-73e8-41b7-9d64-07f86fbc5d6c			artifact_support, combat_support				Artifact — Equipment	{2}	2			Equip		verify analyzer roles	https://scryfall.com/card/dst/142/specters-shroud?utm_source=api	Equipped creature gets +1/+0. Whenever equipped creature deals combat damage to a player, that player discards a card. Equip {1} ({1}: Attach to target creature you control. Equip only as a sorcery.)
dst	Darksteel	2004-02-06	143	Spellbinder	da50989e-4fd4-4353-afd5-9c1354330ec2			artifact_support, card_selection, combat_support				Artifact — Equipment	{3}	3			Equip, Imprint		verify analyzer roles	https://scryfall.com/card/dst/143/spellbinder?utm_source=api	Imprint — When this Equipment enters, you may exile an instant card from your hand. Whenever equipped creature deals combat damage to a player, you may copy the exiled card. If you do, you may cast the copy without paying its mana cost. Equip {4}
dst	Darksteel	2004-02-06	144	Spincrusher	1932a19a-0c2b-4d16-a2ba-34ed136d8e70			combat_body, combat_support, counter_support				Artifact Creature — Construct	{2}	2					verify analyzer roles	https://scryfall.com/card/dst/144/spincrusher?utm_source=api	Whenever this creature blocks, put a +1/+1 counter on it. Remove a +1/+1 counter from this creature: This creature can't be blocked this turn.
dst	Darksteel	2004-02-06	145	Spire Golem	bfdc6bbc-7402-40ae-91be-658afca2f145			combat_body, combat_threat				Artifact Creature — Golem	{6}	6			Flying, Affinity		verify analyzer roles	https://scryfall.com/card/dst/145/spire-golem?utm_source=api	Affinity for Islands (This spell costs {1} less to cast for each Island you control.) Flying
dst	Darksteel	2004-02-06	146	Sundering Titan	d17d071d-dbee-4d65-8435-137f35cd89ca			combat_body				Artifact Creature — Golem	{8}	8					verify analyzer roles	https://scryfall.com/card/dst/146/sundering-titan?utm_source=api	When this creature enters or leaves the battlefield, choose a land of each basic land type, then destroy those lands.
dst	Darksteel	2004-02-06	147	Surestrike Trident	bf09b97b-9387-4b94-a3fc-00080881f052			artifact_support, combat_support, removal, targeted_removal				Artifact — Equipment	{2}	2			Equip		verify analyzer roles	https://scryfall.com/card/dst/147/surestrike-trident?utm_source=api	Equipped creature has first strike and "{T}, Unattach Surestrike Trident: This creature deals damage equal to its power to target player or planeswalker." Equip {4} ({4}: Attach to target creature you control. Equip only as a sorcery.)
dst	Darksteel	2004-02-06	148	Sword of Fire and Ice	2ccdc60a-49a9-44b9-a7af-0ebf18b26785	covered		artifact_support, card_draw, combat_support, direct_draw, draw, equipment_protection, protection, removal, repeatable_advantage, repeatable_draw, self_protection, targeted_removal	false		Covered by PRM role audit.	Artifact — Equipment	{3}	3			Equip		already reviewed	https://scryfall.com/card/dst/148/sword-of-fire-and-ice?utm_source=api	Equipped creature gets +2/+2 and has protection from red and from blue. Whenever equipped creature deals combat damage to a player, this Equipment deals 2 damage to any target and you draw a card. Equip {2}
dst	Darksteel	2004-02-06	149	Sword of Light and Shadow	01c8a554-45a6-46ca-b40a-af0fd4529e40	covered		artifact_support, card_selection, combat_support, equipment_protection, hand_recursion, lifegain, protection, recursion, repeatable_advantage	false		Covered by PRM role audit.	Artifact — Equipment	{3}	3			Equip		already reviewed	https://scryfall.com/card/dst/149/sword-of-light-and-shadow?utm_source=api	Equipped creature gets +2/+2 and has protection from white and from black. Whenever equipped creature deals combat damage to a player, you gain 3 life and you may return up to one target creature card from your graveyard to your hand. Equip {2}
dst	Darksteel	2004-02-06	150	Talon of Pain	0e4d2fbc-1b34-4501-9022-8ea800cb2d24			counter_support, direct_finisher, finisher, removal, scalable_spell, targeted_removal				Artifact	{4}	4					verify analyzer roles	https://scryfall.com/card/dst/150/talon-of-pain?utm_source=api	Whenever a source you control other than this artifact deals damage to an opponent, put a charge counter on this artifact. {X}, {T}, Remove X charge counters from this artifact: It deals X damage to any target.
dst	Darksteel	2004-02-06	151	Tangle Golem	733c6e30-3c0c-41f0-b1e9-4c2eb76f7b82			combat_body				Artifact Creature — Golem	{7}	7			Affinity		verify analyzer roles	https://scryfall.com/card/dst/151/tangle-golem?utm_source=api	Affinity for Forests (This spell costs {1} less to cast for each Forest you control.)
dst	Darksteel	2004-02-06	152	Thought Dissector	6702fcdb-0b06-4b17-966a-3c5e033c3341			sacrifice_support, targeted_removal				Artifact	{4}	4					verify analyzer roles	https://scryfall.com/card/dst/152/thought-dissector?utm_source=api	{X}, {T}: Target opponent reveals cards from the top of their library until an artifact card or X cards are revealed, whichever comes first. If an artifact card is revealed this way, put it onto the battlefield under your control and sacrifice this artifact. Put the rest of the revealed cards into that player's graveyard.
dst	Darksteel	2004-02-06	153	Thunderstaff	1a88a378-051c-42b4-bd0e-9c40ae8efea6			combat_support				Artifact	{3}	3					verify analyzer roles	https://scryfall.com/card/dst/153/thunderstaff?utm_source=api	As long as this artifact is untapped, if a creature would deal combat damage to you, prevent 1 of that damage. {2}, {T}: Attacking creatures get +1/+0 until end of turn.
dst	Darksteel	2004-02-06	154	Trinisphere	69d994f2-b8f6-425f-9655-977c2144d40c			multiplier_support, replacement_engine, stax_piece				Artifact	{3}	3					verify analyzer roles	https://scryfall.com/card/dst/154/trinisphere?utm_source=api	As long as this artifact is untapped, each spell that would cost less than three mana to cast costs three mana to cast. (Additional mana in the cost may be paid with any color of mana or colorless mana. For example, a spell that would cost {1}{B} to cast costs {2}{B} to cast instead.)
dst	Darksteel	2004-02-06	155	Ur-Golem's Eye	fb34fc00-e60d-41fc-9393-ca4248ec0a1c			ramp, stable_ramp				Artifact	{4}	4					verify analyzer roles	https://scryfall.com/card/dst/155/ur-golems-eye?utm_source=api	{T}: Add {C}{C}.
dst	Darksteel	2004-02-06	156	Voltaic Construct	f5677831-6ca9-4c7b-b02d-f44079c3f663			combat_body, tap_untap, tempo_support				Artifact Creature — Golem Construct	{4}	4					verify analyzer roles	https://scryfall.com/card/dst/156/voltaic-construct?utm_source=api	{2}: Untap target artifact creature.
dst	Darksteel	2004-02-06	157	Vulshok Morningstar	12a8adc4-927f-4314-b2ef-9c647ace68d5			artifact_support, combat_support				Artifact — Equipment	{2}	2			Equip		verify analyzer roles	https://scryfall.com/card/dst/157/vulshok-morningstar?utm_source=api	Equipped creature gets +2/+2. Equip {2} ({2}: Attach to target creature you control. Equip only as a sorcery.)
dst	Darksteel	2004-02-06	158	Wand of the Elements	b4931b44-815e-40b5-b239-682d350f3347			sacrifice_support, token_support				Artifact	{4}	4					verify analyzer roles	https://scryfall.com/card/dst/158/wand-of-the-elements?utm_source=api	{T}, Sacrifice an Island: Create a 2/2 blue Elemental creature token with flying. {T}, Sacrifice a Mountain: Create a 3/3 red Elemental creature token.
dst	Darksteel	2004-02-06	159	Well of Lost Dreams	b0394cf2-12a0-4d4f-87e0-fe8937e6faff			card_draw, direct_draw, draw, lifegain, repeatable_advantage, repeatable_draw, scalable_spell				Artifact	{4}	4					verify analyzer roles	https://scryfall.com/card/dst/159/well-of-lost-dreams?utm_source=api	Whenever you gain life, you may pay {X}, where X is less than or equal to the amount of life you gained. If you do, draw X cards.
dst	Darksteel	2004-02-06	160	Whispersilk Cloak	9ad4f730-a18e-4a7c-a468-a926c718c741			artifact_support, combat_support, equipment_protection, protection, self_protection				Artifact — Equipment	{3}	3			Equip		verify analyzer roles	https://scryfall.com/card/dst/160/whispersilk-cloak?utm_source=api	Equipped creature can't be blocked and has shroud. (It can't be the target of spells or abilities.) Equip {2}
dst	Darksteel	2004-02-06	161	Wirefly Hive	846bedc3-a1e0-4f11-a095-85b60ad482da			coin_support, mass_removal, removal, token_support				Artifact	{3}	3					verify analyzer roles	https://scryfall.com/card/dst/161/wirefly-hive?utm_source=api	{3}, {T}: Flip a coin. If you win the flip, create a 2/2 colorless Insect artifact creature token with flying named Wirefly. If you lose the flip, destroy all permanents named Wirefly.
dst	Darksteel	2004-02-06	162	Wurm's Tooth	69476326-fda5-48c8-a506-e71eb7c81c2f			lifegain				Artifact	{2}	2					verify analyzer roles	https://scryfall.com/card/dst/162/wurms-tooth?utm_source=api	Whenever a player casts a green spell, you may gain 1 life.
dst	Darksteel	2004-02-06	163	Blinkmoth Nexus	40d45c02-6416-4e19-8fe3-0ddadf5ba627			burst_ramp, combat_support, land_base, land_slot, mana_source, ramp				Land		0					verify analyzer roles	https://scryfall.com/card/dst/163/blinkmoth-nexus?utm_source=api	{T}: Add {C}. {1}: This land becomes a 1/1 Blinkmoth artifact creature with flying until end of turn. It's still a land. {1}, {T}: Target Blinkmoth creature gets +1/+1 until end of turn.
dst	Darksteel	2004-02-06	164	Darksteel Citadel	8dc067bf-f78f-4ac4-b6e7-b305c42cf0bc			land_base, land_slot, mana_source, self_protection				Artifact Land		0			Indestructible		verify analyzer roles	https://scryfall.com/card/dst/164/darksteel-citadel?utm_source=api	Indestructible {T}: Add {C}.
dst	Darksteel	2004-02-06	165	Mirrodin's Core	ea53adbe-3f9a-4847-87c7-723ac2789918			counter_support, land_base, land_slot, mana_fixing, mana_source, stable_ramp				Land		0					verify analyzer roles	https://scryfall.com/card/dst/165/mirrodins-core?utm_source=api	{T}: Add {C}. {T}: Put a charge counter on this land. {T}, Remove a charge counter from this land: Add one mana of any color.
