setCode	setName	releasedAt	collectorNumber	name	oracleId	auditStatus	expectedRoles	actualAnalyzerRoles	needsCodeChange	tagDecision	manualNotes	typeLine	manaCost	manaValue	colors	colorIdentity	keywords	scryfallOracleTags	attentionHint	scryfallUrl	oracleText
g08	Judge Gift Cards 2008	2008-01-01	1	Orim's Chant	26d3a818-7faf-443a-a6bd-9773edaedf17	covered		combat_support, hate_piece, soft_stack, stack, stax_piece	false		Covered by PLS role audit.	Instant	{W}	1	W	W	Kicker		already reviewed	https://scryfall.com/card/g08/1/orims-chant?utm_source=api	Kicker {W} (You may pay an additional {W} as you cast this spell.) Target player can't cast spells this turn. If this spell was kicked, creatures can't attack this turn.
g08	Judge Gift Cards 2008	2008-01-01	2	Mind's Desire	b3739b5a-5731-4c64-a244-815a363b0d5c	covered		card_selection, direct_draw, draw, selection	false		Covered by PRM role audit.	Sorcery	{4}{U}{U}	6	U	U	Storm		already reviewed	https://scryfall.com/card/g08/2/minds-desire?utm_source=api	Shuffle your library. Then exile the top card of your library. Until end of turn, you may play that card without paying its mana cost. Storm (When you cast this spell, copy it for each spell cast before it this turn.)
g08	Judge Gift Cards 2008	2008-01-01	3	Demonic Tutor	82004860-e589-4e38-8d61-8c0210e4ea39	covered	direct_tutor, tutor	direct_tutor, tutor	false		Covered by PRM role audit.	Sorcery	{1}{B}	2	B	B			already reviewed	https://scryfall.com/card/g08/3/demonic-tutor?utm_source=api	Search your library for a card, put that card into your hand, then shuffle.
g08	Judge Gift Cards 2008	2008-01-01	4	Goblin Piledriver	4d74d12b-1ffb-482f-8bac-635a8d4d32e9	covered		combat_body, combat_support, self_protection	false		Covered by PRM role audit.	Creature — Goblin Warrior	{1}{R}	2	R	R	Protection		already reviewed	https://scryfall.com/card/g08/4/goblin-piledriver?utm_source=api	Protection from blue (This creature can't be blocked, targeted, dealt damage, or enchanted by anything blue.) Whenever this creature attacks, it gets +2/+0 until end of turn for each other attacking Goblin.
g08	Judge Gift Cards 2008	2008-01-01	5	Living Wish	b9d186f5-1c92-4539-a5b5-e7fbd4b726fe	covered		restricted_tutor, tutor	false		Covered by JUD role audit.	Sorcery	{1}{G}	2	G	G			already reviewed	https://scryfall.com/card/g08/5/living-wish?utm_source=api	You may reveal a creature or land card you own from outside the game and put it into your hand. Exile Living Wish.
