setCode	setName	releasedAt	collectorNumber	name	oracleId	auditStatus	expectedRoles	actualAnalyzerRoles	needsCodeChange	tagDecision	manualNotes	typeLine	manaCost	manaValue	colors	colorIdentity	keywords	scryfallOracleTags	attentionHint	scryfallUrl	oracleText
j12	Judge Gift Cards 2012	2012-01-01	1	Xiahou Dun, the One-Eyed	9602f262-62cb-4c1e-91b6-d94780e571cf	covered		card_selection, combat_body, combat_support, hand_recursion, recursion, repeatable_advantage, sacrifice_support	false		Covered by PTK role audit.	Legendary Creature — Human Soldier	{2}{B}{B}	4	B	B	Horsemanship		already reviewed	https://scryfall.com/card/j12/1/xiahou-dun-the-one-eyed?utm_source=api	Horsemanship (This creature can't be blocked except by creatures with horsemanship.) Sacrifice Xiahou Dun: Return target black card from your graveyard to your hand. Activate only during your turn, before attackers are declared.
j12	Judge Gift Cards 2012	2012-01-01	2	Flusterstorm	86bf58f2-7f25-4e10-b797-25e0e8e67769	covered		soft_stack, stack	false		Covered by PRM role audit.	Instant	{U}	1	U	U	Storm		already reviewed	https://scryfall.com/card/j12/2/flusterstorm?utm_source=api	Counter target instant or sorcery spell unless its controller pays {1}. Storm (When you cast this spell, copy it for each spell cast before it this turn. You may choose new targets for the copies.)
j12	Judge Gift Cards 2012	2012-01-01	3	Noble Hierarch	98aa9424-5912-4bd6-9300-b3972a31d8af	covered		burst_ramp, combat_body, combat_support, mana_fixing, ramp, stable_ramp	false		Covered by PRM role audit.	Creature — Human Druid	{G}	1	G	GUW	Exalted		already reviewed	https://scryfall.com/card/j12/3/noble-hierarch?utm_source=api	Exalted (Whenever a creature you control attacks alone, that creature gets +1/+1 until end of turn.) {T}: Add {G}, {W}, or {U}.
j12	Judge Gift Cards 2012	2012-01-01	4	Karmic Guide	8c31fec9-e4b3-4761-990e-7be38eb05604	covered		battlefield_recursion, card_selection, combat_body, combat_threat, recursion, sacrifice_support	false		Covered by ULG role audit.	Creature — Angel Spirit	{3}{W}{W}	5	W	W	Echo, Flying, Protection		already reviewed	https://scryfall.com/card/j12/4/karmic-guide?utm_source=api	Flying, protection from black Echo {3}{W}{W} (At the beginning of your upkeep, if this came under your control since the beginning of your last upkeep, sacrifice it unless you pay its echo cost.) When this creature enters, return target creature card from your graveyard to the battlefield.
j12	Judge Gift Cards 2012	2012-01-01	5	Sneak Attack	e7aee670-e6ac-4b3a-b3d1-7b7013db8f3d	covered		combat_support, cost_reduction, ramp, sacrifice_support	false		Covered by USG role audit.	Enchantment	{3}{R}	4	R	R			already reviewed	https://scryfall.com/card/j12/5/sneak-attack?utm_source=api	{R}: You may put a creature card from your hand onto the battlefield. That creature gains haste. Sacrifice the creature at the beginning of the next end step.
j12	Judge Gift Cards 2012	2012-01-01	6	Karakas	59119143-c0fa-49dd-adf0-e2fd3029c48b	covered	land_base, land_slot, mana_source, removal, tempo_removal	land_base, land_slot, mana_source, removal, tempo_removal	false		Covered by Legends role audit.	Legendary Land		0		W			already reviewed	https://scryfall.com/card/j12/6/karakas?utm_source=api	{T}: Add {W}. {T}: Return target legendary creature to its owner's hand.
j12	Judge Gift Cards 2012	2012-01-01	7	Sword of Light and Shadow	01c8a554-45a6-46ca-b40a-af0fd4529e40	covered		artifact_support, card_selection, combat_support, equipment_protection, hand_recursion, lifegain, protection, recursion, repeatable_advantage	false		Covered by PRM role audit.	Artifact — Equipment	{3}	3			Equip		already reviewed	https://scryfall.com/card/j12/7/sword-of-light-and-shadow?utm_source=api	Equipped creature gets +2/+2 and has protection from white and from black. Whenever equipped creature deals combat damage to a player, you gain 3 life and you may return up to one target creature card from your graveyard to your hand. Equip {2}
j12	Judge Gift Cards 2012	2012-01-01	8	Command Tower	0895c9b7-ae7d-4bb3-af17-3b75deb50a25	covered	land_base, land_slot, mana_source	land_base, land_slot, mana_source	false		Covered by Media and Collaboration Promos role audit.	Land		0					already reviewed	https://scryfall.com/card/j12/8/command-tower?utm_source=api	{T}: Add one mana of any color in your commander's color identity.
j12	Judge Gift Cards 2012	2012-01-01	9	Centaur	c41ea1cd-d87a-4e4c-b814-4c24c5bef511			combat_body				Token Creature — Centaur		0	G	G			verify analyzer roles	https://scryfall.com/card/j12/9/centaur?utm_source=api	
