setCode	setName	releasedAt	collectorNumber	name	oracleId	auditStatus	expectedRoles	actualAnalyzerRoles	needsCodeChange	tagDecision	manualNotes	typeLine	manaCost	manaValue	colors	colorIdentity	keywords	scryfallOracleTags	attentionHint	scryfallUrl	oracleText
j15	Judge Gift Cards 2015	2015-01-01	1	Temporal Manipulation	6b6ac99a-7548-4cad-9fe5-ea611618ab9e	covered		extra_turn, finisher	false		Covered by PRM role audit.	Sorcery	{3}{U}{U}	5	U	U			already reviewed	https://scryfall.com/card/j15/1/temporal-manipulation?utm_source=api	Take an extra turn after this one.
j15	Judge Gift Cards 2015	2015-01-01	2	Shardless Agent	2afbaa9a-c171-4a8b-90f3-5250d8498356	covered		card_selection, combat_body, cost_reduction, draw, repeatable_advantage, repeatable_draw, selection	false		Covered by PRM role audit.	Artifact Creature — Human Rogue	{1}{G}{U}	3	GU	GU	Cascade		already reviewed	https://scryfall.com/card/j15/2/shardless-agent?utm_source=api	Cascade (When you cast this spell, exile cards from the top of your library until you exile a nonland card that costs less. You may cast it without paying its mana cost. Put the exiled cards on the bottom in a random order.)
j15	Judge Gift Cards 2015	2015-01-01	3	Rishadan Port	f3e8dc56-2810-474e-a6a7-9c3555f94ae9	covered		land_base, land_slot, mana_source, removal, tempo_removal	false		Covered by MMQ role audit.	Land		0					already reviewed	https://scryfall.com/card/j15/3/rishadan-port?utm_source=api	{T}: Add {C}. {1}, {T}: Tap target land.
j15	Judge Gift Cards 2015	2015-01-01	4	Ravages of War	265236d1-d96c-4424-835e-a0fe91c41170	covered		hate_piece, land_denial, mass_land_denial, mass_removal, removal, stax_piece	false		Covered by PTK role audit.	Sorcery	{3}{W}	4	W	W			already reviewed	https://scryfall.com/card/j15/4/ravages-of-war?utm_source=api	Destroy all lands.
j15	Judge Gift Cards 2015	2015-01-01	5	Damnation	d57a8f0b-7989-4db5-8756-6f2690097252	covered		mass_removal, removal	false		Covered by PRM role audit.	Sorcery	{2}{B}{B}	4	B	B			already reviewed	https://scryfall.com/card/j15/5/damnation?utm_source=api	Destroy all creatures. They can't be regenerated.
j15	Judge Gift Cards 2015	2015-01-01	6	Dualcaster Mage	8eb7c0a5-6190-40de-b473-2d1daa3bbe28	covered		combat_body, copy_support	false		Covered by PRM role audit.	Creature — Human Wizard	{1}{R}{R}	3	R	R	Flash		already reviewed	https://scryfall.com/card/j15/6/dualcaster-mage?utm_source=api	Flash When this creature enters, copy target instant or sorcery spell. You may choose new targets for the copy.
j15	Judge Gift Cards 2015	2015-01-01	7	Feldon of the Third Path	be094704-5232-4b10-beeb-aa9bbfae063d	covered		battlefield_recursion, combat_body, copy_support, sacrifice_support, token_support	false		Covered by PRM role audit.	Legendary Creature — Human Artificer	{1}{R}{R}	3	R	R			already reviewed	https://scryfall.com/card/j15/7/feldon-of-the-third-path?utm_source=api	{2}{R}, {T}: Create a token that's a copy of target creature card in your graveyard, except it's an artifact in addition to its other types. It gains haste. Sacrifice it at the beginning of the next end step.
j15	Judge Gift Cards 2015	2015-01-01	8	Wasteland	09a70ae8-3859-4a09-901d-dce063fa3b5f	covered	land_base, land_denial, land_slot, mana_source, removal, sacrifice_support, targeted_land_removal, targeted_removal	land_base, land_denial, land_slot, mana_source, removal, sacrifice_support, targeted_land_removal, targeted_removal	false		Covered by Tempest role audit.	Land		0					already reviewed	https://scryfall.com/card/j15/8/wasteland?utm_source=api	{T}: Add {C}. {T}, Sacrifice this land: Destroy target nonbasic land.
