setCode	setName	releasedAt	collectorNumber	name	oracleId	auditStatus	expectedRoles	actualAnalyzerRoles	needsCodeChange	tagDecision	manualNotes	typeLine	manaCost	manaValue	colors	colorIdentity	keywords	scryfallOracleTags	attentionHint	scryfallUrl	oracleText
m13	Magic 2013	2012-07-13	214	Ring of Valkas	412f57e8-76af-4636-bab0-e0940300ee2e			artifact_support, combat_support, counter_support				Artifact — Equipment	{2}	2			Equip		verify analyzer roles	https://scryfall.com/card/m13/214/ring-of-valkas?utm_source=api	Equipped creature has haste. (It can attack and {T} no matter when it came under your control.) At the beginning of your upkeep, put a +1/+1 counter on equipped creature if it's red. Equip {1} ({1}: Attach to target creature you control. Equip only as a sorcery.)
m13	Magic 2013	2012-07-13	215	Ring of Xathrid	ceddad0d-94ad-459a-b109-f979ffc26283			artifact_support, counter_support, equipment_protection				Artifact — Equipment	{2}	2			Heal, Equip		verify analyzer roles	https://scryfall.com/card/m13/215/ring-of-xathrid?utm_source=api	{2}: Regenerate equipped creature. (The next time that creature would be destroyed this turn, instead tap it, remove it from combat, and heal all damage on it.) At the beginning of your upkeep, put a +1/+1 counter on equipped creature if it's black. Equip {1} ({1}: Attach to target creature you control. Equip only as a sorcery.)
m13	Magic 2013	2012-07-13	216	Sands of Delirium	c2cc67bf-59c5-4e06-93a3-dcaa1bf276ba			alternate_finisher, mill_support, scalable_spell				Artifact	{3}	3			Mill		verify analyzer roles	https://scryfall.com/card/m13/216/sands-of-delirium?utm_source=api	{X}, {T}: Target player mills X cards.
m13	Magic 2013	2012-07-13	217	Staff of Nin	48d9f488-4ebb-4fdb-a568-6930fc2f5416	covered		card_draw, direct_draw, draw, removal, repeatable_advantage, repeatable_draw, targeted_removal	false		Covered by PRM role audit.	Artifact	{6}	6					already reviewed	https://scryfall.com/card/m13/217/staff-of-nin?utm_source=api	At the beginning of your upkeep, draw a card. {T}: This artifact deals 1 damage to any target.
m13	Magic 2013	2012-07-13	218	Stuffy Doll	499dceab-1890-49c8-b35d-b059a1dc950f			combat_body, self_protection				Artifact Creature — Construct	{5}	5			Indestructible		verify analyzer roles	https://scryfall.com/card/m13/218/stuffy-doll?utm_source=api	Indestructible As this creature enters, choose a player. Whenever this creature is dealt damage, it deals that much damage to the chosen player. {T}: This creature deals 1 damage to itself.
m13	Magic 2013	2012-07-13	219	Tormod's Crypt	1573f7f9-672c-421a-b1ac-3d0d8aea59ca	covered	graveyard_hate, sacrifice_support	graveyard_hate, sacrifice_support	false		Covered by The Dark role audit.	Artifact	{0}	0					already reviewed	https://scryfall.com/card/m13/219/tormods-crypt?utm_source=api	{T}, Sacrifice this artifact: Exile target player's graveyard.
m13	Magic 2013	2012-07-13	220	Trading Post	63788566-e25a-44bb-bb55-197e1b93b3e8			card_draw, card_selection, direct_draw, draw, hand_recursion, lifegain, recursion, repeatable_advantage, sacrifice_support, token_support				Artifact	{4}	4					verify analyzer roles	https://scryfall.com/card/m13/220/trading-post?utm_source=api	{1}, {T}, Discard a card: You gain 4 life. {1}, {T}, Pay 1 life: Create a 0/1 white Goat creature token. {1}, {T}, Sacrifice a creature: Return target artifact card from your graveyard to your hand. {1}, {T}, Sacrifice an artifact: Draw a card.
m13	Magic 2013	2012-07-13	221	Cathedral of War	5ff647e4-730a-498f-8f2c-5bd64d5a9780	covered		burst_ramp, combat_support, land_base, land_slot, mana_source, ramp	false		Covered by PRM role audit.	Land		0			Exalted		already reviewed	https://scryfall.com/card/m13/221/cathedral-of-war?utm_source=api	This land enters tapped. Exalted (Whenever a creature you control attacks alone, that creature gets +1/+1 until end of turn.) {T}: Add {C}.
m13	Magic 2013	2012-07-13	222	Dragonskull Summit	63398c02-6fb1-481d-9d9f-81063532fbc0			land_base, land_slot, mana_source				Land		0		BR			verify analyzer roles	https://scryfall.com/card/m13/222/dragonskull-summit?utm_source=api	This land enters tapped unless you control a Swamp or a Mountain. {T}: Add {B} or {R}.
m13	Magic 2013	2012-07-13	223	Drowned Catacomb	819fc966-434e-470f-91e9-a38df974ad17			land_base, land_slot, mana_source				Land		0		BU			verify analyzer roles	https://scryfall.com/card/m13/223/drowned-catacomb?utm_source=api	This land enters tapped unless you control an Island or a Swamp. {T}: Add {U} or {B}.
m13	Magic 2013	2012-07-13	224	Evolving Wilds	a75445d3-1303-4bb5-89ad-26ea93fecd48	covered		land_acceleration, land_base, land_slot, land_tutor, mana_fixing, ramp, sacrifice_support, tutor	false		Covered by PRM role audit.	Land		0					already reviewed	https://scryfall.com/card/m13/224/evolving-wilds?utm_source=api	{T}, Sacrifice this land: Search your library for a basic land card, put it onto the battlefield tapped, then shuffle.
m13	Magic 2013	2012-07-13	225	Glacial Fortress	027dd013-baa7-4111-b3c9-f4d1414e9c45			land_base, land_slot, mana_source				Land		0		UW			verify analyzer roles	https://scryfall.com/card/m13/225/glacial-fortress?utm_source=api	This land enters tapped unless you control a Plains or an Island. {T}: Add {W} or {U}.
m13	Magic 2013	2012-07-13	226	Hellion Crucible	c238ef51-4b46-43d5-a70b-40270a96a1fd			combat_support, counter_support, land_base, land_slot, mana_source, sacrifice_support, token_support				Land		0		R			verify analyzer roles	https://scryfall.com/card/m13/226/hellion-crucible?utm_source=api	{T}: Add {C}. {1}{R}, {T}: Put a pressure counter on this land. {1}{R}, {T}, Remove two pressure counters from this land and sacrifice it: Create a 4/4 red Hellion creature token with haste. (It can attack and {T} as soon as it comes under your control.)
m13	Magic 2013	2012-07-13	227	Reliquary Tower	c23e5b80-08d2-4e24-9908-fe2aa4f30f6f	covered		hand_size, land_base, land_slot, mana_source	false		Covered by PRM role audit.	Land		0					already reviewed	https://scryfall.com/card/m13/227/reliquary-tower?utm_source=api	You have no maximum hand size. {T}: Add {C}.
m13	Magic 2013	2012-07-13	228	Rootbound Crag	9516c4c1-d72d-434f-97e1-6a862434a169			land_base, land_slot, mana_source				Land		0		GR			verify analyzer roles	https://scryfall.com/card/m13/228/rootbound-crag?utm_source=api	This land enters tapped unless you control a Mountain or a Forest. {T}: Add {R} or {G}.
m13	Magic 2013	2012-07-13	229	Sunpetal Grove	402ec768-76fb-474e-ae74-babc90d833c4			land_base, land_slot, mana_source				Land		0		GW			verify analyzer roles	https://scryfall.com/card/m13/229/sunpetal-grove?utm_source=api	This land enters tapped unless you control a Forest or a Plains. {T}: Add {G} or {W}.
m13	Magic 2013	2012-07-13	230	Plains	bc71ebf6-2056-41f7-be35-b2e5c34afa99	covered	basic_land, land_base, land_slot, mana_source	basic_land, land_base, land_slot, mana_source	false		Covered by Ice Age role audit.	Basic Land — Plains		0		W			already reviewed	https://scryfall.com/card/m13/230/plains?utm_source=api	({T}: Add {W}.)
m13	Magic 2013	2012-07-13	234	Island	b2c6aa39-2d2a-459c-a555-fb48ba993373	covered	basic_land, land_base, land_slot, mana_source	basic_land, land_base, land_slot, mana_source	false		Covered by Ice Age role audit.	Basic Land — Island		0		U			already reviewed	https://scryfall.com/card/m13/234/island?utm_source=api	({T}: Add {U}.)
m13	Magic 2013	2012-07-13	238	Swamp	56719f6a-1a6c-4c0a-8d21-18f7d7350b68	covered	basic_land, land_base, land_slot, mana_source	basic_land, land_base, land_slot, mana_source	false		Covered by Ice Age role audit.	Basic Land — Swamp		0		B			already reviewed	https://scryfall.com/card/m13/238/swamp?utm_source=api	({T}: Add {B}.)
m13	Magic 2013	2012-07-13	242	Mountain	a3fb7228-e76b-4e96-a40e-20b5fed75685	covered	basic_land, land_base, land_slot, mana_source	basic_land, land_base, land_slot, mana_source	false		Covered by Arabian Nights role audit.	Basic Land — Mountain		0		R			already reviewed	https://scryfall.com/card/m13/242/mountain?utm_source=api	({T}: Add {R}.)
m13	Magic 2013	2012-07-13	246	Forest	b34bb2dc-c1af-4d77-b0b3-a0fb342a5fc6	covered	basic_land, land_base, land_slot, mana_source	basic_land, land_base, land_slot, mana_source	false		Covered by Ice Age role audit.	Basic Land — Forest		0		G			already reviewed	https://scryfall.com/card/m13/246/forest?utm_source=api	({T}: Add {G}.)
