setCode	setName	releasedAt	collectorNumber	name	oracleId	auditStatus	expectedRoles	actualAnalyzerRoles	needsCodeChange	tagDecision	manualNotes	typeLine	manaCost	manaValue	colors	colorIdentity	keywords	scryfallOracleTags	attentionHint	scryfallUrl	oracleText
m13	Magic 2013	2012-07-13	1	Ajani, Caller of the Pride	1d5ff280-7f4d-4801-aefd-9b6e6b1f2818			combat_support, counter_support, scalable_spell, token_support				Legendary Planeswalker — Ajani	{1}{W}{W}	3	W	W			verify analyzer roles	https://scryfall.com/card/m13/1/ajani-caller-of-the-pride?utm_source=api	+1: Put a +1/+1 counter on up to one target creature. −3: Target creature gains flying and double strike until end of turn. −8: Create X 2/2 white Cat creature tokens, where X is your life total.
m13	Magic 2013	2012-07-13	2	Ajani's Sunstriker	31009c45-afba-45f4-a6ca-9dfdb9990e72			combat_body, combat_threat, lifegain				Creature — Cat Cleric	{W}{W}	2	W	W	Lifelink		verify analyzer roles	https://scryfall.com/card/m13/2/ajanis-sunstriker?utm_source=api	Lifelink (Damage dealt by this creature also causes you to gain that much life.)
m13	Magic 2013	2012-07-13	3	Angel's Mercy	6b232bb7-d372-4174-a049-5f8d620810e6			lifegain				Instant	{2}{W}{W}	4	W	W			verify analyzer roles	https://scryfall.com/card/m13/3/angels-mercy?utm_source=api	You gain 7 life.
m13	Magic 2013	2012-07-13	4	Angelic Benediction	6b19377c-f178-49cb-95f8-fd3451acc7cf			combat_support, removal, tempo_removal				Enchantment	{3}{W}	4	W	W	Exalted		verify analyzer roles	https://scryfall.com/card/m13/4/angelic-benediction?utm_source=api	Exalted (Whenever a creature you control attacks alone, that creature gets +1/+1 until end of turn.) Whenever a creature you control attacks alone, you may tap target creature.
m13	Magic 2013	2012-07-13	5	Attended Knight	b3eb8f65-5eba-42a9-a1b4-4f37b14d03d9			combat_body, combat_threat, token_support				Creature — Human Knight	{2}{W}	3	W	W	First strike		verify analyzer roles	https://scryfall.com/card/m13/5/attended-knight?utm_source=api	First strike When this creature enters, create a 1/1 white Soldier creature token.
m13	Magic 2013	2012-07-13	6	Aven Squire	01518a87-6b16-4b7b-805d-b652404c6356			combat_body, combat_support, combat_threat				Creature — Bird Soldier	{1}{W}	2	W	W	Flying, Exalted		verify analyzer roles	https://scryfall.com/card/m13/6/aven-squire?utm_source=api	Flying Exalted (Whenever a creature you control attacks alone, that creature gets +1/+1 until end of turn.)
m13	Magic 2013	2012-07-13	7	Battleflight Eagle	f36e316d-c0ad-414d-8cf0-b1c9ea779e03			combat_body, combat_support, combat_threat				Creature — Bird	{4}{W}	5	W	W	Flying		verify analyzer roles	https://scryfall.com/card/m13/7/battleflight-eagle?utm_source=api	Flying When this creature enters, target creature gets +2/+2 and gains flying until end of turn.
m13	Magic 2013	2012-07-13	8	Captain of the Watch	9f2af06d-8fb7-4276-bb92-3559a6d1fa18			combat_body, combat_support, combat_threat, token_support				Creature — Human Soldier	{4}{W}{W}	6	W	W	Vigilance		verify analyzer roles	https://scryfall.com/card/m13/8/captain-of-the-watch?utm_source=api	Vigilance (Attacking doesn't cause this creature to tap.) Other Soldier creatures you control get +1/+1 and have vigilance. When this creature enters, create three 1/1 white Soldier creature tokens.
m13	Magic 2013	2012-07-13	9	Captain's Call	46418fe4-065c-4dfa-b796-eee02c14f351			token_support				Sorcery	{3}{W}	4	W	W			verify analyzer roles	https://scryfall.com/card/m13/9/captains-call?utm_source=api	Create three 1/1 white Soldier creature tokens.
m13	Magic 2013	2012-07-13	10	Crusader of Odric	ea384b0d-3091-4d50-b15f-1f6763647b7c			combat_body, combat_support				Creature — Human Soldier	{2}{W}	3	W	W			verify analyzer roles	https://scryfall.com/card/m13/10/crusader-of-odric?utm_source=api	Crusader of Odric's power and toughness are each equal to the number of creatures you control.
m13	Magic 2013	2012-07-13	11	Divine Favor	bffa18c3-642c-4239-b425-238599007976			combat_support, lifegain				Enchantment — Aura	{1}{W}	2	W	W	Enchant		verify analyzer roles	https://scryfall.com/card/m13/11/divine-favor?utm_source=api	Enchant creature When this Aura enters, you gain 3 life. Enchanted creature gets +1/+3.
m13	Magic 2013	2012-07-13	12	Divine Verdict	3070f997-24f2-471d-af96-a2f3b588198e			removal, targeted_removal				Instant	{3}{W}	4	W	W			verify analyzer roles	https://scryfall.com/card/m13/12/divine-verdict?utm_source=api	Destroy target attacking or blocking creature.
m13	Magic 2013	2012-07-13	13	Erase	c2ceb15c-5d02-4cf4-a7c9-c1a40b7ca667	covered		removal, targeted_removal	false		Covered by ULG role audit.	Instant	{W}	1	W	W			already reviewed	https://scryfall.com/card/m13/13/erase?utm_source=api	Exile target enchantment.
m13	Magic 2013	2012-07-13	14	Faith's Reward	2fbb6703-3517-4117-9ca4-45e90a6216ce			mass_recursion				Instant	{3}{W}	4	W	W			verify analyzer roles	https://scryfall.com/card/m13/14/faiths-reward?utm_source=api	Return to the battlefield all permanent cards in your graveyard that were put there from the battlefield this turn.
m13	Magic 2013	2012-07-13	15	Glorious Charge	754d5009-7887-4293-b554-b3decddb33f7			combat_support				Instant	{1}{W}	2	W	W			verify analyzer roles	https://scryfall.com/card/m13/15/glorious-charge?utm_source=api	Creatures you control get +1/+1 until end of turn.
m13	Magic 2013	2012-07-13	16	Griffin Protector	2d91cf05-fc39-4d76-8c95-62738b57e0a0			combat_body, combat_support, combat_threat				Creature — Griffin	{3}{W}	4	W	W	Flying		verify analyzer roles	https://scryfall.com/card/m13/16/griffin-protector?utm_source=api	Flying Whenever another creature you control enters, this creature gets +1/+1 until end of turn.
m13	Magic 2013	2012-07-13	17	Guardian Lions	9291f31d-6953-4fe1-9a88-b8dd09fde89c			combat_body, combat_threat				Creature — Cat	{4}{W}	5	W	W	Vigilance		verify analyzer roles	https://scryfall.com/card/m13/17/guardian-lions?utm_source=api	Vigilance (Attacking doesn't cause this creature to tap.)
m13	Magic 2013	2012-07-13	18	Guardians of Akrasa	7ef8df9f-3fab-44fd-b5a9-f57e54dbc38e			combat_body, combat_support				Creature — Human Soldier	{2}{W}	3	W	W	Exalted, Defender		verify analyzer roles	https://scryfall.com/card/m13/18/guardians-of-akrasa?utm_source=api	Defender (This creature can't attack.) Exalted (Whenever a creature you control attacks alone, that creature gets +1/+1 until end of turn.)
m13	Magic 2013	2012-07-13	19	Healer of the Pride	69b9fa68-b409-4de1-9a40-5262386a0180			combat_body, lifegain				Creature — Cat Cleric	{3}{W}	4	W	W			verify analyzer roles	https://scryfall.com/card/m13/19/healer-of-the-pride?utm_source=api	Whenever another creature you control enters, you gain 2 life.
m13	Magic 2013	2012-07-13	20	Intrepid Hero	63c1dfcc-9d47-4dee-b4e6-1f50e716cf9e	covered		combat_body, removal, targeted_removal	false		Covered by USG role audit.	Creature — Human Soldier	{2}{W}	3	W	W			already reviewed	https://scryfall.com/card/m13/20/intrepid-hero?utm_source=api	{T}: Destroy target creature with power 4 or greater.
m13	Magic 2013	2012-07-13	21	Knight of Glory	10b8fd4d-1696-4b0d-b791-7bd3de504457			combat_body, combat_support, self_protection				Creature — Human Knight	{1}{W}	2	W	W	Exalted, Protection		verify analyzer roles	https://scryfall.com/card/m13/21/knight-of-glory?utm_source=api	Protection from black (This creature can't be blocked, targeted, dealt damage, or enchanted by anything black.) Exalted (Whenever a creature you control attacks alone, that creature gets +1/+1 until end of turn.)
m13	Magic 2013	2012-07-13	22	Oblivion Ring	bd9b9772-f5f9-4c6b-913e-7193bea5d0a7	covered		targeted_removal	false		Covered by PRM role audit.	Enchantment	{2}{W}	3	W	W			already reviewed	https://scryfall.com/card/m13/22/oblivion-ring?utm_source=api	When this enchantment enters, exile another target nonland permanent. When this enchantment leaves the battlefield, return the exiled card to the battlefield under its owner's control.
m13	Magic 2013	2012-07-13	23	Odric, Master Tactician	ade898df-14a5-460b-94f6-1f3f74d3ff95			combat_body, combat_support, combat_threat				Legendary Creature — Human Soldier	{2}{W}{W}	4	W	W	First strike		verify analyzer roles	https://scryfall.com/card/m13/23/odric-master-tactician?utm_source=api	First strike (This creature deals combat damage before creatures without first strike.) Whenever Odric and at least three other creatures attack, you choose which creatures block this combat and how those creatures block.
m13	Magic 2013	2012-07-13	24	Pacifism	5f5e0b10-c8cf-450c-bfd3-bcb0528ec330	covered	combat_support, removal, targeted_removal	combat_support, removal, targeted_removal	false		Covered by Mirage role audit.	Enchantment — Aura	{1}{W}	2	W	W	Enchant		already reviewed	https://scryfall.com/card/m13/24/pacifism?utm_source=api	Enchant creature Enchanted creature can't attack or block.
m13	Magic 2013	2012-07-13	25	Pillarfield Ox	0f7c70c4-9795-4c76-8b27-043942a963c6			combat_body				Creature — Ox	{3}{W}	4	W	W			verify analyzer roles	https://scryfall.com/card/m13/25/pillarfield-ox?utm_source=api	
m13	Magic 2013	2012-07-13	26	Planar Cleansing	a98c2d81-4add-4292-bbdd-e1b69ff936d4			mass_removal, removal				Sorcery	{3}{W}{W}{W}	6	W	W			verify analyzer roles	https://scryfall.com/card/m13/26/planar-cleansing?utm_source=api	Destroy all nonland permanents.
m13	Magic 2013	2012-07-13	27	Prized Elephant	4b1674b1-2176-493f-a463-936e715d51a2			combat_body, combat_support				Creature — Elephant	{3}{W}	4	W	GW			verify analyzer roles	https://scryfall.com/card/m13/27/prized-elephant?utm_source=api	This creature gets +1/+1 as long as you control a Forest. {G}: This creature gains trample until end of turn. (It can deal excess combat damage to the player or planeswalker it's attacking.)
m13	Magic 2013	2012-07-13	28	Rain of Blades	c7d398a4-0eb3-43cc-9952-35f3b791aa7a	covered		mass_removal, removal	false		Covered by SCG role audit.	Instant	{W}	1	W	W			already reviewed	https://scryfall.com/card/m13/28/rain-of-blades?utm_source=api	Rain of Blades deals 1 damage to each attacking creature.
m13	Magic 2013	2012-07-13	29	Rhox Faithmender	2abe9303-d498-4aad-b6b2-8b5064bd2ffd			combat_body, combat_threat, lifegain, multiplier_support, replacement_engine				Creature — Rhino Monk	{3}{W}	4	W	W	Lifelink		verify analyzer roles	https://scryfall.com/card/m13/29/rhox-faithmender?utm_source=api	Lifelink (Damage dealt by this creature also causes you to gain that much life.) If you would gain life, you gain twice that much life instead.
m13	Magic 2013	2012-07-13	30	Safe Passage	dfa459a1-b065-4488-88d3-4da388261b52			broad_protection, protection				Instant	{2}{W}	3	W	W			verify analyzer roles	https://scryfall.com/card/m13/30/safe-passage?utm_source=api	Prevent all damage that would be dealt to you and creatures you control this turn.
m13	Magic 2013	2012-07-13	31	Serra Angel	4b7ac066-e5c7-43e6-9e7e-2739b24a905d	covered	combat_body, combat_threat	combat_body, combat_threat	false		Covered by ATH role audit.	Creature — Angel	{3}{W}{W}	5	W	W	Flying, Vigilance		already reviewed	https://scryfall.com/card/m13/31/serra-angel?utm_source=api	Flying Vigilance (Attacking doesn't cause this creature to tap.)
m13	Magic 2013	2012-07-13	32	Serra Avatar	c363725f-15cf-4955-aaf1-536b1f8daaed	covered		combat_body, combat_support	false		Covered by USG role audit.	Creature — Avatar	{4}{W}{W}{W}	7	W	W			already reviewed	https://scryfall.com/card/m13/32/serra-avatar?utm_source=api	Serra Avatar's power and toughness are each equal to your life total. When Serra Avatar is put into a graveyard from anywhere, shuffle it into its owner's library.
m13	Magic 2013	2012-07-13	33	Serra Avenger	b91b65b3-b35c-460e-a49b-333000a9a519	covered		combat_body, combat_threat, hate_piece, stax_piece	false		Covered by PRM role audit.	Creature — Angel	{W}{W}	2	W	W	Flying, Vigilance		already reviewed	https://scryfall.com/card/m13/33/serra-avenger?utm_source=api	You can't cast Serra Avenger during your first, second, or third turns of the game. Flying, vigilance
m13	Magic 2013	2012-07-13	34	Show of Valor	9645c1cb-2305-4bc0-89d0-a50815e91573			combat_support				Instant	{1}{W}	2	W	W			verify analyzer roles	https://scryfall.com/card/m13/34/show-of-valor?utm_source=api	Target creature gets +2/+4 until end of turn.
m13	Magic 2013	2012-07-13	35	Silvercoat Lion	e3c0b11e-7340-4e0a-98b7-91b38439d4f9			combat_body				Creature — Cat	{1}{W}	2	W	W			verify analyzer roles	https://scryfall.com/card/m13/35/silvercoat-lion?utm_source=api	
m13	Magic 2013	2012-07-13	36	Sublime Archangel	b5479c97-df19-49c7-b305-7a0336fd1cb3			combat_body, combat_support, combat_threat				Creature — Angel	{2}{W}{W}	4	W	W	Flying, Exalted		verify analyzer roles	https://scryfall.com/card/m13/36/sublime-archangel?utm_source=api	Flying Exalted (Whenever a creature you control attacks alone, that creature gets +1/+1 until end of turn.) Other creatures you control have exalted. (If a creature has multiple instances of exalted, each triggers separately.)
m13	Magic 2013	2012-07-13	37	Touch of the Eternal	23ecb4bb-b295-46f5-9fd8-a4c66ce80c23							Enchantment	{5}{W}{W}	7	W	W			manual review	https://scryfall.com/card/m13/37/touch-of-the-eternal?utm_source=api	At the beginning of your upkeep, count the number of permanents you control. Your life total becomes that number.
m13	Magic 2013	2012-07-13	38	War Falcon	406bccb6-6602-4486-a556-e0b550650253			combat_body, combat_support, combat_threat				Creature — Bird	{W}	1	W	W	Flying		verify analyzer roles	https://scryfall.com/card/m13/38/war-falcon?utm_source=api	Flying This creature can't attack unless you control a Knight or a Soldier.
m13	Magic 2013	2012-07-13	39	War Priest of Thune	2e44fd5c-5c7f-4ca8-90cd-34015047eb26			combat_body, removal, targeted_removal				Creature — Human Cleric	{1}{W}	2	W	W			verify analyzer roles	https://scryfall.com/card/m13/39/war-priest-of-thune?utm_source=api	When this creature enters, you may destroy target enchantment.
m13	Magic 2013	2012-07-13	40	Warclamp Mastiff	8bd301ea-32f0-4c3a-a215-c04b31fbdc7c			combat_body, combat_support, combat_threat				Creature — Dog	{W}	1	W	W	First strike		verify analyzer roles	https://scryfall.com/card/m13/40/warclamp-mastiff?utm_source=api	First strike (This creature deals combat damage before creatures without first strike.)
m13	Magic 2013	2012-07-13	41	Archaeomancer	a91a3266-cadd-47a0-9b20-160307f14c07			card_selection, combat_body, hand_recursion, recursion				Creature — Human Wizard	{2}{U}{U}	4	U	U			verify analyzer roles	https://scryfall.com/card/m13/41/archaeomancer?utm_source=api	When this creature enters, return target instant or sorcery card from your graveyard to your hand.
m13	Magic 2013	2012-07-13	42	Arctic Aven	616cb1be-074a-46c2-b8f1-6b9f15b7bc23			combat_body, combat_support, combat_threat, lifegain				Creature — Bird Wizard	{2}{U}	3	U	UW	Flying		verify analyzer roles	https://scryfall.com/card/m13/42/arctic-aven?utm_source=api	Flying This creature gets +1/+1 as long as you control a Plains. {W}: This creature gains lifelink until end of turn. (Damage dealt by this creature also causes you to gain that much life.)
m13	Magic 2013	2012-07-13	43	Augur of Bolas	be5d6779-ecc9-44b9-8c4d-97a243059d55			card_selection, combat_body, selection				Creature — Merfolk Wizard	{1}{U}	2	U	U			verify analyzer roles	https://scryfall.com/card/m13/43/augur-of-bolas?utm_source=api	When this creature enters, look at the top three cards of your library. You may reveal an instant or sorcery card from among them and put it into your hand. Put the rest on the bottom of your library in any order.
m13	Magic 2013	2012-07-13	44	Battle of Wits	9b544415-841d-4038-841b-efb0cede5c24	covered		alternate_finisher, finisher, repeatable_finisher	false		Covered by ODY role audit.	Enchantment	{3}{U}{U}	5	U	U			already reviewed	https://scryfall.com/card/m13/44/battle-of-wits?utm_source=api	At the beginning of your upkeep, if you have 200 or more cards in your library, you win the game.
m13	Magic 2013	2012-07-13	45	Clone	42226b87-0746-4ebf-9fd0-108d508462af	covered	combat_body, copy_support	combat_body, copy_support	false		Covered by ONS role audit.	Creature — Shapeshifter	{3}{U}	4	U	U			already reviewed	https://scryfall.com/card/m13/45/clone?utm_source=api	You may have this creature enter as a copy of any creature on the battlefield.
m13	Magic 2013	2012-07-13	46	Courtly Provocateur	3752277a-5b3c-4902-90a1-63acdac66dc9			combat_body, combat_support				Creature — Human Wizard	{2}{U}	3	U	U			verify analyzer roles	https://scryfall.com/card/m13/46/courtly-provocateur?utm_source=api	{T}: Target creature attacks this turn if able. {T}: Target creature blocks this turn if able.
m13	Magic 2013	2012-07-13	47	Divination	273b339c-964b-4a18-8eb5-ceb8abcdfd9e			card_draw, direct_draw, draw				Sorcery	{2}{U}	3	U	U			verify analyzer roles	https://scryfall.com/card/m13/47/divination?utm_source=api	Draw two cards.
m13	Magic 2013	2012-07-13	48	Downpour	78eb5fb1-cb91-4300-9056-4225a416aec0			removal, tempo_removal				Instant	{1}{U}	2	U	U			verify analyzer roles	https://scryfall.com/card/m13/48/downpour?utm_source=api	Tap up to three target creatures.
m13	Magic 2013	2012-07-13	49	Encrust	2e056743-78ff-45b6-80df-7486d52d5df6							Enchantment — Aura	{1}{U}{U}	3	U	U	Enchant		has Scryfall tags/keywords but no analyzer role	https://scryfall.com/card/m13/49/encrust?utm_source=api	Enchant artifact or creature Enchanted permanent doesn't untap during its controller's untap step and its activated abilities can't be activated.
m13	Magic 2013	2012-07-13	50	Essence Scatter	46665089-aa3d-44c3-964d-6638dfbb5782			hard_stack, stack				Instant	{1}{U}	2	U	U			verify analyzer roles	https://scryfall.com/card/m13/50/essence-scatter?utm_source=api	Counter target creature spell.
m13	Magic 2013	2012-07-13	51	Faerie Invaders	df7580fb-4c37-4c09-8785-e320cb124621			combat_body, combat_threat, replacement_engine, tempo_support				Creature — Faerie Rogue	{4}{U}	5	U	U	Flying, Flash		verify analyzer roles	https://scryfall.com/card/m13/51/faerie-invaders?utm_source=api	Flash (You may cast this spell any time you could cast an instant.) Flying
m13	Magic 2013	2012-07-13	52	Fog Bank	3a2bb47d-228d-499e-a34b-9e10d99e9b2c	covered		combat_body, combat_support, combat_threat	false		Covered by USG role audit.	Creature — Wall	{1}{U}	2	U	U	Flying, Defender		already reviewed	https://scryfall.com/card/m13/52/fog-bank?utm_source=api	Defender (This creature can't attack.) Flying Prevent all combat damage that would be dealt to and dealt by this creature.
m13	Magic 2013	2012-07-13	53	Harbor Serpent	599fb8b1-8750-4832-869a-cddc3784087a			combat_body, combat_support, landwalk_support				Creature — Serpent	{4}{U}{U}	6	U	U	Landwalk, Islandwalk		verify analyzer roles	https://scryfall.com/card/m13/53/harbor-serpent?utm_source=api	Islandwalk (This creature can't be blocked as long as defending player controls an Island.) This creature can't attack unless there are five or more Islands on the battlefield.
m13	Magic 2013	2012-07-13	54	Hydrosurge	4c2059d5-9a2e-4b89-a617-9125eb0cd570			targeted_removal				Instant	{U}	1	U	U			verify analyzer roles	https://scryfall.com/card/m13/54/hydrosurge?utm_source=api	Target creature gets -5/-0 until end of turn.
m13	Magic 2013	2012-07-13	55	Index	613b824e-39d1-4c6e-a19c-c915abdc860b	covered		card_selection, selection	false		Covered by APC role audit.	Sorcery	{U}	1	U	U			already reviewed	https://scryfall.com/card/m13/55/index?utm_source=api	Look at the top five cards of your library, then put them back in any order.
m13	Magic 2013	2012-07-13	56	Jace, Memory Adept	4a4dc133-541f-456b-a95f-3d707e1c95e9	covered	card_draw, direct_draw, draw, mill_support, repeatable_advantage	card_draw, direct_draw, draw, mill_support, repeatable_advantage	false		Covered by Media and Collaboration Promos role audit.	Legendary Planeswalker — Jace	{3}{U}{U}	5	U	U	Mill		already reviewed	https://scryfall.com/card/m13/56/jace-memory-adept?utm_source=api	+1: Draw a card. Target player mills a card. 0: Target player mills ten cards. −7: Any number of target players each draw twenty cards.
m13	Magic 2013	2012-07-13	57	Jace's Phantasm	ab56df8f-0ba3-4d66-bde2-4c9b4acf07e5			combat_body, combat_support, combat_threat				Creature — Illusion	{U}	1	U	U	Flying		verify analyzer roles	https://scryfall.com/card/m13/57/jaces-phantasm?utm_source=api	Flying This creature gets +4/+4 as long as an opponent has ten or more cards in their graveyard.
m13	Magic 2013	2012-07-13	58	Kraken Hatchling	08e6c786-d553-4c23-9137-cfad84146739			combat_body				Creature — Kraken	{U}	1	U	U			verify analyzer roles	https://scryfall.com/card/m13/58/kraken-hatchling?utm_source=api	
m13	Magic 2013	2012-07-13	59	Master of the Pearl Trident	9f6ea9fe-eee5-4dca-a34e-c66d3e218716			combat_body, combat_support, landwalk_support				Creature — Merfolk	{U}{U}	2	U	U			verify analyzer roles	https://scryfall.com/card/m13/59/master-of-the-pearl-trident?utm_source=api	Other Merfolk creatures you control get +1/+1 and have islandwalk. (They can't be blocked as long as defending player controls an Island.)
m13	Magic 2013	2012-07-13	60	Merfolk of the Pearl Trident	218d9277-c179-4de3-9c7f-79b5a6d4fa38	covered	combat_body	combat_body	false		Covered by 6ED role audit.	Creature — Merfolk	{U}	1	U	U			already reviewed	https://scryfall.com/card/m13/60/merfolk-of-the-pearl-trident?utm_source=api	
m13	Magic 2013	2012-07-13	61	Mind Sculpt	4d8592d7-2e36-4a7a-be9e-7c8f512d5f62			mill_support				Sorcery	{1}{U}	2	U	U	Mill		verify analyzer roles	https://scryfall.com/card/m13/61/mind-sculpt?utm_source=api	Target opponent mills seven cards.
m13	Magic 2013	2012-07-13	62	Negate	3407fe41-fdd3-4119-8f70-4bc4590a379f	covered		hard_stack, stack	false		Covered by PRM role audit.	Instant	{1}{U}	2	U	U			already reviewed	https://scryfall.com/card/m13/62/negate?utm_source=api	Counter target noncreature spell.
m13	Magic 2013	2012-07-13	63	Omniscience	730e39e6-c61d-48b5-8827-bfd952bf1be7							Enchantment	{7}{U}{U}{U}	10	U	U			manual review	https://scryfall.com/card/m13/63/omniscience?utm_source=api	You may cast spells from your hand without paying their mana costs.
m13	Magic 2013	2012-07-13	64	Redirect	74a7d880-5a49-412b-af4d-0b4cdb8453ee							Instant	{U}{U}	2	U	U			manual review	https://scryfall.com/card/m13/64/redirect?utm_source=api	You may choose new targets for target spell.
m13	Magic 2013	2012-07-13	65	Rewind	bb27bfdf-fe8d-45bd-ad62-8118dce06eda	covered		hard_stack, stack	false		Covered by USG role audit.	Instant	{2}{U}{U}	4	U	U			already reviewed	https://scryfall.com/card/m13/65/rewind?utm_source=api	Counter target spell. Untap up to four lands.
m13	Magic 2013	2012-07-13	66	Scroll Thief	637c5583-4683-4ae4-8b4e-f5da42a772c7			card_draw, combat_body, combat_support, direct_draw, draw, repeatable_advantage, repeatable_draw				Creature — Merfolk Rogue	{2}{U}	3	U	U			verify analyzer roles	https://scryfall.com/card/m13/66/scroll-thief?utm_source=api	Whenever this creature deals combat damage to a player, draw a card.
m13	Magic 2013	2012-07-13	67	Sleep	9b93ff69-f195-4d72-8e1d-574c3e53bca8			combat_support				Sorcery	{2}{U}{U}	4	U	U			verify analyzer roles	https://scryfall.com/card/m13/67/sleep?utm_source=api	Tap all creatures target player controls. Those creatures don't untap during that player's next untap step.
m13	Magic 2013	2012-07-13	68	Spelltwine	307e68e0-5095-474c-af02-bfcb2e463763	covered		copy_support	false		Covered by PRM role audit.	Sorcery	{5}{U}	6	U	U			already reviewed	https://scryfall.com/card/m13/68/spelltwine?utm_source=api	Exile target instant or sorcery card from your graveyard and target instant or sorcery card from an opponent's graveyard. Copy those cards. Cast the copies if able without paying their mana costs. Exile Spelltwine.
m13	Magic 2013	2012-07-13	69	Sphinx of Uthuun	4b4f268d-34ae-416d-a412-66f4fe37659c			card_selection, combat_body, combat_threat				Creature — Sphinx	{5}{U}{U}	7	U	U	Flying		verify analyzer roles	https://scryfall.com/card/m13/69/sphinx-of-uthuun?utm_source=api	Flying When this creature enters, reveal the top five cards of your library. An opponent separates those cards into two piles. Put one pile into your hand and the other into your graveyard.
m13	Magic 2013	2012-07-13	70	Stormtide Leviathan	131a7475-0b9e-46eb-9ade-fef1b9820184			combat_body, combat_support, landwalk_support				Creature — Leviathan	{5}{U}{U}{U}	8	U	U	Landwalk, Islandwalk		verify analyzer roles	https://scryfall.com/card/m13/70/stormtide-leviathan?utm_source=api	Islandwalk (This creature can't be blocked as long as defending player controls an Island.) All lands are Islands in addition to their other types. Creatures without flying or islandwalk can't attack.
m13	Magic 2013	2012-07-13	71	Switcheroo	68227969-39cf-42cf-b3b8-cf8a04647d7e			donation_support, removal, tempo_removal, theft_support				Sorcery	{4}{U}	5	U	U			verify analyzer roles	https://scryfall.com/card/m13/71/switcheroo?utm_source=api	Exchange control of two target creatures.
m13	Magic 2013	2012-07-13	72	Talrand, Sky Summoner	ea1eb902-a23c-44ff-9169-19baf71de238			combat_body, copy_support, spellslinger, token_support				Legendary Creature — Merfolk Wizard	{2}{U}{U}	4	U	U			verify analyzer roles	https://scryfall.com/card/m13/72/talrand-sky-summoner?utm_source=api	Whenever you cast an instant or sorcery spell, create a 2/2 blue Drake creature token with flying.
m13	Magic 2013	2012-07-13	73	Talrand's Invocation	43355ac4-bf8c-48f6-a322-fafbc9d132d1			token_support				Sorcery	{2}{U}{U}	4	U	U			verify analyzer roles	https://scryfall.com/card/m13/73/talrands-invocation?utm_source=api	Create two 2/2 blue Drake creature tokens with flying.
m13	Magic 2013	2012-07-13	74	Tricks of the Trade	9fd288d6-445e-4605-b206-aab43e300dde			combat_support				Enchantment — Aura	{3}{U}	4	U	U	Enchant		verify analyzer roles	https://scryfall.com/card/m13/74/tricks-of-the-trade?utm_source=api	Enchant creature Enchanted creature gets +2/+0 and can't be blocked.
