setCode	setName	releasedAt	collectorNumber	name	oracleId	auditStatus	expectedRoles	actualAnalyzerRoles	needsCodeChange	tagDecision	manualNotes	typeLine	manaCost	manaValue	colors	colorIdentity	keywords	scryfallOracleTags	attentionHint	scryfallUrl	oracleText
m13	Magic 2013	2012-07-13	145	Reverberate	a1f55890-31c5-4ed4-a2cd-7a4a9f05f8ca			copy_support				Instant	{R}{R}	2	R	R			verify analyzer roles	https://scryfall.com/card/m13/145/reverberate?utm_source=api	Copy target instant or sorcery spell. You may choose new targets for the copy.
m13	Magic 2013	2012-07-13	146	Rummaging Goblin	2055eb91-ee36-4752-a6dc-581eaef335c8			card_draw, combat_body, direct_draw, draw, repeatable_advantage, selection				Creature — Goblin Rogue	{2}{R}	3	R	R			verify analyzer roles	https://scryfall.com/card/m13/146/rummaging-goblin?utm_source=api	{T}, Discard a card: Draw a card.
m13	Magic 2013	2012-07-13	147	Searing Spear	aafd44c1-74a9-4aa7-a4a2-67eb39a07478	covered		removal, targeted_removal	false		Covered by PRM role audit.	Instant	{1}{R}	2	R	R			already reviewed	https://scryfall.com/card/m13/147/searing-spear?utm_source=api	Searing Spear deals 3 damage to any target.
m13	Magic 2013	2012-07-13	148	Slumbering Dragon	d424cab6-84be-4e55-8f4e-af11b1c50ede			combat_body, combat_support, combat_threat, counter_support				Creature — Dragon	{R}	1	R	R	Flying		verify analyzer roles	https://scryfall.com/card/m13/148/slumbering-dragon?utm_source=api	Flying This creature can't attack or block unless it has five or more +1/+1 counters on it. Whenever a creature attacks you or a planeswalker you control, put a +1/+1 counter on this creature.
m13	Magic 2013	2012-07-13	149	Smelt	b5f4b732-099c-46e7-a03d-d8e4c78245b8			removal, targeted_removal				Instant	{R}	1	R	R			verify analyzer roles	https://scryfall.com/card/m13/149/smelt?utm_source=api	Destroy target artifact.
m13	Magic 2013	2012-07-13	150	Thundermaw Hellkite	e958144e-01bc-46ff-8f56-ddf2eb098630			combat_body, combat_support, combat_threat, mass_removal, removal				Creature — Dragon	{3}{R}{R}	5	R	R	Flying, Haste		verify analyzer roles	https://scryfall.com/card/m13/150/thundermaw-hellkite?utm_source=api	Flying Haste (This creature can attack and {T} as soon as it comes under your control.) When this creature enters, it deals 1 damage to each creature with flying your opponents control. Tap those creatures.
m13	Magic 2013	2012-07-13	151	Torch Fiend	15f8049c-f21d-4cd0-aa81-1a533936cf77			combat_body, removal, sacrifice_support, targeted_removal				Creature — Devil	{1}{R}	2	R	R			verify analyzer roles	https://scryfall.com/card/m13/151/torch-fiend?utm_source=api	{R}, Sacrifice this creature: Destroy target artifact.
m13	Magic 2013	2012-07-13	152	Trumpet Blast	d3b408e7-4d39-47a3-b00c-846903f8ae77	covered		combat_support	false		Covered by UDS role audit.	Instant	{2}{R}	3	R	R			already reviewed	https://scryfall.com/card/m13/152/trumpet-blast?utm_source=api	Attacking creatures get +2/+0 until end of turn.
m13	Magic 2013	2012-07-13	153	Turn to Slag	4339f621-8502-4433-a37a-654591ca1b43			removal, targeted_removal				Sorcery	{3}{R}{R}	5	R	R			verify analyzer roles	https://scryfall.com/card/m13/153/turn-to-slag?utm_source=api	Turn to Slag deals 5 damage to target creature. Destroy all Equipment attached to that creature.
m13	Magic 2013	2012-07-13	154	Volcanic Geyser	846a4f9c-d955-403f-8a08-5c7c3d32e180	covered	direct_finisher, finisher, mana_sink, removal, scalable_spell, targeted_removal	direct_finisher, finisher, mana_sink, removal, scalable_spell, targeted_removal	false		Covered by Mirage role audit.	Instant	{X}{R}{R}	2	R	R			already reviewed	https://scryfall.com/card/m13/154/volcanic-geyser?utm_source=api	Volcanic Geyser deals X damage to any target.
m13	Magic 2013	2012-07-13	155	Volcanic Strength	7c60b7bd-06cc-487f-ba42-b382ac429b12			combat_support, landwalk_support				Enchantment — Aura	{1}{R}	2	R	R	Enchant		verify analyzer roles	https://scryfall.com/card/m13/155/volcanic-strength?utm_source=api	Enchant creature Enchanted creature gets +2/+2 and has mountainwalk. (It can't be blocked as long as defending player controls a Mountain.)
m13	Magic 2013	2012-07-13	156	Wall of Fire	f38c8b47-e8e0-4d2f-b1da-d8d986805a48	covered	combat_body, combat_support	combat_body, combat_support	false		Covered by 6ED role audit.	Creature — Wall	{1}{R}{R}	3	R	R	Defender		already reviewed	https://scryfall.com/card/m13/156/wall-of-fire?utm_source=api	Defender (This creature can't attack.) {R}: This creature gets +1/+0 until end of turn.
m13	Magic 2013	2012-07-13	157	Wild Guess	a05ab59e-680a-4050-aecb-56ee69dcd13f			card_draw, direct_draw, draw				Sorcery	{R}{R}	2	R	R			verify analyzer roles	https://scryfall.com/card/m13/157/wild-guess?utm_source=api	As an additional cost to cast this spell, discard a card. Draw two cards.
m13	Magic 2013	2012-07-13	158	Worldfire	ae0b8c13-0a71-4a60-bf9f-6e2da9503e9c			mass_removal, removal				Sorcery	{6}{R}{R}{R}	9	R	R			verify analyzer roles	https://scryfall.com/card/m13/158/worldfire?utm_source=api	Exile all permanents. Exile all cards from all hands and graveyards. Each player's life total becomes 1.
m13	Magic 2013	2012-07-13	159	Acidic Slime	21f45043-5419-4019-8b6c-e5294bd5f549	covered		combat_body, combat_threat, removal, targeted_removal	false		Covered by PRM role audit.	Creature — Ooze	{3}{G}{G}	5	G	G	Deathtouch		already reviewed	https://scryfall.com/card/m13/159/acidic-slime?utm_source=api	Deathtouch (Any amount of damage this deals to a creature is enough to destroy it.) When this creature enters, destroy target artifact, enchantment, or land.
m13	Magic 2013	2012-07-13	160	Arbor Elf	4567a528-75f0-4ea6-b927-3a500caf76ac			combat_body, stable_ramp				Creature — Elf Druid	{G}	1	G	G			verify analyzer roles	https://scryfall.com/card/m13/160/arbor-elf?utm_source=api	{T}: Untap target Forest.
m13	Magic 2013	2012-07-13	161	Bond Beetle	9353f6dd-9a08-4e55-9b07-3e68d7d97ef4			combat_body, counter_support				Creature — Insect	{G}	1	G	G			verify analyzer roles	https://scryfall.com/card/m13/161/bond-beetle?utm_source=api	When this creature enters, put a +1/+1 counter on target creature.
m13	Magic 2013	2012-07-13	162	Boundless Realms	e6acafb7-856f-4125-a908-a620635b8ba3			land_acceleration, land_tutor, mana_fixing, ramp, scalable_spell, tutor				Sorcery	{6}{G}	7	G	G			verify analyzer roles	https://scryfall.com/card/m13/162/boundless-realms?utm_source=api	Search your library for up to X basic land cards, where X is the number of lands you control, put them onto the battlefield tapped, then shuffle.
m13	Magic 2013	2012-07-13	163	Bountiful Harvest	2dc94a25-4e35-4277-8eba-b8d0b293ff7b			lifegain				Sorcery	{4}{G}	5	G	G			verify analyzer roles	https://scryfall.com/card/m13/163/bountiful-harvest?utm_source=api	You gain 1 life for each land you control.
m13	Magic 2013	2012-07-13	164	Centaur Courser	2f5bf099-2e01-4e1c-9ebf-0ce0ac66939e			combat_body				Creature — Centaur Warrior	{2}{G}	3	G	G			verify analyzer roles	https://scryfall.com/card/m13/164/centaur-courser?utm_source=api	
m13	Magic 2013	2012-07-13	165	Deadly Recluse	6b941291-1802-4ced-9869-39fa43825550			combat_body, combat_threat				Creature — Spider	{1}{G}	2	G	G	Reach, Deathtouch		verify analyzer roles	https://scryfall.com/card/m13/165/deadly-recluse?utm_source=api	Reach (This creature can block creatures with flying.) Deathtouch (Any amount of damage this deals to a creature is enough to destroy it.)
m13	Magic 2013	2012-07-13	166	Duskdale Wurm	aba4e290-b597-4c93-b3dd-745ca45ad72d			combat_body, combat_support, combat_threat				Creature — Wurm	{5}{G}{G}	7	G	G	Trample		verify analyzer roles	https://scryfall.com/card/m13/166/duskdale-wurm?utm_source=api	Trample (This creature can deal excess combat damage to the player or planeswalker it's attacking.)
m13	Magic 2013	2012-07-13	167	Elderscale Wurm	1e81454a-ce30-4e41-9d09-3256ae30efc2			combat_body, combat_threat, replacement_engine				Creature — Wurm	{4}{G}{G}{G}	7	G	G	Trample		verify analyzer roles	https://scryfall.com/card/m13/167/elderscale-wurm?utm_source=api	Trample When this creature enters, if your life total is less than 7, your life total becomes 7. As long as you have 7 or more life, damage that would reduce your life total to less than 7 reduces it to 7 instead.
m13	Magic 2013	2012-07-13	168	Elvish Archdruid	6e2c2423-d854-4478-99e6-64f29851f026			combat_body, combat_support, ramp, stable_ramp				Creature — Elf Druid	{1}{G}{G}	3	G	G			verify analyzer roles	https://scryfall.com/card/m13/168/elvish-archdruid?utm_source=api	Other Elf creatures you control get +1/+1. {T}: Add {G} for each Elf you control.
m13	Magic 2013	2012-07-13	169	Elvish Visionary	c6a3a882-a127-4590-93d7-679ef4313efe	covered		card_draw, combat_body, direct_draw, draw	false		Covered by PRM role audit.	Creature — Elf Shaman	{1}{G}	2	G	G			already reviewed	https://scryfall.com/card/m13/169/elvish-visionary?utm_source=api	When this creature enters, draw a card.
m13	Magic 2013	2012-07-13	170	Farseek	495e52e6-4c2b-4574-9474-eadbdcc8b4ac	covered		land_acceleration, land_tutor, mana_fixing, ramp, tutor	false		Covered by PRM role audit.	Sorcery	{1}{G}	2	G	G			already reviewed	https://scryfall.com/card/m13/170/farseek?utm_source=api	Search your library for a Plains, Island, Swamp, or Mountain card, put it onto the battlefield tapped, then shuffle.
m13	Magic 2013	2012-07-13	171	Flinthoof Boar	acb58839-2b26-4724-9e9b-b49b8217b13f			combat_body, combat_support				Creature — Boar	{1}{G}	2	G	GR			verify analyzer roles	https://scryfall.com/card/m13/171/flinthoof-boar?utm_source=api	This creature gets +1/+1 as long as you control a Mountain. {R}: This creature gains haste until end of turn. (It can attack and {T} this turn.)
m13	Magic 2013	2012-07-13	172	Fog	27e9db49-7af7-4bef-ad4c-bf5dfb92030d	covered	broad_protection, combat_support, protection	broad_protection, combat_support, protection	false		Covered by Mirage role audit.	Instant	{G}	1	G	G			already reviewed	https://scryfall.com/card/m13/172/fog?utm_source=api	Prevent all combat damage that would be dealt this turn.
m13	Magic 2013	2012-07-13	173	Fungal Sprouting	303d4533-0c6b-4f93-80e8-b1f5926f4cd4			combat_support, scalable_spell, token_support				Sorcery	{3}{G}	4	G	G			verify analyzer roles	https://scryfall.com/card/m13/173/fungal-sprouting?utm_source=api	Create X 1/1 green Saproling creature tokens, where X is the greatest power among creatures you control.
m13	Magic 2013	2012-07-13	174	Garruk, Primal Hunter	298a7e1a-b254-442e-bc1d-2a3e5296d849			card_draw, direct_draw, draw, repeatable_advantage, token_support				Legendary Planeswalker — Garruk	{2}{G}{G}{G}	5	G	G			verify analyzer roles	https://scryfall.com/card/m13/174/garruk-primal-hunter?utm_source=api	+1: Create a 3/3 green Beast creature token. −3: Draw cards equal to the greatest power among creatures you control. −6: Create a 6/6 green Wurm creature token for each land you control.
m13	Magic 2013	2012-07-13	175	Garruk's Packleader	13279222-422d-4447-9451-2463b0c714c6			card_draw, combat_body, direct_draw, draw, repeatable_advantage, repeatable_draw				Creature — Beast	{4}{G}	5	G	G			verify analyzer roles	https://scryfall.com/card/m13/175/garruks-packleader?utm_source=api	Whenever another creature you control with power 3 or greater enters, you may draw a card.
m13	Magic 2013	2012-07-13	176	Ground Seal	13f6f960-ef79-4f2c-8874-90fe9e77099e	covered		card_draw, direct_draw, draw, graveyard_hate	false		Covered by ODY role audit.	Enchantment	{1}{G}	2	G	G			already reviewed	https://scryfall.com/card/m13/176/ground-seal?utm_source=api	When this enchantment enters, draw a card. Cards in graveyards can't be the targets of spells or abilities.
m13	Magic 2013	2012-07-13	177	Mwonvuli Beast Tracker	b6265654-84c3-469b-9afa-f752fd64abe0	covered		combat_body, combat_threat, restricted_tutor, self_protection, tutor	false		Covered by PRM role audit.	Creature — Human Scout	{1}{G}{G}	3	G	G	Reach, Hexproof		already reviewed	https://scryfall.com/card/m13/177/mwonvuli-beast-tracker?utm_source=api	When this creature enters, search your library for a creature card with deathtouch, hexproof, reach, or trample and reveal it. Shuffle and put that card on top.
m13	Magic 2013	2012-07-13	178	Naturalize	bdb3ca68-ec1f-4e16-81cc-d23f8f52c728	covered		removal, targeted_removal	false		Covered by ONS role audit.	Instant	{1}{G}	2	G	G			already reviewed	https://scryfall.com/card/m13/178/naturalize?utm_source=api	Destroy target artifact or enchantment.
m13	Magic 2013	2012-07-13	179	Plummet	85bde6ac-3dd4-4946-8b57-24f57e3eae2b			removal, targeted_removal				Instant	{1}{G}	2	G	G			verify analyzer roles	https://scryfall.com/card/m13/179/plummet?utm_source=api	Destroy target creature with flying.
m13	Magic 2013	2012-07-13	180	Predatory Rampage	ee6d271c-0728-4080-85bb-a6af05f8b213			combat_support				Sorcery	{3}{G}{G}	5	G	G			verify analyzer roles	https://scryfall.com/card/m13/180/predatory-rampage?utm_source=api	Creatures you control get +3/+3 until end of turn. Each creature your opponents control blocks this turn if able.
m13	Magic 2013	2012-07-13	181	Prey Upon	b3c12848-528d-4005-878f-4f950a07240a							Sorcery	{G}	1	G	G	Fight		has Scryfall tags/keywords but no analyzer role	https://scryfall.com/card/m13/181/prey-upon?utm_source=api	Target creature you control fights target creature you don't control. (Each deals damage equal to its power to the other.)
m13	Magic 2013	2012-07-13	182	Primal Huntbeast	44350127-f6b6-458f-8f2f-e57a78d83303			combat_body, self_protection				Creature — Beast	{3}{G}	4	G	G	Hexproof		verify analyzer roles	https://scryfall.com/card/m13/182/primal-huntbeast?utm_source=api	Hexproof (This creature can't be the target of spells or abilities your opponents control.)
m13	Magic 2013	2012-07-13	183	Primordial Hydra	1c36ed3a-c806-47e5-83f9-e44999c67fe5			combat_body, combat_support, counter_support, mana_sink, multiplier_support, replacement_engine, scalable_spell				Creature — Hydra	{X}{G}{G}	2	G	G	Double		verify analyzer roles	https://scryfall.com/card/m13/183/primordial-hydra?utm_source=api	This creature enters with X +1/+1 counters on it. At the beginning of your upkeep, double the number of +1/+1 counters on this creature. This creature has trample as long as it has ten or more +1/+1 counters on it.
m13	Magic 2013	2012-07-13	184	Quirion Dryad	f42b6510-7322-4733-85ea-7ae6bd6ca8fc	covered		combat_body, counter_support	false		Covered by PLS role audit.	Creature — Dryad	{1}{G}	2	G	G			already reviewed	https://scryfall.com/card/m13/184/quirion-dryad?utm_source=api	Whenever you cast a spell that's white, blue, black, or red, put a +1/+1 counter on this creature.
m13	Magic 2013	2012-07-13	185	Rancor	9d2d6479-531c-4ce1-b52b-00e36fa63b64	covered		combat_support	false		Covered by ULG role audit.	Enchantment — Aura	{G}	1	G	G	Enchant		already reviewed	https://scryfall.com/card/m13/185/rancor?utm_source=api	Enchant creature Enchanted creature gets +2/+0 and has trample. When this Aura is put into a graveyard from the battlefield, return it to its owner's hand.
m13	Magic 2013	2012-07-13	186	Ranger's Path	259a023a-de55-4bab-9e24-01aebcf716eb			land_acceleration, land_tutor, mana_fixing, ramp, tutor				Sorcery	{3}{G}	4	G	G			verify analyzer roles	https://scryfall.com/card/m13/186/rangers-path?utm_source=api	Search your library for up to two Forest cards, put them onto the battlefield tapped, then shuffle.
m13	Magic 2013	2012-07-13	187	Revive	51991d28-137e-4690-a674-d852b904bd1a	covered		card_selection, hand_recursion, recursion	false		Covered by MMQ role audit.	Sorcery	{1}{G}	2	G	G			already reviewed	https://scryfall.com/card/m13/187/revive?utm_source=api	Return target green card from your graveyard to your hand.
m13	Magic 2013	2012-07-13	188	Roaring Primadox	2a098296-6a64-48ba-af40-5b68bae06bec			combat_body				Creature — Beast	{3}{G}	4	G	G			verify analyzer roles	https://scryfall.com/card/m13/188/roaring-primadox?utm_source=api	At the beginning of your upkeep, return a creature you control to its owner's hand.
m13	Magic 2013	2012-07-13	189	Sentinel Spider	a37c9b13-dc45-4b55-a63d-5314abde7aab			combat_body, combat_threat				Creature — Spider	{3}{G}{G}	5	G	G	Reach, Vigilance		verify analyzer roles	https://scryfall.com/card/m13/189/sentinel-spider?utm_source=api	Vigilance, reach
m13	Magic 2013	2012-07-13	190	Serpent's Gift	b75fb789-6a78-4d23-b872-7627b478fb6f			combat_support				Instant	{2}{G}	3	G	G			verify analyzer roles	https://scryfall.com/card/m13/190/serpents-gift?utm_source=api	Target creature gains deathtouch until end of turn. (Any amount of damage it deals to a creature is enough to destroy it.)
m13	Magic 2013	2012-07-13	191	Silklash Spider	2d0c73da-ed8c-44fc-abd9-7c344b1f890d	covered		combat_body, combat_threat, mass_removal, removal, scalable_spell	false		Covered by ONS role audit.	Creature — Spider	{3}{G}{G}	5	G	G	Reach		already reviewed	https://scryfall.com/card/m13/191/silklash-spider?utm_source=api	Reach {X}{G}{G}: This creature deals X damage to each creature with flying.
m13	Magic 2013	2012-07-13	192	Spiked Baloth	e873b9c2-1346-4f36-aa48-da58112792db			combat_body, combat_support, combat_threat				Creature — Beast	{3}{G}	4	G	G	Trample		verify analyzer roles	https://scryfall.com/card/m13/192/spiked-baloth?utm_source=api	Trample (This creature can deal excess combat damage to the player or planeswalker it's attacking.)
m13	Magic 2013	2012-07-13	193	Thragtusk	0dd0e91a-d16b-4718-8d11-1a3fcf8e0753			combat_body, lifegain, token_support				Creature — Beast	{4}{G}	5	G	G			verify analyzer roles	https://scryfall.com/card/m13/193/thragtusk?utm_source=api	When this creature enters, you gain 5 life. When this creature leaves the battlefield, create a 3/3 green Beast creature token.
m13	Magic 2013	2012-07-13	194	Timberpack Wolf	c9375dca-2b32-4185-b88a-4bd5dde9a5d6			combat_body, combat_support				Creature — Wolf	{1}{G}	2	G	G			verify analyzer roles	https://scryfall.com/card/m13/194/timberpack-wolf?utm_source=api	This creature gets +1/+1 for each other creature you control named Timberpack Wolf.
m13	Magic 2013	2012-07-13	195	Titanic Growth	61e09dd9-7870-48c2-9177-d6abc3162692			combat_support				Instant	{1}{G}	2	G	G			verify analyzer roles	https://scryfall.com/card/m13/195/titanic-growth?utm_source=api	Target creature gets +4/+4 until end of turn.
m13	Magic 2013	2012-07-13	196	Vastwood Gorger	a17a86a3-9f9c-4e09-93e6-e543a70733bc			combat_body				Creature — Wurm	{5}{G}	6	G	G			verify analyzer roles	https://scryfall.com/card/m13/196/vastwood-gorger?utm_source=api	
m13	Magic 2013	2012-07-13	197	Yeva, Nature's Herald	2d513c3e-bd27-479e-af32-7f66d96d0de0			combat_body, replacement_engine, tempo_support				Legendary Creature — Elf Shaman	{2}{G}{G}	4	G	G	Flash		verify analyzer roles	https://scryfall.com/card/m13/197/yeva-natures-herald?utm_source=api	Flash (You may cast this spell any time you could cast an instant.) You may cast green creature spells as though they had flash.
m13	Magic 2013	2012-07-13	198	Yeva's Forcemage	785e451d-87b6-4772-97e5-d2744818e0fd			combat_body, combat_support				Creature — Elf Shaman	{2}{G}	3	G	G			verify analyzer roles	https://scryfall.com/card/m13/198/yevas-forcemage?utm_source=api	When this creature enters, target creature gets +2/+2 until end of turn.
m13	Magic 2013	2012-07-13	199	Nicol Bolas, Planeswalker	05e9b55e-6329-48ec-b7d7-24c6b9692244	covered	removal, targeted_removal, tempo_removal, theft_support	removal, targeted_removal, tempo_removal, theft_support	false		Covered by Media and Collaboration Promos role audit.	Legendary Planeswalker — Bolas	{4}{U}{B}{B}{R}	8	BRU	BRU			already reviewed	https://scryfall.com/card/m13/199/nicol-bolas-planeswalker?utm_source=api	+3: Destroy target noncreature permanent. −2: Gain control of target creature. −9: Nicol Bolas deals 7 damage to target player or planeswalker. That player or that planeswalker's controller discards seven cards, then sacrifices seven permanents of their choice.
m13	Magic 2013	2012-07-13	200	Akroma's Memorial	967e8b3f-8266-4d9a-a38b-d0e10184e1e4			broad_protection, combat_support, self_protection				Legendary Artifact	{7}	7					verify analyzer roles	https://scryfall.com/card/m13/200/akromas-memorial?utm_source=api	Creatures you control have flying, first strike, vigilance, trample, haste, and protection from black and from red.
m13	Magic 2013	2012-07-13	201	Chronomaton	610f25b0-770f-457a-b0eb-6deb832f71d4			combat_body, counter_support				Artifact Creature — Golem	{1}	1					verify analyzer roles	https://scryfall.com/card/m13/201/chronomaton?utm_source=api	{1}, {T}: Put a +1/+1 counter on this creature.
m13	Magic 2013	2012-07-13	202	Clock of Omens	5d0f4665-aa10-4251-b590-129b59274fb3			artifact_support, tap_untap, tempo_support				Artifact	{4}	4					verify analyzer roles	https://scryfall.com/card/m13/202/clock-of-omens?utm_source=api	Tap two untapped artifacts you control: Untap target artifact.
m13	Magic 2013	2012-07-13	203	Door to Nothingness	b919cca5-88c0-4104-b54e-49644fbf78a5			alternate_finisher, finisher, sacrifice_support				Artifact	{5}	5		BGRUW			verify analyzer roles	https://scryfall.com/card/m13/203/door-to-nothingness?utm_source=api	This artifact enters tapped. {W}{W}{U}{U}{B}{B}{R}{R}{G}{G}, {T}, Sacrifice this artifact: Target player loses the game.
m13	Magic 2013	2012-07-13	204	Elixir of Immortality	204b71fc-4d5f-40dd-903d-56c733171d84			lifegain				Artifact	{1}	1					verify analyzer roles	https://scryfall.com/card/m13/204/elixir-of-immortality?utm_source=api	{2}, {T}: You gain 5 life. Shuffle this artifact and your graveyard into their owner's library.
m13	Magic 2013	2012-07-13	205	Gem of Becoming	6b1e4940-11ac-4d85-98f4-3f50d1060b96			land_acceleration, land_tutor, mana_fixing, repeatable_tutor, sacrifice_support, tutor				Artifact	{3}	3					verify analyzer roles	https://scryfall.com/card/m13/205/gem-of-becoming?utm_source=api	{3}, {T}, Sacrifice this artifact: Search your library for an Island card, a Swamp card, and a Mountain card. Reveal those cards, put them into your hand, then shuffle.
m13	Magic 2013	2012-07-13	206	Gilded Lotus	9a02a9a7-39d9-4763-85d3-747a0540b60b			ramp, stable_ramp				Artifact	{5}	5					verify analyzer roles	https://scryfall.com/card/m13/206/gilded-lotus?utm_source=api	{T}: Add three mana of any one color.
m13	Magic 2013	2012-07-13	207	Jayemdae Tome	39ee576a-0803-4063-9c84-f2b537e4d44c	covered	card_draw, direct_draw, draw, repeatable_advantage, repeatable_draw	card_draw, direct_draw, draw, repeatable_advantage, repeatable_draw	false		Covered by 6ED role audit.	Artifact — Book	{4}	4					already reviewed	https://scryfall.com/card/m13/207/jayemdae-tome?utm_source=api	{4}, {T}: Draw a card.
m13	Magic 2013	2012-07-13	208	Kitesail	b079f9db-974d-4525-a894-57b754ba9dcc			artifact_support, combat_support				Artifact — Equipment	{2}	2			Equip		verify analyzer roles	https://scryfall.com/card/m13/208/kitesail?utm_source=api	Equipped creature gets +1/+0 and has flying. Equip {2} ({2}: Attach to target creature you control. Equip only as a sorcery.)
m13	Magic 2013	2012-07-13	209	Phyrexian Hulk	a16509da-ad46-4ee3-86f3-06c521c23481	covered	combat_body	combat_body	false		Covered by Tempest role audit.	Artifact Creature — Phyrexian Golem	{6}	6					already reviewed	https://scryfall.com/card/m13/209/phyrexian-hulk?utm_source=api	
m13	Magic 2013	2012-07-13	210	Primal Clay	dccf2ca8-8c87-41c9-8373-351859396d05	covered	combat_body, combat_support	combat_body, combat_support	false		Covered by Antiquities role audit.	Artifact Creature — Shapeshifter	{4}	4					already reviewed	https://scryfall.com/card/m13/210/primal-clay?utm_source=api	As this creature enters, it becomes your choice of a 3/3 artifact creature, a 2/2 artifact creature with flying, or a 1/6 Wall artifact creature with defender in addition to its other types. (A creature with defender can't attack.)
m13	Magic 2013	2012-07-13	211	Ring of Evos Isle	4548f379-2647-4446-9e56-e7ef0662793a			artifact_support, counter_support, equipment_protection, protection, self_protection				Artifact — Equipment	{2}	2			Equip		verify analyzer roles	https://scryfall.com/card/m13/211/ring-of-evos-isle?utm_source=api	{2}: Equipped creature gains hexproof until end of turn. (It can't be the target of spells or abilities your opponents control.) At the beginning of your upkeep, put a +1/+1 counter on equipped creature if it's blue. Equip {1} ({1}: Attach to target creature you control. Equip only as a sorcery.)
m13	Magic 2013	2012-07-13	212	Ring of Kalonia	d4344e5e-148b-4df9-88e4-ca91afcc32e0			artifact_support, combat_support, counter_support				Artifact — Equipment	{2}	2			Equip		verify analyzer roles	https://scryfall.com/card/m13/212/ring-of-kalonia?utm_source=api	Equipped creature has trample. (It can deal excess combat damage to the player or planeswalker it's attacking.) At the beginning of your upkeep, put a +1/+1 counter on equipped creature if it's green. Equip {1} ({1}: Attach to target creature you control. Equip only as a sorcery.)
m13	Magic 2013	2012-07-13	213	Ring of Thune	f72e8ccb-a6fb-4161-bfa1-69c94cc5d49a			artifact_support, combat_support, counter_support				Artifact — Equipment	{2}	2			Equip		verify analyzer roles	https://scryfall.com/card/m13/213/ring-of-thune?utm_source=api	Equipped creature has vigilance. (Attacking doesn't cause it to tap.) At the beginning of your upkeep, put a +1/+1 counter on equipped creature if it's white. Equip {1} ({1}: Attach to target creature you control. Equip only as a sorcery.)
