setCode	setName	releasedAt	collectorNumber	name	oracleId	auditStatus	expectedRoles	actualAnalyzerRoles	needsCodeChange	tagDecision	manualNotes	typeLine	manaCost	manaValue	colors	colorIdentity	keywords	scryfallOracleTags	attentionHint	scryfallUrl	oracleText
oc20	Commander 2020 Oversized	2020-04-17	7	Gavi, Nest Warden	716a3bb8-04bd-41f5-a568-131f175e00a6			combat_body, token_support				Legendary Creature — Human Shaman	{2}{U}{R}{W}	5	RUW	RUW			verify analyzer roles	https://scryfall.com/card/oc20/7/gavi-nest-warden?utm_source=api	You may pay {0} rather than pay the cycling cost of the first card you cycle each turn. Whenever you draw your second card each turn, create a 2/2 red and white Dinosaur Cat creature token.
oc20	Commander 2020 Oversized	2020-04-17	8	Jirina Kudro	b122bf99-b003-452a-a854-b25597ff7ca2			combat_body, combat_support, token_support				Legendary Creature — Human Soldier	{1}{R}{W}{B}	4	BRW	BRW			verify analyzer roles	https://scryfall.com/card/oc20/8/jirina-kudro?utm_source=api	When Jirina Kudro enters, create a 1/1 white Human Soldier creature token for each time you've cast a commander from the command zone this game. Other Humans you control get +2/+0.
oc20	Commander 2020 Oversized	2020-04-17	9	Kalamax, the Stormsire	b8501a37-23e4-4873-80cb-d1c0f6c95155			combat_body, copy_support, counter_support				Legendary Creature — Elemental Dinosaur	{1}{G}{U}{R}	4	GRU	GRU			verify analyzer roles	https://scryfall.com/card/oc20/9/kalamax-the-stormsire?utm_source=api	Whenever you cast your first instant spell each turn, if Kalamax is tapped, copy that spell. You may choose new targets for the copy. Whenever you copy an instant spell, put a +1/+1 counter on Kalamax.
oc20	Commander 2020 Oversized	2020-04-17	10	Kathril, Aspect Warper	730897a9-3ead-4990-9492-1a2040d8ccac			combat_body, combat_support, counter_support, lifegain, self_protection				Legendary Creature — Nightmare Insect	{2}{W}{B}{G}	5	BGW	BGW			verify analyzer roles	https://scryfall.com/card/oc20/10/kathril-aspect-warper?utm_source=api	When Kathril enters, put a flying counter on any creature you control if a creature card in your graveyard has flying. Repeat this process for first strike, double strike, deathtouch, hexproof, indestructible, lifelink, menace, reach, trample, and vigilance. Then put a +1/+1 counter on Kathril for each counter put on a creature this way.
oc20	Commander 2020 Oversized	2020-04-17	12	Otrimi, the Ever-Playful	c5054364-2a19-4b70-869b-94d48b7b12c0			card_selection, combat_body, combat_support, combat_threat, hand_recursion, recursion, repeatable_advantage				Legendary Creature — Nightmare Beast	{3}{B}{G}{U}	6	BGU	BGU	Mutate, Trample		verify analyzer roles	https://scryfall.com/card/oc20/12/otrimi-the-ever-playful?utm_source=api	Mutate {1}{B}{G}{U} (If you cast this spell for its mutate cost, put it over or under target non-Human creature you own. They mutate into the creature on top plus all abilities from under it.) Trample Whenever this creature deals combat damage to a player, return target creature card with mutate from your graveyard to your hand.
