setCode	setName	releasedAt	collectorNumber	name	oracleId	auditStatus	expectedRoles	actualAnalyzerRoles	needsCodeChange	tagDecision	manualNotes	typeLine	manaCost	manaValue	colors	colorIdentity	keywords	scryfallOracleTags	attentionHint	scryfallUrl	oracleText
pfdn	Foundations Promos	2024-11-15	1	Sol Ring	6ad8011d-3471-4369-9d68-b264cc027487	covered	ramp, stable_ramp	ramp, stable_ramp	false		Covered by PRM role audit.	Artifact	{1}	1					already reviewed	https://scryfall.com/card/pfdn/1/sol-ring?utm_source=api	{T}: Add {C}{C}.
pfdn	Foundations Promos	2024-11-15	1p	Sire of Seven Deaths	a15547d0-bbcb-41ee-a9ae-8325a9e7fe1f	covered	combat_body, combat_threat, lifegain, self_protection	combat_body, combat_threat, lifegain, self_protection	false		Analyzer roles accepted during batch clean pass.	Creature — Eldrazi	{7}	7			Lifelink, Reach, Vigilance, First strike, Trample, Menace, Ward		verify analyzer roles	https://scryfall.com/card/pfdn/1p/sire-of-seven-deaths?utm_source=api	First strike, vigilance Menace, trample Reach, lifelink Ward—Pay 7 life.
pfdn	Foundations Promos	2024-11-15	2s	Arahbo, the First Fang	dfec65a0-6fb6-463d-aa62-e84a427db217	covered	combat_body, combat_support, token_support	combat_body, combat_support, token_support	false		Analyzer roles accepted during batch clean pass.	Legendary Creature — Cat Avatar	{2}{W}	3	W	W			verify analyzer roles	https://scryfall.com/card/pfdn/2s/arahbo-the-first-fang?utm_source=api	Other Cats you control get +1/+1. Whenever Arahbo or another nontoken Cat you control enters, create a 1/1 white Cat creature token.
pfdn	Foundations Promos	2024-11-15	5s	Celestial Armor	4f1b68d7-7d16-4bb1-af5f-f1708b23ca73	covered	artifact_support, combat_support, replacement_engine, self_protection, tempo_support	artifact_support, combat_support, replacement_engine, self_protection, tempo_support	false		Analyzer roles accepted during batch clean pass.	Artifact — Equipment	{2}{W}	3	W	W	Equip, Flash		verify analyzer roles	https://scryfall.com/card/pfdn/5s/celestial-armor?utm_source=api	Flash (You may cast this spell any time you could cast an instant.) When this Equipment enters, attach it to target creature you control. That creature gains hexproof and indestructible until end of turn. Equipped creature gets +2/+0 and has flying. Equip {3}{W} ({3}{W}: Attach to target creature you control. Equip only as a sorcery.)
pfdn	Foundations Promos	2024-11-15	7p	Crystal Barricade	291c7abf-9d64-4ba0-ae21-e3459edc9a95	covered	broad_protection, combat_body, combat_support, protection, self_protection	broad_protection, combat_body, combat_support, protection, self_protection	false		Analyzer roles accepted during batch clean pass.	Artifact Creature — Wall	{1}{W}	2	W	W	Defender		verify analyzer roles	https://scryfall.com/card/pfdn/7p/crystal-barricade?utm_source=api	Defender (This creature can't attack.) You have hexproof. (You can't be the target of spells or abilities your opponents control.) Prevent all noncombat damage that would be dealt to other creatures you control.
pfdn	Foundations Promos	2024-11-15	11p	Exemplar of Light	9ad730b5-8950-4215-9319-387e2970dd22	covered	card_draw, combat_body, combat_threat, counter_support, direct_draw, draw, lifegain, repeatable_advantage, repeatable_draw	card_draw, combat_body, combat_threat, counter_support, direct_draw, draw, lifegain, repeatable_advantage, repeatable_draw	false		Analyzer roles accepted during batch clean pass.	Creature — Angel	{2}{W}{W}	4	W	W	Flying		verify analyzer roles	https://scryfall.com/card/pfdn/11p/exemplar-of-light?utm_source=api	Flying Whenever you gain life, put a +1/+1 counter on this creature. Whenever you put one or more +1/+1 counters on this creature, draw a card. This ability triggers only once each turn.
pfdn	Foundations Promos	2024-11-15	17s	Herald of Eternal Dawn	4080f7e3-06d3-4d3d-9929-4e826cb66713	covered	broad_protection, combat_body, combat_threat, protection, replacement_engine, tempo_support	broad_protection, combat_body, combat_threat, protection, replacement_engine, tempo_support	false		Analyzer roles accepted during batch clean pass.	Creature — Angel	{4}{W}{W}{W}	7	W	W	Flying, Flash		verify analyzer roles	https://scryfall.com/card/pfdn/17s/herald-of-eternal-dawn?utm_source=api	Flash (You may cast this spell any time you could cast an instant.) Flying You can't lose the game and your opponents can't win the game.
pfdn	Foundations Promos	2024-11-15	22s	Raise the Past	a69a24d0-ca58-4a44-8af1-a3bd1608d2f9	covered	card_selection, mass_recursion, recursion	card_selection, mass_recursion, recursion	false		Analyzer roles accepted during batch clean pass.	Sorcery	{2}{W}{W}	4	W	W			verify analyzer roles	https://scryfall.com/card/pfdn/22s/raise-the-past?utm_source=api	Return all creature cards with mana value 2 or less from your graveyard to the battlefield.
pfdn	Foundations Promos	2024-11-15	23s	Skyknight Squire	7e497f6b-69e1-4fab-bb04-f687c99a8310	covered	combat_body, combat_support, counter_support	combat_body, combat_support, counter_support	false		Analyzer roles accepted during batch clean pass.	Creature — Cat Scout	{1}{W}	2	W	W			verify analyzer roles	https://scryfall.com/card/pfdn/23s/skyknight-squire?utm_source=api	Whenever another creature you control enters, put a +1/+1 counter on this creature. As long as this creature has three or more +1/+1 counters on it, it has flying and is a Knight in addition to its other types.
pfdn	Foundations Promos	2024-11-15	27s	Valkyrie's Call	27400927-9aba-4fb3-90c4-490d01969e60	covered	counter_support, sacrifice_support	counter_support, sacrifice_support	false		Analyzer roles accepted during batch clean pass.	Enchantment	{3}{W}{W}	5	W	W			verify analyzer roles	https://scryfall.com/card/pfdn/27s/valkyries-call?utm_source=api	Whenever a nontoken, non-Angel creature you control dies, return that card to the battlefield under its owner's control with a +1/+1 counter on it. It has flying and is an Angel in addition to its other types.
pfdn	Foundations Promos	2024-11-15	30s	Archmage of Runes	28045b32-4c1a-40e5-a15d-524d0f8fe6ec	covered	card_draw, combat_body, copy_support, cost_reduction, direct_draw, draw, ramp, repeatable_advantage, repeatable_draw, spellslinger	card_draw, combat_body, copy_support, cost_reduction, direct_draw, draw, ramp, repeatable_advantage, repeatable_draw, spellslinger	false		Analyzer roles accepted during batch clean pass.	Creature — Giant Wizard	{3}{U}{U}	5	U	U			verify analyzer roles	https://scryfall.com/card/pfdn/30s/archmage-of-runes?utm_source=api	Instant and sorcery spells you cast cost {1} less to cast. Whenever you cast an instant or sorcery spell, draw a card.
pfdn	Foundations Promos	2024-11-15	34s	Curator of Destinies	9938d178-0ce6-45c0-b317-fd5c54231579	covered	card_selection, combat_body, combat_threat, face_down_support	card_selection, combat_body, combat_threat, face_down_support	false		Analyzer roles accepted during batch clean pass.	Creature — Sphinx	{4}{U}{U}	6	U	U	Flying		verify analyzer roles	https://scryfall.com/card/pfdn/34s/curator-of-destinies?utm_source=api	This spell can't be countered. Flying When this creature enters, look at the top five cards of your library and separate them into a face-down pile and a face-up pile. An opponent chooses one of those piles. Put that pile into your hand and the other into your graveyard.
pfdn	Foundations Promos	2024-11-15	35s	Drake Hatcher	4de0ccab-bb5d-4c7c-827e-36aa1d00b182	covered	combat_body, combat_support, combat_threat, counter_support, token_support	combat_body, combat_support, combat_threat, counter_support, token_support	false		Analyzer roles accepted during batch clean pass.	Creature — Human Wizard	{1}{U}	2	U	U	Prowess, Vigilance		verify analyzer roles	https://scryfall.com/card/pfdn/35s/drake-hatcher?utm_source=api	Vigilance, prowess (Whenever you cast a noncreature spell, this creature gets +1/+1 until end of turn.) Whenever this creature deals combat damage to a player, put that many incubation counters on it. Remove three incubation counters from this creature: Create a 2/2 blue Drake creature token with flying.
pfdn	Foundations Promos	2024-11-15	40p	High Fae Trickster	28c1a4a0-f58c-4d07-a918-51ff8a74f050	covered	combat_body, combat_threat, replacement_engine, tempo_support	combat_body, combat_threat, replacement_engine, tempo_support	false		Analyzer roles accepted during batch clean pass.	Creature — Faerie Wizard	{3}{U}	4	U	U	Flying, Flash		verify analyzer roles	https://scryfall.com/card/pfdn/40p/high-fae-trickster?utm_source=api	Flash (You may cast this spell any time you could cast an instant.) Flying You may cast spells as though they had flash.
pfdn	Foundations Promos	2024-11-15	41s	Homunculus Horde	b3c69bf4-880f-4198-a67c-87d23d9c3d41	covered	combat_body, copy_support, token_support	combat_body, copy_support, token_support	false		Analyzer roles accepted during batch clean pass.	Creature — Homunculus	{3}{U}	4	U	U			verify analyzer roles	https://scryfall.com/card/pfdn/41s/homunculus-horde?utm_source=api	Whenever you draw your second card each turn, create a token that's a copy of this creature.
pfdn	Foundations Promos	2024-11-15	44s	Kaito, Cunning Infiltrator	f6d3f145-00e0-47cd-91d8-0381c19a000d	covered	card_draw, card_selection, combat_support, counter_support, direct_draw, draw, repeatable_advantage, repeatable_draw, selection, token_support	card_draw, card_selection, combat_support, counter_support, direct_draw, draw, repeatable_advantage, repeatable_draw, selection, token_support	false		Analyzer roles accepted during batch clean pass.	Legendary Planeswalker — Kaito	{1}{U}{U}	3	U	U			verify analyzer roles	https://scryfall.com/card/pfdn/44s/kaito-cunning-infiltrator?utm_source=api	Whenever a creature you control deals combat damage to a player, put a loyalty counter on Kaito. +1: Up to one target creature you control can't be blocked this turn. Draw a card, then discard a card. −2: Create a 2/1 blue Ninja creature token. −9: You get an emblem with "Whenever a player casts a spell, you create a 2/1 blue Ninja creature token."
pfdn	Foundations Promos	2024-11-15	45p	Kiora, the Rising Tide	5d748bce-dff8-46fa-a3d1-633863b7bbff	covered	card_draw, card_selection, combat_body, combat_support, direct_draw, draw, selection, token_support	card_draw, card_selection, combat_body, combat_support, direct_draw, draw, selection, token_support	false		Analyzer roles accepted during batch clean pass.	Legendary Creature — Merfolk Noble	{2}{U}	3	U	U	Threshold		verify analyzer roles	https://scryfall.com/card/pfdn/45p/kiora-the-rising-tide?utm_source=api	When Kiora enters, draw two cards, then discard two cards. Threshold — Whenever Kiora attacks, if there are seven or more cards in your graveyard, you may create Scion of the Deep, a legendary 8/8 blue Octopus creature token.
pfdn	Foundations Promos	2024-11-15	46s	Lunar Insight	56b4a2f7-2d35-4d05-8d26-4f9f16c5f9f5	covered	card_draw, direct_draw, draw	card_draw, direct_draw, draw	false		Analyzer roles accepted during batch clean pass.	Sorcery	{2}{U}	3	U	U			verify analyzer roles	https://scryfall.com/card/pfdn/46s/lunar-insight?utm_source=api	Draw a card for each different mana value among nonland permanents you control.
pfdn	Foundations Promos	2024-11-15	51s	Sphinx of Forgotten Lore	ddb7e868-8f1d-4d57-9ee2-ebadb17b398a	covered	card_selection, combat_body, combat_support, combat_threat, recursion, repeatable_advantage, repeatable_draw, replacement_engine, replay_recursion, selection, tempo_support	card_selection, combat_body, combat_support, combat_threat, recursion, repeatable_advantage, repeatable_draw, replacement_engine, replay_recursion, selection, tempo_support	false		Analyzer roles accepted during batch clean pass.	Creature — Sphinx	{2}{U}{U}	4	U	U	Flying, Flash		verify analyzer roles	https://scryfall.com/card/pfdn/51s/sphinx-of-forgotten-lore?utm_source=api	Flash (You may cast this spell any time you could cast an instant.) Flying Whenever this creature attacks, target instant or sorcery card in your graveyard gains flashback until end of turn. The flashback cost is equal to that card's mana cost. (You may cast that card from your graveyard for its flashback cost. Then exile it.)
pfdn	Foundations Promos	2024-11-15	54s	Abyssal Harvester	68cc5065-0514-4adf-885f-da554e1db00a	covered	combat_body, copy_support, graveyard_hate, removal, targeted_removal, token_support	combat_body, copy_support, graveyard_hate, removal, targeted_removal, token_support	false		Analyzer roles accepted during batch clean pass.	Creature — Demon Warlock	{1}{B}{B}	3	B	B			verify analyzer roles	https://scryfall.com/card/pfdn/54s/abyssal-harvester?utm_source=api	{T}: Exile target creature card from a graveyard that was put there this turn. Create a token that's a copy of it, except it's a Nightmare in addition to its other types. Then exile all other Nightmare tokens you control.
pfdn	Foundations Promos	2024-11-15	57p	Blasphemous Edict	6cf50e21-0f60-4e9a-b910-ebe1bad2a29e	covered	removal, targeted_removal	removal, targeted_removal	false		Analyzer roles accepted during batch clean pass.	Sorcery	{3}{B}{B}	5	B	B			verify analyzer roles	https://scryfall.com/card/pfdn/57p/blasphemous-edict?utm_source=api	You may pay {B} rather than pay this spell's mana cost if there are thirteen or more creatures on the battlefield. Each player sacrifices thirteen creatures of their choice.
pfdn	Foundations Promos	2024-11-15	58p	Bloodthirsty Conqueror	fd505c02-c59e-476d-8e88-35da862ddc23	covered	combat_body, combat_threat, lifegain	combat_body, combat_threat, lifegain	false		Analyzer roles accepted during batch clean pass.	Creature — Vampire Knight	{3}{B}{B}	5	B	B	Deathtouch, Flying		verify analyzer roles	https://scryfall.com/card/pfdn/58p/bloodthirsty-conqueror?utm_source=api	Flying, deathtouch Whenever an opponent loses life, you gain that much life. (Damage causes loss of life.)
pfdn	Foundations Promos	2024-11-15	61s	High-Society Hunter	0dc158ba-7ec8-4558-91f5-0a87ef8380d4	covered	card_draw, combat_body, combat_support, combat_threat, counter_support, direct_draw, draw, repeatable_advantage, repeatable_draw, sacrifice_support	card_draw, combat_body, combat_support, combat_threat, counter_support, direct_draw, draw, repeatable_advantage, repeatable_draw, sacrifice_support	false		Analyzer roles accepted during batch clean pass.	Creature — Vampire Noble	{3}{B}{B}	5	B	B	Flying		verify analyzer roles	https://scryfall.com/card/pfdn/61s/high-society-hunter?utm_source=api	Flying Whenever this creature attacks, you may sacrifice another creature. If you do, put a +1/+1 counter on this creature. Whenever another nontoken creature dies, draw a card.
pfdn	Foundations Promos	2024-11-15	66s	Nine-Lives Familiar	5049da27-f38b-4fe6-a387-51510bd1f44e	covered	combat_body, counter_support, sacrifice_support	combat_body, counter_support, sacrifice_support	false		Analyzer roles accepted during batch clean pass.	Creature — Cat	{1}{B}{B}	3	B	B			verify analyzer roles	https://scryfall.com/card/pfdn/66s/nine-lives-familiar?utm_source=api	This creature enters with eight revival counters on it if you cast it. When this creature dies, if it had a revival counter on it, return it to the battlefield with one fewer revival counter on it at the beginning of the next end step.
pfdn	Foundations Promos	2024-11-15	72s	Tinybones, Bauble Burglar	fd335b2f-e6a2-45ac-949e-a67278b21cb6	covered	card_selection, combat_body, counter_support, hand_attack, removal, repeatable_advantage	card_selection, combat_body, counter_support, hand_attack, removal, repeatable_advantage	false		Analyzer roles accepted during batch clean pass.	Legendary Creature — Skeleton Rogue	{1}{B}	2	B	B			verify analyzer roles	https://scryfall.com/card/pfdn/72s/tinybones-bauble-burglar?utm_source=api	Whenever an opponent discards a card, exile it from their graveyard with a stash counter on it. During your turn, you may play cards you don't own with stash counters on them from exile, and mana of any type can be spent to cast those spells. {3}{B}, {T}: Each opponent discards a card. Activate only as a sorcery.
pfdn	Foundations Promos	2024-11-15	77p	Zul Ashur, Lich Lord	a7c6c9b3-91f2-4ecf-b2b0-b0edd96974d9	covered	card_selection, combat_body, recursion, repeatable_advantage, repeatable_draw, replay_recursion, selection, self_protection	card_selection, combat_body, recursion, repeatable_advantage, repeatable_draw, replay_recursion, selection, self_protection	false		Analyzer roles accepted during batch clean pass.	Legendary Creature — Zombie Warlock	{1}{B}	2	B	B	Ward		verify analyzer roles	https://scryfall.com/card/pfdn/77p/zul-ashur-lich-lord?utm_source=api	Ward—Pay 2 life. (Whenever this creature becomes the target of a spell or ability an opponent controls, counter it unless that player pays 2 life.) {T}: You may cast target Zombie creature card from your graveyard this turn.
pfdn	Foundations Promos	2024-11-15	81s	Chandra, Flameshaper	818f908c-9af6-4edc-bb0e-193bc830e2e4	covered	card_selection, combat_support, copy_support, direct_draw, draw, repeatable_advantage, repeatable_draw, sacrifice_support, selection, targeted_removal, token_support	card_selection, combat_support, copy_support, direct_draw, draw, repeatable_advantage, repeatable_draw, sacrifice_support, selection, targeted_removal, token_support	false		Analyzer roles accepted during batch clean pass.	Legendary Planeswalker — Chandra	{5}{R}{R}	7	R	R			verify analyzer roles	https://scryfall.com/card/pfdn/81s/chandra-flameshaper?utm_source=api	+2: Add {R}{R}{R}. Exile the top three cards of your library. Choose one. You may play that card this turn. +1: Create a token that's a copy of target creature you control, except it has haste and "At the beginning of the end step, sacrifice this token." −4: Chandra deals 8 damage divided as you choose among any number of target creatures and/or planeswalkers.
pfdn	Foundations Promos	2024-11-15	85s	Electroduplicate	112f2b3f-32e7-40b1-b80e-0b99184a840c	covered	combat_support, copy_support, graveyard_support, sacrifice_support, token_support	combat_support, copy_support, graveyard_support, sacrifice_support, token_support	false		Analyzer roles accepted during batch clean pass.	Sorcery	{2}{R}	3	R	R	Flashback		verify analyzer roles	https://scryfall.com/card/pfdn/85s/electroduplicate?utm_source=api	Create a token that's a copy of target creature you control, except it has haste and "At the beginning of the end step, sacrifice this token." Flashback {2}{R}{R} (You may cast this card from your graveyard for its flashback cost. Then exile it.)
pfdn	Foundations Promos	2024-11-15	91s	Kellan, Planar Trailblazer	e8fd428f-7521-4e6a-86b7-835f20ee3c5c	covered	card_selection, combat_body, combat_support, direct_draw, draw, repeatable_advantage, repeatable_draw, selection	card_selection, combat_body, combat_support, direct_draw, draw, repeatable_advantage, repeatable_draw, selection	false		Analyzer roles accepted during batch clean pass.	Legendary Creature — Human Faerie Scout	{R}	1	R	R			verify analyzer roles	https://scryfall.com/card/pfdn/91s/kellan-planar-trailblazer?utm_source=api	{1}{R}: If Kellan is a Scout, it becomes a Human Faerie Detective and gains "Whenever Kellan deals combat damage to a player, exile the top card of your library. You may play that card this turn." {2}{R}: If Kellan is a Detective, it becomes a 3/2 Human Faerie Rogue and gains double strike.
pfdn	Foundations Promos	2024-11-15	92s	Rite of the Dragoncaller	5097f4e6-50af-4641-909f-db44abf0ce32	covered	copy_support, spellslinger, token_support	copy_support, spellslinger, token_support	false		Analyzer roles accepted during batch clean pass.	Enchantment	{4}{R}{R}	6	R	R			verify analyzer roles	https://scryfall.com/card/pfdn/92s/rite-of-the-dragoncaller?utm_source=api	Whenever you cast an instant or sorcery spell, create a 5/5 red Dragon creature token with flying.
pfdn	Foundations Promos	2024-11-15	93s	Searslicer Goblin	86ec0b56-497f-481c-a03a-c4e64e8e7404	covered	combat_body, token_support	combat_body, token_support	false		Analyzer roles accepted during batch clean pass.	Creature — Goblin Warrior	{1}{R}	2	R	R	Raid		verify analyzer roles	https://scryfall.com/card/pfdn/93s/searslicer-goblin?utm_source=api	Raid — At the beginning of your end step, if you attacked this turn, create a 1/1 red Goblin creature token.
pfdn	Foundations Promos	2024-11-15	97p	Twinflame Tyrant	321b5cc6-8df6-4292-97a0-a6a3a22f3b55	covered	combat_body, combat_threat, multiplier_support, replacement_engine	combat_body, combat_threat, multiplier_support, replacement_engine	false		Analyzer roles accepted during batch clean pass.	Creature — Dragon	{3}{R}{R}	5	R	R	Flying, Double		verify analyzer roles	https://scryfall.com/card/pfdn/97p/twinflame-tyrant?utm_source=api	Flying If a source you control would deal damage to an opponent or a permanent an opponent controls, it deals double that damage instead.
pfdn	Foundations Promos	2024-11-15	106p	Loot, Exuberant Explorer	f6476884-f73f-465f-8e7f-ea312a5b306d	covered	card_selection, combat_body, land_acceleration, ramp, selection	card_selection, combat_body, land_acceleration, ramp, selection	false		Analyzer roles accepted during batch clean pass.	Legendary Creature — Beast Noble	{2}{G}	3	G	G			verify analyzer roles	https://scryfall.com/card/pfdn/106p/loot-exuberant-explorer?utm_source=api	You may play an additional land on each of your turns. {4}{G}{G}, {T}: Look at the top six cards of your library. You may reveal a creature card with mana value less than or equal to the number of lands you control from among them and put it onto the battlefield. Put the rest on the bottom in a random order.
pfdn	Foundations Promos	2024-11-15	107p	Mossborn Hydra	84122d81-9634-4d3f-85a5-f6cf4303691a	covered	combat_body, combat_support, combat_threat, counter_support, multiplier_support, replacement_engine	combat_body, combat_support, combat_threat, counter_support, multiplier_support, replacement_engine	false		Analyzer roles accepted during batch clean pass.	Creature — Elemental Hydra	{2}{G}	3	G	G	Trample, Double, Landfall		verify analyzer roles	https://scryfall.com/card/pfdn/107p/mossborn-hydra?utm_source=api	Trample (This creature can deal excess combat damage to the player or planeswalker it's attacking.) This creature enters with a +1/+1 counter on it. Landfall — Whenever a land you control enters, double the number of +1/+1 counters on this creature.
pfdn	Foundations Promos	2024-11-15	109s	Preposterous Proportions	1e03aad2-6426-4d18-a0e5-bc3d8e6b7b11	covered	combat_support	combat_support	false		Analyzer roles accepted during batch clean pass.	Sorcery	{5}{G}{G}	7	G	G			verify analyzer roles	https://scryfall.com/card/pfdn/109s/preposterous-proportions?utm_source=api	Creatures you control get +10/+10 and gain vigilance until end of turn.
pfdn	Foundations Promos	2024-11-15	111s	Quilled Greatwurm	01635d21-aeda-4754-9d94-68fcd0cd6556	covered	combat_body, combat_support, combat_threat, counter_support	combat_body, combat_support, combat_threat, counter_support	false		Analyzer roles accepted during batch clean pass.	Creature — Wurm	{4}{G}{G}	6	G	G	Trample		verify analyzer roles	https://scryfall.com/card/pfdn/111s/quilled-greatwurm?utm_source=api	Trample Whenever a creature you control deals combat damage during your turn, put that many +1/+1 counters on it. (It must survive to get the counters.) You may cast this card from your graveyard by removing six counters from among creatures you control in addition to paying its other costs.
pfdn	Foundations Promos	2024-11-15	112s	Spinner of Souls	6883e79e-0b4f-4fb8-aee3-a3905246a408	covered	card_draw, card_selection, combat_body, combat_threat, draw, repeatable_advantage, repeatable_tutor, restricted_tutor, sacrifice_support, selection, tutor	card_draw, card_selection, combat_body, combat_threat, draw, repeatable_advantage, repeatable_tutor, restricted_tutor, sacrifice_support, selection, tutor	false		Analyzer roles accepted during batch clean pass.	Creature — Spider Spirit	{2}{G}	3	G	G	Reach		verify analyzer roles	https://scryfall.com/card/pfdn/112s/spinner-of-souls?utm_source=api	Reach Whenever another nontoken creature you control dies, you may reveal cards from the top of your library until you reveal a creature card. Put that card into your hand and the rest on the bottom of your library in a random order.
pfdn	Foundations Promos	2024-11-15	113s	Sylvan Scavenging	398afdf2-4a12-430e-85c9-c68847230939	covered	counter_support, token_support	counter_support, token_support	false		Analyzer roles accepted during batch clean pass.	Enchantment	{1}{G}{G}	3	G	G			verify analyzer roles	https://scryfall.com/card/pfdn/113s/sylvan-scavenging?utm_source=api	At the beginning of your end step, choose one — • Put a +1/+1 counter on target creature you control. • Create a 3/3 green Raccoon creature token if you control a creature with power 4 or greater.
pfdn	Foundations Promos	2024-11-15	115p	Alesha, Who Laughs at Fate	17ce2c17-b69b-4ebf-9c3c-c64e771af101	covered	battlefield_recursion, card_selection, combat_body, combat_support, combat_threat, counter_support, recursion, repeatable_advantage	battlefield_recursion, card_selection, combat_body, combat_support, combat_threat, counter_support, recursion, repeatable_advantage	false		Analyzer roles accepted during batch clean pass.	Legendary Creature — Human Warrior	{1}{B}{R}	3	BR	BR	First strike, Raid		verify analyzer roles	https://scryfall.com/card/pfdn/115p/alesha-who-laughs-at-fate?utm_source=api	First strike Whenever Alesha attacks, put a +1/+1 counter on it. Raid — At the beginning of your end step, if you attacked this turn, return target creature card with mana value less than or equal to Alesha's power from your graveyard to the battlefield.
