setCode	setName	releasedAt	collectorNumber	name	oracleId	auditStatus	expectedRoles	actualAnalyzerRoles	needsCodeChange	tagDecision	manualNotes	typeLine	manaCost	manaValue	colors	colorIdentity	keywords	scryfallOracleTags	attentionHint	scryfallUrl	oracleText
ph19	2019 Heroes of the Realm	2020-08-01	1	Collectigull // Only the Best	23146975-7ba4-4c64-96a5-1cd54090f367			card_selection, combat_body, combat_support, combat_threat, hand_recursion, recursion, self_protection				Creature — Bird // Sorcery — Adventure	{2}{W} // {1}{W}	3	W	W	Flying, Protection		verify analyzer roles	https://scryfall.com/card/ph19/1/collectigull-only-the-best?utm_source=api	Collectigull: Flying, protection from common Whenever Collectigull attacks, reveal the top card of your library. If it's a Booster Fun card, you may put it into your hand. // Only the Best: Return target Booster Fun card from your graveyard to your hand.
ph19	2019 Heroes of the Realm	2020-08-01	2	Keeper of the Secret Lair	feae9fea-4a4b-4441-bcee-cdea20e98e1a			combat_body, cost_reduction, ramp, replacement_engine, tempo_support				Legendary Creature — Merfolk Rogue	{1}{U}	2	U	U	Flash		verify analyzer roles	https://scryfall.com/card/ph19/2/keeper-of-the-secret-lair?utm_source=api	Flash You may cast Secret Lair spells as though they had flash. Secret Lair spells you cast cost {1} less to cast.
ph19	2019 Heroes of the Realm	2020-08-01	3	War of the Spark	9bb259d0-09f6-4564-8cd1-73b4d0e5b4fc			counter_support, mass_recursion, removal, sacrifice_support, targeted_removal				Enchantment — Saga	{3}{B}	4	B	B	Proliferate		verify analyzer roles	https://scryfall.com/card/ph19/3/war-of-the-spark?utm_source=api	(As this Saga enters and after your draw step, add a lore counter. Sacrifice after III.) I — Each player may put a planeswalker or Zombie card from War of the Spark from their hand or graveyard onto the battlefield. II — Sacrifice any number of creatures and/or planeswalkers. Each opponent sacrifices that many creatures and/or planeswalkers. III — Exile up to one target Bolas. Proliferate three times.
ph19	2019 Heroes of the Realm	2020-08-01	4	Champions of Archery // Join the Group	4e658c56-ebf7-449c-909c-86053f8eaba6			combat_body, combat_threat, scalable_spell				Legendary Creature — Human Archer // Sorcery — Adventure	{3}{R} // {2}{R}	4	R	R	Reach		verify analyzer roles	https://scryfall.com/card/ph19/4/champions-of-archery-join-the-group?utm_source=api	Champions of Archery: Reach Commanders you control get +X/+0, where X is the number of commanders you control. // Join the Group: You may put a legendary creature card from your hand into the command zone. It's also your commander.
ph19	2019 Heroes of the Realm	2020-08-01	5	Myntasha, Honored One	6fc7ecff-749b-48a5-8ed4-8154d2570738			card_selection, combat_body, cost_reduction, draw, selection				Legendary Snow Creature — Elk	{2}{G}{G}	4	G	G			verify analyzer roles	https://scryfall.com/card/ph19/5/myntasha-honored-one?utm_source=api	As an additional cost to cast this spell, you may open a sealed Magic booster pack and put the cards on the bottom of your booster pile in a random order. Spells you cast have booster cascade. (It's like cascade, but use your booster pile rather than your library.)
ph19	2019 Heroes of the Realm	2020-08-01	6	The Cinematic Phoenix	35358853-7443-4f3f-8922-fbcfc88bbd81			alternate_finisher, battlefield_recursion, card_selection, combat_body, combat_threat, finisher, recursion, repeatable_advantage, repeatable_finisher, self_protection				Legendary Creature — Phoenix	{3}{B}{R}	5	BR	BR	Flying, Protection, Haste		verify analyzer roles	https://scryfall.com/card/ph19/6/the-cinematic-phoenix?utm_source=api	Flying, haste, protection from red {1}, {T}: Return target legendary creature card from your graveyard to the battlefield. Tap six untapped creatures you control: Return The Cinematic Phoenix from your graveyard to the battlefield. If you tapped six legendary creatures this way, you win the game.
ph19	2019 Heroes of the Realm	2020-08-01	7	Fabled Path of Searo Point	ed74463c-f36b-4dd6-882b-03d150415f9b			combat_support, land_base, land_slot, landwalk_support, typed_land				Legendary Land — Mountain		0		BGRUW			verify analyzer roles	https://scryfall.com/card/ph19/7/fabled-path-of-searo-point?utm_source=api	{W}{U}{B}{R}{G}, {T}: Creatures you control gain landwalk until end of turn.
