setCode	setName	releasedAt	collectorNumber	name	oracleId	auditStatus	expectedRoles	actualAnalyzerRoles	needsCodeChange	tagDecision	manualNotes	typeLine	manaCost	manaValue	colors	colorIdentity	keywords	scryfallOracleTags	attentionHint	scryfallUrl	oracleText
pip	Fallout	2024-03-08	91	Alpha Deathclaw	0a7d0d1f-a5ac-4db9-860c-9fcbe3fd9e71			combat_body, combat_support, combat_threat, counter_support, removal, targeted_removal				Creature — Lizard Mutant	{4}{B}{G}	6	BG	BG	Trample, Menace, Monstrosity		verify analyzer roles	https://scryfall.com/card/pip/91/alpha-deathclaw?utm_source=api	Menace, trample When this creature enters or becomes monstrous, destroy target permanent. {5}{B}{G}: Monstrosity 4. (If this creature isn't monstrous, put four +1/+1 counters on it and it becomes monstrous.)
pip	Fallout	2024-03-08	92	Arcade Gannon	e001d7e6-71c9-42fa-9d5c-9455da66e4ec			card_draw, card_selection, combat_body, counter_support, direct_draw, draw, recursion, repeatable_advantage, repeatable_draw, replay_recursion, selection				Legendary Creature — Human Doctor	{2}{W}{U}	4	UW	UW	For Auld Lang Syne		verify analyzer roles	https://scryfall.com/card/pip/92/arcade-gannon?utm_source=api	{T}: Draw a card, then discard a card. Put a quest counter on Arcade Gannon. For Auld Lang Syne — Once during each of your turns, you may cast an artifact or Human spell from your graveyard with mana value less than or equal to the number of quest counters on Arcade Gannon.
pip	Fallout	2024-03-08	93	Armory Paladin	360f7bfd-3b4c-4e87-a251-fd55c8a62320			card_selection, combat_body, combat_threat, direct_draw, draw, repeatable_advantage, repeatable_draw, selection				Creature — Human Knight	{1}{R}{W}	3	RW	RW	Trample		verify analyzer roles	https://scryfall.com/card/pip/93/armory-paladin?utm_source=api	Trample Whenever you cast an Aura or Equipment spell, exile the top card of your library. You may play that card until the end of your next turn.
pip	Fallout	2024-03-08	94	Atomize	4b457bc2-2d8c-42cb-9a63-bb4c459d14e3			counter_support, removal, targeted_removal				Instant	{2}{B}{G}	4	BG	BG	Proliferate		verify analyzer roles	https://scryfall.com/card/pip/94/atomize?utm_source=api	Destroy target nonland permanent. Proliferate. (Choose any number of permanents and/or players, then give each another counter of each kind already there.)
pip	Fallout	2024-03-08	95	Boomer Scrapper	3292d795-4fdc-4e42-959a-dd5e8591c5cc			card_selection, combat_body, combat_support, counter_support, direct_draw, draw, repeatable_advantage, repeatable_draw, sacrifice_support, selection, token_support				Creature — Human Soldier	{1}{B}{R}	3	BR	BR			verify analyzer roles	https://scryfall.com/card/pip/95/boomer-scrapper?utm_source=api	Whenever this creature enters or attacks, you lose 1 life and create a Junk token. (It's an artifact with "{T}, Sacrifice this token: Exile the top card of your library. You may play that card this turn. Activate only as a sorcery.") Whenever a token you control leaves the battlefield, put a +1/+1 counter on this creature.
pip	Fallout	2024-03-08	96	Cait, Cage Brawler	f24319a1-0662-44be-9027-11e7bc020e1d			card_draw, card_selection, combat_body, combat_support, counter_support, direct_draw, draw, repeatable_advantage, repeatable_draw, selection, self_protection				Legendary Creature — Human Warrior	{R}{G}	2	GR	GR			verify analyzer roles	https://scryfall.com/card/pip/96/cait-cage-brawler?utm_source=api	During your turn, Cait has indestructible. Whenever Cait attacks, you and defending player each draw a card, then discard a card. Put two +1/+1 counters on Cait if you discarded the card with the greatest mana value among those cards or tied for greatest.
pip	Fallout	2024-03-08	97	Cass, Hand of Vengeance	f9b6b1db-37c6-43d4-b762-6c9770da5964			card_selection, combat_body, combat_threat, mass_recursion, recursion, repeatable_advantage, sacrifice_support				Legendary Creature — Human Ranger	{2}{R}{W}	4	RW	RW	Vigilance		verify analyzer roles	https://scryfall.com/card/pip/97/cass-hand-of-vengeance?utm_source=api	Vigilance Whenever Cass or another creature you control dies, if it was enchanted or equipped, return any number of Aura cards that were attached to it from your graveyard to the battlefield attached to target creature, then attach any number of Equipment that were attached to it to that creature.
pip	Fallout	2024-03-08	98	Colonel Autumn	5c6ce876-781b-437d-b20e-db0b6e2769f4			combat_body, combat_threat, counter_support, lifegain, sacrifice_support				Legendary Creature — Human Soldier	{1}{W}{B}	3	BW	BW	Lifelink, Exploit		verify analyzer roles	https://scryfall.com/card/pip/98/colonel-autumn?utm_source=api	Lifelink Exploit (When this creature enters, you may sacrifice a creature.) Other legendary creatures you control have exploit. Whenever a creature you control exploits a creature, put a +1/+1 counter on each creature you control.
pip	Fallout	2024-03-08	99	Contaminated Drink	ee327c5e-ed29-4de3-bf50-92488f51a3a5			card_draw, direct_draw, draw, mana_sink, scalable_spell				Instant	{X}{U}{B}	2	BU	BU			verify analyzer roles	https://scryfall.com/card/pip/99/contaminated-drink?utm_source=api	Draw X cards, then you get half X rad counters, rounded up.
pip	Fallout	2024-03-08	100	Craig Boone, Novac Guard	74f4743b-06a9-48e3-9fdf-27a56660ac8e			combat_body, combat_support, combat_threat, counter_support, lifegain, removal, targeted_removal				Legendary Creature — Human Soldier	{1}{R}{W}	3	RW	RW	Lifelink, Reach, One for My Baby		verify analyzer roles	https://scryfall.com/card/pip/100/craig-boone-novac-guard?utm_source=api	Reach, lifelink One for My Baby — Whenever you attack with two or more creatures, put two quest counters on Craig Boone. When you do, Craig Boone deals damage equal to the number of quest counters on it to up to one target creature unless that creature's controller has Craig Boone deal that much damage to them.
pip	Fallout	2024-03-08	101	Desdemona, Freedom's Edge	fd06d110-417c-42f5-a7b2-fd032f631dd2			card_selection, combat_body, combat_support, combat_threat, recursion, repeatable_advantage, repeatable_draw, replay_recursion, selection				Legendary Creature — Human Rogue	{2}{R}{W}	4	RW	RW	Vigilance		verify analyzer roles	https://scryfall.com/card/pip/101/desdemona-freedoms-edge?utm_source=api	Vigilance Whenever Desdemona attacks, target creature card in your graveyard that's an artifact or that has mana value 3 or less gains escape until end of turn. The escape cost is equal to its mana cost plus exile two other cards from your graveyard. (You may cast it from your graveyard for its escape cost this turn.)
pip	Fallout	2024-03-08	102	Elder Arthur Maxson	d95cd013-6f32-4a8b-9c46-a28695eea4f1			combat_body, combat_support, counter_support, sacrifice_support, self_protection, token_support				Legendary Creature — Human Knight	{1}{W}{B}	3	BW	BW	Blind Betrayal		verify analyzer roles	https://scryfall.com/card/pip/102/elder-arthur-maxson?utm_source=api	Creature tokens you control have training. (Whenever a creature token you control attacks with another creature with greater power, put a +1/+1 counter on that token.) Blind Betrayal — Sacrifice another creature: Elder Arthur Maxson gains indestructible until end of turn.
pip	Fallout	2024-03-08	103	Elder Owyn Lyons	19788405-7141-475e-94ee-d0c89488f50f			artifact_support, broad_protection, card_selection, combat_body, hand_recursion, recursion, sacrifice_support, self_protection				Legendary Creature — Human Knight	{2}{W}{U}	4	UW	UW			verify analyzer roles	https://scryfall.com/card/pip/103/elder-owyn-lyons?utm_source=api	Artifacts you control have ward {1}. (Whenever an artifact you control becomes the target of a spell or ability an opponent controls, counter it unless that player pays {1}.) When Elder Owyn Lyons enters or dies, return target artifact card from your graveyard to your hand.
pip	Fallout	2024-03-08	104	Electrosiphon	bff9105f-d8d4-4412-88d9-c9697581ebe9			energy_support, hard_stack, stack				Instant	{U}{U}{R}	3	RU	RU			verify analyzer roles	https://scryfall.com/card/pip/104/electrosiphon?utm_source=api	Counter target spell. You get an amount of {E} (energy counters) equal to its mana value.
pip	Fallout	2024-03-08	105	Inventory Management	b20eae3d-d0ff-42c3-a060-d06629506781			hate_piece, stax_piece				Instant	{R}{W}	2	RW	RW	Split second		verify analyzer roles	https://scryfall.com/card/pip/105/inventory-management?utm_source=api	Split second (As long as this spell is on the stack, players can't cast spells or activate abilities that aren't mana abilities.) For each Aura and Equipment you control, you may attach it to a creature you control.
pip	Fallout	2024-03-08	106	Kellogg, Dangerous Mind	904b2603-00c3-44d2-a43c-c25439dd8038			burst_ramp, combat_body, combat_support, combat_threat, donation_support, mana_fixing, ramp, removal, sacrifice_support, tempo_removal, theft_support, token_support				Legendary Creature — Human Mercenary	{1}{B}{R}	3	BR	BR	First strike, Treasure, Haste		verify analyzer roles	https://scryfall.com/card/pip/106/kellogg-dangerous-mind?utm_source=api	First strike, haste Whenever Kellogg attacks, create a Treasure token. Sacrifice five Treasures: Gain control of target creature for as long as you control Kellogg. Activate only as a sorcery.
pip	Fallout	2024-03-08	107	Legate Lanius, Caesar's Ace	c6b5ca62-e5ee-4636-b12e-7c1d455e8384			combat_body, counter_support, removal, targeted_removal				Legendary Creature — Human Soldier	{2}{B}{R}	4	BR	BR	Decimate		verify analyzer roles	https://scryfall.com/card/pip/107/legate-lanius-caesars-ace?utm_source=api	Decimate — When Legate Lanius enters, each opponent sacrifices a tenth of the creatures they control of their choice, rounded up. Whenever an opponent sacrifices a creature, put a +1/+1 counter on Legate Lanius.
pip	Fallout	2024-03-08	108	MacCready, Lamplight Mayor	f40a1a41-d340-4256-8f97-77499cd511a8			combat_body, combat_support, lifegain				Legendary Creature — Human Advisor	{W}{B}	2	BW	BW			verify analyzer roles	https://scryfall.com/card/pip/108/maccready-lamplight-mayor?utm_source=api	Whenever a creature you control with power 2 or less attacks, it gains skulk until end of turn. (It can't be blocked by creatures with greater power.) Whenever a creature with power 4 or greater attacks you, its controller loses 2 life and you gain 2 life.
pip	Fallout	2024-03-08	109	Marcus, Mutant Mayor	c9db8f36-2c72-403e-b2b7-7cdfba5feaa4			card_draw, combat_body, combat_support, combat_threat, counter_support, direct_draw, draw, repeatable_advantage, repeatable_draw				Legendary Creature — Mutant Advisor	{3}{G}{U}	5	GU	GU	Vigilance, Trample		verify analyzer roles	https://scryfall.com/card/pip/109/marcus-mutant-mayor?utm_source=api	Vigilance, trample Whenever a creature you control deals combat damage to a player, draw a card if that creature has a +1/+1 counter on it. If it doesn't, put a +1/+1 counter on it.
pip	Fallout	2024-03-08	110	Moira Brown, Guide Author	db02644b-820f-4102-b1f6-ed8fac40baf8			artifact_support, combat_body, combat_support, counter_support, token_support				Legendary Creature — Human Citizen	{1}{R}{W}	3	RW	RW			verify analyzer roles	https://scryfall.com/card/pip/110/moira-brown-guide-author?utm_source=api	When Moira Brown enters, create a colorless Book Equipment artifact token named Wasteland Survival Guide with "Equipped creature gets +1/+1 for each quest counter among permanents you control" and equip {1}. Whenever you attack, put a quest counter on target nonland permanent you control.
pip	Fallout	2024-03-08	111	Mutational Advantage	2daa5b89-e772-4a2b-ad52-bbbf148c7b2f			broad_protection, counter_support, protection, self_protection				Instant	{1}{G}{U}	3	GU	GU	Proliferate		verify analyzer roles	https://scryfall.com/card/pip/111/mutational-advantage?utm_source=api	Permanents you control with counters on them gain hexproof and indestructible until end of turn. Prevent all damage that would be dealt to those permanents this turn. Proliferate. (Choose any number of permanents and/or players, then give each another counter of each kind already there.)
pip	Fallout	2024-03-08	112	Nightkin Ambusher	2808d652-907d-4071-b386-814507a1549e			combat_body, combat_support, self_protection				Creature — Mutant Warrior	{2}{U}{B}	4	BU	BU	Ward		verify analyzer roles	https://scryfall.com/card/pip/112/nightkin-ambusher?utm_source=api	Ward {2} (Whenever this creature becomes the target of a spell or ability an opponent controls, counter it unless that player pays {2}.) When this creature enters, target player gets four rad counters. This creature can't be blocked as long as defending player has a rad counter.
pip	Fallout	2024-03-08	113	The Nipton Lottery	8af798a9-2198-4f39-aa6d-5420a0f1203c			mass_removal, removal, theft_support				Sorcery	{2}{B}{R}	4	BR	BR			verify analyzer roles	https://scryfall.com/card/pip/113/the-nipton-lottery?utm_source=api	Choose a creature at random. You gain control of that creature until end of turn. Untap it. It gains haste until end of turn. Then destroy all other creatures.
pip	Fallout	2024-03-08	114	Paladin Elizabeth Taggerdy	3cfea32e-6b52-441b-90aa-d8a137997297			card_draw, combat_body, combat_support, cost_reduction, direct_draw, draw, ramp, repeatable_advantage, repeatable_draw, scalable_spell				Legendary Creature — Human Knight	{1}{R}{W}	3	RW	RW	Battalion		verify analyzer roles	https://scryfall.com/card/pip/114/paladin-elizabeth-taggerdy?utm_source=api	Battalion — Whenever Paladin Elizabeth Taggerdy and at least two other creatures attack, draw a card, then you may put a creature card with mana value X or less from your hand onto the battlefield tapped and attacking, where X is Paladin Elizabeth Taggerdy's power.
pip	Fallout	2024-03-08	115	Raul, Trouble Shooter	d247a86d-917d-4833-82c4-876943d54e2c			card_selection, combat_body, mill_support, repeatable_advantage				Legendary Creature — Zombie Mutant Rogue	{1}{U}{B}	3	BU	BU	Mill		verify analyzer roles	https://scryfall.com/card/pip/115/raul-trouble-shooter?utm_source=api	Once during each of your turns, you may cast a spell from among cards in your graveyard that were milled this turn. {T}: Each player mills a card. (They each put the top card of their library into their graveyard.)
pip	Fallout	2024-03-08	116	Red Death, Shipwrecker	0d40b2c3-9f39-45c6-8b25-12353f300613			burst_ramp, card_draw, combat_body, combat_support				Legendary Creature — Crab Mutant	{U}{R}	2	RU	RU	Alluring Eyes, Goad		verify analyzer roles	https://scryfall.com/card/pip/116/red-death-shipwrecker?utm_source=api	Alluring Eyes — {T}: Goad target creature an opponent controls. That player draws a card. You add {R}. (Until your next turn, that creature attacks each combat if able and attacks a player other than you if able.)
pip	Fallout	2024-03-08	117	Rex, Cyber-Hound	7ad52f9c-48d8-486f-90b7-73ce5cb3b9db			combat_body, combat_support, counter_support, energy_support, mill_support, removal, targeted_removal				Legendary Artifact Creature — Robot Dog	{1}{W}{U}	3	UW	UW	Mill		verify analyzer roles	https://scryfall.com/card/pip/117/rex-cyber-hound?utm_source=api	Whenever Rex deals combat damage to a player, they mill two cards and you get {E}{E} (two energy counters). Pay {E}{E}: Choose target creature card in a graveyard. Exile it with a brain counter on it. Activate only as a sorcery. Rex has all activated abilities of all cards in exile with brain counters on them.
pip	Fallout	2024-03-08	118	Sentinel Sarah Lyons	b368b1bd-3273-40a9-8102-27501f4d0e15			artifact_support, combat_body, combat_support, combat_threat				Legendary Creature — Human Knight	{3}{R}{W}	5	RW	RW	Battalion, Haste		verify analyzer roles	https://scryfall.com/card/pip/118/sentinel-sarah-lyons?utm_source=api	Haste As long as an artifact entered the battlefield under your control this turn, creatures you control get +2/+2. Battalion — Whenever Sentinel Sarah Lyons and at least two other creatures attack, Sentinel Sarah Lyons deals damage equal to the number of artifacts you control to target player.
pip	Fallout	2024-03-08	119	Shaun, Father of Synths	0bd11d6c-b707-4b37-b49c-a3274b2a5a81			combat_body, combat_support, copy_support, token_support				Legendary Creature — Human Scientist	{3}{U}{R}	5	RU	RU			verify analyzer roles	https://scryfall.com/card/pip/119/shaun-father-of-synths?utm_source=api	Whenever you attack, you may create a tapped and attacking token that's a copy of target attacking legendary creature you control other than Shaun, except it's not legendary and it's a Synth artifact creature in addition to its other types. When Shaun leaves the battlefield, exile all Synth tokens you control.
pip	Fallout	2024-03-08	120	Three Dog, Galaxy News DJ	cc504f00-f177-4def-956d-92a2217438bb			combat_body, combat_support, copy_support, sacrifice_support, token_support				Legendary Creature — Human Bard	{1}{R}{W}	3	RW	RW			verify analyzer roles	https://scryfall.com/card/pip/120/three-dog-galaxy-news-dj?utm_source=api	Whenever you attack, you may pay {2} and sacrifice an Aura attached to Three Dog. When you sacrifice an Aura this way, for each other attacking creature you control, create a token that's a copy of that Aura attached to that creature.
pip	Fallout	2024-03-08	121	Vault 11: Voter's Dilemma	e2c00aff-696c-4b20-acd4-95b71b5f8b10			card_draw, sacrifice_support, token_support				Enchantment — Saga	{2}{W}{B}	4	BW	BW			verify analyzer roles	https://scryfall.com/card/pip/121/vault-11:-voters-dilemma?utm_source=api	(As this Saga enters and after your draw step, add a lore counter. Sacrifice after III.) I — For each opponent, you create a 1/1 white Human Soldier creature token. II, III — Each player secretly votes for up to one creature, then those votes are revealed. If no creature got votes, each player draws a card. Otherwise, destroy each creature with the most votes or tied for most votes.
pip	Fallout	2024-03-08	122	Vault 87: Forced Evolution	1eb22223-edd4-42bf-a127-e16191cbd1c1			card_draw, counter_support, direct_draw, donation_support, draw, removal, sacrifice_support, tempo_removal, theft_support				Enchantment — Saga	{3}{G}{U}	5	GU	GU			verify analyzer roles	https://scryfall.com/card/pip/122/vault-87:-forced-evolution?utm_source=api	(As this Saga enters and after your draw step, add a lore counter. Sacrifice after III.) I — Gain control of target non-Mutant creature for as long as you control this Saga. II — Put a +1/+1 counter on target creature you control. It becomes a Mutant in addition to its other types. III — Draw cards equal to the greatest power among Mutants you control.
pip	Fallout	2024-03-08	123	Vault 112: Sadistic Simulation	480967df-a967-4093-a999-b71f6ee70688			counter_support, energy_support, removal, sacrifice_support, tempo_removal				Enchantment — Saga	{2}{U}{R}	4	RU	RU			verify analyzer roles	https://scryfall.com/card/pip/123/vault-112:-sadistic-simulation?utm_source=api	(As this Saga enters and after your draw step, add a lore counter. Sacrifice after III.) I, II — Tap up to one target creature and put a stun counter on it. You get {E}{E} (two energy counters). III — Pay any amount of {E}. If you paid one or more {E} this way, shuffle your library, then exile that many cards from the top. You may play one of those cards without paying its mana cost.
pip	Fallout	2024-03-08	124	White Glove Gourmand	3771c0d7-cea3-4c03-933d-f236f32ef2db			combat_body, token_support				Creature — Human Noble	{2}{W}{B}	4	BW	BW	Food		verify analyzer roles	https://scryfall.com/card/pip/124/white-glove-gourmand?utm_source=api	When this creature enters, create two 1/1 white Human Soldier creature tokens. At the beginning of your end step, if another Human died under your control this turn, create a Food token.
pip	Fallout	2024-03-08	125	Young Deathclaws	f24fc213-6341-482c-a056-946d0f1dd76b			combat_body, combat_support, combat_threat				Creature — Lizard Mutant	{2}{B}{G}	4	BG	BG	Menace		verify analyzer roles	https://scryfall.com/card/pip/125/young-deathclaws?utm_source=api	Menace (This creature can't be blocked except by two or more creatures.) Each creature card in your graveyard has scavenge. The scavenge cost is equal to its mana cost. (Exile a creature card from your graveyard and pay its mana cost: Put a number of +1/+1 counters equal to that card's power on target creature. Scavenge only as a sorcery.)
pip	Fallout	2024-03-08	126	Agility Bobblehead	83a3897c-c245-4fad-b253-3f8bbe6445fb			combat_support, mana_fixing, ramp, scalable_spell, stable_ramp				Artifact — Bobblehead	{3}	3					verify analyzer roles	https://scryfall.com/card/pip/126/agility-bobblehead?utm_source=api	{T}: Add one mana of any color. {3}, {T}: Up to X target creatures you control each gain haste until end of turn and can't be blocked this turn except by creatures with haste, where X is the number of Bobbleheads you control as you activate this ability.
pip	Fallout	2024-03-08	127	Behemoth of Vault 0	7d05ffe2-e52b-42af-87ca-6aae488b9f41			combat_body, combat_threat, energy_support, sacrifice_support				Artifact Creature — Robot	{6}	6			Trample		verify analyzer roles	https://scryfall.com/card/pip/127/behemoth-of-vault-0?utm_source=api	Trample When this creature enters, you get {E}{E}{E}{E} (four energy counters). When this creature dies, you may pay an amount of {E} equal to target nonland permanent's mana value. When you do, destroy that permanent.
pip	Fallout	2024-03-08	128	Brotherhood Vertibird	3b000071-3768-44cf-8957-180d0e94c988			artifact_support				Artifact — Vehicle	{3}	3			Flying, Crew		verify analyzer roles	https://scryfall.com/card/pip/128/brotherhood-vertibird?utm_source=api	Flying Brotherhood Vertibird's power is equal to the number of artifacts you control. Crew 2 (Tap any number of creatures you control with total power 2 or greater: This Vehicle becomes an artifact creature until end of turn.)
pip	Fallout	2024-03-08	129	C.A.M.P.	9bf498ce-6d6d-462f-9ec3-b36a2184aff7			card_selection, counter_support, direct_draw, draw, repeatable_advantage, repeatable_draw, sacrifice_support, selection, token_support				Artifact — Fortification	{3}	3			Fortify		verify analyzer roles	https://scryfall.com/card/pip/129/camp?utm_source=api	Whenever fortified land is tapped for mana, put a +1/+1 counter on target creature you control. If that creature shares a color with the mana that land produced, create a Junk token. (It's an artifact with "{T}, Sacrifice this token: Exile the top card of your library. You may play that card this turn. Activate only as a sorcery.") Fortify {3} ({3}: Attach to target land you control. Fortify only as a sorcery.)
pip	Fallout	2024-03-08	130	Charisma Bobblehead	77897962-7d67-4fa8-858f-2f35a322d7c6			combat_support, mana_fixing, ramp, scalable_spell, stable_ramp, token_support				Artifact — Bobblehead	{3}	3					verify analyzer roles	https://scryfall.com/card/pip/130/charisma-bobblehead?utm_source=api	{T}: Add one mana of any color. {4}, {T}: Create X 1/1 white Soldier creature tokens, where X is the number of Bobbleheads you control. Activate only as a sorcery.
pip	Fallout	2024-03-08	131	ED-E, Lonesome Eyebot	1b1bbad2-13b3-4716-85ef-3956268e23ad			card_draw, combat_body, combat_support, combat_threat, counter_support, direct_draw, draw, repeatable_advantage, repeatable_draw, sacrifice_support				Legendary Artifact Creature — Robot	{3}	3			ED-E My Love, Flying		verify analyzer roles	https://scryfall.com/card/pip/131/ed-e-lonesome-eyebot?utm_source=api	Flying ED-E My Love — Whenever you attack, if the number of attacking creatures is greater than the number of quest counters on ED-E, put a quest counter on it. {2}, Sacrifice ED-E: Draw a card, then draw an additional card for each quest counter on ED-E.
pip	Fallout	2024-03-08	132	Endurance Bobblehead	6a69116b-3d2e-4eac-9d02-902373de3cb7			broad_protection, combat_support, mana_fixing, protection, ramp, scalable_spell, self_protection, stable_ramp				Artifact — Bobblehead	{3}	3					verify analyzer roles	https://scryfall.com/card/pip/132/endurance-bobblehead?utm_source=api	{T}: Add one mana of any color. {3}, {T}: Up to X target creatures you control get +1/+0 and gain indestructible until end of turn, where X is the number of Bobbleheads you control as you activate this ability. Activate only as a sorcery.
pip	Fallout	2024-03-08	133	Expert-Level Safe	cf9129a3-25fe-4787-b41c-0b6968ba5aee			face_down_support, sacrifice_support, targeted_removal				Artifact	{2}	2					verify analyzer roles	https://scryfall.com/card/pip/133/expert-level-safe?utm_source=api	When this artifact enters, exile the top two cards of your library face down. {1}, {T}: You and target opponent each secretly choose 1, 2, or 3. Then those choices are revealed. If they match, sacrifice this artifact and put all cards exiled with it into their owners' hands. Otherwise, exile the top card of your library face down.
pip	Fallout	2024-03-08	134	Intelligence Bobblehead	16e6bd4b-fbf1-4bbe-9271-a74f59320e0d			card_draw, direct_draw, draw, mana_fixing, ramp, repeatable_advantage, repeatable_draw, scalable_spell, stable_ramp				Artifact — Bobblehead	{3}	3					verify analyzer roles	https://scryfall.com/card/pip/134/intelligence-bobblehead?utm_source=api	{T}: Add one mana of any color. {5}, {T}: Draw X cards, where X is the number of Bobbleheads you control.
pip	Fallout	2024-03-08	135	Luck Bobblehead	d870a93a-8399-4004-9b45-2b49b001f165			alternate_finisher, burst_ramp, dice_support, finisher, mana_fixing, ramp, repeatable_finisher, scalable_spell, stable_ramp, token_support				Artifact — Bobblehead	{3}	3			Treasure		verify analyzer roles	https://scryfall.com/card/pip/135/luck-bobblehead?utm_source=api	{T}: Add one mana of any color. {1}, {T}: Roll X six-sided dice, where X is the number of Bobbleheads you control. Create a tapped Treasure token for each even result. If you rolled 6 exactly seven times, you win the game.
