setCode	setName	releasedAt	collectorNumber	name	oracleId	auditStatus	expectedRoles	actualAnalyzerRoles	needsCodeChange	tagDecision	manualNotes	typeLine	manaCost	manaValue	colors	colorIdentity	keywords	scryfallOracleTags	attentionHint	scryfallUrl	oracleText
pip	Fallout	2024-03-08	136	Mister Gutsy	09763d9a-056f-49db-a72b-1c7325075789			card_selection, combat_body, combat_support, counter_support, direct_draw, draw, repeatable_advantage, repeatable_draw, sacrifice_support, scalable_spell, selection, token_support				Artifact Creature — Robot Soldier	{2}	2					verify analyzer roles	https://scryfall.com/card/pip/136/mister-gutsy?utm_source=api	Whenever you cast an Aura or Equipment spell, put a +1/+1 counter on this creature. When this creature dies, create X Junk tokens, where X is the number of +1/+1 counters on it. (They're artifacts with "{T}, Sacrifice this token: Exile the top card of your library. You may play that card this turn. Activate only as a sorcery.")
pip	Fallout	2024-03-08	137	Nuka-Cola Vending Machine	6cfb03e5-aca6-4fe2-a3f1-93e1f0cbf9e1			burst_ramp, lifegain, mana_fixing, ramp, sacrifice_support, token_support				Artifact	{3}	3			Treasure, Food		verify analyzer roles	https://scryfall.com/card/pip/137/nuka-cola-vending-machine?utm_source=api	{1}, {T}: Create a Food token. (It's an artifact with "{2}, {T}, Sacrifice this token: You gain 3 life.") Whenever you sacrifice a Food, create a tapped Treasure token. (It's an artifact with "{T}, Sacrifice this token: Add one mana of any color.")
pip	Fallout	2024-03-08	138	Nuka-Nuke Launcher	7fb88a5d-9b72-4da9-ade4-d09cadd7e1cb			artifact_support, combat_support				Artifact — Equipment	{2}	2			Equip		verify analyzer roles	https://scryfall.com/card/pip/138/nuka-nuke-launcher?utm_source=api	Equipped creature gets +3/+0 and has intimidate. (It can't be blocked except by artifact creatures and/or creatures that share a color with it.) Whenever equipped creature attacks, until the end of defending player's next turn, that player gets two rad counters whenever they cast a spell. Equip {3}
pip	Fallout	2024-03-08	139	Perception Bobblehead	f0bcdc43-c43d-4ce7-a283-b8dcab4fc497			card_selection, direct_draw, draw, mana_fixing, ramp, repeatable_advantage, repeatable_draw, scalable_spell, selection, stable_ramp				Artifact — Bobblehead	{3}	3					verify analyzer roles	https://scryfall.com/card/pip/139/perception-bobblehead?utm_source=api	{T}: Add one mana of any color. {3}, {T}: Look at the top X cards of your library, where X is the number of Bobbleheads you control. You may cast a spell with mana value 3 or less from among them without paying its mana cost. Put the rest on the bottom of your library in a random order.
pip	Fallout	2024-03-08	140	Pip-Boy 3000	1e2ee630-9d37-4396-ae18-697c1a3a4e62			artifact_support, card_draw, card_selection, combat_support, counter_support, direct_draw, draw, repeatable_advantage, repeatable_draw, selection				Artifact — Equipment	{1}	1			Check Map, Pick a Perk, Equip, Sort Inventory		verify analyzer roles	https://scryfall.com/card/pip/140/pip-boy-3000?utm_source=api	Whenever equipped creature attacks, choose one — • Sort Inventory — Draw a card, then discard a card. • Pick a Perk — Put a +1/+1 counter on that creature. • Check Map — Untap up to two target lands. Equip {2}
pip	Fallout	2024-03-08	141	Recon Craft Theta	8fba247e-9849-4a06-84ff-242894b0503a			combat_support, counter_support, token_support				Artifact — Vehicle	{4}	4			Flying, Crew, Proliferate		verify analyzer roles	https://scryfall.com/card/pip/141/recon-craft-theta?utm_source=api	Flying When this Vehicle enters, create a 0/0 blue Alien creature token. Put a +1/+1 counter on it. Whenever this Vehicle attacks, proliferate. (Choose any number of permanents and/or players, then give each another counter of each kind already there.) Crew 2
pip	Fallout	2024-03-08	142	Silver Shroud Costume	b40138c3-48bc-4825-ae48-5fea95304088			artifact_support, combat_support, self_protection				Artifact — Equipment	{2}	2			Equip, Flash		verify analyzer roles	https://scryfall.com/card/pip/142/silver-shroud-costume?utm_source=api	Flash When this Equipment enters, attach it to target creature you control. That creature gains shroud until end of turn. (It can't be the target of spells or abilities.) Equipped creature can't be blocked. Equip {3}
pip	Fallout	2024-03-08	143	Strength Bobblehead	bd0e22d1-4789-406d-9293-3ade30365b32			combat_support, counter_support, mana_fixing, ramp, scalable_spell, stable_ramp				Artifact — Bobblehead	{3}	3					verify analyzer roles	https://scryfall.com/card/pip/143/strength-bobblehead?utm_source=api	{T}: Add one mana of any color. {3}, {T}: Put X +1/+1 counters on target creature, where X is the number of Bobbleheads you control. Activate only as a sorcery.
pip	Fallout	2024-03-08	144	Survivor's Med Kit	fa08400f-b7ca-4c5c-b7ca-a6583b783878			card_draw, direct_draw, draw, lifegain, repeatable_advantage, repeatable_draw, sacrifice_support, targeted_removal, token_support				Artifact	{1}	1			Stimpak, Food, RadAway, Fancy Lads Snack Cakes		verify analyzer roles	https://scryfall.com/card/pip/144/survivors-med-kit?utm_source=api	{1}, {T}: Choose one that hasn't been chosen — • Stimpak — Draw a card. • Fancy Lads Snack Cakes — Create a Food token. (It's an artifact with "{2}, {T}, Sacrifice this token: You gain 3 life.") • RadAway — Target player loses all rad counters. Sacrifice this artifact.
pip	Fallout	2024-03-08	145	T-45 Power Armor	370aced9-d8bc-4abe-b648-4c62b5aee5ba			artifact_support, combat_support, counter_support, energy_support, lifegain				Artifact — Equipment	{2}	2			Equip		verify analyzer roles	https://scryfall.com/card/pip/145/t-45-power-armor?utm_source=api	When this Equipment enters, you get {E}{E} (two energy counters). Equipped creature gets +3/+3 and doesn't untap during its controller's untap step. At the beginning of your upkeep, you may pay {E}. If you do, untap equipped creature, then put your choice of a menace, trample, or lifelink counter on it. Equip {3}
pip	Fallout	2024-03-08	146	Desolate Mire	3edf9201-265f-4cd9-b27b-8073bf1a4cf2			land_base, land_slot, mana_fixing, mana_source, stable_ramp				Land		0		BW			verify analyzer roles	https://scryfall.com/card/pip/146/desolate-mire?utm_source=api	{1}, {T}: Add {W}{B}.
pip	Fallout	2024-03-08	147	Diamond City	88e29d50-1680-495d-be84-b92b4c9e636f			counter_support, land_base, land_slot, mana_source, replacement_engine				Land		0					verify analyzer roles	https://scryfall.com/card/pip/147/diamond-city?utm_source=api	This land enters with a shield counter on it. (If it would be dealt damage or destroyed, remove a shield counter from it instead.) {T}: Add {C}. {T}: Move a shield counter from this land onto target creature. Activate only if two or more creatures entered the battlefield under your control this turn.
pip	Fallout	2024-03-08	148	Ferrous Lake	62c15af0-40e1-407d-b056-7a3d909e3fdb			land_base, land_slot, mana_fixing, mana_source, stable_ramp				Land		0		RU			verify analyzer roles	https://scryfall.com/card/pip/148/ferrous-lake?utm_source=api	{1}, {T}: Add {U}{R}.
pip	Fallout	2024-03-08	149	HELIOS One	cfb1a656-0bf1-484d-b099-33087914250b			energy_support, land_base, land_slot, mana_source, removal, sacrifice_support, targeted_removal				Land		0					verify analyzer roles	https://scryfall.com/card/pip/149/helios-one?utm_source=api	{T}: Add {C}. {1}, {T}: You get {E} (an energy counter). {3}, {T}, Pay X {E}, Sacrifice this land: Destroy target nonland permanent with mana value X. Activate only as a sorcery.
pip	Fallout	2024-03-08	150	Junktown	c470a802-931f-4b63-92fd-ef9cf2e796dd			card_selection, direct_draw, draw, land_base, land_slot, mana_source, repeatable_advantage, repeatable_draw, sacrifice_support, selection, token_support				Land		0		R			verify analyzer roles	https://scryfall.com/card/pip/150/junktown?utm_source=api	{T}: Add {C}. {4}{R}, {T}, Sacrifice this land: Create three Junk tokens. (They're artifacts with "{T}, Sacrifice this token: Exile the top card of your library. You may play that card this turn. Activate only as a sorcery.")
pip	Fallout	2024-03-08	151	Mariposa Military Base	f1e03d99-024a-430b-9342-ffd2268bd103			card_draw, direct_draw, draw, land_base, land_slot, mana_source, repeatable_advantage, repeatable_draw				Land		0					verify analyzer roles	https://scryfall.com/card/pip/151/mariposa-military-base?utm_source=api	You may have this land enter tapped. If you do, you get two rad counters. {T}: Add {C}. {5}, {T}: Draw a card. This ability costs {1} less to activate for each rad counter you have.
pip	Fallout	2024-03-08	152	Overflowing Basin	5ac8e01c-b0a7-4855-a122-1cd26b07c4a5			land_base, land_slot, mana_fixing, mana_source, stable_ramp				Land		0		GU			verify analyzer roles	https://scryfall.com/card/pip/152/overflowing-basin?utm_source=api	{1}, {T}: Add {G}{U}.
pip	Fallout	2024-03-08	153	Sunscorched Divide	8d2b2675-19df-4f40-9e8e-196ec097b91c			land_base, land_slot, mana_fixing, mana_source, stable_ramp				Land		0		RW			verify analyzer roles	https://scryfall.com/card/pip/153/sunscorched-divide?utm_source=api	{1}, {T}: Add {R}{W}.
pip	Fallout	2024-03-08	154	Viridescent Bog	6bd6d259-1af7-4dff-a79c-48a616d2a36e			land_base, land_slot, mana_fixing, mana_source, stable_ramp				Land		0		BG			verify analyzer roles	https://scryfall.com/card/pip/154/viridescent-bog?utm_source=api	{1}, {T}: Add {B}{G}.
pip	Fallout	2024-03-08	155	All That Glitters	a4d751e0-41c1-4e90-853d-512f385acd81			combat_support				Enchantment — Aura	{1}{W}	2	W	W	Enchant		verify analyzer roles	https://scryfall.com/card/pip/155/all-that-glitters?utm_source=api	Enchant creature Enchanted creature gets +1/+1 for each artifact and/or enchantment you control.
pip	Fallout	2024-03-08	156	Austere Command	09cc8709-fe10-472a-b05c-e89f3523018d	covered		mass_removal, removal	false		Covered by PRM role audit.	Sorcery	{4}{W}{W}	6	W	W			already reviewed	https://scryfall.com/card/pip/156/austere-command?utm_source=api	Choose two — • Destroy all artifacts. • Destroy all enchantments. • Destroy all creatures with mana value 3 or less. • Destroy all creatures with mana value 4 or greater.
pip	Fallout	2024-03-08	157	Captain of the Watch	9f2af06d-8fb7-4276-bb92-3559a6d1fa18			combat_body, combat_support, combat_threat, token_support				Creature — Human Soldier	{4}{W}{W}	6	W	W	Vigilance		verify analyzer roles	https://scryfall.com/card/pip/157/captain-of-the-watch?utm_source=api	Vigilance (Attacking doesn't cause this creature to tap.) Other Soldier creatures you control get +1/+1 and have vigilance. When this creature enters, create three 1/1 white Soldier creature tokens.
pip	Fallout	2024-03-08	158	Crush Contraband	ecbc234d-e1d3-4bcc-81d4-fffc2c7ea16a			removal, targeted_removal				Instant	{3}{W}	4	W	W			verify analyzer roles	https://scryfall.com/card/pip/158/crush-contraband?utm_source=api	Choose one or both — • Exile target artifact. • Exile target enchantment.
pip	Fallout	2024-03-08	159	Dispatch	133c99c0-3652-410f-8100-68015a47af9f			removal, targeted_removal, tempo_removal				Instant	{W}	1	W	W	Metalcraft		verify analyzer roles	https://scryfall.com/card/pip/159/dispatch?utm_source=api	Tap target creature. Metalcraft — If you control three or more artifacts, exile that creature.
pip	Fallout	2024-03-08	160	Entrapment Maneuver	2244bef9-1e4e-44ed-9b27-810f04f9e611			combat_support, removal, scalable_spell, targeted_removal, token_support				Instant	{3}{W}	4	W	W			verify analyzer roles	https://scryfall.com/card/pip/160/entrapment-maneuver?utm_source=api	Target player sacrifices an attacking creature of their choice. You create X 1/1 white Soldier creature tokens, where X is that creature's toughness.
pip	Fallout	2024-03-08	161	Hour of Reckoning	3bc13640-03f8-4b19-b0a4-7e7cb5271c0c			cost_reduction, mass_removal, removal				Sorcery	{4}{W}{W}{W}	7	W	W	Convoke		verify analyzer roles	https://scryfall.com/card/pip/161/hour-of-reckoning?utm_source=api	Convoke (Your creatures can help cast this spell. Each creature you tap while casting this spell pays for {1} or one mana of that creature's color.) Destroy all nontoken creatures.
pip	Fallout	2024-03-08	162	Impassioned Orator	c7107a2d-2dcf-42e9-9ea9-d0fc0d6d2ec6			combat_body, lifegain				Creature — Human Cleric	{1}{W}	2	W	W			verify analyzer roles	https://scryfall.com/card/pip/162/impassioned-orator?utm_source=api	Whenever another creature you control enters, you gain 1 life.
pip	Fallout	2024-03-08	163	Intangible Virtue	d21c3c8f-d105-4ba9-bf69-e5f26f0f8ec5			combat_support, token_support				Enchantment	{1}{W}	2	W	W			verify analyzer roles	https://scryfall.com/card/pip/163/intangible-virtue?utm_source=api	Creature tokens you control get +1/+1 and have vigilance.
pip	Fallout	2024-03-08	164	Keeper of the Accord	49b9a3ac-d245-431a-bf40-64d1b8dc2b91	covered		combat_body, land_acceleration, land_tutor, mana_fixing, ramp, repeatable_tutor, token_support, tutor	false		Covered by PRM role audit.	Creature — Human Soldier	{3}{W}	4	W	W			already reviewed	https://scryfall.com/card/pip/164/keeper-of-the-accord?utm_source=api	At the beginning of each opponent's end step, if that player controls more creatures than you, create a 1/1 white Soldier creature token. At the beginning of each opponent's end step, if that player controls more lands than you, you may search your library for a basic Plains card, put it onto the battlefield tapped, then shuffle.
pip	Fallout	2024-03-08	165	Mantle of the Ancients	7424560f-557f-4bc9-a3e7-eb890c73aaa3			battlefield_recursion, card_selection, combat_support, mass_recursion, recursion				Enchantment — Aura	{3}{W}{W}	5	W	W	Enchant		verify analyzer roles	https://scryfall.com/card/pip/165/mantle-of-the-ancients?utm_source=api	Enchant creature you control When this Aura enters, return any number of target Aura and/or Equipment cards from your graveyard to the battlefield attached to enchanted creature. Enchanted creature gets +1/+1 for each Aura and Equipment attached to it.
pip	Fallout	2024-03-08	166	Marshal's Anthem	41fb2b0e-d0a0-4e47-a6f3-fc9860ade65a			battlefield_recursion, card_selection, combat_support, recursion, scalable_spell				Enchantment	{2}{W}{W}	4	W	W	Multikicker		verify analyzer roles	https://scryfall.com/card/pip/166/marshals-anthem?utm_source=api	Multikicker {1}{W} (You may pay an additional {1}{W} any number of times as you cast this spell.) Creatures you control get +1/+1. When this enchantment enters, return up to X target creature cards from your graveyard to the battlefield, where X is the number of times this enchantment was kicked.
pip	Fallout	2024-03-08	167	Martial Coup	2b7c4dab-e432-4b34-b058-3cec5c0d72df			combat_support, mana_sink, mass_removal, removal, scalable_spell, token_support				Sorcery	{X}{W}{W}	2	W	W			verify analyzer roles	https://scryfall.com/card/pip/167/martial-coup?utm_source=api	Create X 1/1 white Soldier creature tokens. If X is 5 or more, destroy all other creatures.
pip	Fallout	2024-03-08	168	Open the Vaults	1e9c473e-bd65-4e1f-b2ab-cac58dc581c9			battlefield_recursion, mass_recursion				Sorcery	{4}{W}{W}	6	W	W			verify analyzer roles	https://scryfall.com/card/pip/168/open-the-vaults?utm_source=api	Return all artifact and enchantment cards from all graveyards to the battlefield under their owners' control. (Auras with nothing to enchant remain in graveyards.)
pip	Fallout	2024-03-08	169	Path to Exile	d683d985-9888-4d21-8b5f-69e69ce4a03b	covered		land_acceleration, land_tutor, mana_fixing, ramp, removal, targeted_removal, tutor	false		Covered by PRM role audit.	Instant	{W}	1	W	W			already reviewed	https://scryfall.com/card/pip/169/path-to-exile?utm_source=api	Exile target creature. Its controller may search their library for a basic land card, put that card onto the battlefield tapped, then shuffle.
pip	Fallout	2024-03-08	170	Puresteel Paladin	74a62c7b-4753-4af2-b7a1-9a4ae8988801			card_draw, combat_body, direct_draw, draw, repeatable_advantage, repeatable_draw				Creature — Human Knight	{W}{W}	2	W	W	Metalcraft		verify analyzer roles	https://scryfall.com/card/pip/170/puresteel-paladin?utm_source=api	Whenever an Equipment you control enters, you may draw a card. Metalcraft — Equipment you control have equip {0} as long as you control three or more artifacts.
pip	Fallout	2024-03-08	171	Secure the Wastes	b2347910-d6c6-4681-8316-7ef27056485c			combat_support, mana_sink, scalable_spell, token_support				Instant	{X}{W}	1	W	W			verify analyzer roles	https://scryfall.com/card/pip/171/secure-the-wastes?utm_source=api	Create X 1/1 white Warrior creature tokens.
pip	Fallout	2024-03-08	172	Single Combat	822ef47e-3f1b-40a6-8c5c-fea3d7deba5b			hate_piece, stax_piece, targeted_removal				Sorcery	{3}{W}{W}	5	W	W			verify analyzer roles	https://scryfall.com/card/pip/172/single-combat?utm_source=api	Each player chooses a creature or planeswalker they control, then sacrifices the rest. Players can't cast creature or planeswalker spells until the end of your next turn.
pip	Fallout	2024-03-08	173	Swords to Plowshares	b1544f21-7e98-461b-aed5-e748b0168c52	covered	lifegain, removal, targeted_removal	removal, targeted_removal	false		Covered by Ice Age role audit.	Instant	{W}	1	W	W			already reviewed	https://scryfall.com/card/pip/173/swords-to-plowshares?utm_source=api	Exile target creature. Its controller gains life equal to its power.
pip	Fallout	2024-03-08	174	Valorous Stance	1f938353-9081-4dc1-b8e7-d18ece038bd4	covered		combat_support, protection, removal, self_protection, targeted_protection, targeted_removal	false		Covered by PRM role audit.	Instant	{1}{W}	2	W	W			already reviewed	https://scryfall.com/card/pip/174/valorous-stance?utm_source=api	Choose one — • Target creature gains indestructible until end of turn. (Damage and effects that say "destroy" don't destroy it.) • Destroy target creature with toughness 4 or greater.
pip	Fallout	2024-03-08	175	Fraying Sanity	ab4e9284-7904-413e-97b0-69793be79cc5			alternate_finisher, mill_support, scalable_spell				Enchantment — Aura Curse	{2}{U}	3	U	U	Enchant, Mill		verify analyzer roles	https://scryfall.com/card/pip/175/fraying-sanity?utm_source=api	Enchant player At the beginning of each end step, enchanted player mills X cards, where X is the number of cards put into their graveyard from anywhere this turn.
pip	Fallout	2024-03-08	176	Glimmer of Genius	b9c58cfb-b7d5-4e86-a5d3-efb07192aa22			card_draw, card_selection, direct_draw, draw, energy_support, selection				Instant	{3}{U}	4	U	U	Scry		verify analyzer roles	https://scryfall.com/card/pip/176/glimmer-of-genius?utm_source=api	Scry 2, then draw two cards. You get {E}{E} (two energy counters).
pip	Fallout	2024-03-08	177	Inexorable Tide	40ec0a47-badf-4074-b0a8-749bb7c17b95			counter_support				Enchantment	{3}{U}{U}	5	U	U	Proliferate		verify analyzer roles	https://scryfall.com/card/pip/177/inexorable-tide?utm_source=api	Whenever you cast a spell, proliferate. (Choose any number of permanents and/or players, then give each another counter of each kind already there.)
pip	Fallout	2024-03-08	178	Mechanized Production	39d8406a-90c3-460c-b4e8-0f590573db51			alternate_finisher, artifact_support, copy_support, finisher, repeatable_finisher, token_support				Enchantment — Aura	{2}{U}{U}	4	U	U	Enchant		verify analyzer roles	https://scryfall.com/card/pip/178/mechanized-production?utm_source=api	Enchant artifact you control At the beginning of your upkeep, create a token that's a copy of enchanted artifact. Then if you control eight or more artifacts with the same name as one another, you win the game.
pip	Fallout	2024-03-08	179	One with the Machine	757eadac-dd29-4a7f-8683-5bc823168326			artifact_support, card_draw, direct_draw, draw				Sorcery	{3}{U}	4	U	U			verify analyzer roles	https://scryfall.com/card/pip/179/one-with-the-machine?utm_source=api	Draw cards equal to the greatest mana value among artifacts you control.
pip	Fallout	2024-03-08	180	Thirst for Knowledge	939e6f71-185e-41f2-9d54-72cce06f1dce	covered		card_draw, direct_draw, draw	false		Covered by PRM role audit.	Instant	{2}{U}	3	U	U			already reviewed	https://scryfall.com/card/pip/180/thirst-for-knowledge?utm_source=api	Draw three cards. Then discard two cards unless you discard an artifact card.
pip	Fallout	2024-03-08	181	Whirler Rogue	7060f2c8-fca0-4b7a-bddf-37682f434596			artifact_support, combat_body, combat_support, token_support				Creature — Human Rogue Artificer	{2}{U}{U}	4	U	U			verify analyzer roles	https://scryfall.com/card/pip/181/whirler-rogue?utm_source=api	When this creature enters, create two 1/1 colorless Thopter artifact creature tokens with flying. Tap two untapped artifacts you control: Target creature can't be blocked this turn.
pip	Fallout	2024-03-08	182	Bastion of Remembrance	c7f33cea-2ec8-4081-9208-a5b1d86721b3			direct_finisher, finisher, lifegain, repeatable_finisher, sacrifice_support, token_support				Enchantment	{2}{B}	3	B	B			verify analyzer roles	https://scryfall.com/card/pip/182/bastion-of-remembrance?utm_source=api	When this enchantment enters, create a 1/1 white Human Soldier creature token. Whenever a creature you control dies, each opponent loses 1 life and you gain 1 life.
pip	Fallout	2024-03-08	183	Black Market	21338b71-37f5-4121-9b84-565025ebcd17	covered		counter_support, sacrifice_support, stable_ramp	false		Covered by MMQ role audit.	Enchantment	{3}{B}{B}	5	B	B			already reviewed	https://scryfall.com/card/pip/183/black-market?utm_source=api	Whenever a creature dies, put a charge counter on this enchantment. At the beginning of your first main phase, add {B} for each charge counter on this enchantment.
pip	Fallout	2024-03-08	184	Deadly Dispute	457af74a-02b3-4659-846d-63e482667f34			burst_ramp, card_draw, direct_draw, draw, mana_fixing, ramp, sacrifice_support, token_support				Instant	{1}{B}	2	B	B	Treasure		verify analyzer roles	https://scryfall.com/card/pip/184/deadly-dispute?utm_source=api	As an additional cost to cast this spell, sacrifice an artifact or creature. Draw two cards and create a Treasure token. (It's an artifact with "{T}, Sacrifice this token: Add one mana of any color.")
pip	Fallout	2024-03-08	185	Lethal Scheme	c4660b3c-a234-4a3e-83e7-e2fa9d556685			card_draw, card_selection, cost_reduction, counter_support, direct_draw, draw, removal, selection, targeted_removal				Instant	{2}{B}{B}	4	B	B	Connive, Convoke		verify analyzer roles	https://scryfall.com/card/pip/185/lethal-scheme?utm_source=api	Convoke (Your creatures can help cast this spell. Each creature you tap while casting this spell pays for {1} or one mana of that creature's color.) Destroy target creature or planeswalker. Each creature that convoked this spell connives. (Draw a card, then discard a card. If you discarded a nonland card, put a +1/+1 counter on that creature.)
pip	Fallout	2024-03-08	186	Morbid Opportunist	322f44f0-e6da-4ee0-b474-e7d5e9a461c5			card_draw, combat_body, direct_draw, draw, repeatable_advantage, repeatable_draw				Creature — Human Rogue	{2}{B}	3	B	B			verify analyzer roles	https://scryfall.com/card/pip/186/morbid-opportunist?utm_source=api	Whenever one or more other creatures die, draw a card. This ability triggers only once each turn.
pip	Fallout	2024-03-08	187	Pitiless Plunderer	a784481f-eccb-4112-bb38-04a659319660			burst_ramp, combat_body, mana_fixing, ramp, sacrifice_support, token_support				Creature — Human Pirate	{3}{B}	4	B	B	Treasure		verify analyzer roles	https://scryfall.com/card/pip/187/pitiless-plunderer?utm_source=api	Whenever another creature you control dies, create a Treasure token. (It's an artifact with "{T}, Sacrifice this token: Add one mana of any color.")
pip	Fallout	2024-03-08	188	Blasphemous Act	7a2484a9-04fd-41a0-8224-610c1c07ed10	covered		mass_removal, removal	false		Covered by PRM role audit.	Sorcery	{8}{R}	9	R	R			already reviewed	https://scryfall.com/card/pip/188/blasphemous-act?utm_source=api	This spell costs {1} less to cast for each creature on the battlefield. Blasphemous Act deals 13 damage to each creature.
pip	Fallout	2024-03-08	189	Chaos Warp	07a0cba9-8768-4fd9-a3d5-b0f83b4bf8e8	covered		removal, targeted_removal	false		Covered by PRM role audit.	Instant	{2}{R}	3	R	R			already reviewed	https://scryfall.com/card/pip/189/chaos-warp?utm_source=api	The owner of target permanent shuffles it into their library, then reveals the top card of their library. If it's a permanent card, they put it onto the battlefield.
pip	Fallout	2024-03-08	190	Loyal Apprentice	7f268b15-ac92-4e98-821b-78d15d9285d9			combat_body, combat_threat, token_support				Creature — Human Artificer	{1}{R}	2	R	R	Haste, Lieutenant		verify analyzer roles	https://scryfall.com/card/pip/190/loyal-apprentice?utm_source=api	Haste Lieutenant — At the beginning of combat on your turn, if you control your commander, create a 1/1 colorless Thopter artifact creature token with flying. That token gains haste until end of turn.
pip	Fallout	2024-03-08	191	Sticky Fingers	fa8ddc13-5108-4fe9-b3aa-dc28df476f7b			burst_ramp, card_draw, combat_support, direct_draw, draw, mana_fixing, ramp, sacrifice_support, stable_ramp, token_support				Enchantment — Aura	{R}	1	R	R	Treasure, Enchant		verify analyzer roles	https://scryfall.com/card/pip/191/sticky-fingers?utm_source=api	Enchant creature Enchanted creature has menace and "Whenever this creature deals combat damage to a player, create a Treasure token." (It can't be blocked except by two or more creatures. The token is an artifact with "{T}, Sacrifice this token: Add one mana of any color.") When enchanted creature dies, draw a card.
