setCode	setName	releasedAt	collectorNumber	name	oracleId	auditStatus	expectedRoles	actualAnalyzerRoles	needsCodeChange	tagDecision	manualNotes	typeLine	manaCost	manaValue	colors	colorIdentity	keywords	scryfallOracleTags	attentionHint	scryfallUrl	oracleText
ps15	San Diego Comic-Con 2015	2015-07-09	23	Kytheon, Hero of Akros // Gideon, Battle-Forged	e49d745c-5130-4b54-bcbb-643b08528456	covered	broad_protection, combat_body, combat_support, protection, self_protection, targeted_protection	broad_protection, combat_body, combat_support, protection, self_protection, targeted_protection	false		Analyzer roles accepted during batch clean pass.	Legendary Creature — Human Soldier // Legendary Planeswalker — Gideon		1		W	Transform		verify analyzer roles	https://scryfall.com/card/ps15/23/kytheon-hero-of-akros-gideon-battle-forged?utm_source=api	Kytheon, Hero of Akros: At end of combat, if Kytheon and at least two other creatures attacked this combat, exile Kytheon, then return him to the battlefield transformed under his owner's control. {2}{W}: Kytheon gains indestructible until end of turn. // Gideon, Battle-Forged: +2: Up to one target creature an opponent controls attacks Gideon during its controller's next turn if able. +1: Until your next turn, target creature gains indestructible. Untap that creature. 0: Until end of turn, Gideon becomes a 4/4 Human Soldier creature with indestructible that's still a planeswalker. Prevent all damage that would be dealt to him this turn.
ps15	San Diego Comic-Con 2015	2015-07-09	60	Jace, Vryn's Prodigy // Jace, Telepath Unbound	594f6881-c059-46f8-aa4e-7151d502de73	covered	card_draw, card_selection, combat_body, direct_draw, draw, mill_support, recursion, repeatable_advantage, repeatable_draw, replacement_engine, replay_recursion, selection, targeted_removal	card_draw, card_selection, combat_body, direct_draw, draw, mill_support, recursion, repeatable_advantage, repeatable_draw, replacement_engine, replay_recursion, selection, targeted_removal	false		Analyzer roles accepted during batch clean pass.	Legendary Creature — Human Wizard // Legendary Planeswalker — Jace		2		U	Transform, Mill		verify analyzer roles	https://scryfall.com/card/ps15/60/jace-vryns-prodigy-jace-telepath-unbound?utm_source=api	Jace, Vryn's Prodigy: {T}: Draw a card, then discard a card. If there are five or more cards in your graveyard, exile Jace, then return him to the battlefield transformed under his owner's control. // Jace, Telepath Unbound: +1: Up to one target creature gets -2/-0 until your next turn. −3: You may cast target instant or sorcery card from your graveyard this turn. If that spell would be put into your graveyard, exile it instead. −9: You get an emblem with "Whenever you cast a spell, target opponent mills five cards."
ps15	San Diego Comic-Con 2015	2015-07-09	106	Liliana, Heretical Healer // Liliana, Defiant Necromancer	b96a8ad2-3d86-459b-a34f-19c9dc07c3c4	covered	battlefield_recursion, card_selection, combat_body, combat_threat, hand_attack, lifegain, recursion, repeatable_advantage, sacrifice_support, token_support	battlefield_recursion, card_selection, combat_body, combat_threat, hand_attack, lifegain, recursion, repeatable_advantage, sacrifice_support, token_support	false		Analyzer roles accepted during batch clean pass.	Legendary Creature — Human Cleric // Legendary Planeswalker — Liliana		3		B	Lifelink, Transform		verify analyzer roles	https://scryfall.com/card/ps15/106/liliana-heretical-healer-liliana-defiant-necromancer?utm_source=api	Liliana, Heretical Healer: Lifelink Whenever another nontoken creature you control dies, exile Liliana, Heretical Healer, then return her to the battlefield transformed under her owner's control. If you do, create a 2/2 black Zombie creature token. // Liliana, Defiant Necromancer: +2: Each player discards a card. −X: Return target nonlegendary creature card with mana value X from your graveyard to the battlefield. −8: You get an emblem with "Whenever a creature dies, return it to the battlefield under your control at the beginning of the next end step."
ps15	San Diego Comic-Con 2015	2015-07-09	135	Chandra, Fire of Kaladesh // Chandra, Roaring Flame	6f6b8e14-c247-4dfd-8b39-38c7a5f2f354	covered	combat_body, direct_finisher, finisher, repeatable_finisher, targeted_removal	combat_body, direct_finisher, finisher, repeatable_finisher, targeted_removal	false		Analyzer roles accepted during batch clean pass.	Legendary Creature — Human Shaman // Legendary Planeswalker — Chandra		3		R	Transform		verify analyzer roles	https://scryfall.com/card/ps15/135/chandra-fire-of-kaladesh-chandra-roaring-flame?utm_source=api	Chandra, Fire of Kaladesh: Whenever you cast a red spell, untap Chandra. {T}: Chandra deals 1 damage to target player or planeswalker. If Chandra has dealt 3 or more damage this turn, exile her, then return her to the battlefield transformed under her owner's control. // Chandra, Roaring Flame: +1: Chandra deals 2 damage to target player or planeswalker. −2: Chandra deals 2 damage to target creature. −7: Chandra deals 6 damage to each opponent. Each player dealt damage this way gets an emblem with "At the beginning of your upkeep, this emblem deals 3 damage to you."
ps15	San Diego Comic-Con 2015	2015-07-09	189	Nissa, Vastwood Seer // Nissa, Sage Animist	35754a21-9fba-4370-a254-292918a777ba	covered	card_selection, combat_body, land_acceleration, land_tutor, mana_fixing, ramp, token_support, tutor	card_selection, combat_body, land_acceleration, land_tutor, mana_fixing, ramp, token_support, tutor	false		Analyzer roles accepted during batch clean pass.	Legendary Creature — Elf Scout // Legendary Planeswalker — Nissa		3		G	Transform		verify analyzer roles	https://scryfall.com/card/ps15/189/nissa-vastwood-seer-nissa-sage-animist?utm_source=api	Nissa, Vastwood Seer: When Nissa enters, you may search your library for a basic Forest card, reveal it, put it into your hand, then shuffle. Whenever a land you control enters, if you control seven or more lands, exile Nissa, then return her to the battlefield transformed under her owner's control. // Nissa, Sage Animist: +1: Reveal the top card of your library. If it's a land card, put it onto the battlefield. Otherwise, put it into your hand. −2: Create Ashaya, the Awoken World, a legendary 4/4 green Elemental creature token. −7: Untap up to six target lands. They become 6/6 Elemental creatures. They're still lands.
