setCode	setName	releasedAt	collectorNumber	name	oracleId	auditStatus	expectedRoles	actualAnalyzerRoles	needsCodeChange	tagDecision	manualNotes	typeLine	manaCost	manaValue	colors	colorIdentity	keywords	scryfallOracleTags	attentionHint	scryfallUrl	oracleText
ps19	San Diego Comic-Con 2019	2019-07-18	16	God-Eternal Oketra	3b03358d-f87e-4939-afc9-5ee3f044146a	covered	combat_body, combat_threat, multiplier_support, replacement_engine, sacrifice_support, token_support	combat_body, combat_threat, multiplier_support, replacement_engine, sacrifice_support, token_support	false		Analyzer roles accepted during batch clean pass.	Legendary Creature — Zombie God	{3}{W}{W}	5	W	W	Double strike		verify analyzer roles	https://scryfall.com/card/ps19/16/god-eternal-oketra?utm_source=api	Double strike Whenever you cast a creature spell, create a 4/4 black Zombie Warrior creature token with vigilance. When God-Eternal Oketra dies or is put into exile from the battlefield, you may put it into its owner's library third from the top.
ps19	San Diego Comic-Con 2019	2019-07-18	53	God-Eternal Kefnet	41d11144-32fc-4e45-a8db-3edb9dc0ce80	covered	card_selection, combat_body, combat_threat, cost_reduction, repeatable_advantage, sacrifice_support	card_selection, combat_body, combat_threat, cost_reduction, repeatable_advantage, sacrifice_support	false		Analyzer roles accepted during batch clean pass.	Legendary Creature — Zombie God	{2}{U}{U}	4	U	U	Flying		verify analyzer roles	https://scryfall.com/card/ps19/53/god-eternal-kefnet?utm_source=api	Flying You may reveal the first card you draw each turn as you draw it. Whenever you reveal an instant or sorcery card this way, copy that card and you may cast the copy. That copy costs {2} less to cast. When God-Eternal Kefnet dies or is put into exile from the battlefield, you may put it into its owner's library third from the top.
ps19	San Diego Comic-Con 2019	2019-07-18	92	God-Eternal Bontu	183891b0-b5ec-47f4-8d09-b9d3cfc4e7f1	covered	card_draw, combat_body, combat_threat, sacrifice_support	card_draw, combat_body, combat_threat, sacrifice_support	false		Analyzer roles accepted during batch clean pass.	Legendary Creature — Zombie God	{3}{B}{B}	5	B	B	Menace		verify analyzer roles	https://scryfall.com/card/ps19/92/god-eternal-bontu?utm_source=api	Menace When God-Eternal Bontu enters, sacrifice any number of other permanents, then draw that many cards. When God-Eternal Bontu dies or is put into exile from the battlefield, you may put it into its owner's library third from the top.
ps19	San Diego Comic-Con 2019	2019-07-18	163	God-Eternal Rhonas	fc4f2cdb-966c-4576-8b37-b3d138f5710e	covered	combat_body, combat_support, combat_threat, multiplier_support, replacement_engine, sacrifice_support	combat_body, combat_support, combat_threat, multiplier_support, replacement_engine, sacrifice_support	false		Analyzer roles accepted during batch clean pass.	Legendary Creature — Zombie God	{3}{G}{G}	5	G	G	Double, Deathtouch		verify analyzer roles	https://scryfall.com/card/ps19/163/god-eternal-rhonas?utm_source=api	Deathtouch When God-Eternal Rhonas enters, double the power of each other creature you control until end of turn. Those creatures gain vigilance until end of turn. When God-Eternal Rhonas dies or is put into exile from the battlefield, you may put it into its owner's library third from the top.
ps19	San Diego Comic-Con 2019	2019-07-18	207	Nicol Bolas, Dragon-God	581eedc4-efe4-4ae4-baf2-88071e7e6f6d	covered		card_draw, direct_draw, draw, removal, repeatable_advantage, targeted_removal	false		Covered by PRM role audit.	Legendary Planeswalker — Bolas	{U}{B}{B}{B}{R}	5	BRU	BRU			already reviewed	https://scryfall.com/card/ps19/207/nicol-bolas-dragon-god?utm_source=api	Nicol Bolas has all loyalty abilities of all other planeswalkers on the battlefield. +1: You draw a card. Each opponent exiles a card from their hand or a permanent they control. −3: Destroy target creature or planeswalker. −8: Each opponent who doesn't control a legendary creature or planeswalker loses the game.
