setCode	setName	releasedAt	collectorNumber	name	oracleId	auditStatus	expectedRoles	actualAnalyzerRoles	needsCodeChange	tagDecision	manualNotes	typeLine	manaCost	manaValue	colors	colorIdentity	keywords	scryfallOracleTags	attentionHint	scryfallUrl	oracleText
pw21	Wizards Play Network 2021	2021-06-18	1	Arbor Elf	4567a528-75f0-4ea6-b927-3a500caf76ac	covered	combat_body, stable_ramp	combat_body, stable_ramp	false		Analyzer roles accepted during batch clean pass.	Creature — Elf Druid	{G}	1	G	G			verify analyzer roles	https://scryfall.com/card/pw21/1/arbor-elf?utm_source=api	{T}: Untap target Forest.
pw21	Wizards Play Network 2021	2021-06-18	2	Collected Company	0bbcb563-09b3-499d-a9cc-3a6d7501dd81	covered	card_selection, draw, restricted_tutor, selection, tutor	card_selection, draw, restricted_tutor, selection, tutor	false		Analyzer roles accepted during batch clean pass.	Instant	{3}{G}	4	G	G			verify analyzer roles	https://scryfall.com/card/pw21/2/collected-company?utm_source=api	Look at the top six cards of your library. Put up to two creature cards with mana value 3 or less from among them onto the battlefield. Put the rest on the bottom of your library in any order.
pw21	Wizards Play Network 2021	2021-06-18	3	Wurmcoil Engine	d1a60f44-7696-49ee-91fb-cab5b3102962	covered		combat_body, combat_threat, lifegain, sacrifice_support, token_support	false		Covered by PRM role audit.	Artifact Creature — Phyrexian Wurm	{6}	6			Lifelink, Deathtouch		already reviewed	https://scryfall.com/card/pw21/3/wurmcoil-engine?utm_source=api	Deathtouch, lifelink When this creature dies, create a 3/3 colorless Phyrexian Wurm artifact creature token with deathtouch and a 3/3 colorless Phyrexian Wurm artifact creature token with lifelink.
pw21	Wizards Play Network 2021	2021-06-18	4	Fabled Passage	0c85b8f7-0bd0-4680-9ec5-d4b110460a54	covered		land_acceleration, land_base, land_slot, land_tutor, mana_fixing, ramp, sacrifice_support, tutor	false		Covered by PRM role audit.	Land		0					already reviewed	https://scryfall.com/card/pw21/4/fabled-passage?utm_source=api	{T}, Sacrifice this land: Search your library for a basic land card, put it onto the battlefield tapped, then shuffle. Then if you control four or more lands, untap that land.
pw21	Wizards Play Network 2021	2021-06-18	5	Mind Stone	c97361b5-af16-4a7b-af85-a429dbaf4ad2	covered	card_draw, direct_draw, draw, ramp, repeatable_advantage, repeatable_draw, sacrifice_support, stable_ramp	card_draw, direct_draw, draw, ramp, repeatable_advantage, repeatable_draw, sacrifice_support, stable_ramp	false		Covered by Weatherlight role audit.	Artifact	{2}	2					already reviewed	https://scryfall.com/card/pw21/5/mind-stone?utm_source=api	{T}: Add {C}. {1}, {T}, Sacrifice this artifact: Draw a card.
pw21	Wizards Play Network 2021	2021-06-18	6	Conjurer's Closet	cd1eda60-53e4-44d0-9b2c-7a57395e291f	covered	flicker, protection, rescue_protection	flicker, protection, rescue_protection	false		Analyzer roles accepted during batch clean pass.	Artifact	{5}	5					verify analyzer roles	https://scryfall.com/card/pw21/6/conjurers-closet?utm_source=api	At the beginning of your end step, you may exile target creature you control, then return that card to the battlefield under your control.
