setCode	setName	releasedAt	collectorNumber	name	oracleId	auditStatus	expectedRoles	actualAnalyzerRoles	needsCodeChange	tagDecision	manualNotes	typeLine	manaCost	manaValue	colors	colorIdentity	keywords	scryfallOracleTags	attentionHint	scryfallUrl	oracleText
pw24	Wizards Play Network 2024	2024-01-01	1	Serra Angel	4b7ac066-e5c7-43e6-9e7e-2739b24a905d	covered	combat_body, combat_threat	combat_body, combat_threat	false		Covered by ATH role audit.	Creature — Angel	{3}{W}{W}	5	W	W	Flying, Vigilance		already reviewed	https://scryfall.com/card/pw24/1/serra-angel?utm_source=api	Flying Vigilance (Attacking doesn't cause this creature to tap.)
pw24	Wizards Play Network 2024	2024-01-01	2	Lord of Atlantis	cc7f290f-ca00-4285-9bdb-4b4402444f30	covered	combat_body, combat_support	combat_body, combat_support, landwalk_support	false		Covered by 6ED role audit.	Creature — Merfolk	{U}{U}	2	U	U			already reviewed	https://scryfall.com/card/pw24/2/lord-of-atlantis?utm_source=api	Other Merfolk get +1/+1 and have islandwalk. (They can't be blocked as long as defending player controls an Island.)
pw24	Wizards Play Network 2024	2024-01-01	3	Zombie Master	5446c92f-ff22-4e9b-a2f6-e64c8560c1e0	covered	combat_body, combat_support	combat_body, combat_support, landwalk_support	false		Covered by 6ED role audit.	Creature — Zombie	{1}{B}{B}	3	B	B	Regenerate		already reviewed	https://scryfall.com/card/pw24/3/zombie-master?utm_source=api	Other Zombie creatures have swampwalk. (They can't be blocked as long as defending player controls a Swamp.) Other Zombies have "{B}: Regenerate this permanent."
pw24	Wizards Play Network 2024	2024-01-01	4	Goblin King	d236b3fc-0d3f-4d99-875d-e32a33fe5767	covered	combat_body, combat_support	combat_body, combat_support, landwalk_support	false		Covered by ATH role audit.	Creature — Goblin	{1}{R}{R}	3	R	R			already reviewed	https://scryfall.com/card/pw24/4/goblin-king?utm_source=api	Other Goblins get +1/+1 and have mountainwalk.
pw24	Wizards Play Network 2024	2024-01-01	5	Gaea's Liege	8d134a60-e1e5-4163-8bdc-36af91567185	covered	combat_body, combat_support	combat_body, combat_support	false			Creature — Avatar	{3}{G}{G}{G}	6	G	G			already reviewed	https://scryfall.com/card/pw24/5/gaeas-liege?utm_source=api	As long as Gaea's Liege isn't attacking, its power and toughness are each equal to the number of Forests you control. As long as Gaea's Liege is attacking, its power and toughness are each equal to the number of Forests defending player controls. {T}: Target land becomes a Forest until this creature leaves the battlefield.
pw24	Wizards Play Network 2024	2024-01-01	7	Chaos Warp	07a0cba9-8768-4fd9-a3d5-b0f83b4bf8e8	covered		removal, targeted_removal	false		Covered by PRM role audit.	Instant	{2}{R}	3	R	R			already reviewed	https://scryfall.com/card/pw24/7/chaos-warp?utm_source=api	The owner of target permanent shuffles it into their library, then reveals the top card of their library. If it's a permanent card, they put it onto the battlefield.
pw24	Wizards Play Network 2024	2024-01-01	8	Commander's Sphere	0b67c4e2-f88b-4e01-85a1-9d5f5b8db13b	covered		card_draw, direct_draw, draw, mana_fixing, ramp, repeatable_draw, sacrifice_support, stable_ramp	false		Covered by PRM role audit.	Artifact	{3}	3					already reviewed	https://scryfall.com/card/pw24/8/commanders-sphere?utm_source=api	{T}: Add one mana of any color in your commander's color identity. Sacrifice this artifact: Draw a card.
pw24	Wizards Play Network 2024	2024-01-01	9	Underworld Connections	39c10798-9dfc-47a2-9da3-b4038509aebe	covered	card_draw, direct_draw, draw, repeatable_advantage, repeatable_draw	card_draw, direct_draw, draw, repeatable_advantage, repeatable_draw	false		Analyzer roles accepted during batch clean pass.	Enchantment — Aura	{1}{B}{B}	3	B	B	Enchant		verify analyzer roles	https://scryfall.com/card/pw24/9/underworld-connections?utm_source=api	Enchant land Enchanted land has "{T}, Pay 1 life: Draw a card."
pw24	Wizards Play Network 2024	2024-01-01	10	Rogue's Passage	f29dc596-2121-4421-8463-15f6c2e8b9b3	covered	combat_support, land_base, land_slot, mana_source	combat_support, land_base, land_slot, mana_source	false		Analyzer roles accepted during batch clean pass.	Land		0					verify analyzer roles	https://scryfall.com/card/pw24/10/rogues-passage?utm_source=api	{T}: Add {C}. {4}, {T}: Target creature can't be blocked this turn.
pw24	Wizards Play Network 2024	2024-01-01	11	Transmutation Font	a68e57f3-f138-4c26-b8d5-55d1adec44a8	covered	card_draw, cheat_into_play, cost_reduction, repeatable_advantage, repeatable_tutor, restricted_tutor, sacrifice_support, token_support, tutor	card_draw, cheat_into_play, cost_reduction, repeatable_advantage, repeatable_tutor, restricted_tutor, sacrifice_support, token_support, tutor	false		Analyzer roles accepted during batch clean pass.	Artifact	{5}	5			Food		verify analyzer roles	https://scryfall.com/card/pw24/11/transmutation-font?utm_source=api	{T}: Create your choice of a Blood token, a Clue token, or a Food token. {3}, {T}, Sacrifice three artifact tokens with different names: Search your library for an artifact card, put it onto the battlefield, then shuffle. Activate only as a sorcery.
pw24	Wizards Play Network 2024	2024-01-01	12	Oltec Matterweaver	3cb91696-242f-4e91-806b-61b1bb45a20c	covered	combat_body, copy_support, token_support	combat_body, copy_support, token_support	false		Analyzer roles accepted during batch clean pass.	Creature — Human Artificer	{2}{W}	3	W	W			verify analyzer roles	https://scryfall.com/card/pw24/12/oltec-matterweaver?utm_source=api	Whenever you cast a creature spell, choose one — • Create a 1/1 colorless Gnome artifact creature token. • Create a token that's a copy of target artifact token you control.
pw24	Wizards Play Network 2024	2024-01-01	13	Diabolic Tutor	14589b6b-1814-46f9-a364-83cc15dacac2	covered		direct_tutor, tutor	false		Covered by ODY role audit.	Sorcery	{2}{B}{B}	4	B	B			already reviewed	https://scryfall.com/card/pw24/13/diabolic-tutor?utm_source=api	Search your library for a card, put that card into your hand, then shuffle.
pw24	Wizards Play Network 2024	2024-01-01	14	Costly Plunder	8cdfd9df-4783-4138-a286-828a97f516aa	covered	card_draw, direct_draw, draw, sacrifice_support	card_draw, direct_draw, draw, sacrifice_support	false		Analyzer roles accepted during batch clean pass.	Instant	{1}{B}	2	B	B			verify analyzer roles	https://scryfall.com/card/pw24/14/costly-plunder?utm_source=api	As an additional cost to cast this spell, sacrifice an artifact or creature. Draw two cards.
pw24	Wizards Play Network 2024	2024-01-01	15	Ravenous Squirrel	8fb48d65-406b-4231-83ea-9cf3bb8dff76	covered	card_draw, combat_body, counter_support, direct_draw, draw, lifegain, repeatable_advantage, repeatable_draw, sacrifice_support	card_draw, combat_body, counter_support, direct_draw, draw, lifegain, repeatable_advantage, repeatable_draw, sacrifice_support	false		Analyzer roles accepted during batch clean pass.	Creature — Squirrel	{B/G}	1	BG	BG			verify analyzer roles	https://scryfall.com/card/pw24/15/ravenous-squirrel?utm_source=api	Whenever you sacrifice an artifact or creature, put a +1/+1 counter on this creature. {1}{B}{G}, Sacrifice an artifact or creature: You gain 1 life and draw a card.
pw24	Wizards Play Network 2024	2024-01-01	16	Heirloom Blade	7c3a8766-e440-48c5-a561-197490efdba5	covered	artifact_support, card_draw, card_selection, combat_support, draw, repeatable_advantage, repeatable_tutor, restricted_tutor, sacrifice_support, selection, tutor	artifact_support, card_draw, card_selection, combat_support, draw, repeatable_advantage, repeatable_tutor, restricted_tutor, sacrifice_support, selection, tutor	false		Analyzer roles accepted during batch clean pass.	Artifact — Equipment	{3}	3			Equip		verify analyzer roles	https://scryfall.com/card/pw24/16/heirloom-blade?utm_source=api	Equipped creature gets +3/+1. Whenever equipped creature dies, you may reveal cards from the top of your library until you reveal a creature card that shares a creature type with it. Put that card into your hand and the rest on the bottom of your library in a random order. Equip {1}
pw24	Wizards Play Network 2024	2024-01-01	17	Crippling Fear	e7a7ba65-ad14-41d5-889b-9bbeae9ab3f7	covered		mass_removal, removal	false		Covered by PRM role audit.	Sorcery	{2}{B}{B}	4	B	B			already reviewed	https://scryfall.com/card/pw24/17/crippling-fear?utm_source=api	Choose a creature type. Creatures that aren't of the chosen type get -3/-3 until end of turn.
pw24	Wizards Play Network 2024	2024-01-01	18	Night's Whisper	7ffae8f8-3006-4969-a339-6d30678f87ea	covered	card_draw, direct_draw, draw	card_draw, direct_draw, draw	false		Analyzer roles accepted during batch clean pass.	Sorcery	{1}{B}	2	B	B			verify analyzer roles	https://scryfall.com/card/pw24/18/nights-whisper?utm_source=api	You draw two cards and lose 2 life.
pw24	Wizards Play Network 2024	2024-01-01	19	Darksteel Colossus	1b09d0cf-403c-4a15-aeee-602a1bdaf0c1	covered	combat_body, combat_support, combat_threat, replacement_engine, self_protection	combat_body, combat_support, combat_threat, replacement_engine, self_protection	false		Analyzer roles accepted during batch clean pass.	Artifact Creature — Golem	{11}	11			Indestructible, Trample		verify analyzer roles	https://scryfall.com/card/pw24/19/darksteel-colossus?utm_source=api	Trample (This creature can deal excess combat damage to the player or planeswalker it's attacking.) Indestructible (Damage and effects that say "destroy" don't destroy this creature.) If Darksteel Colossus would be put into a graveyard from anywhere, reveal Darksteel Colossus and shuffle it into its owner's library instead.
