setCode	setName	releasedAt	collectorNumber	name	oracleId	auditStatus	expectedRoles	actualAnalyzerRoles	needsCodeChange	tagDecision	manualNotes	typeLine	manaCost	manaValue	colors	colorIdentity	keywords	scryfallOracleTags	attentionHint	scryfallUrl	oracleText
pz2	Treasure Chest	2016-11-16	70721	Loyal Guardian	de1cfa83-2049-48ab-b093-2f120a3ef4f2			combat_body, combat_threat, counter_support				Creature — Rhino	{4}{G}	5	G	G	Trample, Lieutenant		verify analyzer roles	https://scryfall.com/card/pz2/70721/loyal-guardian?utm_source=api	Trample Lieutenant — At the beginning of combat on your turn, if you control your commander, put a +1/+1 counter on each creature you control.
pz2	Treasure Chest	2016-11-16	70723	Reality Scramble	afad2e76-4b53-4884-8f96-ba68b0808990			card_draw, card_selection, draw, restricted_tutor, selection, tutor				Sorcery	{2}{R}{R}	4	R	R	Retrace		verify analyzer roles	https://scryfall.com/card/pz2/70723/reality-scramble?utm_source=api	Put target permanent you own on the bottom of your library. Reveal cards from the top of your library until you reveal a card that shares a card type with that permanent. Put that card onto the battlefield and the rest on the bottom of your library in a random order. Retrace (You may cast this card from your graveyard by discarding a land card in addition to paying its other costs.)
pz2	Treasure Chest	2016-11-16	70725	Octopus Umbra	6d2ce0ba-f2ff-4c2b-ba85-f6c011ebda6c			combat_support, removal, replacement_engine, tempo_removal				Enchantment — Aura	{3}{U}{U}	5	U	U	Umbra armor, Enchant		verify analyzer roles	https://scryfall.com/card/pz2/70725/octopus-umbra?utm_source=api	Enchant creature Enchanted creature has base power and toughness 8/8 and has "Whenever this creature attacks, you may tap target creature with power 8 or less." Umbra armor (If enchanted creature would be destroyed, instead remove all damage from it and destroy this Aura.)
pz2	Treasure Chest	2016-11-16	70727	Geode Golem	aaed2f39-6d5d-4880-a7c4-5a045399dab3			combat_body, combat_support, combat_threat				Artifact Creature — Golem	{5}	5			Trample		verify analyzer roles	https://scryfall.com/card/pz2/70727/geode-golem?utm_source=api	Trample Whenever this creature deals combat damage to a player, you may cast your commander from the command zone without paying its mana cost. (You still pay any additional costs.)
pz2	Treasure Chest	2016-11-16	70729	Loyal Unicorn	6cf8191c-acca-4145-86c2-53a138b3fe4a			broad_protection, combat_body, combat_support, combat_threat, protection				Creature — Unicorn	{3}{W}	4	W	W	Vigilance, Lieutenant		verify analyzer roles	https://scryfall.com/card/pz2/70729/loyal-unicorn?utm_source=api	Vigilance Lieutenant — At the beginning of combat on your turn, if you control your commander, prevent all combat damage that would be dealt to creatures you control this turn. Other creatures you control gain vigilance until end of turn.
pz2	Treasure Chest	2016-11-16	70731	Vedalken Humiliator	17c3a888-84d2-4c21-8fa3-d2d825dd7601			combat_body, combat_support				Creature — Vedalken Wizard	{3}{U}	4	U	U	Metalcraft		verify analyzer roles	https://scryfall.com/card/pz2/70731/vedalken-humiliator?utm_source=api	Metalcraft — Whenever this creature attacks, if you control three or more artifacts, creatures your opponents control lose all abilities and have base power and toughness 1/1 until end of turn.
pz2	Treasure Chest	2016-11-16	70733	Primordial Mist	afc9e1d3-b012-49e9-8d22-89abbee03c22			card_selection, face_down_support				Enchantment	{4}{U}	5	U	U	Manifest		verify analyzer roles	https://scryfall.com/card/pz2/70733/primordial-mist?utm_source=api	At the beginning of your end step, you may manifest the top card of your library. (Put it onto the battlefield face down as a 2/2 creature. Turn it face up any time for its mana cost if it's a creature card.) Exile a face-down permanent you control face up: You may play that card this turn. (You still pay its costs. Timing rules still apply.)
pz2	Treasure Chest	2016-11-16	70735	Loyal Subordinate	76f405a1-242a-47e6-9aa6-261e49a85b45			combat_body, combat_support, combat_threat, direct_finisher, finisher, repeatable_finisher				Creature — Zombie	{2}{B}	3	B	B	Menace, Lieutenant		verify analyzer roles	https://scryfall.com/card/pz2/70735/loyal-subordinate?utm_source=api	Menace (This creature can't be blocked except by two or more creatures.) Lieutenant — At the beginning of combat on your turn, if you control your commander, each opponent loses 3 life.
pz2	Treasure Chest	2016-11-16	70737	Ravenous Slime	4696decb-7bff-4c6b-8a7b-9ec324faefde			combat_body, combat_support, replacement_engine				Creature — Ooze	{2}{G}	3	G	G			verify analyzer roles	https://scryfall.com/card/pz2/70737/ravenous-slime?utm_source=api	This creature can't be blocked by creatures with power 2 or less. If a creature an opponent controls would die, instead exile it and put a number of +1/+1 counters equal to that creature's power on this creature.
pz2	Treasure Chest	2016-11-16	70739	Estrid, the Masked	7cf1fa2e-1572-4d9d-8e93-e49016b34458			card_selection, mass_recursion, mill_support, recursion, repeatable_advantage, token_support				Legendary Planeswalker — Estrid	{1}{G}{W}{U}	4	GUW	GUW	Mill		verify analyzer roles	https://scryfall.com/card/pz2/70739/estrid-the-masked?utm_source=api	+2: Untap each enchanted permanent you control. −1: Create a white Aura enchantment token named Mask attached to another target permanent. The token has enchant permanent and umbra armor. −7: Mill seven cards. Return all non-Aura enchantment cards from your graveyard to the battlefield, then do the same for Aura cards. Estrid, the Masked can be your commander.
pz2	Treasure Chest	2016-11-16	70741	Varina, Lich Queen	9859fbca-60c3-4a57-a377-51b56f03894f			card_draw, card_selection, combat_body, combat_support, lifegain, repeatable_advantage, selection, token_support				Legendary Creature — Zombie Wizard	{1}{W}{U}{B}	4	BUW	BUW			verify analyzer roles	https://scryfall.com/card/pz2/70741/varina-lich-queen?utm_source=api	Whenever you attack with one or more Zombies, draw that many cards, then discard that many cards. You gain that much life. {2}, Exile two cards from your graveyard: Create a tapped 2/2 black Zombie creature token.
pz2	Treasure Chest	2016-11-16	70743	Entreat the Dead	2de6c3d9-1759-40a2-99c6-8cbe17b4bcdd			battlefield_recursion, card_selection, mana_sink, recursion, scalable_spell				Sorcery	{X}{X}{B}{B}{B}	3	B	B	Miracle		verify analyzer roles	https://scryfall.com/card/pz2/70743/entreat-the-dead?utm_source=api	Return X target creature cards from your graveyard to the battlefield. Miracle {X}{B}{B} (You may cast this card for its miracle cost when you draw it if it's the first card you drew this turn.)
pz2	Treasure Chest	2016-11-16	70745	Aminatou's Augury	c9160997-0305-47f5-9a2f-77588d167da0			card_selection, direct_draw, draw, land_acceleration, restricted_tutor, selection, tutor				Sorcery	{6}{U}{U}	8	U	U			verify analyzer roles	https://scryfall.com/card/pz2/70745/aminatous-augury?utm_source=api	Exile the top eight cards of your library. You may put a land card from among them onto the battlefield. Until end of turn, for each nonland card type, you may cast a spell of that type from among the exiled cards without paying its mana cost.
pz2	Treasure Chest	2016-11-16	70747	Yennett, Cryptic Sovereign	4eec6838-3565-407f-8941-ce9421402f0b			card_draw, combat_body, combat_support, combat_threat, direct_draw, draw, repeatable_advantage, repeatable_draw, selection				Legendary Creature — Sphinx	{2}{W}{U}{B}	5	BUW	BUW	Flying, Vigilance, Menace		verify analyzer roles	https://scryfall.com/card/pz2/70747/yennett-cryptic-sovereign?utm_source=api	Flying, vigilance, menace Whenever Yennett attacks, reveal the top card of your library. You may cast it without paying its mana cost if its mana value is odd. If you don't cast it, draw a card.
pz2	Treasure Chest	2016-11-16	70749	Night Incarnate	abd1c415-8fd3-4852-92c6-4557453dfc41			combat_body, combat_threat, mass_removal, removal				Creature — Elemental	{4}{B}	5	B	B	Evoke, Deathtouch		verify analyzer roles	https://scryfall.com/card/pz2/70749/night-incarnate?utm_source=api	Deathtouch When this creature leaves the battlefield, all creatures get -3/-3 until end of turn. Evoke {3}{B} (You may cast this spell for its evoke cost. If you do, it's sacrificed when it enters.)
pz2	Treasure Chest	2016-11-16	70751	Fury Storm	371fa9e3-5432-4f2f-89d4-55061b0b4e57			copy_support				Instant	{2}{R}{R}	4	R	R			verify analyzer roles	https://scryfall.com/card/pz2/70751/fury-storm?utm_source=api	When you cast this spell, copy it for each time you've cast your commander from the command zone this game. You may choose new targets for the copies. Copy target instant or sorcery spell. You may choose new targets for the copy.
pz2	Treasure Chest	2016-11-16	70753	Loyal Apprentice	7f268b15-ac92-4e98-821b-78d15d9285d9			combat_body, combat_threat, token_support				Creature — Human Artificer	{1}{R}	2	R	R	Haste, Lieutenant		verify analyzer roles	https://scryfall.com/card/pz2/70753/loyal-apprentice?utm_source=api	Haste Lieutenant — At the beginning of combat on your turn, if you control your commander, create a 1/1 colorless Thopter artifact creature token with flying. That token gains haste until end of turn.
pz2	Treasure Chest	2016-11-16	70755	Ancient Stone Idol	5f981cca-5cd9-49e4-ab1a-bbbf6fc7e737			combat_body, combat_threat, sacrifice_support, token_support				Artifact Creature — Golem	{10}	10			Trample, Flash		verify analyzer roles	https://scryfall.com/card/pz2/70755/ancient-stone-idol?utm_source=api	Flash This spell costs {1} less to cast for each attacking creature. Trample When this creature dies, create a 6/12 colorless Construct artifact creature token with trample.
pz2	Treasure Chest	2016-11-16	70757	Loyal Drake	daebf011-ec85-4cbd-9445-02ac59675c58			card_draw, combat_body, combat_threat, direct_draw, draw, repeatable_advantage, repeatable_draw				Creature — Drake	{2}{U}	3	U	U	Flying, Lieutenant		verify analyzer roles	https://scryfall.com/card/pz2/70757/loyal-drake?utm_source=api	Flying Lieutenant — At the beginning of combat on your turn, if you control your commander, draw a card.
pz2	Treasure Chest	2016-11-16	70759	Varchild, Betrayer of Kjeldor	26ae37ab-91f8-4113-beb0-1154f9b62d28			combat_body, combat_support, theft_support				Legendary Creature — Human Knight	{2}{R}	3	R	R			verify analyzer roles	https://scryfall.com/card/pz2/70759/varchild-betrayer-of-kjeldor?utm_source=api	Whenever Varchild deals combat damage to a player, that player creates that many 1/1 red Survivor creature tokens. Survivors your opponents control can't block, and they can't attack you or planeswalkers you control. When Varchild leaves the battlefield, gain control of all Survivors.
pz2	Treasure Chest	2016-11-16	70761	Emissary of Grudges	b415684e-40f0-43c1-b8d5-1a90b75c5a47			combat_body, combat_threat				Creature — Efreet	{5}{R}	6	R	R	Flying, Haste		verify analyzer roles	https://scryfall.com/card/pz2/70761/emissary-of-grudges?utm_source=api	Flying, haste As this creature enters, secretly choose an opponent. Reveal the player you chose: Choose new targets for target spell or ability if it's controlled by the chosen player and if it targets you or a permanent you control. Activate only once.
pz2	Treasure Chest	2016-11-16	70763	Aminatou, the Fateshifter	3a30089d-cd2d-49be-9b06-7a2454117692			card_draw, direct_draw, draw, flicker, repeatable_advantage				Legendary Planeswalker — Aminatou	{W}{U}{B}	3	BUW	BUW			verify analyzer roles	https://scryfall.com/card/pz2/70763/aminatou-the-fateshifter?utm_source=api	+1: Draw a card, then put a card from your hand on top of your library. −1: Exile another target permanent you own, then return it to the battlefield under your control. −6: Choose left or right. Each player gains control of all nonland permanents other than Aminatou controlled by the next player in the chosen direction. Aminatou, the Fateshifter can be your commander.
pz2	Treasure Chest	2016-11-16	70765	Estrid's Invocation	7f5f10ee-6428-4053-8824-3bc70420ec2c			copy_support				Enchantment	{2}{U}	3	U	U			verify analyzer roles	https://scryfall.com/card/pz2/70765/estrids-invocation?utm_source=api	You may have this enchantment enter as a copy of an enchantment you control, except it has "At the beginning of your upkeep, you may exile this enchantment. If you do, return it to the battlefield under its owner's control."
pz2	Treasure Chest	2016-11-16	70767	Angelic Guardian	2f959c67-2b0b-4ba8-a8aa-90c25a3806ec			broad_protection, combat_body, combat_support, combat_threat, protection, self_protection				Creature — Angel	{4}{W}{W}	6	W	W	Flying		verify analyzer roles	https://scryfall.com/card/pz2/70767/angelic-guardian?utm_source=api	Flying (This creature can't be blocked except by creatures with flying or reach.) Whenever one or more creatures you control attack, they gain indestructible until end of turn. (Damage and effects that say "destroy" don't destroy them.)
pz2	Treasure Chest	2016-11-16	70769	Angler Turtle	a09da13e-f8a3-410e-941a-9912d2cfe7de			combat_body, combat_support, self_protection				Creature — Turtle	{5}{U}{U}	7	U	U	Hexproof		verify analyzer roles	https://scryfall.com/card/pz2/70769/angler-turtle?utm_source=api	Hexproof Creatures your opponents control attack each combat if able.
pz2	Treasure Chest	2016-11-16	70771	Vengeant Vampire	e9f4d669-d915-4984-bd3c-12202c366e9b			combat_body, combat_threat, lifegain, removal, sacrifice_support, targeted_removal				Creature — Vampire	{4}{B}{B}	6	B	B	Lifelink		verify analyzer roles	https://scryfall.com/card/pz2/70771/vengeant-vampire?utm_source=api	Lifelink When this creature dies, destroy target creature an opponent controls and you gain 4 life.
pz2	Treasure Chest	2016-11-16	70773	Immortal Phoenix	1d8bd391-b133-4c8b-95ad-7f7ab99137c7			combat_body, combat_support, combat_threat				Creature — Phoenix	{4}{R}{R}	6	R	R	Flying		verify analyzer roles	https://scryfall.com/card/pz2/70773/immortal-phoenix?utm_source=api	Flying (This creature can't be blocked except by creatures with flying or reach.) When this creature dies, return it to its owner's hand.
pz2	Treasure Chest	2016-11-16	70775	Rampaging Brontodon	bfea2229-a1ca-40c1-aaad-5f97add3f079			combat_body, combat_support, combat_threat				Creature — Dinosaur	{5}{G}{G}	7	G	G	Trample		verify analyzer roles	https://scryfall.com/card/pz2/70775/rampaging-brontodon?utm_source=api	Trample Whenever this creature attacks, it gets +1/+1 until end of turn for each land you control.
pz2	Treasure Chest	2016-11-16	70777	Militant Angel	ad645324-204a-49d2-b128-f98eee7c9bb9			combat_body, combat_threat, lifegain, token_support				Creature — Angel	{3}{W}{W}	5	W	W	Flying, Lifelink		verify analyzer roles	https://scryfall.com/card/pz2/70777/militant-angel?utm_source=api	Flying, lifelink When this creature enters, create a number of 2/2 white Knight creature tokens with vigilance equal to the number of opponents you attacked this turn.
pz2	Treasure Chest	2016-11-16	70779	Inspired Sphinx	61cceb14-9568-4a5e-9b56-07afa6407df2			card_draw, combat_body, combat_threat, direct_draw, draw, token_support				Creature — Sphinx	{5}{U}{U}	7	U	U	Flying		verify analyzer roles	https://scryfall.com/card/pz2/70779/inspired-sphinx?utm_source=api	Flying When this creature enters, draw cards equal to the number of opponents you have. {3}{U}: Create a 1/1 colorless Thopter artifact creature token with flying.
pz2	Treasure Chest	2016-11-16	70781	Rot Hulk	36117e99-a2bc-46f9-8e17-bd2e2a9c31f4			battlefield_recursion, card_selection, combat_body, combat_threat, recursion, scalable_spell				Creature — Zombie	{5}{B}{B}	7	B	B	Menace		verify analyzer roles	https://scryfall.com/card/pz2/70781/rot-hulk?utm_source=api	Menace When this creature enters, return up to X target Zombie cards from your graveyard to the battlefield, where X is the number of opponents you have.
pz2	Treasure Chest	2016-11-16	70783	Goblin Goliath	131069a6-8f30-4caf-8934-3588837b5f7f			combat_body, multiplier_support, replacement_engine, token_support				Creature — Goblin Mutant	{4}{R}{R}	6	R	R	Double		verify analyzer roles	https://scryfall.com/card/pz2/70783/goblin-goliath?utm_source=api	When this creature enters, create a number of 1/1 red Goblin creature tokens equal to the number of opponents you have. {3}{R}, {T}: If a source you control would deal damage to an opponent this turn, it deals double that damage to that player instead.
pz2	Treasure Chest	2016-11-16	70785	Avatar of Growth	07db0374-3297-49c3-886d-a6bb42f7bb18			combat_body, combat_threat, land_acceleration, land_tutor, mana_fixing, ramp, tutor				Creature — Elemental Avatar	{4}{G}{G}	6	G	G	Trample		verify analyzer roles	https://scryfall.com/card/pz2/70785/avatar-of-growth?utm_source=api	This spell costs {1} less to cast for each opponent you have. Trample When this creature enters, each player searches their library for up to two basic land cards, puts them onto the battlefield, then shuffles.
pz2	Treasure Chest	2016-11-16	70787	Hardened-Scale Armor	9eb58db8-7934-485c-8606-fb1a6cc60d42			combat_support				Enchantment — Aura	{2}{G}	3	G	G	Enchant		verify analyzer roles	https://scryfall.com/card/pz2/70787/hardened-scale-armor?utm_source=api	Enchant creature Enchanted creature gets +3/+3.
pz2	Treasure Chest	2016-11-16	70789	Leopard-Spotted Jiao	0056e07b-416b-487e-9e6c-3697db402dd4			combat_body				Creature — Beast	{1}{R}	2	R	R			verify analyzer roles	https://scryfall.com/card/pz2/70789/leopard-spotted-jiao?utm_source=api	
pz2	Treasure Chest	2016-11-16	70791	Feiyi Snake	77b69977-200e-44c2-bfde-228e6501b03a			combat_body, combat_threat				Creature — Snake	{1}{G}	2	G	G	Reach		verify analyzer roles	https://scryfall.com/card/pz2/70791/feiyi-snake?utm_source=api	Reach (This creature can block creatures with flying.)
pz2	Treasure Chest	2016-11-16	70793	Jiang Yanggu	b15c8f43-685d-4901-9cad-47bc6dc6346f			combat_support, scalable_spell, token_support				Legendary Planeswalker — Yanggu	{4}{G}	5	G	G			verify analyzer roles	https://scryfall.com/card/pz2/70793/jiang-yanggu?utm_source=api	+1: Target creature gets +2/+2 until end of turn. −1: If you don't control a creature named Mowu, create Mowu, a legendary 3/3 green Dog creature token. −5: Until end of turn, target creature gains trample and gets +X/+X, where X is the number of lands you control.
pz2	Treasure Chest	2016-11-16	70795	Mu Yanling	34e1477a-c0fb-4364-bb93-04a85c0c2517			card_draw, combat_support, direct_draw, draw, extra_turn, finisher, repeatable_advantage				Legendary Planeswalker — Yanling	{4}{U}{U}	6	U	U			verify analyzer roles	https://scryfall.com/card/pz2/70795/mu-yanling?utm_source=api	+2: Target creature can't be blocked this turn. −3: Draw two cards. −10: Tap all creatures your opponents control. You take an extra turn after this one.
pz2	Treasure Chest	2016-11-16	70797	Timber Gorge	00b34fab-5a80-4a4d-b6cf-72479197677a			land_base, land_slot, mana_source				Land		0		GR			verify analyzer roles	https://scryfall.com/card/pz2/70797/timber-gorge?utm_source=api	This land enters tapped. {T}: Add {R} or {G}.
pz2	Treasure Chest	2016-11-16	70799	Meandering River	2d9663be-c466-4191-85e2-a69ce0965432			land_base, land_slot, mana_source				Land		0		UW			verify analyzer roles	https://scryfall.com/card/pz2/70799/meandering-river?utm_source=api	This land enters tapped. {T}: Add {W} or {U}.
pz2	Treasure Chest	2016-11-16	70801	Plains	bc71ebf6-2056-41f7-be35-b2e5c34afa99	covered	basic_land, land_base, land_slot, mana_source	basic_land, land_base, land_slot, mana_source	false		Covered by Ice Age role audit.	Basic Land — Plains		0		W			already reviewed	https://scryfall.com/card/pz2/70801/plains?utm_source=api	({T}: Add {W}.)
pz2	Treasure Chest	2016-11-16	70803	Island	b2c6aa39-2d2a-459c-a555-fb48ba993373	covered	basic_land, land_base, land_slot, mana_source	basic_land, land_base, land_slot, mana_source	false		Covered by Ice Age role audit.	Basic Land — Island		0		U			already reviewed	https://scryfall.com/card/pz2/70803/island?utm_source=api	({T}: Add {U}.)
pz2	Treasure Chest	2016-11-16	70805	Mountain	a3fb7228-e76b-4e96-a40e-20b5fed75685	covered	basic_land, land_base, land_slot, mana_source	basic_land, land_base, land_slot, mana_source	false		Covered by Arabian Nights role audit.	Basic Land — Mountain		0		R			already reviewed	https://scryfall.com/card/pz2/70805/mountain?utm_source=api	({T}: Add {R}.)
pz2	Treasure Chest	2016-11-16	70807	Forest	b34bb2dc-c1af-4d77-b0b3-a0fb342a5fc6	covered	basic_land, land_base, land_slot, mana_source	basic_land, land_base, land_slot, mana_source	false		Covered by Ice Age role audit.	Basic Land — Forest		0		G			already reviewed	https://scryfall.com/card/pz2/70807/forest?utm_source=api	({T}: Add {G}.)
pz2	Treasure Chest	2016-11-16	70809	Armored Whirl Turtle	51a886f2-9b0a-4964-9d59-99dc1a68a97c			combat_body				Creature — Turtle	{2}{U}	3	U	U			verify analyzer roles	https://scryfall.com/card/pz2/70809/armored-whirl-turtle?utm_source=api	
pz2	Treasure Chest	2016-11-16	70811	Colorful Feiyi Sparrow	82657b8b-de2d-46ab-ab56-e2790e326d95			combat_body, combat_support, combat_threat				Creature — Bird	{1}{W}	2	W	W	Flying		verify analyzer roles	https://scryfall.com/card/pz2/70811/colorful-feiyi-sparrow?utm_source=api	Flying (This creature can't be blocked except by creatures with flying or reach.)
pz2	Treasure Chest	2016-11-16	70813	Purple-Crystal Crab	df4569d7-ee75-4ba0-bbc3-7766ac686523			card_draw, combat_body, direct_draw, draw, sacrifice_support				Creature — Crab	{1}{U}	2	U	U			verify analyzer roles	https://scryfall.com/card/pz2/70813/purple-crystal-crab?utm_source=api	When this creature dies, draw a card.
pz2	Treasure Chest	2016-11-16	70815	Welkin Tern	010c660a-a67b-48f0-a63a-15470eb89f69			combat_body, combat_support, combat_threat				Creature — Bird	{1}{U}	2	U	U	Flying		verify analyzer roles	https://scryfall.com/card/pz2/70815/welkin-tern?utm_source=api	Flying (This creature can't be blocked except by creatures with flying or reach.) This creature can block only creatures with flying.
pz2	Treasure Chest	2016-11-16	70817	Vivid Flying Fish	e8ec9ba4-dc6b-437d-863f-5ec37f4ae9cd			combat_body, combat_support				Creature — Fish Lizard	{1}{U}	2	U	U			verify analyzer roles	https://scryfall.com/card/pz2/70817/vivid-flying-fish?utm_source=api	This creature has flying as long as it's attacking. (It can't be blocked except by creatures with flying or reach.)
pz2	Treasure Chest	2016-11-16	70819	Nine-Tail White Fox	51f4eb1f-abf2-425a-b78e-cafac177da89			card_draw, combat_body, combat_support, direct_draw, draw, repeatable_advantage, repeatable_draw				Creature — Fox Spirit	{2}{U}	3	U	U			verify analyzer roles	https://scryfall.com/card/pz2/70819/nine-tail-white-fox?utm_source=api	Whenever this creature deals combat damage to a player, draw a card.
pz2	Treasure Chest	2016-11-16	70821	Earth-Origin Yak	c2b659ef-68f6-452c-94b5-2872f4e7b069			combat_body, combat_support				Creature — Ox	{3}{W}	4	W	W			verify analyzer roles	https://scryfall.com/card/pz2/70821/earth-origin-yak?utm_source=api	When this creature enters, creatures you control get +1/+1 until end of turn.
pz2	Treasure Chest	2016-11-16	70823	Moon-Eating Dog	a8e69725-cd57-4340-83b1-498bc0bd77b8			combat_body, combat_support				Creature — Dog	{3}{U}	4	U	U			verify analyzer roles	https://scryfall.com/card/pz2/70823/moon-eating-dog?utm_source=api	As long as you control a Yanling planeswalker, this creature has flying. (It can't be blocked except by creatures with flying or reach.)
pz2	Treasure Chest	2016-11-16	70825	Stormcloud Spirit	0dc8bdbb-996b-47d7-a5e5-7bdb6d9280fe			combat_body, combat_support, combat_threat				Creature — Spirit	{3}{U}{U}	5	U	U	Flying		verify analyzer roles	https://scryfall.com/card/pz2/70825/stormcloud-spirit?utm_source=api	Flying (This creature can't be blocked except by creatures with flying or reach.)
pz2	Treasure Chest	2016-11-16	70827	Heavenly Qilin	cbe1c80a-db82-460a-b6e9-d0e429628aa1			combat_body, combat_support, combat_threat				Creature — Kirin	{2}{W}	3	W	W	Flying		verify analyzer roles	https://scryfall.com/card/pz2/70827/heavenly-qilin?utm_source=api	Flying (This creature can't be blocked except by creatures with flying or reach.) Whenever this creature attacks, another target creature you control gains flying until end of turn.
pz2	Treasure Chest	2016-11-16	70829	Ancestor Dragon	60b03a44-a7bd-48fa-8c8f-1704aed02cd7			combat_body, combat_support, combat_threat, lifegain				Creature — Dragon	{4}{W}{W}	6	W	W	Flying		verify analyzer roles	https://scryfall.com/card/pz2/70829/ancestor-dragon?utm_source=api	Flying Whenever one or more creatures you control attack, you gain 1 life for each attacking creature.
pz2	Treasure Chest	2016-11-16	70831	Dragon's Presence	4fb7aeb6-2fc3-459e-bad8-1c7ea92f7ae7			removal, targeted_removal				Instant	{2}{W}	3	W	W			verify analyzer roles	https://scryfall.com/card/pz2/70831/dragons-presence?utm_source=api	Dragon's Presence deals 5 damage to target attacking or blocking creature.
pz2	Treasure Chest	2016-11-16	70833	Brilliant Plan	d83e1a42-11d1-412a-b66c-850c7a528777	covered		card_draw, direct_draw, draw	false		Covered by PTK role audit.	Sorcery	{4}{U}	5	U	U			already reviewed	https://scryfall.com/card/pz2/70833/brilliant-plan?utm_source=api	Draw three cards.
pz2	Treasure Chest	2016-11-16	70835	Cloak of Mists	13358b1d-0a35-48ed-a7fb-70359fa3998f	covered		combat_support	false		Covered by USG role audit.	Enchantment — Aura	{1}{U}	2	U	U	Enchant		already reviewed	https://scryfall.com/card/pz2/70835/cloak-of-mists?utm_source=api	Enchant creature Enchanted creature can't be blocked.
