setCode	setName	releasedAt	collectorNumber	name	oracleId	auditStatus	expectedRoles	actualAnalyzerRoles	needsCodeChange	tagDecision	manualNotes	typeLine	manaCost	manaValue	colors	colorIdentity	keywords	scryfallOracleTags	attentionHint	scryfallUrl	oracleText
pz2	Treasure Chest	2016-11-16	65731	Herald's Horn	c02c5547-b9c9-4b2d-9d12-e87bfba8f2d2			card_selection, cost_reduction, ramp				Artifact	{3}	3					verify analyzer roles	https://scryfall.com/card/pz2/65731/heralds-horn?utm_source=api	As this artifact enters, choose a creature type. Creature spells you cast of the chosen type cost {1} less to cast. At the beginning of your upkeep, look at the top card of your library. If it's a creature card of the chosen type, you may reveal it and put it into your hand.
pz2	Treasure Chest	2016-11-16	65733	O-Kagachi, Vengeful Kami	300715a0-4f95-4212-9e13-558434c9d1a4			combat_body, combat_support, combat_threat, removal, targeted_removal				Legendary Creature — Dragon Spirit	{1}{W}{U}{B}{R}{G}	6	BGRUW	BGRUW	Flying, Trample		verify analyzer roles	https://scryfall.com/card/pz2/65733/o-kagachi-vengeful-kami?utm_source=api	Flying, trample Whenever O-Kagachi deals combat damage to a player, if that player attacked you during their last turn, exile target nonland permanent that player controls.
pz2	Treasure Chest	2016-11-16	65735	Arahbo, Roar of the World	66944a11-40a1-4f3a-9f83-52324e0edfef			combat_body, combat_support, scalable_spell				Legendary Creature — Cat Avatar	{3}{G}{W}	5	GW	GW	Eminence		verify analyzer roles	https://scryfall.com/card/pz2/65735/arahbo-roar-of-the-world?utm_source=api	Eminence — At the beginning of combat on your turn, if Arahbo is in the command zone or on the battlefield, another target Cat you control gets +3/+3 until end of turn. Whenever another Cat you control attacks, you may pay {1}{G}{W}. If you do, it gains trample and gets +X/+X until end of turn, where X is its power.
pz2	Treasure Chest	2016-11-16	65737	Inalla, Archmage Ritualist	21bdba6e-3f9d-4ead-8212-0cbb0ce7f8cc			combat_body, copy_support, token_support				Legendary Creature — Human Wizard	{2}{U}{B}{R}	5	BRU	BRU	Eminence		verify analyzer roles	https://scryfall.com/card/pz2/65737/inalla-archmage-ritualist?utm_source=api	Eminence — Whenever another nontoken Wizard you control enters, if Inalla is in the command zone or on the battlefield, you may pay {1}. If you do, create a token that's a copy of that Wizard. The token gains haste. Exile it at the beginning of the next end step. Tap five untapped Wizards you control: Target player loses 7 life.
pz2	Treasure Chest	2016-11-16	65739	Taigam, Ojutai Master	e4cf3710-8600-4f95-abb2-faefdc25693d			broad_stack, card_selection, combat_body, copy_support, hate_piece, repeatable_advantage, repeatable_draw, selection, spellslinger, stack, stax_piece				Legendary Creature — Human Monk	{2}{W}{U}	4	UW	UW			verify analyzer roles	https://scryfall.com/card/pz2/65739/taigam-ojutai-master?utm_source=api	Instant, sorcery, and Dragon spells you control can't be countered. Whenever you cast an instant or sorcery spell from your hand, if Taigam attacked this turn, that spell gains rebound. (Exile the spell as it resolves. At the beginning of your next upkeep, you may cast that card from exile without paying its mana cost.)
pz2	Treasure Chest	2016-11-16	65741	Izzet Chemister	e4a3d6f3-36ba-4e6d-a254-351bc8886f20			combat_body, combat_threat, sacrifice_support				Creature — Goblin Wizard	{2}{R}	3	R	R	Haste		verify analyzer roles	https://scryfall.com/card/pz2/65741/izzet-chemister?utm_source=api	Haste {R}, {T}: Exile target instant or sorcery card from your graveyard. {1}{R}, {T}, Sacrifice this creature: Cast any number of cards exiled with this creature without paying their mana costs.
pz2	Treasure Chest	2016-11-16	65743	Curse of Disturbance	6cbd36d9-de47-41b0-9ef4-a72ca01adccd			token_support				Enchantment — Aura Curse	{2}{B}	3	B	B	Enchant		verify analyzer roles	https://scryfall.com/card/pz2/65743/curse-of-disturbance?utm_source=api	Enchant player Whenever enchanted player is attacked, create a 2/2 black Zombie creature token. Each opponent attacking that player does the same.
pz2	Treasure Chest	2016-11-16	65745	Curse of Opulence	ba0d3df2-3acf-46d7-8d64-8d67d1579adc			burst_ramp, mana_fixing, ramp, sacrifice_support, targeted_removal, token_support				Enchantment — Aura Curse	{R}	1	R	R	Enchant		verify analyzer roles	https://scryfall.com/card/pz2/65745/curse-of-opulence?utm_source=api	Enchant player Whenever enchanted player is attacked, create a Gold token. Each opponent attacking that player does the same. (A Gold token is an artifact with "Sacrifice this token: Add one mana of any color.")
pz2	Treasure Chest	2016-11-16	65747	Curse of Bounty	b6689782-08d8-48e1-a05d-cd040dfe85bc			ramp, stable_ramp				Enchantment — Aura Curse	{1}{G}	2	G	G	Enchant		verify analyzer roles	https://scryfall.com/card/pz2/65747/curse-of-bounty?utm_source=api	Enchant player Whenever enchanted player is attacked, untap all nonland permanents you control. Each opponent attacking that player untaps all nonland permanents they control.
pz2	Treasure Chest	2016-11-16	65749	Ramos, Dragon Engine	3ed41d2d-211b-4013-8562-8c64d54cc43a	covered		combat_body, combat_threat, counter_support, mana_fixing, stable_ramp	false		Covered by PRM role audit.	Legendary Artifact Creature — Dragon	{6}	6		BGRUW	Flying		already reviewed	https://scryfall.com/card/pz2/65749/ramos-dragon-engine?utm_source=api	Flying Whenever you cast a spell, put a +1/+1 counter on Ramos for each of that spell's colors. Remove five +1/+1 counters from Ramos: Add {W}{W}{U}{U}{B}{B}{R}{R}{G}{G}. Activate only once each turn.
pz2	Treasure Chest	2016-11-16	65751	Mirror of the Forebears	9eaeb54b-73a8-43cc-b4d8-ed8b5eb19646			copy_support				Artifact	{2}	2					verify analyzer roles	https://scryfall.com/card/pz2/65751/mirror-of-the-forebears?utm_source=api	As this artifact enters, choose a creature type. {1}: Until end of turn, this artifact becomes a copy of target creature you control of the chosen type, except it's an artifact in addition to its other types.
pz2	Treasure Chest	2016-11-16	65753	Bloodline Necromancer	f2a54e85-dd8b-462c-a811-c9553dc349a5			battlefield_recursion, card_selection, combat_body, combat_threat, lifegain, recursion				Creature — Vampire Wizard	{4}{B}	5	B	B	Lifelink		verify analyzer roles	https://scryfall.com/card/pz2/65753/bloodline-necromancer?utm_source=api	Lifelink When this creature enters, you may return target Vampire or Wizard creature card from your graveyard to the battlefield.
pz2	Treasure Chest	2016-11-16	65755	Galecaster Colossus	d8379d8f-df17-4473-938d-7ac198d17980			combat_body, removal, tempo_removal				Creature — Giant Wizard	{5}{U}{U}	7	U	U			verify analyzer roles	https://scryfall.com/card/pz2/65755/galecaster-colossus?utm_source=api	Tap an untapped Wizard you control: Return target nonland permanent you don't control to its owner's hand.
pz2	Treasure Chest	2016-11-16	65757	Balan, Wandering Knight	d12cfd46-73c2-4206-9a10-0d2e7d6ac87e			combat_body, combat_threat				Legendary Creature — Cat Knight	{2}{W}{W}	4	W	W	First strike		verify analyzer roles	https://scryfall.com/card/pz2/65757/balan-wandering-knight?utm_source=api	First strike Balan has double strike as long as two or more Equipment are attached to it. {1}{W}: Attach all Equipment you control to Balan.
pz2	Treasure Chest	2016-11-16	65759	Mathas, Fiend Seeker	1e8d9d0c-185b-4149-9ec9-74a2f2fe8764			card_draw, combat_body, combat_threat, counter_support, lifegain, sacrifice_support				Legendary Creature — Vampire	{R}{W}{B}	3	BRW	BRW	Menace		verify analyzer roles	https://scryfall.com/card/pz2/65759/mathas-fiend-seeker?utm_source=api	Menace At the beginning of your end step, put a bounty counter on target creature an opponent controls. For as long as that creature has a bounty counter on it, it has "When this creature dies, each opponent draws a card and gains 2 life."
pz2	Treasure Chest	2016-11-16	65761	Kheru Mind-Eater	dfea918b-5702-4c12-ba36-e6aa4ace09c7			card_selection, combat_body, combat_support, combat_threat, face_down_support				Creature — Vampire	{2}{B}	3	B	B	Menace		verify analyzer roles	https://scryfall.com/card/pz2/65761/kheru-mind-eater?utm_source=api	Menace Whenever this creature deals combat damage to a player, that player exiles a card from their hand face down. You may look at cards exiled with this creature, and you may play lands and cast spells from among those cards.
pz2	Treasure Chest	2016-11-16	65763	Kess, Dissident Mage	f5092c14-eec4-472c-999c-ba96c36b2fbb			card_selection, combat_body, combat_threat, recursion, repeatable_advantage, repeatable_draw, replacement_engine, replay_recursion, selection				Legendary Creature — Human Wizard	{1}{U}{B}{R}	4	BRU	BRU	Flying		verify analyzer roles	https://scryfall.com/card/pz2/65763/kess-dissident-mage?utm_source=api	Flying Once during each of your turns, you may cast an instant or sorcery spell from your graveyard. If a spell cast this way would be put into your graveyard, exile it instead.
pz2	Treasure Chest	2016-11-16	65765	Curse of Vitality	6d2eb412-e09b-4ab3-8653-b458e9f38eff			lifegain				Enchantment — Aura Curse	{2}{W}	3	W	W	Enchant		verify analyzer roles	https://scryfall.com/card/pz2/65765/curse-of-vitality?utm_source=api	Enchant player Whenever enchanted player is attacked, you gain 2 life. Each opponent attacking that player does the same.
pz2	Treasure Chest	2016-11-16	65767	Curse of Verbosity	c6f76fa7-095e-4bfe-a38c-5c4531880880			card_draw, direct_draw, draw, repeatable_advantage, repeatable_draw				Enchantment — Aura Curse	{2}{U}	3	U	U	Enchant		verify analyzer roles	https://scryfall.com/card/pz2/65767/curse-of-verbosity?utm_source=api	Enchant player Whenever enchanted player is attacked, you draw a card. Each opponent attacking that player does the same.
pz2	Treasure Chest	2016-11-16	65769	Stalking Leonin	6ec98a34-5c04-423c-98e5-8cf3047135c1			combat_body, removal, targeted_removal				Creature — Cat Archer	{2}{W}	3	W	W			verify analyzer roles	https://scryfall.com/card/pz2/65769/stalking-leonin?utm_source=api	When this creature enters, secretly choose an opponent. Reveal the player you chose: Exile target creature that's attacking you if it's controlled by the chosen player. Activate only once.
pz2	Treasure Chest	2016-11-16	65771	Nazahn, Revered Bladesmith	a3a6c024-43de-4f5c-a1d6-c48a0c96a43b			artifact_support, cheat_into_play, combat_body, combat_support, cost_reduction, removal, restricted_tutor, tempo_removal, tutor				Legendary Creature — Cat Artificer	{4}{G}{W}	6	GW	GW			verify analyzer roles	https://scryfall.com/card/pz2/65771/nazahn-revered-bladesmith?utm_source=api	When Nazahn enters, search your library for an Equipment card and reveal it. If you reveal a card named Hammer of Nazahn this way, put it onto the battlefield. Otherwise, put that card into your hand. Then shuffle. Whenever an equipped creature you control attacks, you may tap target creature defending player controls.
pz2	Treasure Chest	2016-11-16	65773	Sinuous Vermin	658f5cfb-326d-4da9-a39b-2ecd393a1f54			combat_body, combat_support, counter_support				Creature — Rat Horror	{1}{B}	2	B	B	Monstrosity		verify analyzer roles	https://scryfall.com/card/pz2/65773/sinuous-vermin?utm_source=api	{3}{B}{B}: Monstrosity 3. (If this creature isn't monstrous, put three +1/+1 counters on it and it becomes monstrous.) As long as this creature is monstrous, it has menace. (It can't be blocked except by two or more creatures.)
pz2	Treasure Chest	2016-11-16	65775	Borderland Explorer	65bc4f8a-3226-4648-862b-3f62736ff1ae			combat_body, land_acceleration, land_tutor, mana_fixing, tutor				Creature — Elf Scout	{1}{G}	2	G	G			verify analyzer roles	https://scryfall.com/card/pz2/65775/borderland-explorer?utm_source=api	When this creature enters, each player may discard a card. Each player who discarded a card this way may search their library for a basic land card, reveal it, put it into their hand, then shuffle.
pz2	Treasure Chest	2016-11-16	65777	Skittering Crustacean	9a6d8d37-fcf9-4974-89f5-3500e9da3518			combat_body, combat_support, counter_support, self_protection				Creature — Crab	{2}{U}	3	U	U	Monstrosity		verify analyzer roles	https://scryfall.com/card/pz2/65777/skittering-crustacean?utm_source=api	{6}{U}: Monstrosity 4. (If this creature isn't monstrous, put four +1/+1 counters on it and it becomes monstrous.) As long as this creature is monstrous, it has hexproof. (It can't be the target of spells or abilities your opponents control.)
pz2	Treasure Chest	2016-11-16	65779	Treasonous Ogre	826d4279-1576-4898-a1c2-26fd547fb0d0			combat_body, combat_support, counter_support				Creature — Ogre Shaman	{3}{R}	4	R	R	Dethrone		verify analyzer roles	https://scryfall.com/card/pz2/65779/treasonous-ogre?utm_source=api	Dethrone (Whenever this creature attacks the player with the most life or tied for most life, put a +1/+1 counter on it.) Pay 3 life: Add {R}.
pz2	Treasure Chest	2016-11-16	65781	Custodi Squire	07c7193e-f591-4aee-a3cc-3a2c52a38f9b			combat_body, combat_threat				Creature — Spirit Cleric	{4}{W}	5	W	W	Flying, Will of the council		verify analyzer roles	https://scryfall.com/card/pz2/65781/custodi-squire?utm_source=api	Flying Will of the council — When this creature enters, starting with you, each player votes for an artifact, creature, or enchantment card in your graveyard. Return each card with the most votes or tied for most votes to your hand.
pz2	Treasure Chest	2016-11-16	65783	Entourage of Trest	27b0bd3f-2c11-474a-8512-fe035a514905			combat_body, combat_support				Creature — Elf Soldier	{4}{G}	5	G	G			verify analyzer roles	https://scryfall.com/card/pz2/65783/entourage-of-trest?utm_source=api	When this creature enters, you become the monarch. This creature can block an additional creature each combat as long as you're the monarch.
pz2	Treasure Chest	2016-11-16	65785	Expropriate	a69265b2-0e37-4d86-866e-e4a923233b4d			extra_turn, finisher, theft_support				Sorcery	{7}{U}{U}	9	U	U	Council's dilemma		verify analyzer roles	https://scryfall.com/card/pz2/65785/expropriate?utm_source=api	Council's dilemma — Starting with you, each player votes for time or money. For each time vote, take an extra turn after this one. For each money vote, choose a permanent owned by the voter and gain control of it. Exile Expropriate.
pz2	Treasure Chest	2016-11-16	65787	Selvala's Stampede	9d2aea05-f55c-4355-950f-bfdc4e985e80			cost_reduction, ramp				Sorcery	{4}{G}{G}	6	G	G	Council's dilemma		verify analyzer roles	https://scryfall.com/card/pz2/65787/selvalas-stampede?utm_source=api	Council's dilemma — Starting with you, each player votes for wild or free. Reveal cards from the top of your library until you reveal a creature card for each wild vote. Put those creature cards onto the battlefield, then shuffle the rest into your library. You may put a permanent card from your hand onto the battlefield for each free vote.
pz2	Treasure Chest	2016-11-16	65789	Salvage	c01a090a-11e4-469e-aded-74203c06fef4	covered		library_recursion, recursion	false			Sorcery	{G}	1	G	G			already reviewed	https://scryfall.com/card/pz2/65789/salvage?utm_source=api	Put target card from your graveyard on top of your library.
pz2	Treasure Chest	2016-11-16	65791	Conqueror's Flail	9aace0d3-89e6-4254-b96f-ee3a878f2f91			artifact_support, combat_support, hate_piece, soft_stack, stack, stax_piece				Artifact — Equipment	{2}	2			Equip		verify analyzer roles	https://scryfall.com/card/pz2/65791/conquerors-flail?utm_source=api	Equipped creature gets +1/+1 for each color among permanents you control. As long as this Equipment is attached to a creature, your opponents can't cast spells during your turn. Equip {2}
pz2	Treasure Chest	2016-11-16	65793	Stream of Acid	1b9c9083-62c3-46fd-a2a0-6de7de88a3c3	covered		land_denial, removal, targeted_land_removal, targeted_removal	false		Covered by S99 role audit.	Sorcery	{2}{B}{B}	4	B	B			already reviewed	https://scryfall.com/card/pz2/65793/stream-of-acid?utm_source=api	Destroy target land or nonblack creature.
pz2	Treasure Chest	2016-11-16	65795	Brainwash	5a81755f-bc44-47ac-8039-8847a5e37922	covered	combat_support	combat_support	false		Covered by The Dark role audit.	Enchantment — Aura	{W}	1	W	W	Enchant		already reviewed	https://scryfall.com/card/pz2/65795/brainwash?utm_source=api	Enchant creature Enchanted creature can't attack unless its controller pays {3}.
pz2	Treasure Chest	2016-11-16	65797	Cruel Tutor	d9353eb6-c7e7-4d85-a0c2-32b1d091881a	covered	direct_tutor, tutor	direct_tutor, tutor	false		Covered by Portal role audit.	Sorcery	{2}{B}	3	B	B			already reviewed	https://scryfall.com/card/pz2/65797/cruel-tutor?utm_source=api	Search your library for a card, then shuffle and put that card on top. You lose 2 life.
pz2	Treasure Chest	2016-11-16	65799	Xun Yu, Wei Advisor	fb5fea4a-1b04-45c6-a207-e2e8493ea968	covered		combat_body, combat_support	false		Covered by PTK role audit.	Legendary Creature — Human Advisor	{1}{B}{B}	3	B	B			already reviewed	https://scryfall.com/card/pz2/65799/xun-yu-wei-advisor?utm_source=api	{T}: Target creature you control gets +2/+0 until end of turn. Activate only during your turn, before attackers are declared.
pz2	Treasure Chest	2016-11-16	65801	Huang Zhong, Shu General	7d6c4290-d46d-4b98-805c-3f537462c4c8	covered		combat_body, combat_support	false		Covered by PTK role audit.	Legendary Creature — Human Soldier	{2}{W}{W}	4	W	W			already reviewed	https://scryfall.com/card/pz2/65801/huang-zhong-shu-general?utm_source=api	Huang Zhong can't be blocked by more than one creature.
pz2	Treasure Chest	2016-11-16	65803	Lady Sun	dcc363a7-652d-4d2b-9081-3e5735120f21	covered		combat_body, removal, tempo_removal	false		Covered by PTK role audit.	Legendary Creature — Human Advisor	{1}{U}{U}	3	U	U			already reviewed	https://scryfall.com/card/pz2/65803/lady-sun?utm_source=api	{T}: Return Lady Sun and another target creature to their owners' hands. Activate only during your turn, before attackers are declared.
pz2	Treasure Chest	2016-11-16	65805	Zuo Ci, the Mocking Sage	ae8773a3-05f2-4074-9a53-033b0c127235	covered		combat_body, combat_support, self_protection	false		Covered by PTK role audit.	Legendary Creature — Human Advisor	{1}{G}{G}	3	G	G	Hexproof		already reviewed	https://scryfall.com/card/pz2/65805/zuo-ci-the-mocking-sage?utm_source=api	Hexproof (This creature can't be the target of spells or abilities your opponents control.) Zuo Ci can't be blocked by creatures with horsemanship.
pz2	Treasure Chest	2016-11-16	65807	Ma Chao, Western Warrior	023e26d8-b67d-43dd-89b1-8905b1183094	covered		combat_body, combat_support	false		Covered by PTK role audit.	Legendary Creature — Human Soldier Warrior	{3}{R}{R}	5	R	R	Horsemanship		already reviewed	https://scryfall.com/card/pz2/65807/ma-chao-western-warrior?utm_source=api	Horsemanship (This creature can't be blocked except by creatures with horsemanship.) Whenever Ma Chao attacks alone, it can't be blocked this combat.
pz2	Treasure Chest	2016-11-16	65809	Lu Su, Wu Advisor	59238ba1-fde4-4e43-9f24-b24125e59de0	covered		card_draw, combat_body, direct_draw, draw, repeatable_advantage, repeatable_draw	false		Covered by PTK role audit.	Legendary Creature — Human Advisor	{3}{U}{U}	5	U	U			already reviewed	https://scryfall.com/card/pz2/65809/lu-su-wu-advisor?utm_source=api	{T}: Draw a card. Activate only during your turn, before attackers are declared.
pz2	Treasure Chest	2016-11-16	65811	Lady Zhurong, Warrior Queen	531e6ffb-28e0-4e8e-ad88-2f3a243789cf	covered		combat_body, combat_support	false		Covered by PTK role audit.	Legendary Creature — Human Soldier Warrior	{4}{G}	5	G	G	Horsemanship		already reviewed	https://scryfall.com/card/pz2/65811/lady-zhurong-warrior-queen?utm_source=api	Horsemanship (This creature can't be blocked except by creatures with horsemanship.)
pz2	Treasure Chest	2016-11-16	65813	Pang Tong, "Young Phoenix"	6d9dc632-414e-480c-85ef-c2b98a6460ad	covered		combat_body, combat_support	false		Covered by PTK role audit.	Legendary Creature — Human Advisor	{1}{W}{W}	3	W	W			already reviewed	https://scryfall.com/card/pz2/65813/pang-tong-young-phoenix?utm_source=api	{T}: Target creature gets +0/+2 until end of turn. Activate only during your turn, before attackers are declared.
pz2	Treasure Chest	2016-11-16	65815	Sima Yi, Wei Field Marshal	eefa9a94-9915-4dcd-b5dc-7f8e9aa621a7	covered		combat_body	false		Covered by PTK role audit.	Legendary Creature — Human Soldier	{5}{B}	6	B	B			already reviewed	https://scryfall.com/card/pz2/65815/sima-yi-wei-field-marshal?utm_source=api	Sima Yi's power is equal to the number of Swamps you control.
pz2	Treasure Chest	2016-11-16	65817	Cao Ren, Wei Commander	99cbc054-2757-4c07-ad04-9ac67dad4abc	covered		combat_body, combat_support	false		Covered by PTK role audit.	Legendary Creature — Human Soldier Warrior	{2}{B}{B}	4	B	B	Horsemanship		already reviewed	https://scryfall.com/card/pz2/65817/cao-ren-wei-commander?utm_source=api	Horsemanship (This creature can't be blocked except by creatures with horsemanship.) When Cao Ren enters, you lose 3 life.
pz2	Treasure Chest	2016-11-16	65819	Aspect of Wolf	77b7277d-90a1-4774-a998-8c35c3f94e4a	covered	scalable_spell	scalable_spell	false			Enchantment — Aura	{1}{G}	2	G	G	Enchant		already reviewed	https://scryfall.com/card/pz2/65819/aspect-of-wolf?utm_source=api	Enchant creature Enchanted creature gets +X/+Y, where X is half the number of Forests you control, rounded down, and Y is half the number of Forests you control, rounded up.
pz2	Treasure Chest	2016-11-16	65821	Game of Chaos	b6756608-a618-4e26-a090-ea8fc992def1	covered	coin_support, lifegain, multiplier_support, replacement_engine	coin_support, lifegain, multiplier_support, replacement_engine	false		Covered by Ice Age role audit.	Sorcery	{R}{R}{R}	3	R	R	Double		already reviewed	https://scryfall.com/card/pz2/65821/game-of-chaos?utm_source=api	Flip a coin. If you win the flip, you gain 1 life and target opponent loses 1 life, and you decide whether to flip again. If you lose the flip, you lose 1 life and that opponent gains 1 life, and that player decides whether to flip again. Double the life stakes with each flip.
pz2	Treasure Chest	2016-11-16	65823	Pit Scorpion	4804fc42-588c-487a-8ff7-bcc16749fc1f	covered	alternate_finisher, combat_body, finisher	alternate_finisher, combat_body, finisher	false		Covered by Legends role audit.	Creature — Scorpion	{2}{B}	3	B	B			already reviewed	https://scryfall.com/card/pz2/65823/pit-scorpion?utm_source=api	Whenever this creature deals damage to a player, that player gets a poison counter. (A player with ten or more poison counters loses the game.)
pz2	Treasure Chest	2016-11-16	65825	Plant Elemental	e822bf3d-3a29-4a02-9ae8-e2830ce70f15	covered	combat_body	combat_body	false		Covered by Portal role audit.	Creature — Plant Elemental	{1}{G}	2	G	G			already reviewed	https://scryfall.com/card/pz2/65825/plant-elemental?utm_source=api	When this creature enters, sacrifice it unless you sacrifice a Forest.
pz2	Treasure Chest	2016-11-16	65827	Drafna's Restoration	24a78116-d5e0-4e30-b192-d8bffe347a0c	covered	library_recursion, recursion, topdeck_control	library_recursion, recursion, topdeck_control	false		Covered by Antiquities role audit.	Sorcery	{U}	1	U	U			already reviewed	https://scryfall.com/card/pz2/65827/drafnas-restoration?utm_source=api	Put any number of target artifact cards from target player's graveyard on top of their library in any order.
pz2	Treasure Chest	2016-11-16	65829	Flood	e8eb2abb-daf9-43e0-b909-d96b679f71c2	covered	removal, tempo_removal	removal, tempo_removal	false		Covered by The Dark role audit.	Enchantment	{U}	1	U	U			already reviewed	https://scryfall.com/card/pz2/65829/flood?utm_source=api	{U}{U}: Tap target creature without flying.
pz2	Treasure Chest	2016-11-16	65831	Field of Dreams	6dcc62f8-2fd9-473b-9e6a-2dd7e610f855	covered	card_selection, selection, topdeck_info	card_selection, selection, topdeck_info	false		Covered by Legends role audit.	World Enchantment	{U}	1	U	U			already reviewed	https://scryfall.com/card/pz2/65831/field-of-dreams?utm_source=api	Players play with the top card of their libraries revealed.
pz2	Treasure Chest	2016-11-16	65833	Burnt Offering	86eb30a0-0beb-42db-9ddf-cf8be6c99dd3	covered	burst_ramp, ramp, sacrifice_support, scalable_spell	burst_ramp, ramp, sacrifice_support, scalable_spell	false		Covered by Ice Age role audit.	Instant	{B}	1	B	BR			already reviewed	https://scryfall.com/card/pz2/65833/burnt-offering?utm_source=api	As an additional cost to cast this spell, sacrifice a creature. Add X mana in any combination of {B} and/or {R}, where X is the sacrificed creature's mana value.
pz2	Treasure Chest	2016-11-16	65835	Cemetery Gate	443f8dd1-333d-42c4-a286-302a9496209a	covered	combat_body, combat_support, self_protection	combat_body, combat_support, self_protection	false		Covered by Homelands role audit.	Creature — Wall	{2}{B}	3	B	B	Protection, Defender		already reviewed	https://scryfall.com/card/pz2/65835/cemetery-gate?utm_source=api	Defender (This creature can't attack.) Protection from black
pz2	Treasure Chest	2016-11-16	65837	Energy Tap	106ae855-574b-411d-8689-cbb9eeb4f602	covered	burst_ramp, ramp, removal, tempo_removal	burst_ramp, ramp, removal, tempo_removal	false		Covered by Legends role audit.	Sorcery	{U}	1	U	U			already reviewed	https://scryfall.com/card/pz2/65837/energy-tap?utm_source=api	Tap target untapped creature you control. If you do, add an amount of {C} equal to that creature's mana value.
