setCode	setName	releasedAt	collectorNumber	name	oracleId	auditStatus	expectedRoles	actualAnalyzerRoles	needsCodeChange	tagDecision	manualNotes	typeLine	manaCost	manaValue	colors	colorIdentity	keywords	scryfallOracleTags	attentionHint	scryfallUrl	oracleText
rvr	Ravnica Remastered	2024-01-12	123	Siege of Towers	d8eb0897-0d2f-4f2d-a09b-87d57d5a0fa9							Sorcery	{1}{R}	2	R	R	Replicate		has Scryfall tags/keywords but no analyzer role	https://scryfall.com/card/rvr/123/siege-of-towers?utm_source=api	Replicate {1}{R} (When you cast this spell, copy it for each time you paid its replicate cost. You may choose new targets for the copies.) Target Mountain becomes a 3/1 creature. It's still a land.
rvr	Ravnica Remastered	2024-01-12	124	Skewer the Critics	c43b616e-ef87-4c12-810b-a1a3260168fa			removal, targeted_removal				Sorcery	{2}{R}	3	R	R	Spectacle		verify analyzer roles	https://scryfall.com/card/rvr/124/skewer-the-critics?utm_source=api	Spectacle {R} (You may cast this spell for its spectacle cost rather than its mana cost if an opponent lost life this turn.) Skewer the Critics deals 3 damage to any target.
rvr	Ravnica Remastered	2024-01-12	125	Skullcrack	a6fc0b0c-9ba2-47f2-ab92-26fd20d0f86d			lifegain, removal, targeted_removal				Instant	{1}{R}	2	R	R			verify analyzer roles	https://scryfall.com/card/rvr/125/skullcrack?utm_source=api	Players can't gain life this turn. Damage can't be prevented this turn. Skullcrack deals 3 damage to target player or planeswalker.
rvr	Ravnica Remastered	2024-01-12	126	Stalking Vengeance	5f4ff27f-ebc1-4a86-8b0b-eeea470a25fb			combat_body, combat_threat, removal, sacrifice_support, targeted_removal				Creature — Avatar	{5}{R}{R}	7	R	R	Haste		verify analyzer roles	https://scryfall.com/card/rvr/126/stalking-vengeance?utm_source=api	Haste Whenever another creature you control dies, it deals damage equal to its power to target player or planeswalker.
rvr	Ravnica Remastered	2024-01-12	127	Taste for Mayhem	60e7517f-7cc5-4073-9f2c-3e6acb891128			combat_support				Enchantment — Aura	{R}	1	R	R	Enchant, Hellbent		verify analyzer roles	https://scryfall.com/card/rvr/127/taste-for-mayhem?utm_source=api	Enchant creature Enchanted creature gets +2/+0. Hellbent — Enchanted creature gets an additional +2/+0 as long as you have no cards in hand.
rvr	Ravnica Remastered	2024-01-12	128	Tin Street Dodger	fde3c8df-cc57-4e64-b78b-301e103d8487			combat_body, combat_support, combat_threat				Creature — Goblin Rogue	{R}	1	R	R	Haste		verify analyzer roles	https://scryfall.com/card/rvr/128/tin-street-dodger?utm_source=api	Haste {R}: This creature can't be blocked this turn except by creatures with defender.
rvr	Ravnica Remastered	2024-01-12	129	Utvara Hellkite	05a6a571-643e-429e-8e5c-1c3f8b0dc746			combat_body, combat_support, combat_threat, token_support				Creature — Dragon	{6}{R}{R}	8	R	R	Flying		verify analyzer roles	https://scryfall.com/card/rvr/129/utvara-hellkite?utm_source=api	Flying Whenever a Dragon you control attacks, create a 6/6 red Dragon creature token with flying.
rvr	Ravnica Remastered	2024-01-12	130	Wojek Bodyguard	8de57b66-cb97-44e4-8c0d-8ecf3202c299			combat_body, combat_support, counter_support				Creature — Human Soldier	{2}{R}	3	R	R	Mentor		verify analyzer roles	https://scryfall.com/card/rvr/130/wojek-bodyguard?utm_source=api	Mentor (Whenever this creature attacks, put a +1/+1 counter on target attacking creature with lesser power.) This creature can't attack or block alone.
rvr	Ravnica Remastered	2024-01-12	131	Arboreal Grazer	d18a0815-59d3-4667-b52b-9acda741215e			combat_body, combat_threat, land_acceleration, ramp				Creature — Sloth Beast	{G}	1	G	G	Reach		verify analyzer roles	https://scryfall.com/card/rvr/131/arboreal-grazer?utm_source=api	Reach When this creature enters, you may put a land card from your hand onto the battlefield tapped.
rvr	Ravnica Remastered	2024-01-12	132	Band Together	a8631e87-bfc3-463b-bdd1-974ea1d79ae4			removal, targeted_removal				Instant	{2}{G}	3	G	G			verify analyzer roles	https://scryfall.com/card/rvr/132/band-together?utm_source=api	Up to two target creatures you control each deal damage equal to their power to another target creature.
rvr	Ravnica Remastered	2024-01-12	133	Birds of Paradise	d3a0b660-358c-41bd-9cd2-41fbf3491b1a	covered	combat_body, combat_threat, mana_fixing, ramp, stable_ramp	combat_body, combat_threat, mana_fixing, ramp, stable_ramp	false		Non-game insert or decklist card; no analyzer role needed.	Creature — Bird	{G}	1	G	G	Flying		already reviewed	https://scryfall.com/card/rvr/133/birds-of-paradise?utm_source=api	Flying {T}: Add one mana of any color.
rvr	Ravnica Remastered	2024-01-12	134	Chord of Calling	6789a170-f2c5-4fc0-8a45-2b2361e67410	covered		cheat_into_play, cost_reduction, mana_sink, restricted_tutor, scalable_spell, tutor	false		Covered by PRM role audit.	Instant	{X}{G}{G}{G}	3	G	G	Convoke		already reviewed	https://scryfall.com/card/rvr/134/chord-of-calling?utm_source=api	Convoke (Your creatures can help cast this spell. Each creature you tap while casting this spell pays for {1} or one mana of that creature's color.) Search your library for a creature card with mana value X or less, put it onto the battlefield, then shuffle.
rvr	Ravnica Remastered	2024-01-12	135	Crocanura	2071f278-77ba-46f8-85a0-ccd761199f29			combat_body, combat_threat, counter_support				Creature — Crocodile Frog	{2}{G}	3	G	G	Reach, Evolve		verify analyzer roles	https://scryfall.com/card/rvr/135/crocanura?utm_source=api	Reach (This creature can block creatures with flying.) Evolve (Whenever a creature you control enters, if that creature has greater power or toughness than this creature, put a +1/+1 counter on this creature.)
rvr	Ravnica Remastered	2024-01-12	136	Drudge Beetle	f5126c01-f765-44f4-9ced-0fc157f8b897			combat_body, removal, targeted_removal				Creature — Insect	{1}{G}	2	G	G	Scavenge		verify analyzer roles	https://scryfall.com/card/rvr/136/drudge-beetle?utm_source=api	Scavenge {5}{G} ({5}{G}, Exile this card from your graveyard: Put a number of +1/+1 counters equal to this card's power on target creature. Scavenge only as a sorcery.)
rvr	Ravnica Remastered	2024-01-12	137	Experiment One	8520ee67-439b-4f15-838b-420bacbb8b13	covered		combat_body, counter_support	false		Covered by PRM role audit.	Creature — Human Ooze	{G}	1	G	G	Evolve, Heal, Regenerate		already reviewed	https://scryfall.com/card/rvr/137/experiment-one?utm_source=api	Evolve (Whenever a creature you control enters, if that creature has greater power or toughness than this creature, put a +1/+1 counter on this creature.) Remove two +1/+1 counters from this creature: Regenerate it. (The next time this creature would be destroyed this turn, instead tap it, remove it from combat, and heal all damage on it.)
rvr	Ravnica Remastered	2024-01-12	138	Farseek	495e52e6-4c2b-4574-9474-eadbdcc8b4ac	covered		land_acceleration, land_tutor, mana_fixing, ramp, tutor	false		Covered by PRM role audit.	Sorcery	{1}{G}	2	G	G			already reviewed	https://scryfall.com/card/rvr/138/farseek?utm_source=api	Search your library for a Plains, Island, Swamp, or Mountain card, put it onto the battlefield tapped, then shuffle.
rvr	Ravnica Remastered	2024-01-12	139	Fists of Ironwood	2f6a5278-23bf-47b2-a2b9-dfff7d96f3dd			combat_support, token_support				Enchantment — Aura	{1}{G}	2	G	G	Enchant		verify analyzer roles	https://scryfall.com/card/rvr/139/fists-of-ironwood?utm_source=api	Enchant creature When this Aura enters, create two 1/1 green Saproling creature tokens. Enchanted creature has trample.
rvr	Ravnica Remastered	2024-01-12	140	Forced Adaptation	1c859c97-74df-4360-baf8-0f79eae97c45			counter_support				Enchantment — Aura	{G}	1	G	G	Enchant		verify analyzer roles	https://scryfall.com/card/rvr/140/forced-adaptation?utm_source=api	Enchant creature At the beginning of your upkeep, put a +1/+1 counter on enchanted creature.
rvr	Ravnica Remastered	2024-01-12	141	Forced Landing	a787b18d-d33f-41ea-a0f8-f05e272d06eb			removal, tempo_removal				Instant	{1}{G}	2	G	G			verify analyzer roles	https://scryfall.com/card/rvr/141/forced-landing?utm_source=api	Put target creature with flying on the bottom of its owner's library.
rvr	Ravnica Remastered	2024-01-12	142	Fungal Rebirth	b917f39a-3176-47ad-afda-08d09b873c02			card_selection, hand_recursion, recursion, token_support				Instant	{2}{G}	3	G	G			verify analyzer roles	https://scryfall.com/card/rvr/142/fungal-rebirth?utm_source=api	Return target permanent card from your graveyard to your hand. If a creature died this turn, create two 1/1 green Saproling creature tokens.
rvr	Ravnica Remastered	2024-01-12	143	Gather Courage	ae033eb6-47ec-4b9e-9cdb-6d023aca07d1			combat_support, cost_reduction				Instant	{G}	1	G	G	Convoke		verify analyzer roles	https://scryfall.com/card/rvr/143/gather-courage?utm_source=api	Convoke (Your creatures can help cast this spell. Each creature you tap while casting this spell pays for {1} or one mana of that creature's color.) Target creature gets +2/+2 until end of turn.
rvr	Ravnica Remastered	2024-01-12	144	Golgari Grave-Troll	686f4a37-b5e4-46d4-9e0e-11794b2d12cd			card_selection, combat_body, counter_support, hand_recursion, mill_support, protection, regeneration_protection, repeatable_advantage, replacement_engine, targeted_protection				Creature — Troll Skeleton	{4}{G}	5	G	G	Dredge, Regenerate, Mill		verify analyzer roles	https://scryfall.com/card/rvr/144/golgari-grave-troll?utm_source=api	This creature enters with a +1/+1 counter on it for each creature card in your graveyard. {1}, Remove a +1/+1 counter from this creature: Regenerate this creature. Dredge 6 (If you would draw a card, you may mill six cards instead. If you do, return this card from your graveyard to your hand.)
rvr	Ravnica Remastered	2024-01-12	145	Greater Mossdog	aedc3e69-3163-4b8d-97b2-0ad92f28a6dc			card_selection, combat_body, hand_recursion, mill_support, repeatable_advantage, replacement_engine				Creature — Plant Dog	{3}{G}	4	G	G	Dredge, Mill		verify analyzer roles	https://scryfall.com/card/rvr/145/greater-mossdog?utm_source=api	Dredge 3 (If you would draw a card, you may mill three cards instead. If you do, return this card from your graveyard to your hand.)
rvr	Ravnica Remastered	2024-01-12	146	Guardian Project	4f9e07ae-6341-4b46-9f77-f17ab659d266			card_draw, direct_draw, draw, repeatable_advantage, repeatable_draw				Enchantment	{3}{G}	4	G	G			verify analyzer roles	https://scryfall.com/card/rvr/146/guardian-project?utm_source=api	Whenever a nontoken creature you control enters, if it doesn't have the same name as another creature you control or a creature card in your graveyard, draw a card.
rvr	Ravnica Remastered	2024-01-12	147	Horncaller's Chant	8c069834-ed89-4298-989b-e67036d56196			copy_support, token_support				Sorcery	{7}{G}	8	G	G	Populate		verify analyzer roles	https://scryfall.com/card/rvr/147/horncallers-chant?utm_source=api	Create a 4/4 green Rhino creature token with trample, then populate. (Create a token that's a copy of a creature token you control.)
rvr	Ravnica Remastered	2024-01-12	148	Life from the Loam	ac8fba34-512c-4f24-999a-ab72f1ce4acb			card_selection, hand_recursion, mass_recursion, mill_support, recursion, replacement_engine				Sorcery	{1}{G}	2	G	G	Dredge, Mill		verify analyzer roles	https://scryfall.com/card/rvr/148/life-from-the-loam?utm_source=api	Return up to three target land cards from your graveyard to your hand. Dredge 3 (If you would draw a card, you may mill three cards instead. If you do, return this card from your graveyard to your hand.)
rvr	Ravnica Remastered	2024-01-12	149	Loaming Shaman	cf7352bf-3971-4bb7-88b9-65ab9a219289			combat_body				Creature — Centaur Shaman	{2}{G}	3	G	G			verify analyzer roles	https://scryfall.com/card/rvr/149/loaming-shaman?utm_source=api	When this creature enters, target player shuffles any number of target cards from their graveyard into their library.
rvr	Ravnica Remastered	2024-01-12	150	Moldervine Cloak	dd106f2d-5ede-43f0-928a-1ab392b90854			card_selection, combat_support, hand_recursion, mill_support, repeatable_advantage, replacement_engine				Enchantment — Aura	{2}{G}	3	G	G	Dredge, Enchant, Mill		verify analyzer roles	https://scryfall.com/card/rvr/150/moldervine-cloak?utm_source=api	Enchant creature Enchanted creature gets +3/+3. Dredge 2 (If you would draw a card, you may mill two cards instead. If you do, return this card from your graveyard to your hand.)
rvr	Ravnica Remastered	2024-01-12	151	Open the Gates	f38e43b6-9a8c-4f6a-bd1c-d5c4913a28a1			land_acceleration, land_tutor, mana_fixing, ramp, tutor				Sorcery	{G}	1	G	G			verify analyzer roles	https://scryfall.com/card/rvr/151/open-the-gates?utm_source=api	Search your library for a basic land card or Gate card, reveal it, put it into your hand, then shuffle.
rvr	Ravnica Remastered	2024-01-12	152	Overwhelm	caeaad5e-2d68-481c-9a35-c2c3b345963d			combat_support, cost_reduction				Sorcery	{5}{G}{G}	7	G	G	Convoke		verify analyzer roles	https://scryfall.com/card/rvr/152/overwhelm?utm_source=api	Convoke (Your creatures can help cast this spell. Each creature you tap while casting this spell pays for {1} or one mana of that creature's color.) Creatures you control get +3/+3 until end of turn.
rvr	Ravnica Remastered	2024-01-12	153	Protean Hulk	10180e2f-90c5-4d41-ba44-16b14948f923			cheat_into_play, combat_body, cost_reduction, restricted_tutor, sacrifice_support, tutor				Creature — Beast	{5}{G}{G}	7	G	G			verify analyzer roles	https://scryfall.com/card/rvr/153/protean-hulk?utm_source=api	When this creature dies, search your library for any number of creature cards with total mana value 6 or less, put them onto the battlefield, then shuffle.
rvr	Ravnica Remastered	2024-01-12	154	Rampaging Rendhorn	b867deb4-a088-492e-95fe-487071ebfe8d			combat_body				Creature — Beast	{4}{G}	5	G	G	Riot		verify analyzer roles	https://scryfall.com/card/rvr/154/rampaging-rendhorn?utm_source=api	Riot (This creature enters with your choice of a +1/+1 counter or haste.)
rvr	Ravnica Remastered	2024-01-12	155	Siege Wurm	8a802eae-abfb-47fd-8458-1689055531ef			combat_body, combat_threat, cost_reduction				Creature — Wurm	{5}{G}{G}	7	G	G	Trample, Convoke		verify analyzer roles	https://scryfall.com/card/rvr/155/siege-wurm?utm_source=api	Convoke (Your creatures can help cast this spell. Each creature you tap while casting this spell pays for {1} or one mana of that creature's color.) Trample
rvr	Ravnica Remastered	2024-01-12	156	Silhana Ledgewalker	5b15dcac-38dc-4957-bc01-40153ea07559			combat_body, combat_support, self_protection				Creature — Elf Rogue	{1}{G}	2	G	G	Hexproof		verify analyzer roles	https://scryfall.com/card/rvr/156/silhana-ledgewalker?utm_source=api	Hexproof (This creature can't be the target of spells or abilities your opponents control.) This creature can't be blocked except by creatures with flying.
rvr	Ravnica Remastered	2024-01-12	157	Sprouting Renewal	674202f0-6832-4392-a118-d513162bcd03			cost_reduction, removal, targeted_removal, token_support				Sorcery	{2}{G}	3	G	G	Convoke		verify analyzer roles	https://scryfall.com/card/rvr/157/sprouting-renewal?utm_source=api	Convoke (Your creatures can help cast this spell. Each creature you tap while casting this spell pays for {1} or one mana of that creature's color.) Choose one — • Create a 2/2 green and white Elf Knight creature token with vigilance. • Destroy target artifact or enchantment.
rvr	Ravnica Remastered	2024-01-12	158	Titanic Brawl	e8434c77-10df-4456-af27-acb95d624189			counter_support				Instant	{1}{G}	2	G	G	Fight		verify analyzer roles	https://scryfall.com/card/rvr/158/titanic-brawl?utm_source=api	This spell costs {1} less to cast if it targets a creature you control with a +1/+1 counter on it. Target creature you control fights target creature you don't control. (Each deals damage equal to its power to the other.)
rvr	Ravnica Remastered	2024-01-12	159	Utopia Sprawl	00d8efa6-a2d9-4249-8da7-b45173675329			mana_fixing, stable_ramp				Enchantment — Aura	{G}	1	G	G	Enchant		verify analyzer roles	https://scryfall.com/card/rvr/159/utopia-sprawl?utm_source=api	Enchant Forest As this Aura enters, choose a color. Whenever enchanted Forest is tapped for mana, its controller adds an additional one mana of the chosen color.
rvr	Ravnica Remastered	2024-01-12	160	Wasteland Viper	e30b4eb8-6393-486a-9f8e-970ad2351d8a			combat_body, combat_support, combat_threat				Creature — Snake	{G}	1	G	G	Bloodrush, Deathtouch		verify analyzer roles	https://scryfall.com/card/rvr/160/wasteland-viper?utm_source=api	Deathtouch Bloodrush — {G}, Discard this card: Target attacking creature gets +1/+2 and gains deathtouch until end of turn.
rvr	Ravnica Remastered	2024-01-12	161	Wurmweaver Coil	83419229-c266-4022-8297-d1b05ec5ee20			combat_support, sacrifice_support, token_support				Enchantment — Aura	{4}{G}{G}	6	G	G	Enchant		verify analyzer roles	https://scryfall.com/card/rvr/161/wurmweaver-coil?utm_source=api	Enchant green creature Enchanted creature gets +6/+6. {G}{G}{G}, Sacrifice this Aura: Create a 6/6 green Wurm creature token.
rvr	Ravnica Remastered	2024-01-12	162	Yeva, Nature's Herald	2d513c3e-bd27-479e-af32-7f66d96d0de0			combat_body, replacement_engine, tempo_support				Legendary Creature — Elf Shaman	{2}{G}{G}	4	G	G	Flash		verify analyzer roles	https://scryfall.com/card/rvr/162/yeva-natures-herald?utm_source=api	Flash (You may cast this spell any time you could cast an instant.) You may cast green creature spells as though they had flash.
rvr	Ravnica Remastered	2024-01-12	163	Assemble the Legion	6f81bef3-6ca0-4cf4-aa99-7b2813eeef04			counter_support, token_support				Enchantment	{3}{R}{W}	5	RW	RW			verify analyzer roles	https://scryfall.com/card/rvr/163/assemble-the-legion?utm_source=api	At the beginning of your upkeep, put a muster counter on this enchantment. Then create a 1/1 red and white Soldier creature token with haste for each muster counter on this enchantment.
rvr	Ravnica Remastered	2024-01-12	164	Aurelia, Exemplar of Justice	2e1e0385-1537-4cb6-9d24-e4593d9a8f4a			combat_body, combat_support, combat_threat, counter_support				Legendary Creature — Angel	{2}{R}{W}	4	RW	RW	Flying, Mentor		verify analyzer roles	https://scryfall.com/card/rvr/164/aurelia-exemplar-of-justice?utm_source=api	Flying Mentor (Whenever this creature attacks, put a +1/+1 counter on target attacking creature with lesser power.) At the beginning of combat on your turn, choose up to one target creature you control. Until end of turn, that creature gets +2/+0, gains trample if it's red, and gains vigilance if it's white.
rvr	Ravnica Remastered	2024-01-12	165	Azorius Guildmage	16f61f69-cdde-4b6c-b855-c74db9038ceb	covered		broad_stack, combat_body, removal, stack, tempo_removal	false		Covered by PRM role audit.	Creature — Vedalken Wizard	{W/U}{W/U}	2	UW	UW			already reviewed	https://scryfall.com/card/rvr/165/azorius-guildmage?utm_source=api	{2}{W}: Tap target creature. {2}{U}: Counter target activated ability. (Mana abilities can't be targeted.)
rvr	Ravnica Remastered	2024-01-12	166	Blind Hunter	a731f5bc-892c-4857-9590-4fa31c1caf00			combat_body, combat_threat, lifegain, removal, sacrifice_support, targeted_removal				Creature — Bat	{2}{W}{B}	4	BW	BW	Flying, Haunt		verify analyzer roles	https://scryfall.com/card/rvr/166/blind-hunter?utm_source=api	Flying Haunt (When this creature dies, exile it haunting target creature.) When this creature enters or the creature it haunts dies, target player loses 2 life and you gain 2 life.
rvr	Ravnica Remastered	2024-01-12	167	Borborygmos Enraged	b7505737-1fc8-4ee8-8b1d-5dde73b6a76d			card_selection, combat_body, combat_support, combat_threat, removal, targeted_removal				Legendary Creature — Cyclops	{4}{R}{R}{G}{G}	8	GR	GR	Trample		verify analyzer roles	https://scryfall.com/card/rvr/167/borborygmos-enraged?utm_source=api	Trample Whenever Borborygmos Enraged deals combat damage to a player, reveal the top three cards of your library. Put all land cards revealed this way into your hand and the rest into your graveyard. Discard a land card: Borborygmos Enraged deals 3 damage to any target.
rvr	Ravnica Remastered	2024-01-12	168	Boros Guildmage	266c2f49-82eb-48e9-a7ea-e0da787fa40e			combat_body, combat_support				Creature — Human Wizard	{R/W}{R/W}	2	RW	RW			verify analyzer roles	https://scryfall.com/card/rvr/168/boros-guildmage?utm_source=api	{1}{R}: Target creature gains haste until end of turn. {1}{W}: Target creature gains first strike until end of turn.
rvr	Ravnica Remastered	2024-01-12	169	Call of the Conclave	e1635acd-ed1e-4038-a11a-6518df285253	covered		token_support	false		Covered by PRM role audit.	Sorcery	{G}{W}	2	GW	GW			already reviewed	https://scryfall.com/card/rvr/169/call-of-the-conclave?utm_source=api	Create a 3/3 green Centaur creature token.
rvr	Ravnica Remastered	2024-01-12	170	Cartel Aristocrat	9603e553-f72d-40bf-94ab-596afb7d6db3			combat_body, sacrifice_support, self_protection				Creature — Human Advisor	{W}{B}	2	BW	BW			verify analyzer roles	https://scryfall.com/card/rvr/170/cartel-aristocrat?utm_source=api	Sacrifice another creature: This creature gains protection from the color of your choice until end of turn.
rvr	Ravnica Remastered	2024-01-12	171	Cindervines	92d95e12-fa51-4360-88e4-9078ccc5d8d3			removal, sacrifice_support, targeted_removal				Enchantment	{R}{G}	2	GR	GR			verify analyzer roles	https://scryfall.com/card/rvr/171/cindervines?utm_source=api	Whenever an opponent casts a noncreature spell, this enchantment deals 1 damage to that player. {1}, Sacrifice this enchantment: Destroy target artifact or enchantment. This enchantment deals 2 damage to that permanent's controller.
rvr	Ravnica Remastered	2024-01-12	172	Coiling Oracle	69fd4ddf-9ed8-4c56-bef3-9944daf05e4f	covered		card_selection, combat_body	false		Covered by PRM role audit.	Creature — Snake Elf Druid	{G}{U}	2	GU	GU			already reviewed	https://scryfall.com/card/rvr/172/coiling-oracle?utm_source=api	When this creature enters, reveal the top card of your library. If it's a land card, put it onto the battlefield. Otherwise, put that card into your hand.
rvr	Ravnica Remastered	2024-01-12	173	Conclave Cavalier	653de668-beb0-4be7-bb05-30de5f52a3f1			combat_body, combat_threat, sacrifice_support, token_support				Creature — Centaur Knight	{G}{G}{W}{W}	4	GW	GW	Vigilance		verify analyzer roles	https://scryfall.com/card/rvr/173/conclave-cavalier?utm_source=api	Vigilance When this creature dies, create two 2/2 green and white Elf Knight creature tokens with vigilance.
rvr	Ravnica Remastered	2024-01-12	174	Crackling Drake	c8b4eba6-88ce-42d7-a235-5a4765a4a981			card_draw, combat_body, combat_threat, direct_draw, draw				Creature — Drake	{U}{U}{R}{R}	4	RU	RU	Flying		verify analyzer roles	https://scryfall.com/card/rvr/174/crackling-drake?utm_source=api	Flying Crackling Drake's power is equal to the total number of instant and sorcery cards you own in exile and in your graveyard. When this creature enters, draw a card.
rvr	Ravnica Remastered	2024-01-12	175	Deathrite Shaman	22f1a4a4-c423-4d1c-8775-0ed604a9fa51			combat_body, direct_finisher, finisher, graveyard_hate, lifegain, mana_fixing, removal, repeatable_finisher, stable_ramp, targeted_removal				Creature — Elf Shaman	{B/G}	1	BG	BG			verify analyzer roles	https://scryfall.com/card/rvr/175/deathrite-shaman?utm_source=api	{T}: Exile target land card from a graveyard. Add one mana of any color. {B}, {T}: Exile target instant or sorcery card from a graveyard. Each opponent loses 2 life. {G}, {T}: Exile target creature card from a graveyard. You gain 2 life.
rvr	Ravnica Remastered	2024-01-12	176	Debt to the Deathless	6130f22d-7901-4f9f-b777-27bb0dacc063			direct_finisher, finisher, lifegain, mana_sink, scalable_spell				Sorcery	{X}{W}{W}{B}{B}	4	BW	BW			verify analyzer roles	https://scryfall.com/card/rvr/176/debt-to-the-deathless?utm_source=api	Each opponent loses two times X life. You gain life equal to the life lost this way.
rvr	Ravnica Remastered	2024-01-12	177	Deputy of Acquittals	3cbb5045-8566-4279-b7d3-3e599b11ccc5			combat_body, removal, replacement_engine, self_bounce, tempo_removal, tempo_support				Creature — Human Wizard	{W}{U}	2	UW	UW	Flash		verify analyzer roles	https://scryfall.com/card/rvr/177/deputy-of-acquittals?utm_source=api	Flash (You may cast this spell any time you could cast an instant.) When this creature enters, you may return another target creature you control to its owner's hand.
rvr	Ravnica Remastered	2024-01-12	178	Dimir Guildmage	1b6c67e5-5913-4db9-85d9-8dae57da02ee	covered		card_draw, combat_body, hand_attack, removal, repeatable_advantage	false		Covered by PRM role audit.	Creature — Human Wizard	{U/B}{U/B}	2	BU	BU			already reviewed	https://scryfall.com/card/rvr/178/dimir-guildmage?utm_source=api	({U/B} can be paid with either {U} or {B}.) {3}{U}: Target player draws a card. Activate only as a sorcery. {3}{B}: Target player discards a card. Activate only as a sorcery.
rvr	Ravnica Remastered	2024-01-12	179	Domri Rade	0c4a2c42-0874-40b4-8d12-47eeadc3e976			broad_protection, card_selection, combat_support, self_protection				Legendary Planeswalker — Domri	{1}{R}{G}	3	GR	GR	Fight		verify analyzer roles	https://scryfall.com/card/rvr/179/domri-rade?utm_source=api	+1: Look at the top card of your library. If it's a creature card, you may reveal it and put it into your hand. −2: Target creature you control fights another target creature. −7: You get an emblem with "Creatures you control have double strike, trample, hexproof, and haste."
rvr	Ravnica Remastered	2024-01-12	180	Dreadbore	d685799f-cc1a-40d6-9df6-d05b8b1f5b13			removal, targeted_removal				Sorcery	{B}{R}	2	BR	BR			verify analyzer roles	https://scryfall.com/card/rvr/180/dreadbore?utm_source=api	Destroy target creature or planeswalker.
