setCode	setName	releasedAt	collectorNumber	name	oracleId	auditStatus	expectedRoles	actualAnalyzerRoles	needsCodeChange	tagDecision	manualNotes	typeLine	manaCost	manaValue	colors	colorIdentity	keywords	scryfallOracleTags	attentionHint	scryfallUrl	oracleText
tdm	Tarkir: Dragonstorm	2025-04-11	1	Ugin, Eye of the Storms	5c58353a-fd60-4528-bf0d-669626cda0b2	covered	burst_ramp, card_draw, card_selection, direct_draw, direct_tutor, draw, lifegain, ramp, removal, repeatable_advantage, repeatable_draw, targeted_removal, tutor	burst_ramp, card_draw, card_selection, direct_draw, direct_tutor, draw, lifegain, ramp, removal, repeatable_advantage, repeatable_draw, targeted_removal, tutor	false		Analyzer roles accepted during batch clean pass.	Legendary Planeswalker — Ugin	{7}	7					verify analyzer roles	https://scryfall.com/card/tdm/1/ugin-eye-of-the-storms?utm_source=api	When you cast this spell, exile up to one target permanent that's one or more colors. Whenever you cast a colorless spell, exile up to one target permanent that's one or more colors. +2: You gain 3 life and draw a card. 0: Add {C}{C}{C}. −11: Search your library for any number of colorless nonland cards, exile them, then shuffle. Until end of turn, you may cast those cards without paying their mana costs.
tdm	Tarkir: Dragonstorm	2025-04-11	2	Anafenza, Unyielding Lineage	659bc01c-fa60-4d00-bdad-5bca1d2a978f	covered	combat_body, combat_threat, counter_support, sacrifice_support, token_support	combat_body, combat_threat, counter_support, sacrifice_support, token_support	false		Analyzer roles accepted during batch clean pass.	Legendary Creature — Spirit Soldier	{2}{W}	3	W	W	First strike, Flash, Endure		verify analyzer roles	https://scryfall.com/card/tdm/2/anafenza-unyielding-lineage?utm_source=api	Flash First strike Whenever another nontoken creature you control dies, Anafenza endures 2. (Put two +1/+1 counters on it or create a 2/2 white Spirit creature token.)
tdm	Tarkir: Dragonstorm	2025-04-11	3	Arashin Sunshield	1175d482-d8a2-467f-bc50-2f4b241966bb	covered	combat_body, graveyard_hate, hate_piece, removal, stax_piece, tempo_removal	combat_body, graveyard_hate, hate_piece, removal, stax_piece, tempo_removal	false		Analyzer roles accepted during batch clean pass.	Creature — Human Warrior	{3}{W}	4	W	W			verify analyzer roles	https://scryfall.com/card/tdm/3/arashin-sunshield?utm_source=api	When this creature enters, exile up to two target cards from a single graveyard. {W}, {T}: Tap target creature.
tdm	Tarkir: Dragonstorm	2025-04-11	4	Bearer of Glory	963947d5-5fe4-49cd-be0c-0bdb5f7bcbb6	covered	combat_body, combat_support	combat_body, combat_support	false		Analyzer roles accepted during batch clean pass.	Creature — Human Soldier	{1}{W}	2	W	W			verify analyzer roles	https://scryfall.com/card/tdm/4/bearer-of-glory?utm_source=api	During your turn, this creature has first strike. {4}{W}: Creatures you control get +1/+1 until end of turn.
tdm	Tarkir: Dragonstorm	2025-04-11	5	Clarion Conqueror	f1266a1b-bae6-4ded-b4d5-7586a5b6c5d0	covered	combat_body, combat_threat	combat_body, combat_threat	false		Analyzer roles accepted during batch clean pass.	Creature — Dragon	{2}{W}	3	W	W	Flying		verify analyzer roles	https://scryfall.com/card/tdm/5/clarion-conqueror?utm_source=api	Flying Activated abilities of artifacts, creatures, and planeswalkers can't be activated.
tdm	Tarkir: Dragonstorm	2025-04-11	6	Coordinated Maneuver	6ff39311-565e-4414-b32b-eb24c70b3090	covered	removal, targeted_removal	removal, targeted_removal	false		Analyzer roles accepted during batch clean pass.	Instant	{1}{W}	2	W	W			verify analyzer roles	https://scryfall.com/card/tdm/6/coordinated-maneuver?utm_source=api	Choose one — • Coordinated Maneuver deals damage equal to the number of creatures you control to target creature or planeswalker. • Destroy target enchantment.
tdm	Tarkir: Dragonstorm	2025-04-11	7	Dalkovan Packbeasts	cdd1a043-bd47-4197-be26-e2f7d3f1d209	covered	combat_body, combat_support, combat_threat, sacrifice_support, token_support	combat_body, combat_support, combat_threat, sacrifice_support, token_support	false		Analyzer roles accepted during batch clean pass.	Creature — Ox	{2}{W}	3	W	W	Vigilance, Mobilize		verify analyzer roles	https://scryfall.com/card/tdm/7/dalkovan-packbeasts?utm_source=api	Vigilance Mobilize 3 (Whenever this creature attacks, create three tapped and attacking 1/1 red Warrior creature tokens. Sacrifice them at the beginning of the next end step.)
tdm	Tarkir: Dragonstorm	2025-04-11	8	Descendant of Storms	ca773c52-ca64-463c-99cf-e71b59d2cff7	covered	combat_body, combat_support, counter_support, token_support	combat_body, combat_support, counter_support, token_support	false		Analyzer roles accepted during batch clean pass.	Creature — Human Soldier	{W}	1	W	W	Endure		verify analyzer roles	https://scryfall.com/card/tdm/8/descendant-of-storms?utm_source=api	Whenever this creature attacks, you may pay {1}{W}. If you do, it endures 1. (Put a +1/+1 counter on it or create a 1/1 white Spirit creature token.)
tdm	Tarkir: Dragonstorm	2025-04-11	9	Dragonback Lancer	7875c063-19c3-4e6e-81d8-1a378a4e16e5	covered	combat_body, combat_support, combat_threat, sacrifice_support, token_support	combat_body, combat_support, combat_threat, sacrifice_support, token_support	false		Analyzer roles accepted during batch clean pass.	Creature — Human Soldier	{3}{W}	4	W	W	Flying, Mobilize		verify analyzer roles	https://scryfall.com/card/tdm/9/dragonback-lancer?utm_source=api	Flying Mobilize 1 (Whenever this creature attacks, create a tapped and attacking 1/1 red Warrior creature token. Sacrifice it at the beginning of the next end step.)
tdm	Tarkir: Dragonstorm	2025-04-11	10	Duty Beyond Death	67e6ce99-4883-4713-9822-cb2334765b5b	covered	broad_protection, combat_support, counter_support, protection, sacrifice_support, self_protection	broad_protection, combat_support, counter_support, protection, sacrifice_support, self_protection	false		Analyzer roles accepted during batch clean pass.	Instant	{1}{W}	2	W	W			verify analyzer roles	https://scryfall.com/card/tdm/10/duty-beyond-death?utm_source=api	As an additional cost to cast this spell, sacrifice a creature. Creatures you control gain indestructible until end of turn. Put a +1/+1 counter on each creature you control. (Damage and effects that say "destroy" don't destroy those creatures.)
tdm	Tarkir: Dragonstorm	2025-04-11	11	Elspeth, Storm Slayer	f78af825-023a-42e9-8374-5c52303a1417	covered	combat_support, counter_support, multiplier_support, removal, replacement_engine, targeted_removal, token_support	combat_support, counter_support, multiplier_support, removal, replacement_engine, targeted_removal, token_support	false		Analyzer roles accepted during batch clean pass.	Legendary Planeswalker — Elspeth	{3}{W}{W}	5	W	W			verify analyzer roles	https://scryfall.com/card/tdm/11/elspeth-storm-slayer?utm_source=api	If one or more tokens would be created under your control, twice that many of those tokens are created instead. +1: Create a 1/1 white Soldier creature token. 0: Put a +1/+1 counter on each creature you control. Those creatures gain flying until your next turn. −3: Destroy target creature an opponent controls with mana value 3 or greater.
tdm	Tarkir: Dragonstorm	2025-04-11	12	Fortress Kin-Guard	fa3ed0f6-e44e-433d-80d3-824de5e6135a	covered	combat_body, counter_support, token_support	combat_body, counter_support, token_support	false		Analyzer roles accepted during batch clean pass.	Creature — Dog Soldier	{1}{W}	2	W	W	Endure		verify analyzer roles	https://scryfall.com/card/tdm/12/fortress-kin-guard?utm_source=api	When this creature enters, it endures 1. (Put a +1/+1 counter on it or create a 1/1 white Spirit creature token.)
tdm	Tarkir: Dragonstorm	2025-04-11	13	Furious Forebear	4fb1d33f-a87d-46cf-a73e-882c3dbcb26f	covered	card_selection, combat_body, hand_recursion, repeatable_advantage, sacrifice_support	card_selection, combat_body, hand_recursion, repeatable_advantage, sacrifice_support	false		Analyzer roles accepted during batch clean pass.	Creature — Spirit Warrior	{1}{W}	2	W	W			verify analyzer roles	https://scryfall.com/card/tdm/13/furious-forebear?utm_source=api	Whenever a creature you control dies while this card is in your graveyard, you may pay {1}{W}. If you do, return this card from your graveyard to your hand.
tdm	Tarkir: Dragonstorm	2025-04-11	14	Lightfoot Technique	601b7481-19fc-4779-950e-883a9a22aec3	covered	counter_support, self_protection	counter_support, self_protection	false		Analyzer roles accepted during batch clean pass.	Instant	{1}{W}	2	W	W			verify analyzer roles	https://scryfall.com/card/tdm/14/lightfoot-technique?utm_source=api	Put a +1/+1 counter on target creature. It gains flying and indestructible until end of turn. (Damage and effects that say "destroy" don't destroy it.)
tdm	Tarkir: Dragonstorm	2025-04-11	15	Loxodon Battle Priest	8cf4ddb0-2a83-4d8f-b636-7ba3c81ea4ca	covered	combat_body, counter_support	combat_body, counter_support	false		Analyzer roles accepted during batch clean pass.	Creature — Elephant Cleric	{4}{W}	5	W	W			verify analyzer roles	https://scryfall.com/card/tdm/15/loxodon-battle-priest?utm_source=api	At the beginning of combat on your turn, put a +1/+1 counter on another target creature you control.
tdm	Tarkir: Dragonstorm	2025-04-11	16	Mardu Devotee	24ee57b5-a505-4264-97ca-8b8dfb12298e	covered	card_selection, combat_body, ramp, selection, stable_ramp	card_selection, combat_body, ramp, selection, stable_ramp	false		Analyzer roles accepted during batch clean pass.	Creature — Human Scout	{W}	1	W	BRW	Scry		verify analyzer roles	https://scryfall.com/card/tdm/16/mardu-devotee?utm_source=api	When this creature enters, scry 2. (Look at the top two cards of your library, then put any number of them on the bottom and the rest on top in any order.) {1}: Add {R}, {W}, or {B}. Activate only once each turn.
tdm	Tarkir: Dragonstorm	2025-04-11	17	Osseous Exhale	8d84a706-080c-4fb2-b1b9-3dbb3294fb7b	covered	lifegain, removal, targeted_removal	lifegain, removal, targeted_removal	false		Analyzer roles accepted during batch clean pass.	Instant	{1}{W}	2	W	W	Behold		verify analyzer roles	https://scryfall.com/card/tdm/17/osseous-exhale?utm_source=api	As an additional cost to cast this spell, you may behold a Dragon. (You may choose a Dragon you control or reveal a Dragon card from your hand.) Osseous Exhale deals 5 damage to target attacking or blocking creature. If a Dragon was beheld, you gain 2 life.
tdm	Tarkir: Dragonstorm	2025-04-11	18	Poised Practitioner	e08debdc-2db5-4562-8a02-4158bfc0db88	covered	card_selection, combat_body, counter_support, selection	card_selection, combat_body, counter_support, selection	false		Analyzer roles accepted during batch clean pass.	Creature — Human Monk	{2}{W}	3	W	W	Flurry, Scry		verify analyzer roles	https://scryfall.com/card/tdm/18/poised-practitioner?utm_source=api	Flurry — Whenever you cast your second spell each turn, put a +1/+1 counter on this creature. Scry 1. (Look at the top card of your library. You may put that card on the bottom.)
tdm	Tarkir: Dragonstorm	2025-04-11	19	Rally the Monastery	3f6101a5-3038-45b0-8302-b2e4127b9510	covered	combat_support, removal, targeted_removal, token_support	combat_support, removal, targeted_removal, token_support	false		Analyzer roles accepted during batch clean pass.	Instant	{3}{W}	4	W	W			verify analyzer roles	https://scryfall.com/card/tdm/19/rally-the-monastery?utm_source=api	This spell costs {2} less to cast if you've cast another spell this turn. Choose one — • Create two 1/1 white Monk creature tokens with prowess. • Up to two target creatures you control each get +2/+2 until end of turn. • Destroy target creature with power 4 or greater.
tdm	Tarkir: Dragonstorm	2025-04-11	20	Rebellious Strike	4f3d7102-f8ce-42d4-94eb-f69b695773d1	covered	card_draw, combat_support, direct_draw, draw	card_draw, combat_support, direct_draw, draw	false		Analyzer roles accepted during batch clean pass.	Instant	{1}{W}	2	W	W			verify analyzer roles	https://scryfall.com/card/tdm/20/rebellious-strike?utm_source=api	Target creature gets +3/+0 until end of turn. Draw a card.
tdm	Tarkir: Dragonstorm	2025-04-11	21	Riling Dawnbreaker // Signaling Roar	1fc31651-70fe-4a58-9b7e-7359510bba51	covered	combat_body, combat_support, combat_threat, token_support	combat_body, combat_support, combat_threat, token_support	false		Analyzer roles accepted during batch clean pass.	Creature — Dragon // Sorcery — Omen	{4}{W} // {1}{W}	5	W	W	Flying, Vigilance		verify analyzer roles	https://scryfall.com/card/tdm/21/riling-dawnbreaker-signaling-roar?utm_source=api	Riling Dawnbreaker: Flying, vigilance At the beginning of combat on your turn, another target creature you control gets +1/+0 until end of turn. // Signaling Roar: Create a 2/2 white Soldier creature token. (Then shuffle this card into its owner's library.)
tdm	Tarkir: Dragonstorm	2025-04-11	22	Sage of the Skies	cfc7cef7-0a95-49f8-970f-abff2cacd82d	covered	combat_body, combat_threat, lifegain	combat_body, combat_threat, lifegain	false		Analyzer roles accepted during batch clean pass.	Creature — Human Monk	{2}{W}	3	W	W	Flying, Lifelink		verify analyzer roles	https://scryfall.com/card/tdm/22/sage-of-the-skies?utm_source=api	When you cast this spell, if you've cast another spell this turn, copy this spell. (The copy becomes a token.) Flying, lifelink
tdm	Tarkir: Dragonstorm	2025-04-11	23	Salt Road Packbeast	50261b9d-48f2-4bad-a35b-14f13b3cdd32	covered	card_draw, combat_body, direct_draw, draw	card_draw, combat_body, direct_draw, draw	false		Analyzer roles accepted during batch clean pass.	Creature — Beast	{5}{W}	6	W	W	Affinity		verify analyzer roles	https://scryfall.com/card/tdm/23/salt-road-packbeast?utm_source=api	Affinity for creatures (This spell costs {1} less to cast for each creature you control.) When this creature enters, draw a card.
tdm	Tarkir: Dragonstorm	2025-04-11	24	Smile at Death	9228f04c-506f-4453-a335-e66876b8ce8d	covered	battlefield_recursion, card_selection, counter_support, mass_recursion, recursion, repeatable_advantage	battlefield_recursion, card_selection, counter_support, mass_recursion, recursion, repeatable_advantage	false		Analyzer roles accepted during batch clean pass.	Enchantment	{3}{W}{W}	5	W	W			verify analyzer roles	https://scryfall.com/card/tdm/24/smile-at-death?utm_source=api	At the beginning of your upkeep, return up to two target creature cards with power 2 or less from your graveyard to the battlefield. Put a +1/+1 counter on each of those creatures.
tdm	Tarkir: Dragonstorm	2025-04-11	25	Starry-Eyed Skyrider	04e615e6-4088-4170-904c-f2d4bcebed59	covered	combat_body, combat_support, combat_threat, token_support	combat_body, combat_support, combat_threat, token_support	false		Analyzer roles accepted during batch clean pass.	Creature — Human Scout	{2}{W}	3	W	W	Flying		verify analyzer roles	https://scryfall.com/card/tdm/25/starry-eyed-skyrider?utm_source=api	Flying Whenever this creature attacks, another target creature you control gains flying until end of turn. Attacking tokens you control have flying.
tdm	Tarkir: Dragonstorm	2025-04-11	26	Static Snare	b5b742d2-f19b-47c9-84bd-e85d975900e6	covered	removal, targeted_removal	removal, targeted_removal	false		Analyzer roles accepted during batch clean pass.	Enchantment	{4}{W}	5	W	W	Flash		verify analyzer roles	https://scryfall.com/card/tdm/26/static-snare?utm_source=api	Flash This spell costs {1} less to cast for each attacking creature. When this enchantment enters, exile target artifact or creature an opponent controls until this enchantment leaves the battlefield.
tdm	Tarkir: Dragonstorm	2025-04-11	27	Stormbeacon Blade	f4b3ee43-fc01-425f-8322-29bf6d16cb3f	covered	artifact_support, card_draw, combat_support, direct_draw, draw, repeatable_advantage, repeatable_draw	artifact_support, card_draw, combat_support, direct_draw, draw, repeatable_advantage, repeatable_draw	false		Analyzer roles accepted during batch clean pass.	Artifact — Equipment	{1}{W}	2	W	W	Equip		verify analyzer roles	https://scryfall.com/card/tdm/27/stormbeacon-blade?utm_source=api	Equipped creature gets +3/+0. Whenever equipped creature attacks, draw a card if you control three or more attacking creatures. Equip {2} ({2}: Attach to target creature you control. Equip only as a sorcery.)
tdm	Tarkir: Dragonstorm	2025-04-11	28	Stormplain Detainment	4ad9c550-5605-4ffe-8e27-e9f2d9ada000	covered	removal, targeted_removal	removal, targeted_removal	false		Analyzer roles accepted during batch clean pass.	Enchantment	{2}{W}	3	W	W			verify analyzer roles	https://scryfall.com/card/tdm/28/stormplain-detainment?utm_source=api	When this enchantment enters, exile target nonland permanent an opponent controls until this enchantment leaves the battlefield.
tdm	Tarkir: Dragonstorm	2025-04-11	29	Sunpearl Kirin	f17b9356-a329-4f89-b690-afc2eaff4977	covered	card_draw, combat_body, combat_threat, direct_draw, draw, removal, self_bounce, tempo_removal	card_draw, combat_body, combat_threat, direct_draw, draw, removal, self_bounce, tempo_removal	false		Analyzer roles accepted during batch clean pass.	Creature — Kirin	{1}{W}	2	W	W	Flying, Flash		verify analyzer roles	https://scryfall.com/card/tdm/29/sunpearl-kirin?utm_source=api	Flash Flying When this creature enters, return up to one other target nonland permanent you control to its owner's hand. If it was a token, draw a card.
tdm	Tarkir: Dragonstorm	2025-04-11	30	Teeming Dragonstorm	2154cc68-41a4-4e88-9fe0-e0150dc0be45	covered	token_support	token_support	false		Analyzer roles accepted during batch clean pass.	Enchantment	{3}{W}	4	W	W			verify analyzer roles	https://scryfall.com/card/tdm/30/teeming-dragonstorm?utm_source=api	When this enchantment enters, create two 2/2 white Soldier creature tokens. When a Dragon you control enters, return this enchantment to its owner's hand.
tdm	Tarkir: Dragonstorm	2025-04-11	31	Tempest Hawk	7423b3b9-56eb-4cf2-8ada-135918219c4b	covered	combat_body, combat_support, combat_threat, repeatable_tutor, restricted_tutor, tutor	combat_body, combat_support, combat_threat, repeatable_tutor, restricted_tutor, tutor	false		Analyzer roles accepted during batch clean pass.	Creature — Bird	{2}{W}	3	W	W	Flying		verify analyzer roles	https://scryfall.com/card/tdm/31/tempest-hawk?utm_source=api	Flying Whenever this creature deals combat damage to a player, you may search your library for a card named Tempest Hawk, reveal it, put it into your hand, then shuffle. A deck can have any number of cards named Tempest Hawk.
tdm	Tarkir: Dragonstorm	2025-04-11	32	United Battlefront	892a83a0-a3cb-4cfb-9106-4008e4e75c0f	covered	card_selection, draw, restricted_tutor, selection, tutor	card_selection, draw, restricted_tutor, selection, tutor	false		Analyzer roles accepted during batch clean pass.	Sorcery	{3}{W}	4	W	W			verify analyzer roles	https://scryfall.com/card/tdm/32/united-battlefront?utm_source=api	Look at the top seven cards of your library. Put up to two noncreature, nonland permanent cards with mana value 3 or less from among them onto the battlefield. Put the rest on the bottom of your library in a random order.
tdm	Tarkir: Dragonstorm	2025-04-11	33	Voice of Victory	b12cbda1-ac09-49eb-96b3-a4df27bc37ea	covered	combat_body, combat_support, hate_piece, sacrifice_support, soft_stack, stack, stax_piece, token_support	combat_body, combat_support, hate_piece, sacrifice_support, soft_stack, stack, stax_piece, token_support	false		Analyzer roles accepted during batch clean pass.	Creature — Human Bard	{1}{W}	2	W	W	Mobilize		verify analyzer roles	https://scryfall.com/card/tdm/33/voice-of-victory?utm_source=api	Mobilize 2 (Whenever this creature attacks, create two tapped and attacking 1/1 red Warrior creature tokens. Sacrifice them at the beginning of the next end step.) Your opponents can't cast spells during your turn.
tdm	Tarkir: Dragonstorm	2025-04-11	34	Wayspeaker Bodyguard	b93eaf66-91b3-44da-851c-79810901be0c	covered	card_selection, combat_body, hand_recursion, recursion, removal, tempo_removal	card_selection, combat_body, hand_recursion, recursion, removal, tempo_removal	false		Analyzer roles accepted during batch clean pass.	Creature — Orc Monk	{3}{W}	4	W	W	Flurry		verify analyzer roles	https://scryfall.com/card/tdm/34/wayspeaker-bodyguard?utm_source=api	When this creature enters, return target nonland permanent card with mana value 2 or less from your graveyard to your hand. Flurry — Whenever you cast your second spell each turn, tap target creature an opponent controls.
tdm	Tarkir: Dragonstorm	2025-04-11	35	Aegis Sculptor	3a75c56a-bdf7-490d-aa41-51d5eb8be46c	covered	combat_body, combat_threat, counter_support, self_protection	combat_body, combat_threat, counter_support, self_protection	false		Analyzer roles accepted during batch clean pass.	Creature — Bird Wizard	{3}{U}	4	U	U	Flying, Ward		verify analyzer roles	https://scryfall.com/card/tdm/35/aegis-sculptor?utm_source=api	Flying Ward {2} (Whenever this creature becomes the target of a spell or ability an opponent controls, counter it unless that player pays {2}.) At the beginning of your upkeep, you may exile two cards from your graveyard. If you do, put a +1/+1 counter on this creature.
tdm	Tarkir: Dragonstorm	2025-04-11	36	Agent of Kotis	584fe1e4-029d-43fe-8c9e-6995dd392d65	covered	combat_body, counter_support, removal, targeted_removal	combat_body, counter_support, removal, targeted_removal	false		Analyzer roles accepted during batch clean pass.	Creature — Human Rogue	{1}{U}	2	U	U	Renew		verify analyzer roles	https://scryfall.com/card/tdm/36/agent-of-kotis?utm_source=api	Renew — {3}{U}, Exile this card from your graveyard: Put two +1/+1 counters on target creature. Activate only as a sorcery.
tdm	Tarkir: Dragonstorm	2025-04-11	37	Ambling Stormshell	75070eaf-c931-46e5-9aa1-b849e33580c6	covered	card_draw, combat_body, combat_support, counter_support, direct_draw, draw, repeatable_advantage, repeatable_draw, replacement_engine, self_protection	card_draw, combat_body, combat_support, counter_support, direct_draw, draw, repeatable_advantage, repeatable_draw, replacement_engine, self_protection	false		Analyzer roles accepted during batch clean pass.	Creature — Turtle	{3}{U}{U}	5	U	U	Ward		verify analyzer roles	https://scryfall.com/card/tdm/37/ambling-stormshell?utm_source=api	Ward {2} Whenever this creature attacks, put three stun counters on it and draw three cards. (If a permanent with a stun counter would become untapped, remove one from it instead.) Whenever you cast a Turtle spell, untap this creature.
tdm	Tarkir: Dragonstorm	2025-04-11	38	Bewildering Blizzard	84469042-d48d-409f-a2c9-047058f13bc5	covered	card_draw, direct_draw, draw, mass_removal, removal	card_draw, direct_draw, draw, mass_removal, removal	false		Analyzer roles accepted during batch clean pass.	Instant	{4}{U}{U}	6	U	U			verify analyzer roles	https://scryfall.com/card/tdm/38/bewildering-blizzard?utm_source=api	Draw three cards. Creatures your opponents control get -3/-0 until end of turn.
tdm	Tarkir: Dragonstorm	2025-04-11	39	Constrictor Sage	abfb7234-c5cc-4e0b-9a67-d66473f918fc	covered	combat_body, counter_support, removal, replacement_engine, targeted_removal, tempo_removal	combat_body, counter_support, removal, replacement_engine, targeted_removal, tempo_removal	false		Analyzer roles accepted during batch clean pass.	Creature — Snake Wizard	{4}{U}	5	U	U	Renew		verify analyzer roles	https://scryfall.com/card/tdm/39/constrictor-sage?utm_source=api	When this creature enters, tap target creature an opponent controls and put a stun counter on it. (If a permanent with a stun counter would become untapped, remove one from it instead.) Renew — {2}{U}, Exile this card from your graveyard: Tap target creature an opponent controls and put a stun counter on it. Activate only as a sorcery.
tdm	Tarkir: Dragonstorm	2025-04-11	40	Dirgur Island Dragon // Skimming Strike	23cda76b-6e47-4922-a38d-93f7aae1eb00	covered	card_draw, combat_body, combat_threat, direct_draw, draw, removal, repeatable_draw, self_protection, tempo_removal	card_draw, combat_body, combat_threat, direct_draw, draw, removal, repeatable_draw, self_protection, tempo_removal	false		Analyzer roles accepted during batch clean pass.	Creature — Dragon // Instant — Omen	{5}{U} // {1}{U}	6	U	U	Flying, Ward		verify analyzer roles	https://scryfall.com/card/tdm/40/dirgur-island-dragon-skimming-strike?utm_source=api	Dirgur Island Dragon: Flying Ward {2} (Whenever this creature becomes the target of a spell or ability an opponent controls, counter it unless that player pays {2}.) // Skimming Strike: Tap up to one target creature. Draw a card. (Then shuffle this card into its owner's library.)
tdm	Tarkir: Dragonstorm	2025-04-11	41	Dispelling Exhale	dd3a4b64-0987-4e9b-a18d-c54365438857	covered	soft_stack, stack	soft_stack, stack	false		Analyzer roles accepted during batch clean pass.	Instant	{1}{U}	2	U	U	Behold		verify analyzer roles	https://scryfall.com/card/tdm/41/dispelling-exhale?utm_source=api	As an additional cost to cast this spell, you may behold a Dragon. (You may choose a Dragon you control or reveal a Dragon card from your hand.) Counter target spell unless its controller pays {2}. If a Dragon was beheld, counter that spell unless its controller pays {4} instead.
