setCode	setName	releasedAt	collectorNumber	name	oracleId	auditStatus	expectedRoles	actualAnalyzerRoles	needsCodeChange	tagDecision	manualNotes	typeLine	manaCost	manaValue	colors	colorIdentity	keywords	scryfallOracleTags	attentionHint	scryfallUrl	oracleText
uma	Ultimate Masters	2018-12-07	180	Satyr Wayfinder	ead4c01a-e2ae-49c9-95d9-651d81005907			card_selection, combat_body, draw, restricted_tutor, selection, tutor				Creature — Satyr	{1}{G}	2	G	G			verify analyzer roles	https://scryfall.com/card/uma/180/satyr-wayfinder?utm_source=api	When this creature enters, reveal the top four cards of your library. You may put a land card from among them into your hand. Put the rest into your graveyard.
uma	Ultimate Masters	2018-12-07	181	Shed Weakness	e3390776-66cc-4e0a-a034-701793b05db8			combat_support				Instant	{G}	1	G	G			verify analyzer roles	https://scryfall.com/card/uma/181/shed-weakness?utm_source=api	Target creature gets +2/+2 until end of turn. You may remove a -1/-1 counter from it.
uma	Ultimate Masters	2018-12-07	182	Snake Umbra	70ed2052-f03c-461d-b32a-8835c97c559f			card_draw, combat_support, direct_draw, draw, repeatable_advantage, repeatable_draw, replacement_engine				Enchantment — Aura	{2}{G}	3	G	G	Umbra armor, Enchant		verify analyzer roles	https://scryfall.com/card/uma/182/snake-umbra?utm_source=api	Enchant creature Enchanted creature gets +1/+1 and has "Whenever this creature deals damage to an opponent, you may draw a card." Umbra armor (If enchanted creature would be destroyed, instead remove all damage from it and destroy this Aura.)
uma	Ultimate Masters	2018-12-07	183	Spider Spawning	da113cc9-bb2b-4af4-9c43-32c165b87363			graveyard_support, token_support				Sorcery	{4}{G}	5	G	BG	Flashback		verify analyzer roles	https://scryfall.com/card/uma/183/spider-spawning?utm_source=api	Create a 1/2 green Spider creature token with reach for each creature card in your graveyard. Flashback {6}{B} (You may cast this card from your graveyard for its flashback cost. Then exile it.)
uma	Ultimate Masters	2018-12-07	184	Spider Umbra	f32aaa81-96bd-4213-b0b8-8c021f3cea57			combat_support, replacement_engine				Enchantment — Aura	{G}	1	G	G	Umbra armor, Enchant		verify analyzer roles	https://scryfall.com/card/uma/184/spider-umbra?utm_source=api	Enchant creature Enchanted creature gets +1/+1 and has reach. (It can block creatures with flying.) Umbra armor (If enchanted creature would be destroyed, instead remove all damage from it and destroy this Aura.)
uma	Ultimate Masters	2018-12-07	185	Staunch-Hearted Warrior	aa6244fb-e1f1-4b53-b530-a8c9d0712a5b			combat_body, counter_support				Creature — Human Warrior	{3}{G}	4	G	G	Heroic		verify analyzer roles	https://scryfall.com/card/uma/185/staunch-hearted-warrior?utm_source=api	Heroic — Whenever you cast a spell that targets this creature, put two +1/+1 counters on this creature.
uma	Ultimate Masters	2018-12-07	186	Stingerfling Spider	056770e2-8ab7-424d-a2d8-7be6d6cc73f1			combat_body, combat_threat, removal, targeted_removal				Creature — Spider	{4}{G}	5	G	G	Reach		verify analyzer roles	https://scryfall.com/card/uma/186/stingerfling-spider?utm_source=api	Reach When this creature enters, you may destroy target creature with flying.
uma	Ultimate Masters	2018-12-07	187	Tarmogoyf	45900b2f-f6a9-4c42-9642-008f3c1cf6dd			combat_body				Creature — Lhurgoyf	{1}{G}	2	G	G			verify analyzer roles	https://scryfall.com/card/uma/187/tarmogoyf?utm_source=api	Tarmogoyf's power is equal to the number of card types among cards in all graveyards and its toughness is equal to that number plus 1.
uma	Ultimate Masters	2018-12-07	188	Travel Preparations	8432729e-5fd4-4661-8b79-e41b1d03eb7b			counter_support, graveyard_support				Sorcery	{1}{G}	2	G	GW	Flashback		verify analyzer roles	https://scryfall.com/card/uma/188/travel-preparations?utm_source=api	Put a +1/+1 counter on each of up to two target creatures. Flashback {1}{W} (You may cast this card from your graveyard for its flashback cost. Then exile it.)
uma	Ultimate Masters	2018-12-07	189	Vengevine	7ed52301-81ea-4e7f-b985-cfab0593cae4	covered		battlefield_recursion, card_selection, combat_body, combat_threat, repeatable_advantage	false		Covered by PRM role audit.	Creature — Elemental	{2}{G}{G}	4	G	G	Haste		already reviewed	https://scryfall.com/card/uma/189/vengevine?utm_source=api	Haste Whenever you cast a spell, if it's the second creature spell you cast this turn, you may return this card from your graveyard to the battlefield.
uma	Ultimate Masters	2018-12-07	190	Verdant Eidolon	a3acc388-4015-42e4-88ff-b35a91134d12			burst_ramp, card_selection, combat_body, hand_recursion, repeatable_advantage, sacrifice_support				Creature — Spirit	{3}{G}	4	G	G			verify analyzer roles	https://scryfall.com/card/uma/190/verdant-eidolon?utm_source=api	{G}, Sacrifice this creature: Add three mana of any one color. Whenever you cast a multicolored spell, you may return this card from your graveyard to your hand.
uma	Ultimate Masters	2018-12-07	191	Walker of the Grove	02d69413-e040-46b1-8f58-69bde666329d			combat_body, token_support				Creature — Elemental	{6}{G}{G}	8	G	G	Evoke		verify analyzer roles	https://scryfall.com/card/uma/191/walker-of-the-grove?utm_source=api	When this creature leaves the battlefield, create a 4/4 green Elemental creature token. Evoke {4}{G} (You may cast this spell for its evoke cost. If you do, it's sacrificed when it enters.)
uma	Ultimate Masters	2018-12-07	192	Wickerbough Elder	3d794629-9014-460a-8d3b-785eadc1cdb5			combat_body, counter_support, removal, targeted_removal				Creature — Treefolk Shaman	{3}{G}	4	G	G			verify analyzer roles	https://scryfall.com/card/uma/192/wickerbough-elder?utm_source=api	This creature enters with a -1/-1 counter on it. {G}, Remove a -1/-1 counter from this creature: Destroy target artifact or enchantment.
uma	Ultimate Masters	2018-12-07	193	Wild Hunger	9d250088-d5f2-40ed-bdb7-a6decce0fb67			combat_support, graveyard_support				Instant	{2}{G}	3	G	GR	Flashback		verify analyzer roles	https://scryfall.com/card/uma/193/wild-hunger?utm_source=api	Target creature gets +3/+1 and gains trample until end of turn. Flashback {3}{R} (You may cast this card from your graveyard for its flashback cost. Then exile it.)
uma	Ultimate Masters	2018-12-07	194	Wild Mongrel	e9441ab3-7a17-4f9b-a873-e5e82f6e9690	covered		combat_body, combat_support	false		Covered by ODY role audit.	Creature — Dog	{1}{G}	2	G	G			already reviewed	https://scryfall.com/card/uma/194/wild-mongrel?utm_source=api	Discard a card: This creature gets +1/+1 and becomes the color of your choice until end of turn.
uma	Ultimate Masters	2018-12-07	195	Woodfall Primus	2f70f1bb-29fa-4abb-afc2-653acd0a08b9			combat_body, combat_threat, counter_support, sacrifice_support, targeted_removal				Creature — Treefolk Shaman	{5}{G}{G}{G}	8	G	G	Persist, Trample		verify analyzer roles	https://scryfall.com/card/uma/195/woodfall-primus?utm_source=api	Trample When this creature enters, destroy target noncreature permanent. Persist (When this creature dies, if it had no -1/-1 counters on it, return it to the battlefield under its owner's control with a -1/-1 counter on it.)
uma	Ultimate Masters	2018-12-07	196	Angel of Despair	02520741-d7f0-46e6-acbe-010b65fc24c0			combat_body, combat_threat, removal, targeted_removal				Creature — Angel	{3}{W}{W}{B}{B}	7	BW	BW	Flying		verify analyzer roles	https://scryfall.com/card/uma/196/angel-of-despair?utm_source=api	Flying When this creature enters, destroy target permanent.
uma	Ultimate Masters	2018-12-07	197	Blast of Genius	cfe82e0f-7ac0-4de3-b1b3-a2d519b00bbd	covered		card_draw, card_selection, direct_draw, draw, removal, selection, targeted_removal	false		Covered by PRM role audit.	Sorcery	{4}{U}{R}	6	RU	RU			already reviewed	https://scryfall.com/card/uma/197/blast-of-genius?utm_source=api	Choose any target. Draw three cards, then discard a card. Blast of Genius deals damage equal to the discarded card's mana value to that permanent or player.
uma	Ultimate Masters	2018-12-07	198	Countersquall	6df620b8-1e54-4f63-8556-12c75e5679af			hard_stack, stack				Instant	{U}{B}	2	BU	BU			verify analyzer roles	https://scryfall.com/card/uma/198/countersquall?utm_source=api	Counter target noncreature spell. Its controller loses 2 life.
uma	Ultimate Masters	2018-12-07	199	Gaddock Teeg	98dd6d43-cc56-4656-9e0c-240d0679b404	covered		combat_body, stax_piece	false		Covered by PRM role audit.	Legendary Creature — Kithkin Advisor	{G}{W}	2	GW	GW			already reviewed	https://scryfall.com/card/uma/199/gaddock-teeg?utm_source=api	Noncreature spells with mana value 4 or greater can't be cast. Noncreature spells with {X} in their mana costs can't be cast.
uma	Ultimate Masters	2018-12-07	200	Garna, the Bloodflame	97cb993c-90ae-49ff-8ccb-b4fe317a43ef			combat_body, combat_support, mass_recursion				Legendary Creature — Human Warrior	{3}{B}{R}	5	BR	BR	Flash		verify analyzer roles	https://scryfall.com/card/uma/200/garna-the-bloodflame?utm_source=api	Flash When Garna enters, return to your hand all creature cards in your graveyard that were put there from anywhere this turn. Other creatures you control have haste.
uma	Ultimate Masters	2018-12-07	201	Golgari Charm	f0ab7166-9fcf-46e5-af2c-b7f628db4789			broad_protection, mass_removal, removal, targeted_removal				Instant	{B}{G}	2	BG	BG	Regenerate		verify analyzer roles	https://scryfall.com/card/uma/201/golgari-charm?utm_source=api	Choose one — • All creatures get -1/-1 until end of turn. • Destroy target enchantment. • Regenerate each creature you control.
uma	Ultimate Masters	2018-12-07	202	Leovold, Emissary of Trest	d5d91377-fd66-4dbe-a092-07f2ea379ca7			card_draw, combat_body, direct_draw, draw, repeatable_advantage, repeatable_draw, stax_piece				Legendary Creature — Elf Advisor	{B}{G}{U}	3	BGU	BGU			verify analyzer roles	https://scryfall.com/card/uma/202/leovold-emissary-of-trest?utm_source=api	Each opponent can't draw more than one card each turn. Whenever you or a permanent you control becomes the target of a spell or ability an opponent controls, you may draw a card.
uma	Ultimate Masters	2018-12-07	203	Lord of Extinction	ea5e3401-bd6c-47bb-a52a-8eec5f09455d			combat_body, combat_support				Creature — Elemental	{3}{B}{G}	5	BG	BG			verify analyzer roles	https://scryfall.com/card/uma/203/lord-of-extinction?utm_source=api	Lord of Extinction's power and toughness are each equal to the number of cards in all graveyards.
uma	Ultimate Masters	2018-12-07	204	Maelstrom Pulse	95ce305f-34bc-4d6d-b7ba-ffd4b2a25336	covered		removal, targeted_removal	false		Covered by PRM role audit.	Sorcery	{1}{B}{G}	3	BG	BG			already reviewed	https://scryfall.com/card/uma/204/maelstrom-pulse?utm_source=api	Destroy target nonland permanent and all other permanents with the same name as that permanent.
uma	Ultimate Masters	2018-12-07	205	Reviving Vapors	57104a79-cfb6-4330-8ea1-7726534ada56	covered		card_selection, lifegain, restricted_tutor	false		Covered by INV role audit.	Instant	{2}{W}{U}	4	UW	UW			already reviewed	https://scryfall.com/card/uma/205/reviving-vapors?utm_source=api	Reveal the top three cards of your library and put one of them into your hand. You gain life equal to that card's mana value. Put all other cards revealed this way into your graveyard.
uma	Ultimate Masters	2018-12-07	206	Sigarda, Host of Herons	e55104e2-4900-48de-b288-d3e6abd5e09e			combat_body, combat_threat, sacrifice_support, self_protection				Legendary Creature — Angel	{2}{G}{W}{W}	5	GW	GW	Flying, Hexproof		verify analyzer roles	https://scryfall.com/card/uma/206/sigarda-host-of-herons?utm_source=api	Flying, hexproof Spells and abilities your opponents control can't cause you to sacrifice permanents.
uma	Ultimate Masters	2018-12-07	207	Sovereigns of Lost Alara	86e13e19-45df-4d73-8600-51b7caa3e6ab			cheat_into_play, combat_body, combat_support, cost_reduction, repeatable_tutor, restricted_tutor, tutor				Creature — Spirit	{4}{W}{U}	6	UW	UW	Exalted		verify analyzer roles	https://scryfall.com/card/uma/207/sovereigns-of-lost-alara?utm_source=api	Exalted (Whenever a creature you control attacks alone, that creature gets +1/+1 until end of turn.) Whenever a creature you control attacks alone, you may search your library for an Aura card that could enchant that creature, put it onto the battlefield attached to that creature, then shuffle.
uma	Ultimate Masters	2018-12-07	208	Urban Evolution	c715e525-fc3a-4cab-94a0-04e0a22a5013			card_draw, direct_draw, draw, land_acceleration, ramp				Sorcery	{3}{G}{U}	5	GU	GU			verify analyzer roles	https://scryfall.com/card/uma/208/urban-evolution?utm_source=api	Draw three cards. You may play an additional land this turn.
uma	Ultimate Masters	2018-12-07	209	Vengeful Rebirth	522297b1-493a-4c62-a82a-3017c44183e8			card_selection, hand_recursion, recursion				Sorcery	{4}{R}{G}	6	GR	GR			verify analyzer roles	https://scryfall.com/card/uma/209/vengeful-rebirth?utm_source=api	Return target card from your graveyard to your hand. If you return a nonland card to your hand this way, Vengeful Rebirth deals damage equal to that card's mana value to any target. Exile Vengeful Rebirth.
uma	Ultimate Masters	2018-12-07	210	Warleader's Helix	b1ea88f5-162b-4f08-bec3-be1f06dec392	covered		lifegain, removal, targeted_removal	false		Covered by PRM role audit.	Instant	{2}{R}{W}	4	RW	RW			already reviewed	https://scryfall.com/card/uma/210/warleaders-helix?utm_source=api	Warleader's Helix deals 4 damage to any target and you gain 4 life.
uma	Ultimate Masters	2018-12-07	211	Beckon Apparition	10762505-ebaa-47de-9f3e-08d48f2ac240			graveyard_hate, token_support				Instant	{W/B}	1	BW	BW			verify analyzer roles	https://scryfall.com/card/uma/211/beckon-apparition?utm_source=api	Exile target card from a graveyard. Create a 1/1 white and black Spirit creature token with flying.
uma	Ultimate Masters	2018-12-07	212	Canker Abomination	4440e41c-042f-4e13-925a-c1e40b77e010			combat_body, counter_support				Creature — Treefolk Horror	{2}{B/G}{B/G}	4	BG	BG			verify analyzer roles	https://scryfall.com/card/uma/212/canker-abomination?utm_source=api	As this creature enters, choose an opponent. This creature enters with a -1/-1 counter on it for each creature that player controls.
uma	Ultimate Masters	2018-12-07	213	Dimir Guildmage	1b6c67e5-5913-4db9-85d9-8dae57da02ee	covered		card_draw, combat_body, hand_attack, removal, repeatable_advantage	false		Covered by PRM role audit.	Creature — Human Wizard	{U/B}{U/B}	2	BU	BU			already reviewed	https://scryfall.com/card/uma/213/dimir-guildmage?utm_source=api	({U/B} can be paid with either {U} or {B}.) {3}{U}: Target player draws a card. Activate only as a sorcery. {3}{B}: Target player discards a card. Activate only as a sorcery.
uma	Ultimate Masters	2018-12-07	214	Double Cleave	d86f3d5e-838c-4787-9417-85a6997c3bde			combat_support				Instant	{1}{R/W}	2	RW	RW			verify analyzer roles	https://scryfall.com/card/uma/214/double-cleave?utm_source=api	Target creature gains double strike until end of turn. (It deals both first-strike and regular combat damage.)
uma	Ultimate Masters	2018-12-07	215	Fulminator Mage	bd4c46a3-b723-4b35-9061-9a1dee7cc9d8			combat_body, land_denial, removal, sacrifice_support, targeted_land_removal, targeted_removal				Creature — Elemental Shaman	{1}{B/R}{B/R}	3	BR	BR			verify analyzer roles	https://scryfall.com/card/uma/215/fulminator-mage?utm_source=api	Sacrifice this creature: Destroy target nonbasic land.
uma	Ultimate Masters	2018-12-07	216	Kitchen Finks	5470dcfa-4eff-43da-abf7-19922841f719	covered		combat_body, counter_support, lifegain, sacrifice_support	false		Covered by PRM role audit.	Creature — Ouphe	{1}{G/W}{G/W}	3	GW	GW	Persist		already reviewed	https://scryfall.com/card/uma/216/kitchen-finks?utm_source=api	When this creature enters, you gain 2 life. Persist (When this creature dies, if it had no -1/-1 counters on it, return it to the battlefield under its owner's control with a -1/-1 counter on it.)
uma	Ultimate Masters	2018-12-07	217	Murderous Redcap	a498bc70-36e7-4454-bc44-906893df38b8	covered		combat_body, counter_support, direct_finisher, finisher, sacrifice_support	false		Covered by PRM role audit.	Creature — Goblin Assassin	{2}{B/R}{B/R}	4	BR	BR	Persist		already reviewed	https://scryfall.com/card/uma/217/murderous-redcap?utm_source=api	When this creature enters, it deals damage equal to its power to any target. Persist (When this creature dies, if it had no -1/-1 counters on it, return it to the battlefield under its owner's control with a -1/-1 counter on it.)
uma	Ultimate Masters	2018-12-07	218	Plumeveil	14fa0771-cf2b-4563-98b2-ff4ee24bce21			combat_body, combat_threat				Creature — Elemental	{W/U}{W/U}{W/U}	3	UW	UW	Flying, Flash, Defender		verify analyzer roles	https://scryfall.com/card/uma/218/plumeveil?utm_source=api	Flash Defender, flying
uma	Ultimate Masters	2018-12-07	219	Rakdos Shred-Freak	e900b2b5-4bb2-482d-89ee-b5bbaf246698			combat_body, combat_threat				Creature — Human Berserker	{B/R}{B/R}	2	BR	BR	Haste		verify analyzer roles	https://scryfall.com/card/uma/219/rakdos-shred-freak?utm_source=api	Haste
uma	Ultimate Masters	2018-12-07	220	Safehold Elite	68ca91ba-31fb-47e0-9b32-e4f3504cbbca			combat_body, counter_support, sacrifice_support				Creature — Elf Scout	{1}{G/W}	2	GW	GW	Persist		verify analyzer roles	https://scryfall.com/card/uma/220/safehold-elite?utm_source=api	Persist (When this creature dies, if it had no -1/-1 counters on it, return it to the battlefield under its owner's control with a -1/-1 counter on it.)
uma	Ultimate Masters	2018-12-07	221	Scuzzback Marauders	423a1fc2-f623-4b5f-9a3e-7f63b2f3cf5d			combat_body, combat_threat, counter_support, sacrifice_support				Creature — Goblin Warrior	{4}{R/G}	5	GR	GR	Persist, Trample		verify analyzer roles	https://scryfall.com/card/uma/221/scuzzback-marauders?utm_source=api	Trample Persist (When this creature dies, if it had no -1/-1 counters on it, return it to the battlefield under its owner's control with a -1/-1 counter on it.)
uma	Ultimate Masters	2018-12-07	222	Shielding Plax	e9bdb194-745d-4abb-9312-a65a68c40a18			card_draw, direct_draw, draw, protection, targeted_protection				Enchantment — Aura	{2}{G/U}	3	GU	GU	Enchant		verify analyzer roles	https://scryfall.com/card/uma/222/shielding-plax?utm_source=api	({G/U} can be paid with either {G} or {U}.) Enchant creature When this Aura enters, draw a card. Enchanted creature can't be the target of spells or abilities your opponents control.
uma	Ultimate Masters	2018-12-07	223	Slippery Bogle	f64878c1-1fba-44f7-a24f-d24bef2e03ae			combat_body, self_protection				Creature — Beast	{G/U}	1	GU	GU	Hexproof		verify analyzer roles	https://scryfall.com/card/uma/223/slippery-bogle?utm_source=api	Hexproof (This creature can't be the target of spells or abilities your opponents control.)
uma	Ultimate Masters	2018-12-07	224	Turn to Mist	631f04d6-5693-4414-a378-fd839c3b6f6d			targeted_removal				Instant	{1}{W/U}	2	UW	UW			verify analyzer roles	https://scryfall.com/card/uma/224/turn-to-mist?utm_source=api	Exile target creature. Return that card to the battlefield under its owner's control at the beginning of the next end step.
uma	Ultimate Masters	2018-12-07	225	Fire // Ice	ae92942b-919c-4ea9-b693-85fcef765d5a	covered		card_draw, direct_draw, draw, removal, tempo_removal	false		Covered by APC role audit.	Instant // Instant	{1}{R} // {1}{U}	4	RU	RU			already reviewed	https://scryfall.com/card/uma/225/fire-ice?utm_source=api	Fire: Fire deals 2 damage divided as you choose among one or two targets. // Ice: Tap target permanent. Draw a card.
uma	Ultimate Masters	2018-12-07	226	Cathodion	fcd4f816-2de1-4b30-82fb-cb87f45747ea	covered		combat_body, sacrifice_support	false		Covered by USG role audit.	Artifact Creature — Construct	{3}	3					already reviewed	https://scryfall.com/card/uma/226/cathodion?utm_source=api	When this creature dies, add {C}{C}{C}.
uma	Ultimate Masters	2018-12-07	227	Engineered Explosives	95fd897e-9086-42c4-8e0d-61bb02333c5f			counter_support, mana_sink, sacrifice_support, scalable_spell				Artifact	{X}	0			Sunburst		verify analyzer roles	https://scryfall.com/card/uma/227/engineered-explosives?utm_source=api	Sunburst (This artifact enters with a charge counter on it for each color of mana spent to cast it.) {2}, Sacrifice this artifact: Destroy each nonland permanent with mana value equal to the number of charge counters on this artifact.
uma	Ultimate Masters	2018-12-07	228	Heap Doll	aa7f0f15-bcbb-4af5-ad31-ff215dd81e71			combat_body, graveyard_hate, sacrifice_support				Artifact Creature — Scarecrow	{1}	1					verify analyzer roles	https://scryfall.com/card/uma/228/heap-doll?utm_source=api	Sacrifice this creature: Exile target card from a graveyard.
uma	Ultimate Masters	2018-12-07	229	Mana Vault	736892cb-a34b-4bb9-b56c-e26e3db207a2	covered	ramp, stable_ramp	ramp, stable_ramp	false		Covered by PRM role audit.	Artifact	{1}	1					already reviewed	https://scryfall.com/card/uma/229/mana-vault?utm_source=api	This artifact doesn't untap during your untap step. At the beginning of your upkeep, you may pay {4}. If you do, untap this artifact. At the beginning of your draw step, if this artifact is tapped, it deals 1 damage to you. {T}: Add {C}{C}{C}.
uma	Ultimate Masters	2018-12-07	230	Myr Servitor	b6a50858-a013-4703-a9d7-5b69ef9bd9ae			combat_body, mass_recursion				Artifact Creature — Myr	{1}	1					verify analyzer roles	https://scryfall.com/card/uma/230/myr-servitor?utm_source=api	At the beginning of your upkeep, if this creature is on the battlefield, each player returns all cards named Myr Servitor from their graveyard to the battlefield.
uma	Ultimate Masters	2018-12-07	231	Patchwork Gnomes	00ad27a1-9162-408d-ac75-970e45d7e06c	covered	combat_body, protection, regeneration_protection, targeted_protection	combat_body, protection, regeneration_protection, targeted_protection	false		Covered by Tempest role audit.	Artifact Creature — Gnome	{3}	3			Heal, Regenerate		already reviewed	https://scryfall.com/card/uma/231/patchwork-gnomes?utm_source=api	Discard a card: Regenerate this creature. (The next time this creature would be destroyed this turn, instead tap it, remove it from combat, and heal all damage on it.)
uma	Ultimate Masters	2018-12-07	232	Phyrexian Altar	8d02b297-97c4-4379-9862-0a462400f66f	covered		burst_ramp, sacrifice_support	false		Covered by INV role audit.	Artifact	{3}	3					already reviewed	https://scryfall.com/card/uma/232/phyrexian-altar?utm_source=api	Sacrifice a creature: Add one mana of any color.
uma	Ultimate Masters	2018-12-07	233	Platinum Emperion	bcd2f70c-36c2-44b2-9d4b-1000e9bb62b6			combat_body, lifegain				Artifact Creature — Golem	{8}	8					verify analyzer roles	https://scryfall.com/card/uma/233/platinum-emperion?utm_source=api	Your life total can't change. (You can't gain or lose life. You can't pay any amount of life except 0.)
uma	Ultimate Masters	2018-12-07	234	Prismatic Lens	e3056f28-868b-401a-a528-7528d639bdeb			mana_fixing, ramp, stable_ramp				Artifact	{2}	2					verify analyzer roles	https://scryfall.com/card/uma/234/prismatic-lens?utm_source=api	{T}: Add {C}. {1}, {T}: Add one mana of any color.
uma	Ultimate Masters	2018-12-07	235	Vessel of Endless Rest	8031285b-2add-42da-aa97-03c3f2fff226			library_recursion, mana_fixing, ramp, stable_ramp				Artifact	{3}	3					verify analyzer roles	https://scryfall.com/card/uma/235/vessel-of-endless-rest?utm_source=api	When this artifact enters, put target card from a graveyard on the bottom of its owner's library. {T}: Add one mana of any color.
uma	Ultimate Masters	2018-12-07	236	Ancient Tomb	23467047-6dba-4498-b783-1ebc4f74b8c2	covered	land_base, land_slot, mana_source, stable_ramp	land_base, land_slot, mana_source, stable_ramp	false		Covered by Tempest role audit.	Land		0					already reviewed	https://scryfall.com/card/uma/236/ancient-tomb?utm_source=api	{T}: Add {C}{C}. This land deals 2 damage to you.
uma	Ultimate Masters	2018-12-07	237	Cavern of Souls	89ca686a-7c72-4d8f-9290-e89635624a83	covered		land_base, land_slot, mana_source	false		Covered by PRM role audit.	Land		0					already reviewed	https://scryfall.com/card/uma/237/cavern-of-souls?utm_source=api	As this land enters, choose a creature type. {T}: Add {C}. {T}: Add one mana of any color. Spend this mana only to cast a creature spell of the chosen type, and that spell can't be countered.
uma	Ultimate Masters	2018-12-07	238	Celestial Colonnade	876ac6f6-74de-4666-84c6-83d81f054723	covered		burst_ramp, land_base, land_slot, mana_source, ramp	false		Covered by PRM role audit.	Land		0		UW			already reviewed	https://scryfall.com/card/uma/238/celestial-colonnade?utm_source=api	This land enters tapped. {T}: Add {W} or {U}. {3}{W}{U}: Until end of turn, this land becomes a 4/4 white and blue Elemental creature with flying and vigilance. It's still a land.
uma	Ultimate Masters	2018-12-07	239	Creeping Tar Pit	250cb58b-2924-4dff-92fe-ac0ebbbeb218			burst_ramp, combat_support, land_base, land_slot, mana_source, ramp				Land		0		BU			verify analyzer roles	https://scryfall.com/card/uma/239/creeping-tar-pit?utm_source=api	This land enters tapped. {T}: Add {U} or {B}. {1}{U}{B}: Until end of turn, this land becomes a 3/2 blue and black Elemental creature. It's still a land. It can't be blocked this turn.
uma	Ultimate Masters	2018-12-07	240	Dakmor Salvage	cdc4048a-73ec-4ec1-a179-2b36c397bf1a			card_selection, hand_recursion, land_base, land_slot, mana_source, mill_support, repeatable_advantage, replacement_engine				Land		0		B	Dredge, Mill		verify analyzer roles	https://scryfall.com/card/uma/240/dakmor-salvage?utm_source=api	This land enters tapped. {T}: Add {B}. Dredge 2 (If you would draw a card, you may mill two cards instead. If you do, return this card from your graveyard to your hand.)
