setCode	setName	releasedAt	collectorNumber	name	oracleId	auditStatus	expectedRoles	actualAnalyzerRoles	needsCodeChange	tagDecision	manualNotes	typeLine	manaCost	manaValue	colors	colorIdentity	keywords	scryfallOracleTags	attentionHint	scryfallUrl	oracleText
uma	Ultimate Masters	2018-12-07	119	Unburial Rites	d48e1545-7997-45ed-83a1-aee45b3d3d20			battlefield_recursion, card_selection, graveyard_support, recursion				Sorcery	{4}{B}	5	B	BW	Flashback		verify analyzer roles	https://scryfall.com/card/uma/119/unburial-rites?utm_source=api	Return target creature card from your graveyard to the battlefield. Flashback {3}{W} (You may cast this card from your graveyard for its flashback cost. Then exile it.)
uma	Ultimate Masters	2018-12-07	120	Unholy Hunger	ed8d8eb5-fbc8-4b7f-9b75-53ab118e72de			lifegain, removal, targeted_removal				Instant	{3}{B}{B}	5	B	B	Spell mastery		verify analyzer roles	https://scryfall.com/card/uma/120/unholy-hunger?utm_source=api	Destroy target creature. Spell mastery — If there are two or more instant and/or sorcery cards in your graveyard, you gain 2 life.
uma	Ultimate Masters	2018-12-07	121	Akroan Crusader	d981d85c-e97b-4fe7-b415-6e73a3e7e35c			combat_body, combat_support, token_support				Creature — Human Soldier	{R}	1	R	R	Heroic		verify analyzer roles	https://scryfall.com/card/uma/121/akroan-crusader?utm_source=api	Heroic — Whenever you cast a spell that targets this creature, create a 1/1 red Soldier creature token with haste. (It can attack and {T} as soon as it comes under your control.)
uma	Ultimate Masters	2018-12-07	122	Anger	eaabd151-2160-4bff-82c0-3fa88659be98	covered		combat_body, combat_support, combat_threat	false		Covered by JUD role audit.	Creature — Incarnation	{3}{R}	4	R	R	Haste		already reviewed	https://scryfall.com/card/uma/122/anger?utm_source=api	Haste As long as this card is in your graveyard and you control a Mountain, creatures you control have haste.
uma	Ultimate Masters	2018-12-07	123	Arena Athlete	4dfea3bf-dfd1-4abd-a17e-f3a07488a069			combat_body				Creature — Human	{1}{R}	2	R	R	Heroic		verify analyzer roles	https://scryfall.com/card/uma/123/arena-athlete?utm_source=api	Heroic — Whenever you cast a spell that targets this creature, target creature an opponent controls can't block this turn.
uma	Ultimate Masters	2018-12-07	124	Balefire Dragon	3d783beb-9ca6-4681-9276-fc3ad13b993f			combat_body, combat_support, combat_threat				Creature — Dragon	{5}{R}{R}	7	R	R	Flying		verify analyzer roles	https://scryfall.com/card/uma/124/balefire-dragon?utm_source=api	Flying Whenever this creature deals combat damage to a player, it deals that much damage to each creature that player controls.
uma	Ultimate Masters	2018-12-07	125	Brazen Scourge	422ef4ec-863a-450e-9577-a0707bc16532			combat_body, combat_support, combat_threat				Creature — Gremlin	{1}{R}{R}	3	R	R	Haste		verify analyzer roles	https://scryfall.com/card/uma/125/brazen-scourge?utm_source=api	Haste (This creature can attack and {T} as soon as it comes under your control.)
uma	Ultimate Masters	2018-12-07	126	Conflagrate	0de0bc10-9699-47f9-bb98-b5bac2063756			direct_finisher, finisher, graveyard_support, mana_sink, removal, scalable_spell, targeted_removal				Sorcery	{X}{X}{R}	1	R	R	Flashback		verify analyzer roles	https://scryfall.com/card/uma/126/conflagrate?utm_source=api	Conflagrate deals X damage divided as you choose among any number of targets. Flashback—{R}{R}, Discard X cards. (You may cast this card from your graveyard for its flashback cost. Then exile it.)
uma	Ultimate Masters	2018-12-07	127	Desperate Ritual	3620ab8f-b693-4225-bb96-5ca3cb3fa465			burst_ramp, ramp				Instant — Arcane	{1}{R}	2	R	R	Splice		verify analyzer roles	https://scryfall.com/card/uma/127/desperate-ritual?utm_source=api	Add {R}{R}{R}. Splice onto Arcane {1}{R} (As you cast an Arcane spell, you may reveal this card from your hand and pay its splice cost. If you do, add this card's effects to that spell.)
uma	Ultimate Masters	2018-12-07	128	Faithless Looting	3d6fa57a-aa53-4b5c-b8af-a7612c823117			card_draw, card_selection, direct_draw, draw, graveyard_support, selection				Sorcery	{R}	1	R	R	Flashback		verify analyzer roles	https://scryfall.com/card/uma/128/faithless-looting?utm_source=api	Draw two cards, then discard two cards. Flashback {2}{R} (You may cast this card from your graveyard for its flashback cost. Then exile it.)
uma	Ultimate Masters	2018-12-07	129	Fiery Temper	f07bd49d-8e71-4d56-be2a-638514011318	covered		removal, targeted_removal	false		Covered by TOR role audit.	Instant	{1}{R}{R}	3	R	R	Madness		already reviewed	https://scryfall.com/card/uma/129/fiery-temper?utm_source=api	Fiery Temper deals 3 damage to any target. Madness {R} (If you discard this card, discard it into exile. When you do, cast it for its madness cost or put it into your graveyard.)
uma	Ultimate Masters	2018-12-07	130	Firewing Phoenix	326d9b5c-ac04-45b5-9a8c-a9be7d8cca1b			card_selection, combat_body, combat_threat, hand_recursion, repeatable_advantage				Creature — Phoenix	{3}{R}	4	R	R	Flying		verify analyzer roles	https://scryfall.com/card/uma/130/firewing-phoenix?utm_source=api	Flying {1}{R}{R}{R}: Return this card from your graveyard to your hand.
uma	Ultimate Masters	2018-12-07	131	Furnace Celebration	af6d6844-c612-4731-86da-59a8fa02956b			removal, sacrifice_support, targeted_removal				Enchantment	{1}{R}{R}	3	R	R			verify analyzer roles	https://scryfall.com/card/uma/131/furnace-celebration?utm_source=api	Whenever you sacrifice another permanent, you may pay {2}. If you do, this enchantment deals 2 damage to any target.
uma	Ultimate Masters	2018-12-07	132	Gamble	a54f0869-94c8-42af-9080-166efb9486a4	covered		direct_tutor, tutor	false		Covered by USG role audit.	Sorcery	{R}	1	R	R			already reviewed	https://scryfall.com/card/uma/132/gamble?utm_source=api	Search your library for a card, put that card into your hand, discard a card at random, then shuffle.
uma	Ultimate Masters	2018-12-07	133	Generator Servant	68ac061a-e4a3-46df-9169-62f6a8481584			burst_ramp, combat_body, combat_support, ramp, sacrifice_support				Creature — Elemental	{1}{R}	2	R	R			verify analyzer roles	https://scryfall.com/card/uma/133/generator-servant?utm_source=api	{T}, Sacrifice this creature: Add {C}{C}. If that mana is spent on a creature spell, it gains haste until end of turn. (That creature can attack and {T} as soon as it comes under your control.)
uma	Ultimate Masters	2018-12-07	134	Hissing Iguanar	7c4fc524-4734-4fb8-a5ca-ac2617242c3f			combat_body, removal, sacrifice_support, targeted_removal				Creature — Lizard	{2}{R}	3	R	R			verify analyzer roles	https://scryfall.com/card/uma/134/hissing-iguanar?utm_source=api	Whenever another creature dies, you may have this creature deal 1 damage to target player or planeswalker.
uma	Ultimate Masters	2018-12-07	135	Ingot Chewer	127795e6-3f0e-4318-95ad-ccb1912580ac			combat_body, removal, targeted_removal				Creature — Elemental	{4}{R}	5	R	R	Evoke		verify analyzer roles	https://scryfall.com/card/uma/135/ingot-chewer?utm_source=api	When this creature enters, destroy target artifact. Evoke {R} (You may cast this spell for its evoke cost. If you do, it's sacrificed when it enters.)
uma	Ultimate Masters	2018-12-07	136	Lava Spike	2837888c-bfa8-4955-9334-0605ad409f7e			removal, targeted_removal				Sorcery — Arcane	{R}	1	R	R			verify analyzer roles	https://scryfall.com/card/uma/136/lava-spike?utm_source=api	Lava Spike deals 3 damage to target player or planeswalker.
uma	Ultimate Masters	2018-12-07	137	Mad Prophet	91081181-aec6-47de-b8ef-241a2f4fe880			card_draw, combat_body, combat_threat, direct_draw, draw, repeatable_advantage, selection				Creature — Human Shaman	{3}{R}	4	R	R	Haste		verify analyzer roles	https://scryfall.com/card/uma/137/mad-prophet?utm_source=api	Haste {T}, Discard a card: Draw a card.
uma	Ultimate Masters	2018-12-07	138	Magmaw	bc891258-2f22-4248-9972-4f41905744c6			combat_body, removal, sacrifice_support, targeted_removal				Creature — Elemental	{3}{R}{R}	5	R	R			verify analyzer roles	https://scryfall.com/card/uma/138/magmaw?utm_source=api	{1}, Sacrifice a nonland permanent: This creature deals 1 damage to any target.
uma	Ultimate Masters	2018-12-07	139	Malevolent Whispers	b7ff27b6-7591-44b9-86b9-ee12f795ec25			removal, tempo_removal, theft_support				Sorcery	{3}{R}	4	R	R	Madness		verify analyzer roles	https://scryfall.com/card/uma/139/malevolent-whispers?utm_source=api	Gain control of target creature until end of turn. Untap that creature. It gets +2/+0 and gains haste until end of turn. Madness {3}{R} (If you discard this card, discard it into exile. When you do, cast it for its madness cost or put it into your graveyard.)
uma	Ultimate Masters	2018-12-07	140	Molten Birth	aeaae9cc-f30f-4d7e-86f3-3132ef47e987			coin_support, token_support				Sorcery	{1}{R}{R}	3	R	R			verify analyzer roles	https://scryfall.com/card/uma/140/molten-birth?utm_source=api	Create two 1/1 red Elemental creature tokens, then flip a coin. If you win the flip, return Molten Birth to its owner's hand.
uma	Ultimate Masters	2018-12-07	141	Nightbird's Clutches	d12b875c-0056-4a57-a7ff-09c73d00f8cc			combat_support, graveyard_support				Sorcery	{1}{R}	2	R	R	Flashback		verify analyzer roles	https://scryfall.com/card/uma/141/nightbirds-clutches?utm_source=api	Up to two target creatures can't block this turn. Flashback {3}{R} (You may cast this card from your graveyard for its flashback cost. Then exile it.)
uma	Ultimate Masters	2018-12-07	142	Raid Bombardment	1734e777-d34a-4526-ae24-ef034f147cc5			combat_support				Enchantment	{2}{R}	3	R	R			verify analyzer roles	https://scryfall.com/card/uma/142/raid-bombardment?utm_source=api	Whenever a creature you control with power 2 or less attacks, this enchantment deals 1 damage to the player or planeswalker that creature is attacking.
uma	Ultimate Masters	2018-12-07	143	Reckless Charge	45bee121-0beb-4901-9473-20e4704ba6dc	covered		combat_support, graveyard_support	false		Covered by ODY role audit.	Sorcery	{R}	1	R	R	Flashback		already reviewed	https://scryfall.com/card/uma/143/reckless-charge?utm_source=api	Target creature gets +3/+0 and gains haste until end of turn. Flashback {2}{R} (You may cast this card from your graveyard for its flashback cost. Then exile it.)
uma	Ultimate Masters	2018-12-07	144	Reckless Wurm	c9159396-81d3-4f81-88b4-dda163ff4b74	covered		combat_body, combat_threat	false		Covered by PRM role audit.	Creature — Wurm	{3}{R}{R}	5	R	R	Madness, Trample		already reviewed	https://scryfall.com/card/uma/144/reckless-wurm?utm_source=api	Trample Madness {2}{R} (If you discard this card, discard it into exile. When you do, cast it for its madness cost or put it into your graveyard.)
uma	Ultimate Masters	2018-12-07	145	Rolling Temblor	e450014f-7152-476b-ae6e-0d49fcb91d18			graveyard_support, mass_removal, removal				Sorcery	{2}{R}	3	R	R	Flashback		verify analyzer roles	https://scryfall.com/card/uma/145/rolling-temblor?utm_source=api	Rolling Temblor deals 2 damage to each creature without flying. Flashback {4}{R}{R} (You may cast this card from your graveyard for its flashback cost. Then exile it.)
uma	Ultimate Masters	2018-12-07	146	Seismic Assault	8ad4f2fe-6d98-4279-a331-3817d40ae46d	covered		removal, targeted_removal	false		Covered by 7ED role audit.	Enchantment	{R}{R}{R}	3	R	R			already reviewed	https://scryfall.com/card/uma/146/seismic-assault?utm_source=api	Discard a land card: This enchantment deals 2 damage to any target.
uma	Ultimate Masters	2018-12-07	147	Seize the Day	2a6abd59-e448-46f1-9af8-bb9040645971	covered		combat_finisher, finisher, graveyard_support, multiplier_support, replacement_engine, tap_untap, tempo_support	false		Covered by ODY role audit.	Sorcery	{3}{R}	4	R	R	Flashback		already reviewed	https://scryfall.com/card/uma/147/seize-the-day?utm_source=api	Untap target creature. After this main phase, there is an additional combat phase followed by an additional main phase. Flashback {2}{R} (You may cast this card from your graveyard for its flashback cost. Then exile it.)
uma	Ultimate Masters	2018-12-07	148	Soul's Fire	62d7ed6e-c386-477e-b155-982c3790f842			direct_finisher, finisher, removal, targeted_removal				Instant	{2}{R}	3	R	R			verify analyzer roles	https://scryfall.com/card/uma/148/souls-fire?utm_source=api	Target creature you control deals damage equal to its power to any target.
uma	Ultimate Masters	2018-12-07	149	Sparkspitter	0fbec99f-0e49-4211-a06e-edd783cf47da			combat_body, sacrifice_support, token_support				Creature — Elemental Spellshaper	{2}{R}	3	R	R			verify analyzer roles	https://scryfall.com/card/uma/149/sparkspitter?utm_source=api	{R}, {T}, Discard a card: Create a 3/1 red Elemental creature token named Spark Elemental. It has trample, haste, and "At the beginning of the end step, sacrifice this token."
uma	Ultimate Masters	2018-12-07	150	Squee, Goblin Nabob	0ef760f4-bbec-4735-8d60-fc24d973452a	covered		card_selection, combat_body, hand_recursion, repeatable_advantage	false		Covered by MMQ role audit.	Legendary Creature — Goblin	{2}{R}	3	R	R			already reviewed	https://scryfall.com/card/uma/150/squee-goblin-nabob?utm_source=api	At the beginning of your upkeep, you may return this card from your graveyard to your hand.
uma	Ultimate Masters	2018-12-07	151	Thermo-Alchemist	228fbae1-423e-461d-b8c3-55786938a3cb			combat_body, copy_support, direct_finisher, finisher, repeatable_finisher, spellslinger				Creature — Human Shaman	{1}{R}	2	R	R	Defender		verify analyzer roles	https://scryfall.com/card/uma/151/thermo-alchemist?utm_source=api	Defender {T}: This creature deals 1 damage to each opponent. Whenever you cast an instant or sorcery spell, untap this creature.
uma	Ultimate Masters	2018-12-07	152	Through the Breach	c207aaee-0b67-4520-ad02-2c289228be2a			burst_ramp, combat_support, cost_reduction, ramp, sacrifice_support				Instant — Arcane	{4}{R}	5	R	R	Splice		verify analyzer roles	https://scryfall.com/card/uma/152/through-the-breach?utm_source=api	You may put a creature card from your hand onto the battlefield. That creature gains haste. Sacrifice that creature at the beginning of the next end step. Splice onto Arcane {2}{R}{R} (As you cast an Arcane spell, you may reveal this card from your hand and pay its splice cost. If you do, add this card's effects to that spell.)
uma	Ultimate Masters	2018-12-07	153	Undying Rage	622d783d-4201-4769-8a0f-442b358d8bf1			combat_support				Enchantment — Aura	{2}{R}	3	R	R	Enchant		verify analyzer roles	https://scryfall.com/card/uma/153/undying-rage?utm_source=api	Enchant creature Enchanted creature gets +2/+2 and can't block. When this Aura is put into a graveyard from the battlefield, return it to its owner's hand.
uma	Ultimate Masters	2018-12-07	154	Vexing Devil	b582e485-c024-47f0-ad6f-b918d32288ba			combat_body, sacrifice_support				Creature — Devil	{R}	1	R	R			verify analyzer roles	https://scryfall.com/card/uma/154/vexing-devil?utm_source=api	When this creature enters, any opponent may have it deal 4 damage to them. If a player does, sacrifice this creature.
uma	Ultimate Masters	2018-12-07	155	Young Pyromancer	5fac139a-07d3-4e6c-98e3-d98b199f7a6f	covered		combat_body, copy_support, spellslinger, token_support	false		Covered by PRM role audit.	Creature — Human Shaman	{1}{R}	2	R	R			already reviewed	https://scryfall.com/card/uma/155/young-pyromancer?utm_source=api	Whenever you cast an instant or sorcery spell, create a 1/1 red Elemental creature token.
uma	Ultimate Masters	2018-12-07	156	Basking Rootwalla	b2ec080f-ad5d-4274-91e3-bc6ac89fc3e4	covered		combat_body, combat_support	false		Covered by TOR role audit.	Creature — Lizard	{G}	1	G	G	Madness		already reviewed	https://scryfall.com/card/uma/156/basking-rootwalla?utm_source=api	{1}{G}: This creature gets +2/+2 until end of turn. Activate only once each turn. Madness {0} (If you discard this card, discard it into exile. When you do, cast it for its madness cost or put it into your graveyard.)
uma	Ultimate Masters	2018-12-07	157	Become Immense	40e5b83e-5f53-4b15-8bfd-c0c0b8355a6f			combat_support, cost_reduction				Instant	{5}{G}	6	G	G	Delve		verify analyzer roles	https://scryfall.com/card/uma/157/become-immense?utm_source=api	Delve (Each card you exile from your graveyard while casting this spell pays for {1}.) Target creature gets +6/+6 until end of turn.
uma	Ultimate Masters	2018-12-07	158	Boar Umbra	75e4448b-5bd7-4ed4-8db8-820cd6d04c12			combat_support, replacement_engine				Enchantment — Aura	{2}{G}	3	G	G	Umbra armor, Enchant		verify analyzer roles	https://scryfall.com/card/uma/158/boar-umbra?utm_source=api	Enchant creature Enchanted creature gets +3/+3. Umbra armor (If enchanted creature would be destroyed, instead remove all damage from it and destroy this Aura.)
uma	Ultimate Masters	2018-12-07	159	Boneyard Wurm	6e5f908a-f4f1-4718-ac39-34176e401756	covered		combat_body, combat_support	false		Covered by PRM role audit.	Creature — Wurm	{1}{G}	2	G	G			already reviewed	https://scryfall.com/card/uma/159/boneyard-wurm?utm_source=api	Boneyard Wurm's power and toughness are each equal to the number of creature cards in your graveyard.
uma	Ultimate Masters	2018-12-07	160	Brawn	00876e98-d062-4a12-85e6-86a2b20cf867	covered		combat_body, combat_support, combat_threat	false		Covered by JUD role audit.	Creature — Incarnation	{3}{G}	4	G	G	Trample		already reviewed	https://scryfall.com/card/uma/160/brawn?utm_source=api	Trample As long as this card is in your graveyard and you control a Forest, creatures you control have trample.
uma	Ultimate Masters	2018-12-07	161	Crushing Canopy	618cd1bc-4422-441b-906f-1a209277be93			removal, targeted_removal				Instant	{2}{G}	3	G	G			verify analyzer roles	https://scryfall.com/card/uma/161/crushing-canopy?utm_source=api	Choose one — • Destroy target creature with flying. • Destroy target enchantment.
uma	Ultimate Masters	2018-12-07	162	Devoted Druid	cb814e16-acf7-41d5-a357-1323dcc369f3			combat_body, counter_support, ramp, stable_ramp				Creature — Elf Druid	{1}{G}	2	G	G			verify analyzer roles	https://scryfall.com/card/uma/162/devoted-druid?utm_source=api	{T}: Add {G}. Put a -1/-1 counter on this creature: Untap this creature.
uma	Ultimate Masters	2018-12-07	163	Eternal Witness	30b24e8e-3b0e-4d8e-90f3-f66eb7c1858c	covered		card_selection, combat_body, hand_recursion, recursion	false		Covered by PRM role audit.	Creature — Human Shaman	{1}{G}{G}	3	G	G			already reviewed	https://scryfall.com/card/uma/163/eternal-witness?utm_source=api	When this creature enters, you may return target card from your graveyard to your hand.
uma	Ultimate Masters	2018-12-07	164	Fauna Shaman	35b8fa77-4e85-418b-b335-cd1af127075c	covered		combat_body, repeatable_tutor, restricted_tutor, tutor	false		Covered by PRM role audit.	Creature — Elf Shaman	{1}{G}	2	G	G			already reviewed	https://scryfall.com/card/uma/164/fauna-shaman?utm_source=api	{G}, {T}, Discard a creature card: Search your library for a creature card, reveal it, put it into your hand, then shuffle.
uma	Ultimate Masters	2018-12-07	165	Fecundity	ffa64ac6-fe55-48b8-b015-849982cd7ad8	covered		card_draw, direct_draw, draw, repeatable_advantage, repeatable_draw, sacrifice_support	false		Covered by USG role audit.	Enchantment	{2}{G}	3	G	G			already reviewed	https://scryfall.com/card/uma/165/fecundity?utm_source=api	Whenever a creature dies, that creature's controller may draw a card.
uma	Ultimate Masters	2018-12-07	166	Golgari Brownscale	34242c44-a987-412c-9652-5242b9b5200c			card_selection, combat_body, hand_recursion, lifegain, mill_support, repeatable_advantage, replacement_engine				Creature — Lizard	{1}{G}{G}	3	G	G	Dredge, Mill		verify analyzer roles	https://scryfall.com/card/uma/166/golgari-brownscale?utm_source=api	When this card is put into your hand from your graveyard, you gain 2 life. Dredge 2 (If you would draw a card, you may mill two cards instead. If you do, return this card from your graveyard to your hand.)
uma	Ultimate Masters	2018-12-07	167	Golgari Grave-Troll	686f4a37-b5e4-46d4-9e0e-11794b2d12cd			card_selection, combat_body, counter_support, hand_recursion, mill_support, protection, regeneration_protection, repeatable_advantage, replacement_engine, targeted_protection				Creature — Troll Skeleton	{4}{G}	5	G	G	Dredge, Regenerate, Mill		verify analyzer roles	https://scryfall.com/card/uma/167/golgari-grave-troll?utm_source=api	This creature enters with a +1/+1 counter on it for each creature card in your graveyard. {1}, Remove a +1/+1 counter from this creature: Regenerate this creature. Dredge 6 (If you would draw a card, you may mill six cards instead. If you do, return this card from your graveyard to your hand.)
uma	Ultimate Masters	2018-12-07	168	Groundskeeper	f2c19fba-9b06-461f-bb5e-e827ba41204d	covered		card_selection, combat_body, hand_recursion, recursion, repeatable_advantage	false		Covered by MMQ role audit.	Creature — Human Druid	{G}	1	G	G			already reviewed	https://scryfall.com/card/uma/168/groundskeeper?utm_source=api	{1}{G}: Return target basic land card from your graveyard to your hand.
uma	Ultimate Masters	2018-12-07	169	Hero of Leina Tower	ae15a96d-ce88-4cb9-a353-439387ca3d02			combat_body, combat_support, counter_support, scalable_spell				Creature — Human Warrior	{G}	1	G	G	Heroic		verify analyzer roles	https://scryfall.com/card/uma/169/hero-of-leina-tower?utm_source=api	Heroic — Whenever you cast a spell that targets this creature, you may pay {X}. If you do, put X +1/+1 counters on this creature.
uma	Ultimate Masters	2018-12-07	170	Hooting Mandrills	70e35385-6129-4bd1-861c-df04469566b7			combat_body, combat_threat, cost_reduction				Creature — Ape	{5}{G}	6	G	G	Delve, Trample		verify analyzer roles	https://scryfall.com/card/uma/170/hooting-mandrills?utm_source=api	Delve (Each card you exile from your graveyard while casting this spell pays for {1}.) Trample
uma	Ultimate Masters	2018-12-07	171	Kodama's Reach	1593ea18-2f2f-4ab4-83fb-6ccc0bec8a90	covered		land_acceleration, land_tutor, mana_fixing, ramp, tutor	false		Covered by PRM role audit.	Sorcery — Arcane	{2}{G}	3	G	G			already reviewed	https://scryfall.com/card/uma/171/kodamas-reach?utm_source=api	Search your library for up to two basic land cards, reveal those cards, put one onto the battlefield tapped and the other into your hand, then shuffle.
uma	Ultimate Masters	2018-12-07	172	Life from the Loam	ac8fba34-512c-4f24-999a-ab72f1ce4acb			card_selection, hand_recursion, mass_recursion, mill_support, recursion, replacement_engine				Sorcery	{1}{G}	2	G	G	Dredge, Mill		verify analyzer roles	https://scryfall.com/card/uma/172/life-from-the-loam?utm_source=api	Return up to three target land cards from your graveyard to your hand. Dredge 3 (If you would draw a card, you may mill three cards instead. If you do, return this card from your graveyard to your hand.)
uma	Ultimate Masters	2018-12-07	173	Miming Slime	50e7f705-c347-440b-8159-81a52bbfbdfb			combat_support, scalable_spell, token_support				Sorcery	{2}{G}	3	G	G			verify analyzer roles	https://scryfall.com/card/uma/173/miming-slime?utm_source=api	Create an X/X green Ooze creature token, where X is the greatest power among creatures you control.
uma	Ultimate Masters	2018-12-07	174	Noble Hierarch	98aa9424-5912-4bd6-9300-b3972a31d8af	covered		burst_ramp, combat_body, combat_support, mana_fixing, ramp, stable_ramp	false		Covered by PRM role audit.	Creature — Human Druid	{G}	1	G	GUW	Exalted		already reviewed	https://scryfall.com/card/uma/174/noble-hierarch?utm_source=api	Exalted (Whenever a creature you control attacks alone, that creature gets +1/+1 until end of turn.) {T}: Add {G}, {W}, or {U}.
uma	Ultimate Masters	2018-12-07	175	Nourishing Shoal	2aa0e0e5-cb6d-4518-8eff-d29f935486e0			lifegain, mana_sink, scalable_spell				Instant — Arcane	{X}{G}{G}	2	G	G			verify analyzer roles	https://scryfall.com/card/uma/175/nourishing-shoal?utm_source=api	You may exile a green card with mana value X from your hand rather than pay this spell's mana cost. You gain X life.
uma	Ultimate Masters	2018-12-07	176	Pattern of Rebirth	4b8856f8-3cd1-450c-a71b-eb0026e8e179	covered		cheat_into_play, cost_reduction, restricted_tutor, sacrifice_support, tutor	false		Covered by UDS role audit.	Enchantment — Aura	{3}{G}	4	G	G	Enchant		already reviewed	https://scryfall.com/card/uma/176/pattern-of-rebirth?utm_source=api	Enchant creature When enchanted creature dies, that creature's controller may search their library for a creature card, put that card onto the battlefield, then shuffle.
uma	Ultimate Masters	2018-12-07	177	Penumbra Wurm	abccb19f-098b-4453-b7bc-838ad5914ebe	covered		combat_body, combat_threat, sacrifice_support, token_support	false		Covered by APC role audit.	Creature — Wurm	{5}{G}{G}	7	G	G	Trample		already reviewed	https://scryfall.com/card/uma/177/penumbra-wurm?utm_source=api	Trample When this creature dies, create a 6/6 black Wurm creature token with trample.
uma	Ultimate Masters	2018-12-07	178	Prey Upon	b3c12848-528d-4005-878f-4f950a07240a							Sorcery	{G}	1	G	G	Fight		has Scryfall tags/keywords but no analyzer role	https://scryfall.com/card/uma/178/prey-upon?utm_source=api	Target creature you control fights target creature you don't control. (Each deals damage equal to its power to the other.)
uma	Ultimate Masters	2018-12-07	179	Pulse of Murasa	d5b446a4-a761-42f0-acf0-ea0a1a9538d6			lifegain, removal, tempo_removal				Instant	{2}{G}	3	G	G			verify analyzer roles	https://scryfall.com/card/uma/179/pulse-of-murasa?utm_source=api	Return target creature or land card from a graveyard to its owner's hand. You gain 6 life.
