setCode	setName	releasedAt	collectorNumber	name	oracleId	auditStatus	expectedRoles	actualAnalyzerRoles	needsCodeChange	tagDecision	manualNotes	typeLine	manaCost	manaValue	colors	colorIdentity	keywords	scryfallOracleTags	attentionHint	scryfallUrl	oracleText
w16	Welcome Deck 2016	2016-04-08	1	Aegis Angel	5902e074-7154-4fc7-8776-b87e8b1925e7			combat_body, combat_support, combat_threat, protection, self_protection, targeted_protection				Creature — Angel	{4}{W}{W}	6	W	W	Flying		verify analyzer roles	https://scryfall.com/card/w16/1/aegis-angel?utm_source=api	Flying (This creature can't be blocked except by creatures with flying or reach.) When this creature enters, another target permanent gains indestructible for as long as you control this creature. (Effects that say "destroy" don't destroy it. A creature with indestructible can't be destroyed by damage.)
w16	Welcome Deck 2016	2016-04-08	2	Marked by Honor	aa5a7940-976d-4d96-9ddf-1c3891885c7e			combat_support				Enchantment — Aura	{3}{W}	4	W	W	Enchant		verify analyzer roles	https://scryfall.com/card/w16/2/marked-by-honor?utm_source=api	Enchant creature Enchanted creature gets +2/+2 and has vigilance. (Attacking doesn't cause it to tap.)
w16	Welcome Deck 2016	2016-04-08	3	Serra Angel	4b7ac066-e5c7-43e6-9e7e-2739b24a905d	covered	combat_body, combat_threat	combat_body, combat_threat	false		Covered by ATH role audit.	Creature — Angel	{3}{W}{W}	5	W	W	Flying, Vigilance		already reviewed	https://scryfall.com/card/w16/3/serra-angel?utm_source=api	Flying Vigilance (Attacking doesn't cause this creature to tap.)
w16	Welcome Deck 2016	2016-04-08	4	Air Servant	49638d96-e83e-4aab-bafb-d6183a6e3ff6			combat_body, combat_threat, removal, tempo_removal				Creature — Elemental	{4}{U}	5	U	U	Flying		verify analyzer roles	https://scryfall.com/card/w16/4/air-servant?utm_source=api	Flying {2}{U}: Tap target creature with flying.
w16	Welcome Deck 2016	2016-04-08	5	Disperse	9d8fe3f8-5027-4f9e-999e-e277caa96478			removal, tempo_removal				Instant	{1}{U}	2	U	U			verify analyzer roles	https://scryfall.com/card/w16/5/disperse?utm_source=api	Return target nonland permanent to its owner's hand.
w16	Welcome Deck 2016	2016-04-08	6	Sphinx of Magosi	1c9cf20c-51e4-4a87-b9f8-231b6baf5d6b			card_draw, combat_body, combat_threat, counter_support, direct_draw, draw, repeatable_advantage, repeatable_draw				Creature — Sphinx	{3}{U}{U}{U}	6	U	U	Flying		verify analyzer roles	https://scryfall.com/card/w16/6/sphinx-of-magosi?utm_source=api	Flying {2}{U}: Draw a card, then put a +1/+1 counter on this creature.
w16	Welcome Deck 2016	2016-04-08	7	Mind Rot	ad44cf74-b717-48fb-9fa2-77512024d76a	covered	hand_attack, removal	hand_attack, removal	false		Covered by Portal role audit.	Sorcery	{2}{B}	3	B	B			already reviewed	https://scryfall.com/card/w16/7/mind-rot?utm_source=api	Target player discards two cards.
w16	Welcome Deck 2016	2016-04-08	8	Nightmare	375932e6-1b3e-48dc-8154-9b664c3add34	covered	combat_body, combat_support, combat_threat	combat_body, combat_support, combat_threat	false		Covered by 6ED role audit.	Creature — Nightmare Horse	{5}{B}	6	B	B	Flying		already reviewed	https://scryfall.com/card/w16/8/nightmare?utm_source=api	Flying (This creature can't be blocked except by creatures with flying or reach.) Nightmare's power and toughness are each equal to the number of Swamps you control.
w16	Welcome Deck 2016	2016-04-08	9	Sengir Vampire	749141aa-f6c4-4ad8-b146-406e68ae9b0b	covered	combat_body, combat_support, combat_threat, counter_support, sacrifice_support	combat_body, combat_support, combat_threat, counter_support, sacrifice_support	false		Covered by BRB role audit.	Creature — Vampire	{3}{B}{B}	5	B	B	Flying		already reviewed	https://scryfall.com/card/w16/9/sengir-vampire?utm_source=api	Flying (This creature can't be blocked except by creatures with flying or reach.) Whenever a creature dealt damage by this creature this turn dies, put a +1/+1 counter on this creature.
w16	Welcome Deck 2016	2016-04-08	10	Walking Corpse	fea95888-e16a-4209-9cd4-623f7f4d2f67			combat_body				Creature — Zombie	{1}{B}	2	B	B			verify analyzer roles	https://scryfall.com/card/w16/10/walking-corpse?utm_source=api	
w16	Welcome Deck 2016	2016-04-08	11	Borderland Marauder	11fd2650-2150-4e62-8b64-e820d734a231			combat_body, combat_support				Creature — Human Warrior	{1}{R}	2	R	R			verify analyzer roles	https://scryfall.com/card/w16/11/borderland-marauder?utm_source=api	Whenever this creature attacks, it gets +2/+0 until end of turn.
w16	Welcome Deck 2016	2016-04-08	12	Cone of Flame	62879f3d-ed6d-4004-8196-f3fd7f614695	covered	removal, targeted_removal	removal, targeted_removal	false		Covered by Weatherlight role audit.	Sorcery	{3}{R}{R}	5	R	R			already reviewed	https://scryfall.com/card/w16/12/cone-of-flame?utm_source=api	Cone of Flame deals 1 damage to any target, 2 damage to another target, and 3 damage to a third target.
w16	Welcome Deck 2016	2016-04-08	13	Shivan Dragon	711eea87-0fa3-46e0-a42b-fa5a86455f04	covered	combat_body, combat_support, combat_threat	combat_body, combat_support, combat_threat	false		Covered by BTD role audit.	Creature — Dragon	{4}{R}{R}	6	R	R	Flying		already reviewed	https://scryfall.com/card/w16/13/shivan-dragon?utm_source=api	Flying {R}: This creature gets +1/+0 until end of turn.
w16	Welcome Deck 2016	2016-04-08	14	Incremental Growth	802ff367-e52e-4f79-aa0f-96c45fe477a0			counter_support				Sorcery	{3}{G}{G}	5	G	G			verify analyzer roles	https://scryfall.com/card/w16/14/incremental-growth?utm_source=api	Put a +1/+1 counter on target creature, two +1/+1 counters on another target creature, and three +1/+1 counters on a third target creature.
w16	Welcome Deck 2016	2016-04-08	15	Oakenform	b254fefb-11d2-4369-ae5c-0c3bd48ae580			combat_support				Enchantment — Aura	{2}{G}	3	G	G	Enchant		verify analyzer roles	https://scryfall.com/card/w16/15/oakenform?utm_source=api	Enchant creature Enchanted creature gets +3/+3.
w16	Welcome Deck 2016	2016-04-08	16	Soul of the Harvest	6b9194dd-2296-4879-ac5e-f89b18431df6			card_draw, combat_body, combat_threat, direct_draw, draw, repeatable_advantage, repeatable_draw				Creature — Elemental	{4}{G}{G}	6	G	G	Trample		verify analyzer roles	https://scryfall.com/card/w16/16/soul-of-the-harvest?utm_source=api	Trample Whenever another nontoken creature you control enters, you may draw a card.
